{
    "name": "홍승훈",
    "field": "비주얼 컴퓨팅, 인공지능·정보서비스",
    "major": "기계학습, 컴퓨터비전",
    "degree": "PhD, POSTECH, 2017",
    "web": "https://maga33.github.io/",
    "mail": "seunghoon.hong@kaist.ac.kr",
    "phone": "3579",
    "office": "506, E3-5",
    "etc": "연구실: 비전 및 학습 연구실\n\n홍승훈 교수는 2019년부터 KAIST 전산학부 부교수로 재직 중이다. 주 연구분야는 기계 학습 및 이를 활용한 자율적 시각 인지 시스템이다. 홍승훈 교수는 POSTECH에서 학사 및 박사 학위를 각각 2011년과 2017년에 받았으며, 2017-2019년에는 University of Michigan에서 박사 후 연구원으로, 2019년에는 Google Brain team에서 방문 교수로 재직하였다.",
    "tag": "csweb.profs",
    "id": 48,
    "content": "name:홍승훈 field:비주얼 컴퓨팅, 인공지능·정보서비스 major:기계학습, 컴퓨터비전 degree:PhD, POSTECH, 2017 web:https://maga33.github.io/ mail:seunghoon.hong@kaist.ac.kr phone:3579 office:506, E3-5 etc:연구실: 비전 및 학습 연구실\n\n홍승훈 교수는 2019년부터 KAIST 전산학부 부교수로 재직 중이다. 주 연구분야는 기계 학습 및 이를 활용한 자율적 시각 인지 시스템이다. 홍승훈 교수는 POSTECH에서 학사 및 박사 학위를 각각 2011년과 2017년에 받았으며, 2017-2019년에는 University of Michigan에서 박사 후 연구원으로, 2019년에는 Google Brain team에서 방문 교수로 재직하였다. tag:csweb.profs content:홍승훈 비주얼 컴퓨팅, 인공지능·정보서비스 기계학습, 컴퓨터비전 PhD, POSTECH, 2017 https://maga33.github.io/ seunghoon.hong@kaist.ac.kr 3579 506, E3-5 연구실: 비전 및 학습 연구실\n\n홍승훈 교수는 2019년부터 KAIST 전산학부 부교수로 재직 중이다. 주 연구분야는 기계 학습 및 이를 활용한 자율적 시각 인지 시스템이다. 홍승훈 교수는 POSTECH에서 학사 및 박사 학위를 각각 2011년과 2017년에 받았으며, 2017-2019년에는 University of Michigan에서 박사 후 연구원으로, 2019년에는 Google Brain team에서 방문 교수로 재직하였다. csweb.profs"
}