{
    "name": "노용만",
    "field": "비주얼 컴퓨팅, 인공지능·정보서비스",
    "major": "멀티모달 학습, AI를 위한 시각, 음성 및 언어 통합, 컴퓨터 비전 및 멀티미디어",
    "degree": "PhD, KAIST, 1992",
    "web": "https://www.ivllab.kaist.ac.kr/people/professor",
    "mail": "ymro@kaist.ac.kr",
    "phone": "",
    "office": "",
    "etc": "연구실: \n\n노용만 교수는 카이스트의 정교수이자 ICT 분야 석좌교수입니다. 그는 CARAI연구센터, IVL Lab, IVL Lab (\nhttps://www.ivllab.kaist.\nac.kr/ivylab-ivllab\n) 을 이끌고 있습니다. 그는 컬럼비아 대학교, 캘리포니아 대학교 어바인, 캘리포니아 대학교 버클리, 토론토 대학교 등 다양한 기관에서 연구를 수행했습니다. 2003년에는 올해의 과학자상을 수상했습니다. 그는IEEE Signal Processing Letters and IEEE Transactions on CSVT  저널에서 부편집장으로 활동했습니다. 현재 IEEE Transactions on Image Processing저널의 부편집장으로 활동하고 있습니다. 그는 멀티미디어 분야의 여러 컨퍼런스에서 TPC 및 조직 의장/프로그램 의장으로 활동했습니다. 그는 \"이미지/비디오 처리를 위한 설명 가능한 심층 신경망\"(ICIP 2021, 2022), \"디지털 사진 앨범 기술\"(AIRS 2005), \"소셜 미디어\"(DSP 2009), \"대규모 비전/언어 모델과 이미지 처리 통합\"(ICIP 2024-25) 등 여러 주요한 특별 세션을 조직했습니다. 그의 연구 그룹은 최고 수준의 컨퍼런스와 국제저널에 500편 이상의 논문을 발표했습니다.",
    "tag": "csweb.profs",
    "id": 78,
    "content": "name:노용만 field:비주얼 컴퓨팅, 인공지능·정보서비스 major:멀티모달 학습, AI를 위한 시각, 음성 및 언어 통합, 컴퓨터 비전 및 멀티미디어 degree:PhD, KAIST, 1992 web:https://www.ivllab.kaist.ac.kr/people/professor mail:ymro@kaist.ac.kr phone: office: etc:연구실: \n\n노용만 교수는 카이스트의 정교수이자 ICT 분야 석좌교수입니다. 그는 CARAI연구센터, IVL Lab, IVL Lab (\nhttps://www.ivllab.kaist.\nac.kr/ivylab-ivllab\n) 을 이끌고 있습니다. 그는 컬럼비아 대학교, 캘리포니아 대학교 어바인, 캘리포니아 대학교 버클리, 토론토 대학교 등 다양한 기관에서 연구를 수행했습니다. 2003년에는 올해의 과학자상을 수상했습니다. 그는IEEE Signal Processing Letters and IEEE Transactions on CSVT  저널에서 부편집장으로 활동했습니다. 현재 IEEE Transactions on Image Processing저널의 부편집장으로 활동하고 있습니다. 그는 멀티미디어 분야의 여러 컨퍼런스에서 TPC 및 조직 의장/프로그램 의장으로 활동했습니다. 그는 \"이미지/비디오 처리를 위한 설명 가능한 심층 신경망\"(ICIP 2021, 2022), \"디지털 사진 앨범 기술\"(AIRS 2005), \"소셜 미디어\"(DSP 2009), \"대규모 비전/언어 모델과 이미지 처리 통합\"(ICIP 2024-25) 등 여러 주요한 특별 세션을 조직했습니다. 그의 연구 그룹은 최고 수준의 컨퍼런스와 국제저널에 500편 이상의 논문을 발표했습니다. tag:csweb.profs content:노용만 비주얼 컴퓨팅, 인공지능·정보서비스 멀티모달 학습, AI를 위한 시각, 음성 및 언어 통합, 컴퓨터 비전 및 멀티미디어 PhD, KAIST, 1992 https://www.ivllab.kaist.ac.kr/people/professor ymro@kaist.ac.kr   연구실: \n\n노용만 교수는 카이스트의 정교수이자 ICT 분야 석좌교수입니다. 그는 CARAI연구센터, IVL Lab, IVL Lab (\nhttps://www.ivllab.kaist.\nac.kr/ivylab-ivllab\n) 을 이끌고 있습니다. 그는 컬럼비아 대학교, 캘리포니아 대학교 어바인, 캘리포니아 대학교 버클리, 토론토 대학교 등 다양한 기관에서 연구를 수행했습니다. 2003년에는 올해의 과학자상을 수상했습니다. 그는IEEE Signal Processing Letters and IEEE Transactions on CSVT  저널에서 부편집장으로 활동했습니다. 현재 IEEE Transactions on Image Processing저널의 부편집장으로 활동하고 있습니다. 그는 멀티미디어 분야의 여러 컨퍼런스에서 TPC 및 조직 의장/프로그램 의장으로 활동했습니다. 그는 \"이미지/비디오 처리를 위한 설명 가능한 심층 신경망\"(ICIP 2021, 2022), \"디지털 사진 앨범 기술\"(AIRS 2005), \"소셜 미디어\"(DSP 2009), \"대규모 비전/언어 모델과 이미지 처리 통합\"(ICIP 2024-25) 등 여러 주요한 특별 세션을 조직했습니다. 그의 연구 그룹은 최고 수준의 컨퍼런스와 국제저널에 500편 이상의 논문을 발표했습니다. csweb.profs"
}