{
    "name": "최호진",
    "field": "비주얼 컴퓨팅, 인공지능·정보서비스, 소셜 컴퓨팅",
    "major": "인공지능, 소프트웨어공학",
    "degree": "PhD, Imperial College, 1995",
    "web": "https://keai.kaist.ac.kr",
    "mail": "hojinc@kaist.ac.kr",
    "phone": "3561",
    "office": "E3-1, 1420",
    "etc": "연구실: 지식공학 및 인공지능 연구실\n\n최호진교수는 현재 카이스트 전산학부 교수로 재직중이다. 1982년 서울대학교 공과대학에서 컴퓨터공학 학사, 1985년 영국 뉴캐슬대학교에서 컴퓨팅소프트웨어및시스템설계학 석사, 1995년 영국 런던 임페리얼칼리지에서 인공지능학 박사 학위를 각각 수여받았다. 1982-89년 동안 ㈜데이콤 정보통신연구소에 근무하며 회사내 소프트웨어공학 환경조성을 위해 일했으며, 1995-96년 동안 임페리얼칼리지 IC-PARC 박사후연구원, 1997-2002년 동안 한국항공대학교 전자정보통신컴퓨터공학부 조교수, 2002-09년 동안 한국정보통신대학교 공학부 부교수를 역임하였다. 2003-10년 동안 미국 카네기멜론대학교 소프트웨어공학석사(MSE) 프로그램의 겸임교수를 역임하였고, 2006-08년 동안 한국정보통신대학교 IT영재교육원 원장을 역임하였다. 2010년부터는 서울대학교 의과대학에 설립된 시스템바이오정보의학연구센터(NCRC)에 참여하고 있으며, 현재 아랍에미리트 칼리파대학교와의 국제공동연구, 삼성전자 전략산학패키지, ETRI 주관 지능진화형 WiseQA 질의응답시스템 국책과제 등에 참여하고 있다. IEEE, ACM, AAAI 등 국제학회 멤버로 활동중이며, 한국정보과학회 산하 인공지능소사이어티, 소프트웨어공학 소사이어티, 한국의료정보학회 등 국내학회 이사를 역임하였다. 주요 연구분야는 인공지능, 지식공학, 데이터마이닝, 토픽마이닝, 지능형개인비서, 자연어질의응답, 바이오의료정보학 등이다.",
    "tag": "csweb.profs",
    "id": 104,
    "content": "name:최호진 field:비주얼 컴퓨팅, 인공지능·정보서비스, 소셜 컴퓨팅 major:인공지능, 소프트웨어공학 degree:PhD, Imperial College, 1995 web:https://keai.kaist.ac.kr mail:hojinc@kaist.ac.kr phone:3561 office:E3-1, 1420 etc:연구실: 지식공학 및 인공지능 연구실\n\n최호진교수는 현재 카이스트 전산학부 교수로 재직중이다. 1982년 서울대학교 공과대학에서 컴퓨터공학 학사, 1985년 영국 뉴캐슬대학교에서 컴퓨팅소프트웨어및시스템설계학 석사, 1995년 영국 런던 임페리얼칼리지에서 인공지능학 박사 학위를 각각 수여받았다. 1982-89년 동안 ㈜데이콤 정보통신연구소에 근무하며 회사내 소프트웨어공학 환경조성을 위해 일했으며, 1995-96년 동안 임페리얼칼리지 IC-PARC 박사후연구원, 1997-2002년 동안 한국항공대학교 전자정보통신컴퓨터공학부 조교수, 2002-09년 동안 한국정보통신대학교 공학부 부교수를 역임하였다. 2003-10년 동안 미국 카네기멜론대학교 소프트웨어공학석사(MSE) 프로그램의 겸임교수를 역임하였고, 2006-08년 동안 한국정보통신대학교 IT영재교육원 원장을 역임하였다. 2010년부터는 서울대학교 의과대학에 설립된 시스템바이오정보의학연구센터(NCRC)에 참여하고 있으며, 현재 아랍에미리트 칼리파대학교와의 국제공동연구, 삼성전자 전략산학패키지, ETRI 주관 지능진화형 WiseQA 질의응답시스템 국책과제 등에 참여하고 있다. IEEE, ACM, AAAI 등 국제학회 멤버로 활동중이며, 한국정보과학회 산하 인공지능소사이어티, 소프트웨어공학 소사이어티, 한국의료정보학회 등 국내학회 이사를 역임하였다. 주요 연구분야는 인공지능, 지식공학, 데이터마이닝, 토픽마이닝, 지능형개인비서, 자연어질의응답, 바이오의료정보학 등이다. tag:csweb.profs content:최호진 비주얼 컴퓨팅, 인공지능·정보서비스, 소셜 컴퓨팅 인공지능, 소프트웨어공학 PhD, Imperial College, 1995 https://keai.kaist.ac.kr hojinc@kaist.ac.kr 3561 E3-1, 1420 연구실: 지식공학 및 인공지능 연구실\n\n최호진교수는 현재 카이스트 전산학부 교수로 재직중이다. 1982년 서울대학교 공과대학에서 컴퓨터공학 학사, 1985년 영국 뉴캐슬대학교에서 컴퓨팅소프트웨어및시스템설계학 석사, 1995년 영국 런던 임페리얼칼리지에서 인공지능학 박사 학위를 각각 수여받았다. 1982-89년 동안 ㈜데이콤 정보통신연구소에 근무하며 회사내 소프트웨어공학 환경조성을 위해 일했으며, 1995-96년 동안 임페리얼칼리지 IC-PARC 박사후연구원, 1997-2002년 동안 한국항공대학교 전자정보통신컴퓨터공학부 조교수, 2002-09년 동안 한국정보통신대학교 공학부 부교수를 역임하였다. 2003-10년 동안 미국 카네기멜론대학교 소프트웨어공학석사(MSE) 프로그램의 겸임교수를 역임하였고, 2006-08년 동안 한국정보통신대학교 IT영재교육원 원장을 역임하였다. 2010년부터는 서울대학교 의과대학에 설립된 시스템바이오정보의학연구센터(NCRC)에 참여하고 있으며, 현재 아랍에미리트 칼리파대학교와의 국제공동연구, 삼성전자 전략산학패키지, ETRI 주관 지능진화형 WiseQA 질의응답시스템 국책과제 등에 참여하고 있다. IEEE, ACM, AAAI 등 국제학회 멤버로 활동중이며, 한국정보과학회 산하 인공지능소사이어티, 소프트웨어공학 소사이어티, 한국의료정보학회 등 국내학회 이사를 역임하였다. 주요 연구분야는 인공지능, 지식공학, 데이터마이닝, 토픽마이닝, 지능형개인비서, 자연어질의응답, 바이오의료정보학 등이다. csweb.profs"
}