{
    "name": "심장섭",
    "field": "시스템·네트워크",
    "major": "Database, e-GoV Architecture, ICT policy",
    "degree": "PhD, ChungBuk National Univ. 2005",
    "web": "https://cs.kaist.ac.kr",
    "mail": "hl1iit@kaist.ac.kr",
    "phone": "042-350-6026",
    "office": "N1, 403",
    "etc": "연구실: \n\n심장섭 교수는 한국과학기술원(KAIST) 공과대학 전산학부에 연구교수로 근무하고 있다. 심교수는 2020년 KAIST에 부임하기 전에는 과학기술정보통신부 산하 정보통신기획평가원(IITP)에서 사업지원단장, 연구위원 등으로 활동을 하는 등 35년이상 ICT분야에 종사하였다. 2019년에는 우송대학교에서 IT융합과 소프트웨어분야 강의를 통한 인력양성을 하였다. 심교수는 다양한 학회(IEEE, 한국정보통신공학회, 통신공학회, EA학회등)에서 위원회 활동을 해오고 있다. 심교수의 연구분야는 국가정보통신 연구개발(ICT R&D)분야의 정책연구와 사업관리에 집중 하고 있으며, 전자정부 프레임워크 및 엔터프라이즈 아키텍처(EA)의 표준화와 글로벌확산 활동을 하고 있다.",
    "tag": "csweb.profs",
    "id": 101,
    "content": "name:심장섭 field:시스템·네트워크 major:Database, e-GoV Architecture, ICT policy degree:PhD, ChungBuk National Univ. 2005 web:https://cs.kaist.ac.kr mail:hl1iit@kaist.ac.kr phone:042-350-6026 office:N1, 403 etc:연구실: \n\n심장섭 교수는 한국과학기술원(KAIST) 공과대학 전산학부에 연구교수로 근무하고 있다. 심교수는 2020년 KAIST에 부임하기 전에는 과학기술정보통신부 산하 정보통신기획평가원(IITP)에서 사업지원단장, 연구위원 등으로 활동을 하는 등 35년이상 ICT분야에 종사하였다. 2019년에는 우송대학교에서 IT융합과 소프트웨어분야 강의를 통한 인력양성을 하였다. 심교수는 다양한 학회(IEEE, 한국정보통신공학회, 통신공학회, EA학회등)에서 위원회 활동을 해오고 있다. 심교수의 연구분야는 국가정보통신 연구개발(ICT R&D)분야의 정책연구와 사업관리에 집중 하고 있으며, 전자정부 프레임워크 및 엔터프라이즈 아키텍처(EA)의 표준화와 글로벌확산 활동을 하고 있다. tag:csweb.profs content:심장섭 시스템·네트워크 Database, e-GoV Architecture, ICT policy PhD, ChungBuk National Univ. 2005 https://cs.kaist.ac.kr hl1iit@kaist.ac.kr 042-350-6026 N1, 403 연구실: \n\n심장섭 교수는 한국과학기술원(KAIST) 공과대학 전산학부에 연구교수로 근무하고 있다. 심교수는 2020년 KAIST에 부임하기 전에는 과학기술정보통신부 산하 정보통신기획평가원(IITP)에서 사업지원단장, 연구위원 등으로 활동을 하는 등 35년이상 ICT분야에 종사하였다. 2019년에는 우송대학교에서 IT융합과 소프트웨어분야 강의를 통한 인력양성을 하였다. 심교수는 다양한 학회(IEEE, 한국정보통신공학회, 통신공학회, EA학회등)에서 위원회 활동을 해오고 있다. 심교수의 연구분야는 국가정보통신 연구개발(ICT R&D)분야의 정책연구와 사업관리에 집중 하고 있으며, 전자정부 프레임워크 및 엔터프라이즈 아키텍처(EA)의 표준화와 글로벌확산 활동을 하고 있다. csweb.profs"
}