{
    "name": "이동만",
    "field": "소셜 컴퓨팅, 인터랙티브 컴퓨팅, 시스템·네트워크",
    "major": "에지컴퓨팅, 어반컴퓨팅, 유비쿼터스컴퓨팅",
    "degree": "PhD, KAIST, 1987",
    "web": "http://cds.kaist.ac.kr",
    "mail": "dlee@kaist.ac.kr",
    "phone": "3559",
    "office": "N1, 803",
    "etc": "연구실: 협동 분산 시스템 및 네트워크 연구실\n\n이동만 교수는 서울대학교 컴퓨터공학과를 졸업하고, KAIST에서 1984년에 석사학위, 1987년에 박 사학위를 취득하였다. 1988년부터 1997년까지 Hewlett-Packard (HP)에서 Technical Contributor로 근무하였 고, 1997년부터 2009년까지 한국정보통신대학교(ICU) 공학부에서 교수를 역임하였으며, 2009년 부터 현재 KAIST 전산학과 교수로 재직 중이다.\n이동만 교수는 대한민국 인터넷 발전에 기여한 공로로 2000년 국무총리상, 2007년 인터넷 기술상, 2014년 미래부 장관상, 2017년 인터넷 대상을 수상하였고, 미래 인터넷 연구를 주도하는 미래인터넷포럼(FIF; http://fif.kr)과 한국/ 중국/일본의 미래 인터넷 연구 협력을 주도하는 AsiaFI (http://asiafi.net)의 창립 멤버 및 이사회 의장으로 현재까지 활동하고 있다. 또한 ACM TOMCCAP, IEEE TPDS, IEEE JIE, IEEE TWC, Computer Networks, TOCSJ, Journal of Computer Networks (JCN), IEEE Wireless Communication Magazine, IEEE Intelligence Magazine 등 다수의 국제 저널과 매거진에서 리뷰어로 활동하였 고, IEEE COMPSAC, SocialCom, PDCS, PerCom, Ubicomp 등의 저명 국제학술대회의 위원 (committee)으로 활동하였다. 현재 이동만 교수는 어번 컴퓨팅, 유비쿼터스 컴퓨팅, 소셜컴퓨팅과 AI 기술을 접목한 인텔리전트 에지 컴퓨팅 플랫폼을 연구하고 있다.",
    "tag": "csweb.profs",
    "id": 35,
    "content": "name:이동만 field:소셜 컴퓨팅, 인터랙티브 컴퓨팅, 시스템·네트워크 major:에지컴퓨팅, 어반컴퓨팅, 유비쿼터스컴퓨팅 degree:PhD, KAIST, 1987 web:http://cds.kaist.ac.kr mail:dlee@kaist.ac.kr phone:3559 office:N1, 803 etc:연구실: 협동 분산 시스템 및 네트워크 연구실\n\n이동만 교수는 서울대학교 컴퓨터공학과를 졸업하고, KAIST에서 1984년에 석사학위, 1987년에 박 사학위를 취득하였다. 1988년부터 1997년까지 Hewlett-Packard (HP)에서 Technical Contributor로 근무하였 고, 1997년부터 2009년까지 한국정보통신대학교(ICU) 공학부에서 교수를 역임하였으며, 2009년 부터 현재 KAIST 전산학과 교수로 재직 중이다.\n이동만 교수는 대한민국 인터넷 발전에 기여한 공로로 2000년 국무총리상, 2007년 인터넷 기술상, 2014년 미래부 장관상, 2017년 인터넷 대상을 수상하였고, 미래 인터넷 연구를 주도하는 미래인터넷포럼(FIF; http://fif.kr)과 한국/ 중국/일본의 미래 인터넷 연구 협력을 주도하는 AsiaFI (http://asiafi.net)의 창립 멤버 및 이사회 의장으로 현재까지 활동하고 있다. 또한 ACM TOMCCAP, IEEE TPDS, IEEE JIE, IEEE TWC, Computer Networks, TOCSJ, Journal of Computer Networks (JCN), IEEE Wireless Communication Magazine, IEEE Intelligence Magazine 등 다수의 국제 저널과 매거진에서 리뷰어로 활동하였 고, IEEE COMPSAC, SocialCom, PDCS, PerCom, Ubicomp 등의 저명 국제학술대회의 위원 (committee)으로 활동하였다. 현재 이동만 교수는 어번 컴퓨팅, 유비쿼터스 컴퓨팅, 소셜컴퓨팅과 AI 기술을 접목한 인텔리전트 에지 컴퓨팅 플랫폼을 연구하고 있다. tag:csweb.profs content:이동만 소셜 컴퓨팅, 인터랙티브 컴퓨팅, 시스템·네트워크 에지컴퓨팅, 어반컴퓨팅, 유비쿼터스컴퓨팅 PhD, KAIST, 1987 http://cds.kaist.ac.kr dlee@kaist.ac.kr 3559 N1, 803 연구실: 협동 분산 시스템 및 네트워크 연구실\n\n이동만 교수는 서울대학교 컴퓨터공학과를 졸업하고, KAIST에서 1984년에 석사학위, 1987년에 박 사학위를 취득하였다. 1988년부터 1997년까지 Hewlett-Packard (HP)에서 Technical Contributor로 근무하였 고, 1997년부터 2009년까지 한국정보통신대학교(ICU) 공학부에서 교수를 역임하였으며, 2009년 부터 현재 KAIST 전산학과 교수로 재직 중이다.\n이동만 교수는 대한민국 인터넷 발전에 기여한 공로로 2000년 국무총리상, 2007년 인터넷 기술상, 2014년 미래부 장관상, 2017년 인터넷 대상을 수상하였고, 미래 인터넷 연구를 주도하는 미래인터넷포럼(FIF; http://fif.kr)과 한국/ 중국/일본의 미래 인터넷 연구 협력을 주도하는 AsiaFI (http://asiafi.net)의 창립 멤버 및 이사회 의장으로 현재까지 활동하고 있다. 또한 ACM TOMCCAP, IEEE TPDS, IEEE JIE, IEEE TWC, Computer Networks, TOCSJ, Journal of Computer Networks (JCN), IEEE Wireless Communication Magazine, IEEE Intelligence Magazine 등 다수의 국제 저널과 매거진에서 리뷰어로 활동하였 고, IEEE COMPSAC, SocialCom, PDCS, PerCom, Ubicomp 등의 저명 국제학술대회의 위원 (committee)으로 활동하였다. 현재 이동만 교수는 어번 컴퓨팅, 유비쿼터스 컴퓨팅, 소셜컴퓨팅과 AI 기술을 접목한 인텔리전트 에지 컴퓨팅 플랫폼을 연구하고 있다. csweb.profs"
}