{
    "name": "윤성의",
    "field": "비주얼 컴퓨팅, 인공지능·정보서비스, 인터랙티브 컴퓨팅",
    "major": "컴퓨터그래픽스, 컴퓨터비젼, 로보틱스",
    "degree": "PhD, Univ. of North Carolina at Chapel Hill, 2005",
    "web": "http://sglab.kaist.ac.kr/~sungeui/",
    "mail": "sungeui@gmail.com",
    "phone": "3531",
    "office": "E3-1, 3432",
    "etc": "연구실: 컴퓨터 그래픽스, 컴퓨터 비젼, 로보틱스\n\n현재 한국과학기술원 전산학과 교수로 재직 중인 윤성의 교수는 서울대학교에서 전산학 학사, 석사를 하고 미국 North Carolina at Chapel Hill 대학에서 전산학 분야로 박사학위를 취득하였다. 윤성의 교수는 미국 Lawrence Livermore National Laboratory에서 박사 후 과정으로 연구한 경력을 보유하고 있으며,\n현재 렌더링, 로봇경로생성, 이미지 검색 분야에 대한 전문적인 연구를 수행하고 있다.\n윤성의 교수는 관련 최고 학회 및 저널에 다수의 논문의 발표 하였고, ACM SIGGRAPH, IEEE CVPR 같은 권위있는 학회에서 많은 초청 강연 실적을 보유하고 있다.\n또한 distinguished paper, journal invitations, national-wide recognition을 수상하였고, 현재 IEEE 및 ACM senior member이다.",
    "tag": "csweb.profs",
    "id": 33,
    "content": "name:윤성의 field:비주얼 컴퓨팅, 인공지능·정보서비스, 인터랙티브 컴퓨팅 major:컴퓨터그래픽스, 컴퓨터비젼, 로보틱스 degree:PhD, Univ. of North Carolina at Chapel Hill, 2005 web:http://sglab.kaist.ac.kr/~sungeui/ mail:sungeui@gmail.com phone:3531 office:E3-1, 3432 etc:연구실: 컴퓨터 그래픽스, 컴퓨터 비젼, 로보틱스\n\n현재 한국과학기술원 전산학과 교수로 재직 중인 윤성의 교수는 서울대학교에서 전산학 학사, 석사를 하고 미국 North Carolina at Chapel Hill 대학에서 전산학 분야로 박사학위를 취득하였다. 윤성의 교수는 미국 Lawrence Livermore National Laboratory에서 박사 후 과정으로 연구한 경력을 보유하고 있으며,\n현재 렌더링, 로봇경로생성, 이미지 검색 분야에 대한 전문적인 연구를 수행하고 있다.\n윤성의 교수는 관련 최고 학회 및 저널에 다수의 논문의 발표 하였고, ACM SIGGRAPH, IEEE CVPR 같은 권위있는 학회에서 많은 초청 강연 실적을 보유하고 있다.\n또한 distinguished paper, journal invitations, national-wide recognition을 수상하였고, 현재 IEEE 및 ACM senior member이다. tag:csweb.profs content:윤성의 비주얼 컴퓨팅, 인공지능·정보서비스, 인터랙티브 컴퓨팅 컴퓨터그래픽스, 컴퓨터비젼, 로보틱스 PhD, Univ. of North Carolina at Chapel Hill, 2005 http://sglab.kaist.ac.kr/~sungeui/ sungeui@gmail.com 3531 E3-1, 3432 연구실: 컴퓨터 그래픽스, 컴퓨터 비젼, 로보틱스\n\n현재 한국과학기술원 전산학과 교수로 재직 중인 윤성의 교수는 서울대학교에서 전산학 학사, 석사를 하고 미국 North Carolina at Chapel Hill 대학에서 전산학 분야로 박사학위를 취득하였다. 윤성의 교수는 미국 Lawrence Livermore National Laboratory에서 박사 후 과정으로 연구한 경력을 보유하고 있으며,\n현재 렌더링, 로봇경로생성, 이미지 검색 분야에 대한 전문적인 연구를 수행하고 있다.\n윤성의 교수는 관련 최고 학회 및 저널에 다수의 논문의 발표 하였고, ACM SIGGRAPH, IEEE CVPR 같은 권위있는 학회에서 많은 초청 강연 실적을 보유하고 있다.\n또한 distinguished paper, journal invitations, national-wide recognition을 수상하였고, 현재 IEEE 및 ACM senior member이다. csweb.profs"
}