{
    "name": "양은호",
    "field": "비주얼 컴퓨팅, 인공지능·정보서비스",
    "major": "기계학습, 인공지능",
    "degree": "PhD, University of Texas at Austin, 2014",
    "web": "https://sites.google.com/site/yangeh/",
    "mail": "eunhoy@kaist.ac.kr",
    "phone": "3572",
    "office": "N1, 802",
    "etc": "연구실: \n\n양은호 교수는 2016년부터 KAIST 전산학부 조교수로 재직 중이다. KAIST에 부임하기 전, IBM T.J. Watson Research Center에서 2년동안 연구원으로 근무하였다. 2014년에 University of Texas, Austin 에서 박사학위를, 2006년과 2004년에 서울대학교에서 석사, 학사 학위를 취득하였다. 주요 관심 연구분야는 기계학습이며, 데이터 분석을 위한 통계 및 전산 해석 연구를 수행하고 있다.",
    "tag": "csweb.profs",
    "id": 83,
    "content": "name:양은호 field:비주얼 컴퓨팅, 인공지능·정보서비스 major:기계학습, 인공지능 degree:PhD, University of Texas at Austin, 2014 web:https://sites.google.com/site/yangeh/ mail:eunhoy@kaist.ac.kr phone:3572 office:N1, 802 etc:연구실: \n\n양은호 교수는 2016년부터 KAIST 전산학부 조교수로 재직 중이다. KAIST에 부임하기 전, IBM T.J. Watson Research Center에서 2년동안 연구원으로 근무하였다. 2014년에 University of Texas, Austin 에서 박사학위를, 2006년과 2004년에 서울대학교에서 석사, 학사 학위를 취득하였다. 주요 관심 연구분야는 기계학습이며, 데이터 분석을 위한 통계 및 전산 해석 연구를 수행하고 있다. tag:csweb.profs content:양은호 비주얼 컴퓨팅, 인공지능·정보서비스 기계학습, 인공지능 PhD, University of Texas at Austin, 2014 https://sites.google.com/site/yangeh/ eunhoy@kaist.ac.kr 3572 N1, 802 연구실: \n\n양은호 교수는 2016년부터 KAIST 전산학부 조교수로 재직 중이다. KAIST에 부임하기 전, IBM T.J. Watson Research Center에서 2년동안 연구원으로 근무하였다. 2014년에 University of Texas, Austin 에서 박사학위를, 2006년과 2004년에 서울대학교에서 석사, 학사 학위를 취득하였다. 주요 관심 연구분야는 기계학습이며, 데이터 분석을 위한 통계 및 전산 해석 연구를 수행하고 있다. csweb.profs"
}