{
    "name": "김민수",
    "field": "시스템·네트워크, 인공지능·정보서비스, 소셜 컴퓨팅",
    "major": "데이터베이스, 데이터마이닝／기계학습, 메디컬／바이오인포매틱스",
    "degree": "PhD, KAIST, 2006",
    "web": "http://infolab.kaist.ac.kr/",
    "mail": "minsoo.k@kaist.ac.kr",
    "phone": "3582",
    "office": "2427, E3-1",
    "etc": "연구실: 인포랩\n\n김민수 교수는 한국과학기술원(KAIST)에 영년직 부교수로 근무하고 인포랩을 이끌고 있다. 김교수는 2020년 KAIST에 부임하기 전에는 대구경북과학기술원(DGIST)에서 영년직 부교수로 근무를 했었으며, 전공책임교수 및 학술본부장을 역임했다. 2006년에 KAIST에서 데이터베이스 분야로 전산학 박사학위를 취득했으며, 그 후 미국 일리노이 대학교 어배너-섐페인(UIUC)에서 그래프 데이터 마이닝을 연구하고, 미국 IBM 알마덴 연구소에서 상용 분산 인-메모리 OLAP 엔진을 개발한 바 있다. 김교수의 연구분야는 데이터베이스, 데이터 마이닝, 기계학습, 바이오인포매틱스로서 해당 분야에서 선도연구센터(ERC), SW스타랩, 삼성전자 미래기술육성센터 등 여러 과제들을 연구책임자로 수행했거나 수행하고 있고, 분야 최고 국제학회(ACM SIGMOD, ACM KDD, IEEE ICDE) 및 최고 국제저널(Nucleic Acids Research)에 꾸준히 연구논문들을 발표해오고 있다.",
    "tag": "csweb.profs",
    "id": 7,
    "content": "name:김민수 field:시스템·네트워크, 인공지능·정보서비스, 소셜 컴퓨팅 major:데이터베이스, 데이터마이닝／기계학습, 메디컬／바이오인포매틱스 degree:PhD, KAIST, 2006 web:http://infolab.kaist.ac.kr/ mail:minsoo.k@kaist.ac.kr phone:3582 office:2427, E3-1 etc:연구실: 인포랩\n\n김민수 교수는 한국과학기술원(KAIST)에 영년직 부교수로 근무하고 인포랩을 이끌고 있다. 김교수는 2020년 KAIST에 부임하기 전에는 대구경북과학기술원(DGIST)에서 영년직 부교수로 근무를 했었으며, 전공책임교수 및 학술본부장을 역임했다. 2006년에 KAIST에서 데이터베이스 분야로 전산학 박사학위를 취득했으며, 그 후 미국 일리노이 대학교 어배너-섐페인(UIUC)에서 그래프 데이터 마이닝을 연구하고, 미국 IBM 알마덴 연구소에서 상용 분산 인-메모리 OLAP 엔진을 개발한 바 있다. 김교수의 연구분야는 데이터베이스, 데이터 마이닝, 기계학습, 바이오인포매틱스로서 해당 분야에서 선도연구센터(ERC), SW스타랩, 삼성전자 미래기술육성센터 등 여러 과제들을 연구책임자로 수행했거나 수행하고 있고, 분야 최고 국제학회(ACM SIGMOD, ACM KDD, IEEE ICDE) 및 최고 국제저널(Nucleic Acids Research)에 꾸준히 연구논문들을 발표해오고 있다. tag:csweb.profs content:김민수 시스템·네트워크, 인공지능·정보서비스, 소셜 컴퓨팅 데이터베이스, 데이터마이닝／기계학습, 메디컬／바이오인포매틱스 PhD, KAIST, 2006 http://infolab.kaist.ac.kr/ minsoo.k@kaist.ac.kr 3582 2427, E3-1 연구실: 인포랩\n\n김민수 교수는 한국과학기술원(KAIST)에 영년직 부교수로 근무하고 인포랩을 이끌고 있다. 김교수는 2020년 KAIST에 부임하기 전에는 대구경북과학기술원(DGIST)에서 영년직 부교수로 근무를 했었으며, 전공책임교수 및 학술본부장을 역임했다. 2006년에 KAIST에서 데이터베이스 분야로 전산학 박사학위를 취득했으며, 그 후 미국 일리노이 대학교 어배너-섐페인(UIUC)에서 그래프 데이터 마이닝을 연구하고, 미국 IBM 알마덴 연구소에서 상용 분산 인-메모리 OLAP 엔진을 개발한 바 있다. 김교수의 연구분야는 데이터베이스, 데이터 마이닝, 기계학습, 바이오인포매틱스로서 해당 분야에서 선도연구센터(ERC), SW스타랩, 삼성전자 미래기술육성센터 등 여러 과제들을 연구책임자로 수행했거나 수행하고 있고, 분야 최고 국제학회(ACM SIGMOD, ACM KDD, IEEE ICDE) 및 최고 국제저널(Nucleic Acids Research)에 꾸준히 연구논문들을 발표해오고 있다. csweb.profs"
}