{
    "name": "허재혁",
    "field": "시스템·네트워크, 시큐어 컴퓨팅",
    "major": "컴퓨터구조, 시스템 소프트웨어, 시스템 보안",
    "degree": "PhD, Univ of Texas at Austin, 2006",
    "web": "https://jaehyuk-huh.github.io/",
    "mail": "jhhuh@kaist.ac.kr",
    "phone": "3515",
    "office": "E3-5, 404",
    "etc": "연구실: 컴퓨터구조 및 시스템 연구실\n\n허재혁 교수는 KAIST 전산학과 교수이며, 관심 연구 분야는 컴퓨터 구조, 운영체제, 시스템 보안입니다. 현재 컴퓨터 구조와 시스템 소프트웨어 간의 상호 작용에 중점을 두며, 가상화 시스템이나 모바일 환경을 위한 컴퓨터 구조, 시스템 보안, 메모리 계층의 변화와 관련된 연구를 하고 있습니다. 허재혁 교수는 2006년에 The University of Texas at Austin에서 박사학위를 취득한 후에, Advanced Micro Devices (AMD)에서 프로세서 개발에 참여하였으며 2008년에 카이스트 교수로 부임하였습니다.",
    "tag": "csweb.profs",
    "id": 47,
    "content": "name:허재혁 field:시스템·네트워크, 시큐어 컴퓨팅 major:컴퓨터구조, 시스템 소프트웨어, 시스템 보안 degree:PhD, Univ of Texas at Austin, 2006 web:https://jaehyuk-huh.github.io/ mail:jhhuh@kaist.ac.kr phone:3515 office:E3-5, 404 etc:연구실: 컴퓨터구조 및 시스템 연구실\n\n허재혁 교수는 KAIST 전산학과 교수이며, 관심 연구 분야는 컴퓨터 구조, 운영체제, 시스템 보안입니다. 현재 컴퓨터 구조와 시스템 소프트웨어 간의 상호 작용에 중점을 두며, 가상화 시스템이나 모바일 환경을 위한 컴퓨터 구조, 시스템 보안, 메모리 계층의 변화와 관련된 연구를 하고 있습니다. 허재혁 교수는 2006년에 The University of Texas at Austin에서 박사학위를 취득한 후에, Advanced Micro Devices (AMD)에서 프로세서 개발에 참여하였으며 2008년에 카이스트 교수로 부임하였습니다. tag:csweb.profs content:허재혁 시스템·네트워크, 시큐어 컴퓨팅 컴퓨터구조, 시스템 소프트웨어, 시스템 보안 PhD, Univ of Texas at Austin, 2006 https://jaehyuk-huh.github.io/ jhhuh@kaist.ac.kr 3515 E3-5, 404 연구실: 컴퓨터구조 및 시스템 연구실\n\n허재혁 교수는 KAIST 전산학과 교수이며, 관심 연구 분야는 컴퓨터 구조, 운영체제, 시스템 보안입니다. 현재 컴퓨터 구조와 시스템 소프트웨어 간의 상호 작용에 중점을 두며, 가상화 시스템이나 모바일 환경을 위한 컴퓨터 구조, 시스템 보안, 메모리 계층의 변화와 관련된 연구를 하고 있습니다. 허재혁 교수는 2006년에 The University of Texas at Austin에서 박사학위를 취득한 후에, Advanced Micro Devices (AMD)에서 프로세서 개발에 참여하였으며 2008년에 카이스트 교수로 부임하였습니다. csweb.profs"
}