{
    "name": "맹승렬",
    "field": "시스템·네트워크, 소셜 컴퓨팅",
    "major": "컴퓨터 구조, 내장형 시스템",
    "degree": "PhD, KAIST, 1984",
    "web": "http://camars.kaist.ac.kr/~maeng/",
    "mail": "maeng@kaist.ac.kr",
    "phone": "3519",
    "office": "1426, E3-1",
    "etc": "연구실: \n\n맹승렬 교수는 현재 카이스트 전산학과 교수이자 모바일 소프트웨어 센터의 센터장입니다. 현재 컴퓨터 구조, 시스템 보안, 분산 컴퓨팅, 모바일 컴퓨팅, 그리고 임베이디드 시스템에 주로 관심을 두고 연구를 하고 있습니다. 맹승렬 교수는 1977년에 서울대학교 전자공학과에서 학사학위를, 카이스트 전산학과에서 1979년에 석사, 1984년에 박사학위를 취득하였고, 1984년부터 카이스트 교수로 취임하였습니다.",
    "tag": "csweb.profs",
    "id": 57,
    "content": "name:맹승렬 field:시스템·네트워크, 소셜 컴퓨팅 major:컴퓨터 구조, 내장형 시스템 degree:PhD, KAIST, 1984 web:http://camars.kaist.ac.kr/~maeng/ mail:maeng@kaist.ac.kr phone:3519 office:1426, E3-1 etc:연구실: \n\n맹승렬 교수는 현재 카이스트 전산학과 교수이자 모바일 소프트웨어 센터의 센터장입니다. 현재 컴퓨터 구조, 시스템 보안, 분산 컴퓨팅, 모바일 컴퓨팅, 그리고 임베이디드 시스템에 주로 관심을 두고 연구를 하고 있습니다. 맹승렬 교수는 1977년에 서울대학교 전자공학과에서 학사학위를, 카이스트 전산학과에서 1979년에 석사, 1984년에 박사학위를 취득하였고, 1984년부터 카이스트 교수로 취임하였습니다. tag:csweb.profs content:맹승렬 시스템·네트워크, 소셜 컴퓨팅 컴퓨터 구조, 내장형 시스템 PhD, KAIST, 1984 http://camars.kaist.ac.kr/~maeng/ maeng@kaist.ac.kr 3519 1426, E3-1 연구실: \n\n맹승렬 교수는 현재 카이스트 전산학과 교수이자 모바일 소프트웨어 센터의 센터장입니다. 현재 컴퓨터 구조, 시스템 보안, 분산 컴퓨팅, 모바일 컴퓨팅, 그리고 임베이디드 시스템에 주로 관심을 두고 연구를 하고 있습니다. 맹승렬 교수는 1977년에 서울대학교 전자공학과에서 학사학위를, 카이스트 전산학과에서 1979년에 석사, 1984년에 박사학위를 취득하였고, 1984년부터 카이스트 교수로 취임하였습니다. csweb.profs"
}