{
    "name": "윤인수",
    "field": "시스템·네트워크, 시큐어 컴퓨팅",
    "major": "System security, Software security",
    "degree": "PhD, Georgia Institute of Technology, 2020",
    "web": "https://insuyun.github.io",
    "mail": "insuyun@kaist.ac.kr",
    "phone": "",
    "office": "812, N1",
    "etc": "연구실: \n\n윤인수 교수는 한국과학기술원(KAIST)에 조교수로 근무하고 있으며 주로 시스템 보안을 연구하며, 바이너리 분석, 자동 취약점 탐지, 자동 공격 생성 등에 관심이 많다. 그의 연구는 세계 우수 학회인 IEEE Security & Privacy, USENIX Security, USENIX OSDI 등에 발표되었으며, 2018년에는 USENIX Security와 USENIX OSDI에서 최우수 논문상을 수상하였다.\n연구 뿐 아니라 윤교수는 해킹 전문가로 다양한 해킹 대회에 참가하였다. 특히, Pwn2Own 2020에서 애플사의 사파리 브라우저를 해킹하였으며, DEFCON CTF에서2회 우승하였다.\nKAIST에 부임하기 전 윤교수는 조지아 공대에서 컴퓨터 공학으로 박사 학위를 취득했다.",
    "tag": "csweb.profs",
    "id": 86,
    "content": "name:윤인수 field:시스템·네트워크, 시큐어 컴퓨팅 major:System security, Software security degree:PhD, Georgia Institute of Technology, 2020 web:https://insuyun.github.io mail:insuyun@kaist.ac.kr phone: office:812, N1 etc:연구실: \n\n윤인수 교수는 한국과학기술원(KAIST)에 조교수로 근무하고 있으며 주로 시스템 보안을 연구하며, 바이너리 분석, 자동 취약점 탐지, 자동 공격 생성 등에 관심이 많다. 그의 연구는 세계 우수 학회인 IEEE Security & Privacy, USENIX Security, USENIX OSDI 등에 발표되었으며, 2018년에는 USENIX Security와 USENIX OSDI에서 최우수 논문상을 수상하였다.\n연구 뿐 아니라 윤교수는 해킹 전문가로 다양한 해킹 대회에 참가하였다. 특히, Pwn2Own 2020에서 애플사의 사파리 브라우저를 해킹하였으며, DEFCON CTF에서2회 우승하였다.\nKAIST에 부임하기 전 윤교수는 조지아 공대에서 컴퓨터 공학으로 박사 학위를 취득했다. tag:csweb.profs content:윤인수 시스템·네트워크, 시큐어 컴퓨팅 System security, Software security PhD, Georgia Institute of Technology, 2020 https://insuyun.github.io insuyun@kaist.ac.kr  812, N1 연구실: \n\n윤인수 교수는 한국과학기술원(KAIST)에 조교수로 근무하고 있으며 주로 시스템 보안을 연구하며, 바이너리 분석, 자동 취약점 탐지, 자동 공격 생성 등에 관심이 많다. 그의 연구는 세계 우수 학회인 IEEE Security & Privacy, USENIX Security, USENIX OSDI 등에 발표되었으며, 2018년에는 USENIX Security와 USENIX OSDI에서 최우수 논문상을 수상하였다.\n연구 뿐 아니라 윤교수는 해킹 전문가로 다양한 해킹 대회에 참가하였다. 특히, Pwn2Own 2020에서 애플사의 사파리 브라우저를 해킹하였으며, DEFCON CTF에서2회 우승하였다.\nKAIST에 부임하기 전 윤교수는 조지아 공대에서 컴퓨터 공학으로 박사 학위를 취득했다. csweb.profs"
}