{
    "name": "윤상호",
    "field": "인터랙티브 컴퓨팅",
    "major": "인간-컴퓨터 상호작용, 햅틱스, 인터랙션 테크닉, 웨어러블 컴퓨팅, 확장 현실",
    "degree": "PhD, Purdue Univ, 2017",
    "web": "https://hcitech.org/",
    "mail": "sangho@kaist.ac.kr",
    "phone": "042-350-2915",
    "office": "2327, N5",
    "etc": "연구실: \n\n윤상호 교수는 Carnegie Mellon University에서 학사와 석사, Purdue University에서 2017년 박사학위를 취득한 후 현재 문화기술대학원 교수로 재직하고 있다. KAIST 부임 전 약 10년의 국내외 기업 연구소 경험을 가지고 있으며, Microsoft Applied Science Lab과 Samsung Research에서 미래형 컴퓨팅 기기의 인터랙션 기법 및 관련 기기 개발 연구를 진행하며 다수의 국내외 특허를 등록 하였다. 주요 연구 분야는 인간-컴퓨터 상호작용, 인터랙션 기법 및 지능형 사용자 인터페이스 관련 연구를 수행하고 있다.",
    "tag": "csweb.profs",
    "id": 85,
    "content": "name:윤상호 field:인터랙티브 컴퓨팅 major:인간-컴퓨터 상호작용, 햅틱스, 인터랙션 테크닉, 웨어러블 컴퓨팅, 확장 현실 degree:PhD, Purdue Univ, 2017 web:https://hcitech.org/ mail:sangho@kaist.ac.kr phone:042-350-2915 office:2327, N5 etc:연구실: \n\n윤상호 교수는 Carnegie Mellon University에서 학사와 석사, Purdue University에서 2017년 박사학위를 취득한 후 현재 문화기술대학원 교수로 재직하고 있다. KAIST 부임 전 약 10년의 국내외 기업 연구소 경험을 가지고 있으며, Microsoft Applied Science Lab과 Samsung Research에서 미래형 컴퓨팅 기기의 인터랙션 기법 및 관련 기기 개발 연구를 진행하며 다수의 국내외 특허를 등록 하였다. 주요 연구 분야는 인간-컴퓨터 상호작용, 인터랙션 기법 및 지능형 사용자 인터페이스 관련 연구를 수행하고 있다. tag:csweb.profs content:윤상호 인터랙티브 컴퓨팅 인간-컴퓨터 상호작용, 햅틱스, 인터랙션 테크닉, 웨어러블 컴퓨팅, 확장 현실 PhD, Purdue Univ, 2017 https://hcitech.org/ sangho@kaist.ac.kr 042-350-2915 2327, N5 연구실: \n\n윤상호 교수는 Carnegie Mellon University에서 학사와 석사, Purdue University에서 2017년 박사학위를 취득한 후 현재 문화기술대학원 교수로 재직하고 있다. KAIST 부임 전 약 10년의 국내외 기업 연구소 경험을 가지고 있으며, Microsoft Applied Science Lab과 Samsung Research에서 미래형 컴퓨팅 기기의 인터랙션 기법 및 관련 기기 개발 연구를 진행하며 다수의 국내외 특허를 등록 하였다. 주요 연구 분야는 인간-컴퓨터 상호작용, 인터랙션 기법 및 지능형 사용자 인터페이스 관련 연구를 수행하고 있다. csweb.profs"
}