{
    "name": "이장수",
    "field": "소프트웨어 디자인, 시큐어 컴퓨팅, 인공지능·정보서비스",
    "major": "Software Engineering",
    "degree": "PhD, KAIST, 2002",
    "web": "https://cs.kaist.ac.kr",
    "mail": "jsleese@kaist.ac.kr",
    "phone": "042-350-7707",
    "office": "405, N1",
    "etc": "연구실: \n\n이장수 교수는 2023년 4월부터 한국과학기술원(KAIST) 전산학부 연구교수 겸 소프트웨어 중심대학 사업의 산학협력 중점교수로 근무하고 있다. 이교수는 2018년부터 2022년에는 삼성전자 반도체연구소, S.LSI사업부 등에서 상근고문으로 근무했으며, 1986년부터 2018년까지는 한국원자력연구원에 재직하였다. 2002년엔 KAIST에서 안전필수 제어시스템용 소프트웨어 안전 연구를 하여 컴퓨터과학 박사학위를 취득했다. 2013년 원전 제어시스템 기술자립으로 대한민국 과학기술포장을 수여하였고, 삼성전자에서는 자동차용 반도체, 시스템 소프트웨어, 자율주행 AI 소프트웨어 등의 안전과 보안을 자문하였다. 연구분야는 원자력발전소, 고속철도, 자율주행 자동차 등 안전이 필수적인 Cyber Physical System 용 반도체, 소프트웨어, AI 시스템의 Safety, Cybersecurity 등이다.",
    "tag": "csweb.profs",
    "id": 108,
    "content": "name:이장수 field:소프트웨어 디자인, 시큐어 컴퓨팅, 인공지능·정보서비스 major:Software Engineering degree:PhD, KAIST, 2002 web:https://cs.kaist.ac.kr mail:jsleese@kaist.ac.kr phone:042-350-7707 office:405, N1 etc:연구실: \n\n이장수 교수는 2023년 4월부터 한국과학기술원(KAIST) 전산학부 연구교수 겸 소프트웨어 중심대학 사업의 산학협력 중점교수로 근무하고 있다. 이교수는 2018년부터 2022년에는 삼성전자 반도체연구소, S.LSI사업부 등에서 상근고문으로 근무했으며, 1986년부터 2018년까지는 한국원자력연구원에 재직하였다. 2002년엔 KAIST에서 안전필수 제어시스템용 소프트웨어 안전 연구를 하여 컴퓨터과학 박사학위를 취득했다. 2013년 원전 제어시스템 기술자립으로 대한민국 과학기술포장을 수여하였고, 삼성전자에서는 자동차용 반도체, 시스템 소프트웨어, 자율주행 AI 소프트웨어 등의 안전과 보안을 자문하였다. 연구분야는 원자력발전소, 고속철도, 자율주행 자동차 등 안전이 필수적인 Cyber Physical System 용 반도체, 소프트웨어, AI 시스템의 Safety, Cybersecurity 등이다. tag:csweb.profs content:이장수 소프트웨어 디자인, 시큐어 컴퓨팅, 인공지능·정보서비스 Software Engineering PhD, KAIST, 2002 https://cs.kaist.ac.kr jsleese@kaist.ac.kr 042-350-7707 405, N1 연구실: \n\n이장수 교수는 2023년 4월부터 한국과학기술원(KAIST) 전산학부 연구교수 겸 소프트웨어 중심대학 사업의 산학협력 중점교수로 근무하고 있다. 이교수는 2018년부터 2022년에는 삼성전자 반도체연구소, S.LSI사업부 등에서 상근고문으로 근무했으며, 1986년부터 2018년까지는 한국원자력연구원에 재직하였다. 2002년엔 KAIST에서 안전필수 제어시스템용 소프트웨어 안전 연구를 하여 컴퓨터과학 박사학위를 취득했다. 2013년 원전 제어시스템 기술자립으로 대한민국 과학기술포장을 수여하였고, 삼성전자에서는 자동차용 반도체, 시스템 소프트웨어, 자율주행 AI 소프트웨어 등의 안전과 보안을 자문하였다. 연구분야는 원자력발전소, 고속철도, 자율주행 자동차 등 안전이 필수적인 Cyber Physical System 용 반도체, 소프트웨어, AI 시스템의 Safety, Cybersecurity 등이다. csweb.profs"
}