{
    "name": "박노성",
    "field": "인공지능·정보서비스, 소셜 컴퓨팅",
    "major": "Machine Learning",
    "degree": "PhD, University of Maryland, College Park, 2009",
    "web": "https://sites.google.com/view/noseong",
    "mail": "noseong@kaist.ac.kr",
    "phone": "3514",
    "office": "604, E3-5",
    "etc": "연구실: 빅데이터 분석 및 학습 연구실\n\n박노성 교수는 한국과학기술원(KAIST)에 부교수로 근무하면서 빅데이터 분석 및 학습 연구실을 이끌고 있다. 박교수는 2016년 미국 메릴랜드주립대(University of Maryland, College Park)에서 박사 학위를 취득 하였다. 2016년도에서 2018년도까지 노스캐롤라이나주립대 샬럿(University of North Carolina at Charlotte)에서 조교수로 근무 하였고, 2018년도에서 2020년도까지 조지메이슨대학교(George Mason University)에서 조교수로 근무 하였다. 2020년도에서 2024년도까지는 연세대에서 부교수로 근무하였다. 박교수는 다양한 국제학회(NeurIPS, ICLR, ICML, KDD 등)에 TPC 위원으로 활동을 하고 있다. 박교수의 메인 연구분야는 기계학습과 데이터지능 분야이며, 특히 미분방정식 기반 딥러, 시계열, 시공간계열, 추천 시스템 분야에 깊은 관심을 가지고 있다.",
    "tag": "csweb.profs",
    "id": 16,
    "content": "name:박노성 field:인공지능·정보서비스, 소셜 컴퓨팅 major:Machine Learning degree:PhD, University of Maryland, College Park, 2009 web:https://sites.google.com/view/noseong mail:noseong@kaist.ac.kr phone:3514 office:604, E3-5 etc:연구실: 빅데이터 분석 및 학습 연구실\n\n박노성 교수는 한국과학기술원(KAIST)에 부교수로 근무하면서 빅데이터 분석 및 학습 연구실을 이끌고 있다. 박교수는 2016년 미국 메릴랜드주립대(University of Maryland, College Park)에서 박사 학위를 취득 하였다. 2016년도에서 2018년도까지 노스캐롤라이나주립대 샬럿(University of North Carolina at Charlotte)에서 조교수로 근무 하였고, 2018년도에서 2020년도까지 조지메이슨대학교(George Mason University)에서 조교수로 근무 하였다. 2020년도에서 2024년도까지는 연세대에서 부교수로 근무하였다. 박교수는 다양한 국제학회(NeurIPS, ICLR, ICML, KDD 등)에 TPC 위원으로 활동을 하고 있다. 박교수의 메인 연구분야는 기계학습과 데이터지능 분야이며, 특히 미분방정식 기반 딥러, 시계열, 시공간계열, 추천 시스템 분야에 깊은 관심을 가지고 있다. tag:csweb.profs content:박노성 인공지능·정보서비스, 소셜 컴퓨팅 Machine Learning PhD, University of Maryland, College Park, 2009 https://sites.google.com/view/noseong noseong@kaist.ac.kr 3514 604, E3-5 연구실: 빅데이터 분석 및 학습 연구실\n\n박노성 교수는 한국과학기술원(KAIST)에 부교수로 근무하면서 빅데이터 분석 및 학습 연구실을 이끌고 있다. 박교수는 2016년 미국 메릴랜드주립대(University of Maryland, College Park)에서 박사 학위를 취득 하였다. 2016년도에서 2018년도까지 노스캐롤라이나주립대 샬럿(University of North Carolina at Charlotte)에서 조교수로 근무 하였고, 2018년도에서 2020년도까지 조지메이슨대학교(George Mason University)에서 조교수로 근무 하였다. 2020년도에서 2024년도까지는 연세대에서 부교수로 근무하였다. 박교수는 다양한 국제학회(NeurIPS, ICLR, ICML, KDD 등)에 TPC 위원으로 활동을 하고 있다. 박교수의 메인 연구분야는 기계학습과 데이터지능 분야이며, 특히 미분방정식 기반 딥러, 시계열, 시공간계열, 추천 시스템 분야에 깊은 관심을 가지고 있다. csweb.profs"
}