{
    "name": "김대영",
    "field": "인공지능·정보서비스",
    "major": "사물인터넷, 데이터공학, 딥러닝",
    "degree": "PhD, University of Florida, 2001",
    "web": "https://www.deal.kaist.ac.kr/",
    "mail": "kimd@kaist.ac.kr",
    "phone": "3551",
    "office": "N1, 902",
    "etc": "연구실: 데이터 공학 및 분석 연구실\n\n카이스트 전산학부 김대영 교수는 데이터 공학 및 분석 연구실（DEAL, Data Engineering and Analytics Laboratory）과 Auto-ID Labs, KAIST (http://autoidlabs.org) 사물인터넷(Internet of Things) 국제공동연구소를 운영하고 있다. 연구 분야는 사물인터넷, 기계학습 및 빅데이터 분석, 데이터공학 분야이며, 사물인터넷 세상에서 발생하는 데이터를 수집, 가공, 공유 및 분석하기 위한 사물인터넷 국제 표준 플랫폼인 Oliot(http://www.oliot.org) 오픈소스 프로젝트의 개발을 주도하고 있다. 국제 표준 기구인 GS1(http://gs1.org) 과 미국, 유럽, 중국, 일본 등지의 다양한 국제 연구 파트너들과 공동 연구를 진행하고 있다.",
    "tag": "csweb.profs",
    "id": 5,
    "content": "name:김대영 field:인공지능·정보서비스 major:사물인터넷, 데이터공학, 딥러닝 degree:PhD, University of Florida, 2001 web:https://www.deal.kaist.ac.kr/ mail:kimd@kaist.ac.kr phone:3551 office:N1, 902 etc:연구실: 데이터 공학 및 분석 연구실\n\n카이스트 전산학부 김대영 교수는 데이터 공학 및 분석 연구실（DEAL, Data Engineering and Analytics Laboratory）과 Auto-ID Labs, KAIST (http://autoidlabs.org) 사물인터넷(Internet of Things) 국제공동연구소를 운영하고 있다. 연구 분야는 사물인터넷, 기계학습 및 빅데이터 분석, 데이터공학 분야이며, 사물인터넷 세상에서 발생하는 데이터를 수집, 가공, 공유 및 분석하기 위한 사물인터넷 국제 표준 플랫폼인 Oliot(http://www.oliot.org) 오픈소스 프로젝트의 개발을 주도하고 있다. 국제 표준 기구인 GS1(http://gs1.org) 과 미국, 유럽, 중국, 일본 등지의 다양한 국제 연구 파트너들과 공동 연구를 진행하고 있다. tag:csweb.profs content:김대영 인공지능·정보서비스 사물인터넷, 데이터공학, 딥러닝 PhD, University of Florida, 2001 https://www.deal.kaist.ac.kr/ kimd@kaist.ac.kr 3551 N1, 902 연구실: 데이터 공학 및 분석 연구실\n\n카이스트 전산학부 김대영 교수는 데이터 공학 및 분석 연구실（DEAL, Data Engineering and Analytics Laboratory）과 Auto-ID Labs, KAIST (http://autoidlabs.org) 사물인터넷(Internet of Things) 국제공동연구소를 운영하고 있다. 연구 분야는 사물인터넷, 기계학습 및 빅데이터 분석, 데이터공학 분야이며, 사물인터넷 세상에서 발생하는 데이터를 수집, 가공, 공유 및 분석하기 위한 사물인터넷 국제 표준 플랫폼인 Oliot(http://www.oliot.org) 오픈소스 프로젝트의 개발을 주도하고 있다. 국제 표준 기구인 GS1(http://gs1.org) 과 미국, 유럽, 중국, 일본 등지의 다양한 국제 연구 파트너들과 공동 연구를 진행하고 있다. csweb.profs"
}