{
    "name": "이영희",
    "field": "전산이론, 소셜 컴퓨팅",
    "major": "컴퓨터네트워크",
    "degree": "PhD, UTC France, 1984",
    "web": "http://comnet.kaist.ac.kr",
    "mail": "younghlee@kaist.ac.kr",
    "phone": "3560",
    "office": "E3-1, 1406",
    "etc": "연구실: \n\n2009.03 - present Professor of KAIST\n2009.08 - 2011.11 Project Manager (PM) of Future Internet area, 한국 방송통신위원회 (KCC)\n2002.01 - 2003.07 ICU SOTI 연구소장\n1999.01 - 2001.12 ICU 공학부장\n1984.08 - 1997.09 한국전자통신연구원, 정보통신표준연구센터 센터장 (Gigabit 통신기술, 대용량 신호중계 교환기)\n1992.09 - 1996.06 충남대학교 컴퓨터과학과 겸임부교수\n1986.07 - 1987.11 IBM T. J. Watson 연구소 초빙과학자 (High Speed Network)\n1976.12 - 1980.03 동양정밀 중앙 연구소\n프랑스 UTC(Universite de Technology de Compiegne), 전산학 박사 (1984)\n서울대학교 공과대학 공업교육학과 공학석사 (1980)\n서울대학교 공과대학 공업교육학과 공학사 (1976)",
    "tag": "csweb.profs",
    "id": 62,
    "content": "name:이영희 field:전산이론, 소셜 컴퓨팅 major:컴퓨터네트워크 degree:PhD, UTC France, 1984 web:http://comnet.kaist.ac.kr mail:younghlee@kaist.ac.kr phone:3560 office:E3-1, 1406 etc:연구실: \n\n2009.03 - present Professor of KAIST\n2009.08 - 2011.11 Project Manager (PM) of Future Internet area, 한국 방송통신위원회 (KCC)\n2002.01 - 2003.07 ICU SOTI 연구소장\n1999.01 - 2001.12 ICU 공학부장\n1984.08 - 1997.09 한국전자통신연구원, 정보통신표준연구센터 센터장 (Gigabit 통신기술, 대용량 신호중계 교환기)\n1992.09 - 1996.06 충남대학교 컴퓨터과학과 겸임부교수\n1986.07 - 1987.11 IBM T. J. Watson 연구소 초빙과학자 (High Speed Network)\n1976.12 - 1980.03 동양정밀 중앙 연구소\n프랑스 UTC(Universite de Technology de Compiegne), 전산학 박사 (1984)\n서울대학교 공과대학 공업교육학과 공학석사 (1980)\n서울대학교 공과대학 공업교육학과 공학사 (1976) tag:csweb.profs content:이영희 전산이론, 소셜 컴퓨팅 컴퓨터네트워크 PhD, UTC France, 1984 http://comnet.kaist.ac.kr younghlee@kaist.ac.kr 3560 E3-1, 1406 연구실: \n\n2009.03 - present Professor of KAIST\n2009.08 - 2011.11 Project Manager (PM) of Future Internet area, 한국 방송통신위원회 (KCC)\n2002.01 - 2003.07 ICU SOTI 연구소장\n1999.01 - 2001.12 ICU 공학부장\n1984.08 - 1997.09 한국전자통신연구원, 정보통신표준연구센터 센터장 (Gigabit 통신기술, 대용량 신호중계 교환기)\n1992.09 - 1996.06 충남대학교 컴퓨터과학과 겸임부교수\n1986.07 - 1987.11 IBM T. J. Watson 연구소 초빙과학자 (High Speed Network)\n1976.12 - 1980.03 동양정밀 중앙 연구소\n프랑스 UTC(Universite de Technology de Compiegne), 전산학 박사 (1984)\n서울대학교 공과대학 공업교육학과 공학석사 (1980)\n서울대학교 공과대학 공업교육학과 공학사 (1976) csweb.profs"
}