{
    "name": "정혜원",
    "field": "인공지능·정보서비스",
    "major": "Information Theory, Data Science, Machine Learning, Deep Learning",
    "degree": "PhD, MIT, 2014",
    "web": "http://iids.kaist.ac.kr",
    "mail": "hwchung@kaist.ac.kr",
    "phone": "042-350-7441",
    "office": "N1,206",
    "etc": "연구실: \n\n정혜원 교수는 KAIST에 부교수로 재직하고 있으며 Inference and Information for Data Science (IIDS) 연구실을 이끌고 있다. 정혜원 교수는 2014년 MIT EECS에서 박사학위를 취득 했으며, 2014-2017년엔 University of Michigan에서 Research Fellow로 데이터과학 분야를 연구하였다. 정교수는 기계학습분야 다양한 국제학회(ICML, NeurIPS, ICLR, AAAI, IJCAI)에서 Program Committee로 활동하고 있으며, IEEE Information Theory Society에서 WiTHITS co-chair로도 활동하고 있다. 정교수의 연구분야는 정보이론, 데이터과학, 기계학습, 딥러닝, 통계적 추론으로 데이터과학 및 기계학습 분야의 효율적 알고리즘을 개발하고 이와 관련된 이론 분석 연구를 진행하고 있다.",
    "tag": "csweb.profs",
    "id": 91,
    "content": "name:정혜원 field:인공지능·정보서비스 major:Information Theory, Data Science, Machine Learning, Deep Learning degree:PhD, MIT, 2014 web:http://iids.kaist.ac.kr mail:hwchung@kaist.ac.kr phone:042-350-7441 office:N1,206 etc:연구실: \n\n정혜원 교수는 KAIST에 부교수로 재직하고 있으며 Inference and Information for Data Science (IIDS) 연구실을 이끌고 있다. 정혜원 교수는 2014년 MIT EECS에서 박사학위를 취득 했으며, 2014-2017년엔 University of Michigan에서 Research Fellow로 데이터과학 분야를 연구하였다. 정교수는 기계학습분야 다양한 국제학회(ICML, NeurIPS, ICLR, AAAI, IJCAI)에서 Program Committee로 활동하고 있으며, IEEE Information Theory Society에서 WiTHITS co-chair로도 활동하고 있다. 정교수의 연구분야는 정보이론, 데이터과학, 기계학습, 딥러닝, 통계적 추론으로 데이터과학 및 기계학습 분야의 효율적 알고리즘을 개발하고 이와 관련된 이론 분석 연구를 진행하고 있다. tag:csweb.profs content:정혜원 인공지능·정보서비스 Information Theory, Data Science, Machine Learning, Deep Learning PhD, MIT, 2014 http://iids.kaist.ac.kr hwchung@kaist.ac.kr 042-350-7441 N1,206 연구실: \n\n정혜원 교수는 KAIST에 부교수로 재직하고 있으며 Inference and Information for Data Science (IIDS) 연구실을 이끌고 있다. 정혜원 교수는 2014년 MIT EECS에서 박사학위를 취득 했으며, 2014-2017년엔 University of Michigan에서 Research Fellow로 데이터과학 분야를 연구하였다. 정교수는 기계학습분야 다양한 국제학회(ICML, NeurIPS, ICLR, AAAI, IJCAI)에서 Program Committee로 활동하고 있으며, IEEE Information Theory Society에서 WiTHITS co-chair로도 활동하고 있다. 정교수의 연구분야는 정보이론, 데이터과학, 기계학습, 딥러닝, 통계적 추론으로 데이터과학 및 기계학습 분야의 효율적 알고리즘을 개발하고 이와 관련된 이론 분석 연구를 진행하고 있다. csweb.profs"
}