{
    "name": "차미영",
    "field": "인공지능·정보서비스, 소셜 컴퓨팅, 인터랙티브 컴퓨팅",
    "major": "데이터과학, 전산사회과학, 통계분석",
    "degree": "박사, KAIST, 2008",
    "web": "https://ds.ibs.re.kr/",
    "mail": "meeyoungcha@kaist.ac.kr",
    "phone": "3574",
    "office": "E3-1, 2425",
    "etc": "연구실: 데이터 사이언스 연구실\n\n차미영 교수는 카이스트 전산학부 교수이다. 관심 분야는 데이터 과학, 네트워크 과학, 인공지능을 활용한 계산사회과학으로 가짜뉴스, 빈곤예측, 이상거래 탐지 등의 중요한 사회 문제를 다룬 그의 논문은 그간 18,000회 이상 피인용 되었다. 차교수는 아시아 최초로 미국 페이스북 본사 데이터 사이언스 팀의 초빙교수로 근무한 경험이 있으며, 정보과학회 젊은정보과학자상, AAAI ICWSM Test of Time Award, 과기부 장관표창의 수상자이다. 현재 그는 기초과학연구원 데이터사이언스 그룹을 이끌며 겸직 중이다.",
    "tag": "csweb.profs",
    "id": 41,
    "content": "name:차미영 field:인공지능·정보서비스, 소셜 컴퓨팅, 인터랙티브 컴퓨팅 major:데이터과학, 전산사회과학, 통계분석 degree:박사, KAIST, 2008 web:https://ds.ibs.re.kr/ mail:meeyoungcha@kaist.ac.kr phone:3574 office:E3-1, 2425 etc:연구실: 데이터 사이언스 연구실\n\n차미영 교수는 카이스트 전산학부 교수이다. 관심 분야는 데이터 과학, 네트워크 과학, 인공지능을 활용한 계산사회과학으로 가짜뉴스, 빈곤예측, 이상거래 탐지 등의 중요한 사회 문제를 다룬 그의 논문은 그간 18,000회 이상 피인용 되었다. 차교수는 아시아 최초로 미국 페이스북 본사 데이터 사이언스 팀의 초빙교수로 근무한 경험이 있으며, 정보과학회 젊은정보과학자상, AAAI ICWSM Test of Time Award, 과기부 장관표창의 수상자이다. 현재 그는 기초과학연구원 데이터사이언스 그룹을 이끌며 겸직 중이다. tag:csweb.profs content:차미영 인공지능·정보서비스, 소셜 컴퓨팅, 인터랙티브 컴퓨팅 데이터과학, 전산사회과학, 통계분석 박사, KAIST, 2008 https://ds.ibs.re.kr/ meeyoungcha@kaist.ac.kr 3574 E3-1, 2425 연구실: 데이터 사이언스 연구실\n\n차미영 교수는 카이스트 전산학부 교수이다. 관심 분야는 데이터 과학, 네트워크 과학, 인공지능을 활용한 계산사회과학으로 가짜뉴스, 빈곤예측, 이상거래 탐지 등의 중요한 사회 문제를 다룬 그의 논문은 그간 18,000회 이상 피인용 되었다. 차교수는 아시아 최초로 미국 페이스북 본사 데이터 사이언스 팀의 초빙교수로 근무한 경험이 있으며, 정보과학회 젊은정보과학자상, AAAI ICWSM Test of Time Award, 과기부 장관표창의 수상자이다. 현재 그는 기초과학연구원 데이터사이언스 그룹을 이끌며 겸직 중이다. csweb.profs"
}