{
    "name": "최성희",
    "field": "전산이론, 비주얼 컴퓨팅, 소셜 컴퓨팅",
    "major": "계산기하학, 컴퓨터그래픽스",
    "degree": "PhD, Univ of Texas at Austin, 2003",
    "web": "https://sites.google.com/view/kaist-gclab",
    "mail": "sunghee@kaist.edu",
    "phone": "3534",
    "office": "E3-1, 3404",
    "etc": "연구실: 기하 컴퓨팅 연구실\n\n최성희 교수는 한국과학기술원(KAIST) 전산학과의 부교수이다. 서울대학교에서 1995년에 컴퓨터 공학 학사 학위를 받았으며 오스틴의 텍사스 주립대에서 1997년과 2003년에 전산학 석사 및 박사 학위를 받았다. 주요 연구 분야는 기하학적 컴퓨팅(geometric computing), 계산기하학(computational geometry), 기하학적 모델링(geometric modeling)과 컴퓨터 그래픽스(computer graphics) 분야이다.",
    "tag": "csweb.profs",
    "id": 43,
    "content": "name:최성희 field:전산이론, 비주얼 컴퓨팅, 소셜 컴퓨팅 major:계산기하학, 컴퓨터그래픽스 degree:PhD, Univ of Texas at Austin, 2003 web:https://sites.google.com/view/kaist-gclab mail:sunghee@kaist.edu phone:3534 office:E3-1, 3404 etc:연구실: 기하 컴퓨팅 연구실\n\n최성희 교수는 한국과학기술원(KAIST) 전산학과의 부교수이다. 서울대학교에서 1995년에 컴퓨터 공학 학사 학위를 받았으며 오스틴의 텍사스 주립대에서 1997년과 2003년에 전산학 석사 및 박사 학위를 받았다. 주요 연구 분야는 기하학적 컴퓨팅(geometric computing), 계산기하학(computational geometry), 기하학적 모델링(geometric modeling)과 컴퓨터 그래픽스(computer graphics) 분야이다. tag:csweb.profs content:최성희 전산이론, 비주얼 컴퓨팅, 소셜 컴퓨팅 계산기하학, 컴퓨터그래픽스 PhD, Univ of Texas at Austin, 2003 https://sites.google.com/view/kaist-gclab sunghee@kaist.edu 3534 E3-1, 3404 연구실: 기하 컴퓨팅 연구실\n\n최성희 교수는 한국과학기술원(KAIST) 전산학과의 부교수이다. 서울대학교에서 1995년에 컴퓨터 공학 학사 학위를 받았으며 오스틴의 텍사스 주립대에서 1997년과 2003년에 전산학 석사 및 박사 학위를 받았다. 주요 연구 분야는 기하학적 컴퓨팅(geometric computing), 계산기하학(computational geometry), 기하학적 모델링(geometric modeling)과 컴퓨터 그래픽스(computer graphics) 분야이다. csweb.profs"
}