{
    "name": "박찬종",
    "field": "인공지능·정보서비스, 인터랙티브 컴퓨팅",
    "major": "Augmented Reality ／ Virtual Reality",
    "degree": "PhD, KAIST, 2007",
    "web": "https://cs.kaist.ac.kr",
    "mail": "cjpark0323@kaist.ac.kr",
    "phone": "",
    "office": "407, N1",
    "etc": "연구실: \n\n박찬종 교수는 KAIST 연구교수로 근무하고 있으며, SW중심대학사업의 산학협력 업무를 주로 수행하고 있습니다. 박교수는 2023년 KAIST에 부임하기 직전에는 연세대학교 미래캠퍼스에서 근무했으며, 한국전자통신연구원, 대전정보문화산업진흥원 원장, 한국연구재단 기술사업화단장, 연구개발특구진흥재단 대덕특구본부장을 역임하면서 산학연관 분야에서 공공기술사업화와 기술창업 전문가로 활동했습니다. 박교수의 연구분야는 컴퓨터그래픽, AR/VR 등이다.",
    "tag": "csweb.profs",
    "id": 106,
    "content": "name:박찬종 field:인공지능·정보서비스, 인터랙티브 컴퓨팅 major:Augmented Reality ／ Virtual Reality degree:PhD, KAIST, 2007 web:https://cs.kaist.ac.kr mail:cjpark0323@kaist.ac.kr phone: office:407, N1 etc:연구실: \n\n박찬종 교수는 KAIST 연구교수로 근무하고 있으며, SW중심대학사업의 산학협력 업무를 주로 수행하고 있습니다. 박교수는 2023년 KAIST에 부임하기 직전에는 연세대학교 미래캠퍼스에서 근무했으며, 한국전자통신연구원, 대전정보문화산업진흥원 원장, 한국연구재단 기술사업화단장, 연구개발특구진흥재단 대덕특구본부장을 역임하면서 산학연관 분야에서 공공기술사업화와 기술창업 전문가로 활동했습니다. 박교수의 연구분야는 컴퓨터그래픽, AR/VR 등이다. tag:csweb.profs content:박찬종 인공지능·정보서비스, 인터랙티브 컴퓨팅 Augmented Reality ／ Virtual Reality PhD, KAIST, 2007 https://cs.kaist.ac.kr cjpark0323@kaist.ac.kr  407, N1 연구실: \n\n박찬종 교수는 KAIST 연구교수로 근무하고 있으며, SW중심대학사업의 산학협력 업무를 주로 수행하고 있습니다. 박교수는 2023년 KAIST에 부임하기 직전에는 연세대학교 미래캠퍼스에서 근무했으며, 한국전자통신연구원, 대전정보문화산업진흥원 원장, 한국연구재단 기술사업화단장, 연구개발특구진흥재단 대덕특구본부장을 역임하면서 산학연관 분야에서 공공기술사업화와 기술창업 전문가로 활동했습니다. 박교수의 연구분야는 컴퓨터그래픽, AR/VR 등이다. csweb.profs"
}