{
    "name": "김주호",
    "field": "인공지능·정보서비스, 소셜 컴퓨팅, 인터랙티브 컴퓨팅",
    "major": "인간-컴퓨터 상호작용 (HCI), 인간-AI 상호작용, 소셜 컴퓨팅, 크라우드소싱, 온라인 교육",
    "degree": "Ph.D., Massachusetts Institute of Technology (MIT), 2015",
    "web": "https://juhokim.com/",
    "mail": "juhokim@kaist.ac.kr",
    "phone": "3570",
    "office": "N1, 605",
    "etc": "연구실: 인터랙션 연구실\n\n김주호 교수는 KAIST 전산학부 부교수로 재직하며 인터랙션 연구실(KIXLAB: kixlab.org)을 이끌고 있다. 주 연구분야는 인간-컴퓨터 상호작용(HCI)과 인간-AI 상호작용으로, 인공지능과 빅데이터 기법을 활용하여 사용자 인터페이스와 인터랙션을 설계하는 연구를 하고 있다. 특히 영상을 통한 온라인 교육과 토론을 통한 협업 및 의사결정 등의 중요한 사회 문제에 집단지성과 AI 기법을 결합하여 지원하고 실제 사용자들이 사용할 수 있는 플랫폼을 개발해 왔다. 김주호 교수는 2015년에 MIT에서 박사학위를, 2010년에 Stanford University에서 석사학위를, 2008년에 서울대학교에서 학사학위를 취득하였다. 2015∼2016년에는 Stanford University에 방문 조교수 및 Brown Fellow로 재직하였다. 김주호 교수는 KAIST 창의강의대상, 송암 미래석학 우수연구상, 우수강의상과 더불어 ACM CHI, ACM CSCW, ACM IUI, ACM Learning at Scale, ACM DIS, AAAI HCOMP 등의 HCI 분야 국제학술대회에서 총 14개의 우수논문상을 받았다.",
    "tag": "csweb.profs",
    "id": 11,
    "content": "name:김주호 field:인공지능·정보서비스, 소셜 컴퓨팅, 인터랙티브 컴퓨팅 major:인간-컴퓨터 상호작용 (HCI), 인간-AI 상호작용, 소셜 컴퓨팅, 크라우드소싱, 온라인 교육 degree:Ph.D., Massachusetts Institute of Technology (MIT), 2015 web:https://juhokim.com/ mail:juhokim@kaist.ac.kr phone:3570 office:N1, 605 etc:연구실: 인터랙션 연구실\n\n김주호 교수는 KAIST 전산학부 부교수로 재직하며 인터랙션 연구실(KIXLAB: kixlab.org)을 이끌고 있다. 주 연구분야는 인간-컴퓨터 상호작용(HCI)과 인간-AI 상호작용으로, 인공지능과 빅데이터 기법을 활용하여 사용자 인터페이스와 인터랙션을 설계하는 연구를 하고 있다. 특히 영상을 통한 온라인 교육과 토론을 통한 협업 및 의사결정 등의 중요한 사회 문제에 집단지성과 AI 기법을 결합하여 지원하고 실제 사용자들이 사용할 수 있는 플랫폼을 개발해 왔다. 김주호 교수는 2015년에 MIT에서 박사학위를, 2010년에 Stanford University에서 석사학위를, 2008년에 서울대학교에서 학사학위를 취득하였다. 2015∼2016년에는 Stanford University에 방문 조교수 및 Brown Fellow로 재직하였다. 김주호 교수는 KAIST 창의강의대상, 송암 미래석학 우수연구상, 우수강의상과 더불어 ACM CHI, ACM CSCW, ACM IUI, ACM Learning at Scale, ACM DIS, AAAI HCOMP 등의 HCI 분야 국제학술대회에서 총 14개의 우수논문상을 받았다. tag:csweb.profs content:김주호 인공지능·정보서비스, 소셜 컴퓨팅, 인터랙티브 컴퓨팅 인간-컴퓨터 상호작용 (HCI), 인간-AI 상호작용, 소셜 컴퓨팅, 크라우드소싱, 온라인 교육 Ph.D., Massachusetts Institute of Technology (MIT), 2015 https://juhokim.com/ juhokim@kaist.ac.kr 3570 N1, 605 연구실: 인터랙션 연구실\n\n김주호 교수는 KAIST 전산학부 부교수로 재직하며 인터랙션 연구실(KIXLAB: kixlab.org)을 이끌고 있다. 주 연구분야는 인간-컴퓨터 상호작용(HCI)과 인간-AI 상호작용으로, 인공지능과 빅데이터 기법을 활용하여 사용자 인터페이스와 인터랙션을 설계하는 연구를 하고 있다. 특히 영상을 통한 온라인 교육과 토론을 통한 협업 및 의사결정 등의 중요한 사회 문제에 집단지성과 AI 기법을 결합하여 지원하고 실제 사용자들이 사용할 수 있는 플랫폼을 개발해 왔다. 김주호 교수는 2015년에 MIT에서 박사학위를, 2010년에 Stanford University에서 석사학위를, 2008년에 서울대학교에서 학사학위를 취득하였다. 2015∼2016년에는 Stanford University에 방문 조교수 및 Brown Fellow로 재직하였다. 김주호 교수는 KAIST 창의강의대상, 송암 미래석학 우수연구상, 우수강의상과 더불어 ACM CHI, ACM CSCW, ACM IUI, ACM Learning at Scale, ACM DIS, AAAI HCOMP 등의 HCI 분야 국제학술대회에서 총 14개의 우수논문상을 받았다. csweb.profs"
}