{
    "name": "한동수",
    "field": "인공지능·정보서비스",
    "major": "실내 GPS, 위치기반 서비스",
    "degree": "PhD, Kyoto University, 1996",
    "web": "https://sites.google.com/view/isilab",
    "mail": "ddsshhan@kaist.ac.kr",
    "phone": "3562",
    "office": "N1, 704",
    "etc": "연구실: 지능형 서비스 통합 연구실\n\n한동수 교수는 현재 KAIST 전산학과 교수로 재직중이며, 2010년 KTNET과의 협업으로 코엑스에 실내측위 시스템을 구축하였고, 2011년 실내측위 연구센터(IPRC)를 설립하고 센터장을 역임하였다. 2014년 실내GPS 시스템으로서 KAILOS(KAIST Indoor Localization System)을 개발 하였다. KAIST교내 강좌에서도 ‘융합 캡스톤 디자인’과 같은 신 교과목 개설 기여를 통해 특허 전도사로서 활발한 활동을 하였으며, 2013년 ‘특허무한도전’ 이라는 책을 출간하였다. 공공물에서의 실내측위기술 연구 및 내비게이션 서비스를 제공하는데 주력하고 있다. 한동수 교수는 IEEE의 IEEE Computer society 회원이며, 한국 ITS 학회의 부회장이다.",
    "tag": "csweb.profs",
    "id": 44,
    "content": "name:한동수 field:인공지능·정보서비스 major:실내 GPS, 위치기반 서비스 degree:PhD, Kyoto University, 1996 web:https://sites.google.com/view/isilab mail:ddsshhan@kaist.ac.kr phone:3562 office:N1, 704 etc:연구실: 지능형 서비스 통합 연구실\n\n한동수 교수는 현재 KAIST 전산학과 교수로 재직중이며, 2010년 KTNET과의 협업으로 코엑스에 실내측위 시스템을 구축하였고, 2011년 실내측위 연구센터(IPRC)를 설립하고 센터장을 역임하였다. 2014년 실내GPS 시스템으로서 KAILOS(KAIST Indoor Localization System)을 개발 하였다. KAIST교내 강좌에서도 ‘융합 캡스톤 디자인’과 같은 신 교과목 개설 기여를 통해 특허 전도사로서 활발한 활동을 하였으며, 2013년 ‘특허무한도전’ 이라는 책을 출간하였다. 공공물에서의 실내측위기술 연구 및 내비게이션 서비스를 제공하는데 주력하고 있다. 한동수 교수는 IEEE의 IEEE Computer society 회원이며, 한국 ITS 학회의 부회장이다. tag:csweb.profs content:한동수 인공지능·정보서비스 실내 GPS, 위치기반 서비스 PhD, Kyoto University, 1996 https://sites.google.com/view/isilab ddsshhan@kaist.ac.kr 3562 N1, 704 연구실: 지능형 서비스 통합 연구실\n\n한동수 교수는 현재 KAIST 전산학과 교수로 재직중이며, 2010년 KTNET과의 협업으로 코엑스에 실내측위 시스템을 구축하였고, 2011년 실내측위 연구센터(IPRC)를 설립하고 센터장을 역임하였다. 2014년 실내GPS 시스템으로서 KAILOS(KAIST Indoor Localization System)을 개발 하였다. KAIST교내 강좌에서도 ‘융합 캡스톤 디자인’과 같은 신 교과목 개설 기여를 통해 특허 전도사로서 활발한 활동을 하였으며, 2013년 ‘특허무한도전’ 이라는 책을 출간하였다. 공공물에서의 실내측위기술 연구 및 내비게이션 서비스를 제공하는데 주력하고 있다. 한동수 교수는 IEEE의 IEEE Computer society 회원이며, 한국 ITS 학회의 부회장이다. csweb.profs"
}