{
    "name": "권영진",
    "field": "시스템·네트워크, 시큐어 컴퓨팅",
    "major": "운영체제, 시스템 보안",
    "degree": "Ph.D., The University of Texas at Austin, 2018",
    "web": "https://sites.google.com/view/yjkwon/home",
    "mail": "yjkwon@kaist.ac.kr",
    "phone": "042-350-3577",
    "office": "406, E3-5",
    "etc": "연구실: 컴퓨터구조 및 시스템 연구실\n\n권영진 교수는 한국과학기술원(KAIST)에서 조교수로 근무하며, 운영체제 연구실을 이끌고 있다. 권영진 교수는 KAIST에 부임하기 전에, 미국 택사스 오스틴 대학교(The University of Texas at Austin)에서 컴퓨터과학 박사학위을 2018년에 취득하였다. 주 연구분야는 운영체제로, 차세대 서비스들을 위한 운영체제, 새로운 스토리지와 네트워크 기술을 위한 파일/메모리 시스템, 보안을 위한 시스템 설계에 관심을 갖고 있다. 권영진 교수는 실제 적용가능한 연구에 관심을 갖고 있다. 특히 메모리 연구(OSDI 2016년)는 VMware의 주목을 받아, VMware ESXi hypervisor의 메모리 시스템에 적용되었다.",
    "tag": "csweb.profs",
    "id": 4,
    "content": "name:권영진 field:시스템·네트워크, 시큐어 컴퓨팅 major:운영체제, 시스템 보안 degree:Ph.D., The University of Texas at Austin, 2018 web:https://sites.google.com/view/yjkwon/home mail:yjkwon@kaist.ac.kr phone:042-350-3577 office:406, E3-5 etc:연구실: 컴퓨터구조 및 시스템 연구실\n\n권영진 교수는 한국과학기술원(KAIST)에서 조교수로 근무하며, 운영체제 연구실을 이끌고 있다. 권영진 교수는 KAIST에 부임하기 전에, 미국 택사스 오스틴 대학교(The University of Texas at Austin)에서 컴퓨터과학 박사학위을 2018년에 취득하였다. 주 연구분야는 운영체제로, 차세대 서비스들을 위한 운영체제, 새로운 스토리지와 네트워크 기술을 위한 파일/메모리 시스템, 보안을 위한 시스템 설계에 관심을 갖고 있다. 권영진 교수는 실제 적용가능한 연구에 관심을 갖고 있다. 특히 메모리 연구(OSDI 2016년)는 VMware의 주목을 받아, VMware ESXi hypervisor의 메모리 시스템에 적용되었다. tag:csweb.profs content:권영진 시스템·네트워크, 시큐어 컴퓨팅 운영체제, 시스템 보안 Ph.D., The University of Texas at Austin, 2018 https://sites.google.com/view/yjkwon/home yjkwon@kaist.ac.kr 042-350-3577 406, E3-5 연구실: 컴퓨터구조 및 시스템 연구실\n\n권영진 교수는 한국과학기술원(KAIST)에서 조교수로 근무하며, 운영체제 연구실을 이끌고 있다. 권영진 교수는 KAIST에 부임하기 전에, 미국 택사스 오스틴 대학교(The University of Texas at Austin)에서 컴퓨터과학 박사학위을 2018년에 취득하였다. 주 연구분야는 운영체제로, 차세대 서비스들을 위한 운영체제, 새로운 스토리지와 네트워크 기술을 위한 파일/메모리 시스템, 보안을 위한 시스템 설계에 관심을 갖고 있다. 권영진 교수는 실제 적용가능한 연구에 관심을 갖고 있다. 특히 메모리 연구(OSDI 2016년)는 VMware의 주목을 받아, VMware ESXi hypervisor의 메모리 시스템에 적용되었다. csweb.profs"
}