{
    "name": "한태숙",
    "field": "전산이론",
    "major": "프로그래밍언어, 컴파일러",
    "degree": "PhD, Univ of North Carolina, 1990",
    "web": "http://plus.kaist.ac.kr/~han/",
    "mail": "tshan@kaist.ac.kr",
    "phone": "3533",
    "office": "E3-1, 1419",
    "etc": "연구실: \n\n한태숙 교수는 서울대학교에서 전자공학과 학사를, KAIST에서 전산학과 석사를 취득하였으며, 1990년 UNC Chapel Hill에서 전산학 박사학위를 취득하였다. 그 뒤 1991년부터 KAIST 전산학부 교수로 재직하고 있으며, 프로그래밍 언어 및 컴파일러 등을 강의해 왔다. 프로그래밍 언어 이론을 기반으로 프로그램 분석 도구 및 소프트웨어 보안 분석 등에 관한 연구를 수행해 왔다. 현재는 바이너리코드의 분석 기법에 초점을 맞추어 연구 과제들을 진행하고 있다.",
    "tag": "csweb.profs",
    "id": 68,
    "content": "name:한태숙 field:전산이론 major:프로그래밍언어, 컴파일러 degree:PhD, Univ of North Carolina, 1990 web:http://plus.kaist.ac.kr/~han/ mail:tshan@kaist.ac.kr phone:3533 office:E3-1, 1419 etc:연구실: \n\n한태숙 교수는 서울대학교에서 전자공학과 학사를, KAIST에서 전산학과 석사를 취득하였으며, 1990년 UNC Chapel Hill에서 전산학 박사학위를 취득하였다. 그 뒤 1991년부터 KAIST 전산학부 교수로 재직하고 있으며, 프로그래밍 언어 및 컴파일러 등을 강의해 왔다. 프로그래밍 언어 이론을 기반으로 프로그램 분석 도구 및 소프트웨어 보안 분석 등에 관한 연구를 수행해 왔다. 현재는 바이너리코드의 분석 기법에 초점을 맞추어 연구 과제들을 진행하고 있다. tag:csweb.profs content:한태숙 전산이론 프로그래밍언어, 컴파일러 PhD, Univ of North Carolina, 1990 http://plus.kaist.ac.kr/~han/ tshan@kaist.ac.kr 3533 E3-1, 1419 연구실: \n\n한태숙 교수는 서울대학교에서 전자공학과 학사를, KAIST에서 전산학과 석사를 취득하였으며, 1990년 UNC Chapel Hill에서 전산학 박사학위를 취득하였다. 그 뒤 1991년부터 KAIST 전산학부 교수로 재직하고 있으며, 프로그래밍 언어 및 컴파일러 등을 강의해 왔다. 프로그래밍 언어 이론을 기반으로 프로그램 분석 도구 및 소프트웨어 보안 분석 등에 관한 연구를 수행해 왔다. 현재는 바이너리코드의 분석 기법에 초점을 맞추어 연구 과제들을 진행하고 있다. csweb.profs"
}