{
    "name": "강병훈",
    "field": "인공지능·정보서비스, 시큐어 컴퓨팅, 시스템·네트워크",
    "major": "시스템 보안",
    "degree": "Ph.D., University of California at Berkeley, 2004",
    "web": "https://cysec.kaist.ac.kr/",
    "mail": "brentkang@kaist.ac.kr",
    "phone": "8322",
    "office": "N5, 2315",
    "etc": "연구실: 사이버 보안 시스템 연구실\n\n강병훈 교수는 2004년 버클리 대학(University of California at Berkeley)에서 컴퓨터과학(CS) 전공으로 박사학위를 받고, 2013년부터 카이스트 부교수로 재직 중이다. 국제 활동으로는 2011, 2012 ACM CCS Tutorial co-chair, 2015 USENIX SECURITY, 2015 ICDCS, 2015, 2016, 2017 ACM CCS, 2016, 2017, 2018 IEEE S&P Program Committee 직책을 맡았다. 주 연구 분야는 Trusted Execution Environment 설계 및 이를 이용한 안전한 호스트 시스템 디자인이다 (OS 커널 무결성 모니터, 하드웨어 기반 신뢰 실행 환경, 가상머신 감시, 메모리 주소 변환 무결성, 코드 재사용 공격 방어, 히든 서버, 안티 스팸, 봇넷 악성코드 분석)",
    "tag": "csweb.profs",
    "id": 2,
    "content": "name:강병훈 field:인공지능·정보서비스, 시큐어 컴퓨팅, 시스템·네트워크 major:시스템 보안 degree:Ph.D., University of California at Berkeley, 2004 web:https://cysec.kaist.ac.kr/ mail:brentkang@kaist.ac.kr phone:8322 office:N5, 2315 etc:연구실: 사이버 보안 시스템 연구실\n\n강병훈 교수는 2004년 버클리 대학(University of California at Berkeley)에서 컴퓨터과학(CS) 전공으로 박사학위를 받고, 2013년부터 카이스트 부교수로 재직 중이다. 국제 활동으로는 2011, 2012 ACM CCS Tutorial co-chair, 2015 USENIX SECURITY, 2015 ICDCS, 2015, 2016, 2017 ACM CCS, 2016, 2017, 2018 IEEE S&P Program Committee 직책을 맡았다. 주 연구 분야는 Trusted Execution Environment 설계 및 이를 이용한 안전한 호스트 시스템 디자인이다 (OS 커널 무결성 모니터, 하드웨어 기반 신뢰 실행 환경, 가상머신 감시, 메모리 주소 변환 무결성, 코드 재사용 공격 방어, 히든 서버, 안티 스팸, 봇넷 악성코드 분석) tag:csweb.profs content:강병훈 인공지능·정보서비스, 시큐어 컴퓨팅, 시스템·네트워크 시스템 보안 Ph.D., University of California at Berkeley, 2004 https://cysec.kaist.ac.kr/ brentkang@kaist.ac.kr 8322 N5, 2315 연구실: 사이버 보안 시스템 연구실\n\n강병훈 교수는 2004년 버클리 대학(University of California at Berkeley)에서 컴퓨터과학(CS) 전공으로 박사학위를 받고, 2013년부터 카이스트 부교수로 재직 중이다. 국제 활동으로는 2011, 2012 ACM CCS Tutorial co-chair, 2015 USENIX SECURITY, 2015 ICDCS, 2015, 2016, 2017 ACM CCS, 2016, 2017, 2018 IEEE S&P Program Committee 직책을 맡았다. 주 연구 분야는 Trusted Execution Environment 설계 및 이를 이용한 안전한 호스트 시스템 디자인이다 (OS 커널 무결성 모니터, 하드웨어 기반 신뢰 실행 환경, 가상머신 감시, 메모리 주소 변환 무결성, 코드 재사용 공격 방어, 히든 서버, 안티 스팸, 봇넷 악성코드 분석) csweb.profs"
}