{
    "name": "윤현수",
    "field": "시스템·네트워크, 시큐어 컴퓨팅, 인공지능·정보서비스",
    "major": "컴퓨터네트워크, 정보보안",
    "degree": "PhD, Ohio State Univ, 1988",
    "web": "http://nslab.kaist.ac.kr",
    "mail": "hyoon@kaist.ac.kr",
    "phone": "3529",
    "office": "E3-1, 3435",
    "etc": "연구실: \n\n윤현수 교수님은 1979년 서울대학교 전자공학 학사 학위를 받으셨고, 1981년 한국과학기술원에서 전산학 석사 학위 및 1988년 오하이오 주립 대학에서 컴퓨터 및 정보 과학 박사 학위를 각각 취득하셨습니다. 윤현수 교수님은 1978년∼1980년에는 동양 방송에서 근무하셨으며, 이후 1980년∼1984년에는삼성 전자에서 근무하셨습니다. 1988∼1989년에는 AT&T Bell Labs 연구원이셨으며, 1989년 이래 한국과학기술원 전산학과의 교수로 재직 중이십니다.",
    "tag": "csweb.profs",
    "id": 61,
    "content": "name:윤현수 field:시스템·네트워크, 시큐어 컴퓨팅, 인공지능·정보서비스 major:컴퓨터네트워크, 정보보안 degree:PhD, Ohio State Univ, 1988 web:http://nslab.kaist.ac.kr mail:hyoon@kaist.ac.kr phone:3529 office:E3-1, 3435 etc:연구실: \n\n윤현수 교수님은 1979년 서울대학교 전자공학 학사 학위를 받으셨고, 1981년 한국과학기술원에서 전산학 석사 학위 및 1988년 오하이오 주립 대학에서 컴퓨터 및 정보 과학 박사 학위를 각각 취득하셨습니다. 윤현수 교수님은 1978년∼1980년에는 동양 방송에서 근무하셨으며, 이후 1980년∼1984년에는삼성 전자에서 근무하셨습니다. 1988∼1989년에는 AT&T Bell Labs 연구원이셨으며, 1989년 이래 한국과학기술원 전산학과의 교수로 재직 중이십니다. tag:csweb.profs content:윤현수 시스템·네트워크, 시큐어 컴퓨팅, 인공지능·정보서비스 컴퓨터네트워크, 정보보안 PhD, Ohio State Univ, 1988 http://nslab.kaist.ac.kr hyoon@kaist.ac.kr 3529 E3-1, 3435 연구실: \n\n윤현수 교수님은 1979년 서울대학교 전자공학 학사 학위를 받으셨고, 1981년 한국과학기술원에서 전산학 석사 학위 및 1988년 오하이오 주립 대학에서 컴퓨터 및 정보 과학 박사 학위를 각각 취득하셨습니다. 윤현수 교수님은 1978년∼1980년에는 동양 방송에서 근무하셨으며, 이후 1980년∼1984년에는삼성 전자에서 근무하셨습니다. 1988∼1989년에는 AT&T Bell Labs 연구원이셨으며, 1989년 이래 한국과학기술원 전산학과의 교수로 재직 중이십니다. csweb.profs"
}