{
    "name": "김학수",
    "field": "인공지능·정보서비스",
    "major": "Natural Language Processing",
    "degree": "PhD, Sogang Univ, 2003",
    "web": "http://nlp.konkuk.ac.kr",
    "mail": "nlpdrkim@konkuk.ac.kr",
    "phone": "",
    "office": "",
    "etc": "연구실: \n\n김학수 교수는 건국대학교 컴퓨터공학부에 정교수로 근무하고 자연어처리연구실을 이끌고 있다. 또한 KAIST에 겸임교수직을 수행하면서 자연어처리 강의를 진행하고 있다. 1996년에 건국대학교 전자계산학과에서 공학사, 1998년에 서강대학교 컴퓨터공학과에서 공학석사, 2003년에 서강대학교 컴퓨터공학과에서 공학박사 학위를 받았다. 2004년에 매사추세츠대학교 앰허스트 캠퍼스(Umass, Amherst)의 지능형 정보검색 센터(CIIR)에서 박사후 과정을 밟았으며, 2005년에 한국전자통신연구원(ETRI)에서 선임연구원으로 근무하였고, 2006년 3월부터 2020년 2월까지 강원대학교 교수로 재직했다. 그의 연구 관심 분야는 자연어 처리, 정보 검색 및 질의 응답 등이다.",
    "tag": "csweb.profs",
    "id": 94,
    "content": "name:김학수 field:인공지능·정보서비스 major:Natural Language Processing degree:PhD, Sogang Univ, 2003 web:http://nlp.konkuk.ac.kr mail:nlpdrkim@konkuk.ac.kr phone: office: etc:연구실: \n\n김학수 교수는 건국대학교 컴퓨터공학부에 정교수로 근무하고 자연어처리연구실을 이끌고 있다. 또한 KAIST에 겸임교수직을 수행하면서 자연어처리 강의를 진행하고 있다. 1996년에 건국대학교 전자계산학과에서 공학사, 1998년에 서강대학교 컴퓨터공학과에서 공학석사, 2003년에 서강대학교 컴퓨터공학과에서 공학박사 학위를 받았다. 2004년에 매사추세츠대학교 앰허스트 캠퍼스(Umass, Amherst)의 지능형 정보검색 센터(CIIR)에서 박사후 과정을 밟았으며, 2005년에 한국전자통신연구원(ETRI)에서 선임연구원으로 근무하였고, 2006년 3월부터 2020년 2월까지 강원대학교 교수로 재직했다. 그의 연구 관심 분야는 자연어 처리, 정보 검색 및 질의 응답 등이다. tag:csweb.profs content:김학수 인공지능·정보서비스 Natural Language Processing PhD, Sogang Univ, 2003 http://nlp.konkuk.ac.kr nlpdrkim@konkuk.ac.kr   연구실: \n\n김학수 교수는 건국대학교 컴퓨터공학부에 정교수로 근무하고 자연어처리연구실을 이끌고 있다. 또한 KAIST에 겸임교수직을 수행하면서 자연어처리 강의를 진행하고 있다. 1996년에 건국대학교 전자계산학과에서 공학사, 1998년에 서강대학교 컴퓨터공학과에서 공학석사, 2003년에 서강대학교 컴퓨터공학과에서 공학박사 학위를 받았다. 2004년에 매사추세츠대학교 앰허스트 캠퍼스(Umass, Amherst)의 지능형 정보검색 센터(CIIR)에서 박사후 과정을 밟았으며, 2005년에 한국전자통신연구원(ETRI)에서 선임연구원으로 근무하였고, 2006년 3월부터 2020년 2월까지 강원대학교 교수로 재직했다. 그의 연구 관심 분야는 자연어 처리, 정보 검색 및 질의 응답 등이다. csweb.profs"
}