{
    "name": "현순주",
    "field": "인공지능·정보서비스",
    "major": "데이타베이스",
    "degree": "PhD, University of Florida, 1995",
    "web": "http://idb.kaist.ac.kr/",
    "mail": "sjhyun@kaist.ac.kr",
    "phone": "3563",
    "office": "E3-1, 1420",
    "etc": "연구실: \n\n현순주 교수님은 현재 전산학과 교수로 재직중이며 지능형 데이터 베이스 시스템 연구실(iDBLab)에 소속되어 있습니다. 석사 학위는 1987년에 벨기에 Katholieke Universiteit Leuven (KUL)에서 취득하였고, 박사 학위는 1995년에 미국 University of Florida에서 취득하였습니다. 교수님은 1984년부터 1997년까지 벨 연구소, 한국전자통신연구원(ETRI)에서 근무하였습니다. 현재 관심 연구분야로는 상황인지 유비쿼터스 컴퓨팅과 센서네트워크 데이터베이스 분야로 활발히 연구중에 있습니다.",
    "tag": "csweb.profs",
    "id": 69,
    "content": "name:현순주 field:인공지능·정보서비스 major:데이타베이스 degree:PhD, University of Florida, 1995 web:http://idb.kaist.ac.kr/ mail:sjhyun@kaist.ac.kr phone:3563 office:E3-1, 1420 etc:연구실: \n\n현순주 교수님은 현재 전산학과 교수로 재직중이며 지능형 데이터 베이스 시스템 연구실(iDBLab)에 소속되어 있습니다. 석사 학위는 1987년에 벨기에 Katholieke Universiteit Leuven (KUL)에서 취득하였고, 박사 학위는 1995년에 미국 University of Florida에서 취득하였습니다. 교수님은 1984년부터 1997년까지 벨 연구소, 한국전자통신연구원(ETRI)에서 근무하였습니다. 현재 관심 연구분야로는 상황인지 유비쿼터스 컴퓨팅과 센서네트워크 데이터베이스 분야로 활발히 연구중에 있습니다. tag:csweb.profs content:현순주 인공지능·정보서비스 데이타베이스 PhD, University of Florida, 1995 http://idb.kaist.ac.kr/ sjhyun@kaist.ac.kr 3563 E3-1, 1420 연구실: \n\n현순주 교수님은 현재 전산학과 교수로 재직중이며 지능형 데이터 베이스 시스템 연구실(iDBLab)에 소속되어 있습니다. 석사 학위는 1987년에 벨기에 Katholieke Universiteit Leuven (KUL)에서 취득하였고, 박사 학위는 1995년에 미국 University of Florida에서 취득하였습니다. 교수님은 1984년부터 1997년까지 벨 연구소, 한국전자통신연구원(ETRI)에서 근무하였습니다. 현재 관심 연구분야로는 상황인지 유비쿼터스 컴퓨팅과 센서네트워크 데이터베이스 분야로 활발히 연구중에 있습니다. csweb.profs"
}