{
    "name": "오태현",
    "field": "비주얼 컴퓨팅, 인공지능·정보서비스, 인터랙티브 컴퓨팅",
    "major": "컴퓨터 비전, 머신 러닝, 컴퓨터 그래픽스, 데이터 시각화",
    "degree": "PhD, KAIST, 2017",
    "web": "https://ami.kaist.ac.kr",
    "mail": "taehyun.oh@kaist.ac.kr",
    "phone": "3520",
    "office": "E-5, 607",
    "etc": "연구실: 기계 지능 연구실\n\n오태현 교수는 2025년부터 KAIST 전산학부 부교수로 Advanced Machine Intelligence Lab을 이끌고 있다. KAIST 부임 이전에는 POSTECH에서 부교수(2020∼2025년)로 재직했으며, POSCO-RIST 오픈랩의 연구소장(2021∼2023년)으로 겸직하였다. 오태현 교수는 2017년에 KAIST 전기전자공학부에서 Low-rank optimization과 컴퓨터 비전 응용으로 박사학위를 받았으며, MIT CSAIL(2017∼2019년)과 Facebook AI Research(2019∼2020년)에서 박사후연구원으로 재직하였다. 또한 중국 Microsoft Research Asia(2014∼2015년)와 미국 Microsoft Research(2016년)에서 연구 인턴십을 수련하였다. 오태현 교수는 CVPR, ICCV, NeurIPS, ICLR, ACCV의 Area Chair와 AAAI의 Senior program chair를 역임하였고, International Journal of Computer Vision (IJCV)와 ICRA의 Associate Editor로 활발히 활동하고 있다. 그는 Microsoft Research Asia Fellowship, BMVC Best Poster Award, 삼성 휴먼테크 논문상 금상, Qualcomm Innovation Awards, KAIST 전기및전자공학과 김충기상 (박사과정  최우수연구실적상), CVPR과 ICLR의 우수 리뷰어상을 수상하였다. 최근 그의 연구 관심사는 컴퓨터 비전, 머신 러닝, 그래픽, 멀티모달 러닝에 걸쳐 있으며, 생성형 기계 지각 (Machine Perception) 시스템과 알고리즘 연구를 활발히 수행하고 있다.",
    "tag": "csweb.profs",
    "id": 29,
    "content": "name:오태현 field:비주얼 컴퓨팅, 인공지능·정보서비스, 인터랙티브 컴퓨팅 major:컴퓨터 비전, 머신 러닝, 컴퓨터 그래픽스, 데이터 시각화 degree:PhD, KAIST, 2017 web:https://ami.kaist.ac.kr mail:taehyun.oh@kaist.ac.kr phone:3520 office:E-5, 607 etc:연구실: 기계 지능 연구실\n\n오태현 교수는 2025년부터 KAIST 전산학부 부교수로 Advanced Machine Intelligence Lab을 이끌고 있다. KAIST 부임 이전에는 POSTECH에서 부교수(2020∼2025년)로 재직했으며, POSCO-RIST 오픈랩의 연구소장(2021∼2023년)으로 겸직하였다. 오태현 교수는 2017년에 KAIST 전기전자공학부에서 Low-rank optimization과 컴퓨터 비전 응용으로 박사학위를 받았으며, MIT CSAIL(2017∼2019년)과 Facebook AI Research(2019∼2020년)에서 박사후연구원으로 재직하였다. 또한 중국 Microsoft Research Asia(2014∼2015년)와 미국 Microsoft Research(2016년)에서 연구 인턴십을 수련하였다. 오태현 교수는 CVPR, ICCV, NeurIPS, ICLR, ACCV의 Area Chair와 AAAI의 Senior program chair를 역임하였고, International Journal of Computer Vision (IJCV)와 ICRA의 Associate Editor로 활발히 활동하고 있다. 그는 Microsoft Research Asia Fellowship, BMVC Best Poster Award, 삼성 휴먼테크 논문상 금상, Qualcomm Innovation Awards, KAIST 전기및전자공학과 김충기상 (박사과정  최우수연구실적상), CVPR과 ICLR의 우수 리뷰어상을 수상하였다. 최근 그의 연구 관심사는 컴퓨터 비전, 머신 러닝, 그래픽, 멀티모달 러닝에 걸쳐 있으며, 생성형 기계 지각 (Machine Perception) 시스템과 알고리즘 연구를 활발히 수행하고 있다. tag:csweb.profs content:오태현 비주얼 컴퓨팅, 인공지능·정보서비스, 인터랙티브 컴퓨팅 컴퓨터 비전, 머신 러닝, 컴퓨터 그래픽스, 데이터 시각화 PhD, KAIST, 2017 https://ami.kaist.ac.kr taehyun.oh@kaist.ac.kr 3520 E-5, 607 연구실: 기계 지능 연구실\n\n오태현 교수는 2025년부터 KAIST 전산학부 부교수로 Advanced Machine Intelligence Lab을 이끌고 있다. KAIST 부임 이전에는 POSTECH에서 부교수(2020∼2025년)로 재직했으며, POSCO-RIST 오픈랩의 연구소장(2021∼2023년)으로 겸직하였다. 오태현 교수는 2017년에 KAIST 전기전자공학부에서 Low-rank optimization과 컴퓨터 비전 응용으로 박사학위를 받았으며, MIT CSAIL(2017∼2019년)과 Facebook AI Research(2019∼2020년)에서 박사후연구원으로 재직하였다. 또한 중국 Microsoft Research Asia(2014∼2015년)와 미국 Microsoft Research(2016년)에서 연구 인턴십을 수련하였다. 오태현 교수는 CVPR, ICCV, NeurIPS, ICLR, ACCV의 Area Chair와 AAAI의 Senior program chair를 역임하였고, International Journal of Computer Vision (IJCV)와 ICRA의 Associate Editor로 활발히 활동하고 있다. 그는 Microsoft Research Asia Fellowship, BMVC Best Poster Award, 삼성 휴먼테크 논문상 금상, Qualcomm Innovation Awards, KAIST 전기및전자공학과 김충기상 (박사과정  최우수연구실적상), CVPR과 ICLR의 우수 리뷰어상을 수상하였다. 최근 그의 연구 관심사는 컴퓨터 비전, 머신 러닝, 그래픽, 멀티모달 러닝에 걸쳐 있으며, 생성형 기계 지각 (Machine Perception) 시스템과 알고리즘 연구를 활발히 수행하고 있다. csweb.profs"
}