{
    "name": "문영수",
    "field": "시큐어 컴퓨팅, 비주얼 컴퓨팅",
    "major": "Electrical Engineering",
    "degree": "PhD. Seoul National Univ, 1998",
    "web": "https://cs.kaist.ac.kr",
    "mail": "youngsmoon@kaist.ac.kr",
    "phone": "",
    "office": "806, N1",
    "etc": "연구실: \n\n문영수 교수는 KAIST 전산학부 정보보호대학원 초빙교수로, 주요 관심분야는 바이오인식과 물리보안이다. 문 교수는 물리보안 산업의 전문가로, 2000년 ㈜슈프리마를 공동 창업하여 20여 년간 회사를 글로벌 물리보안 선도 기업으로 성장시키는 데 기여하였다. 슈프리마에서 대표이사와 부회장을 역임했으며, 2018년 벤처창업진흥유공자로 선정되어 동탑산업훈장을 받았다. 문 교수는 서울대학교 제어계측공학과에서 학사 및 석사 학위를, 동대학 전기공학부에서 박사학위를 취득하였다. 슈프리마 공동 창업 이전에는 미국 스탠포드 대학에서 방문연구원으로, 한국전자통신연구원(ETRI)에서 선임연구원으로 근무한 바 있다.",
    "tag": "csweb.profs",
    "id": 99,
    "content": "name:문영수 field:시큐어 컴퓨팅, 비주얼 컴퓨팅 major:Electrical Engineering degree:PhD. Seoul National Univ, 1998 web:https://cs.kaist.ac.kr mail:youngsmoon@kaist.ac.kr phone: office:806, N1 etc:연구실: \n\n문영수 교수는 KAIST 전산학부 정보보호대학원 초빙교수로, 주요 관심분야는 바이오인식과 물리보안이다. 문 교수는 물리보안 산업의 전문가로, 2000년 ㈜슈프리마를 공동 창업하여 20여 년간 회사를 글로벌 물리보안 선도 기업으로 성장시키는 데 기여하였다. 슈프리마에서 대표이사와 부회장을 역임했으며, 2018년 벤처창업진흥유공자로 선정되어 동탑산업훈장을 받았다. 문 교수는 서울대학교 제어계측공학과에서 학사 및 석사 학위를, 동대학 전기공학부에서 박사학위를 취득하였다. 슈프리마 공동 창업 이전에는 미국 스탠포드 대학에서 방문연구원으로, 한국전자통신연구원(ETRI)에서 선임연구원으로 근무한 바 있다. tag:csweb.profs content:문영수 시큐어 컴퓨팅, 비주얼 컴퓨팅 Electrical Engineering PhD. Seoul National Univ, 1998 https://cs.kaist.ac.kr youngsmoon@kaist.ac.kr  806, N1 연구실: \n\n문영수 교수는 KAIST 전산학부 정보보호대학원 초빙교수로, 주요 관심분야는 바이오인식과 물리보안이다. 문 교수는 물리보안 산업의 전문가로, 2000년 ㈜슈프리마를 공동 창업하여 20여 년간 회사를 글로벌 물리보안 선도 기업으로 성장시키는 데 기여하였다. 슈프리마에서 대표이사와 부회장을 역임했으며, 2018년 벤처창업진흥유공자로 선정되어 동탑산업훈장을 받았다. 문 교수는 서울대학교 제어계측공학과에서 학사 및 석사 학위를, 동대학 전기공학부에서 박사학위를 취득하였다. 슈프리마 공동 창업 이전에는 미국 스탠포드 대학에서 방문연구원으로, 한국전자통신연구원(ETRI)에서 선임연구원으로 근무한 바 있다. csweb.profs"
}