{
    "name": "이안오클리",
    "field": "시큐어 컴퓨팅, 인공지능·정보서비스",
    "major": "Human Computer Interaction",
    "degree": "PhD, University of Glasgow, 2003",
    "web": "https://wit.kaist.ac.kr/",
    "mail": "ian.r.oakley@gmail.com",
    "phone": "042-350-7476",
    "office": "208, N1",
    "etc": "연구실: \n\nIan Oakley is a full professor at the School of Electrical Engineering at KAIST in South Korea with a joint appointment in computer science. He holds a BSc (Joint Honours First Class) in Computing Science and Psychology and a PhD in Computer Science from the University of Glasgow, UK. Before joining KAIST, he worked in Ireland (MIT MediaLab Europe), Portugal (University of Madeira), and several other institutions in Korea (GIST, ETRI, and UNIST) and has been a visiting professor at Carnegie Mellon HCII and the University of Washington iSchool. His research area is Human-Computer Interaction (HCI). He specifically focuses on the design, development, and evaluation of wearable, mobile, and interactive technologies for fundamental use cases such as text entry, pointing and selection, and authentication. He regularly publishes at (and serves as a program committee or editor of) leading HCI conferences (such as ACM CHI, ACM UIST, ACM TEI) and journals (such as ACM IMWUT, Interacting with Computers and IJHCS).",
    "tag": "csweb.profs",
    "id": 88,
    "content": "name:이안오클리 field:시큐어 컴퓨팅, 인공지능·정보서비스 major:Human Computer Interaction degree:PhD, University of Glasgow, 2003 web:https://wit.kaist.ac.kr/ mail:ian.r.oakley@gmail.com phone:042-350-7476 office:208, N1 etc:연구실: \n\nIan Oakley is a full professor at the School of Electrical Engineering at KAIST in South Korea with a joint appointment in computer science. He holds a BSc (Joint Honours First Class) in Computing Science and Psychology and a PhD in Computer Science from the University of Glasgow, UK. Before joining KAIST, he worked in Ireland (MIT MediaLab Europe), Portugal (University of Madeira), and several other institutions in Korea (GIST, ETRI, and UNIST) and has been a visiting professor at Carnegie Mellon HCII and the University of Washington iSchool. His research area is Human-Computer Interaction (HCI). He specifically focuses on the design, development, and evaluation of wearable, mobile, and interactive technologies for fundamental use cases such as text entry, pointing and selection, and authentication. He regularly publishes at (and serves as a program committee or editor of) leading HCI conferences (such as ACM CHI, ACM UIST, ACM TEI) and journals (such as ACM IMWUT, Interacting with Computers and IJHCS). tag:csweb.profs content:이안오클리 시큐어 컴퓨팅, 인공지능·정보서비스 Human Computer Interaction PhD, University of Glasgow, 2003 https://wit.kaist.ac.kr/ ian.r.oakley@gmail.com 042-350-7476 208, N1 연구실: \n\nIan Oakley is a full professor at the School of Electrical Engineering at KAIST in South Korea with a joint appointment in computer science. He holds a BSc (Joint Honours First Class) in Computing Science and Psychology and a PhD in Computer Science from the University of Glasgow, UK. Before joining KAIST, he worked in Ireland (MIT MediaLab Europe), Portugal (University of Madeira), and several other institutions in Korea (GIST, ETRI, and UNIST) and has been a visiting professor at Carnegie Mellon HCII and the University of Washington iSchool. His research area is Human-Computer Interaction (HCI). He specifically focuses on the design, development, and evaluation of wearable, mobile, and interactive technologies for fundamental use cases such as text entry, pointing and selection, and authentication. He regularly publishes at (and serves as a program committee or editor of) leading HCI conferences (such as ACM CHI, ACM UIST, ACM TEI) and journals (such as ACM IMWUT, Interacting with Computers and IJHCS). csweb.profs"
}