{
    "name": "문수복",
    "field": "시스템·네트워크, 소셜 컴퓨팅",
    "major": "네트워크 플랫폼, 온라인 소셜 네트워크",
    "degree": "PhD, Univ of Massachusetts, Amherst, 2000",
    "web": "http://an.kaist.ac.kr/~sbmoon/",
    "mail": "sbmoon@kaist.ac.kr",
    "phone": "3548",
    "office": "N1, 608",
    "etc": "연구실: 첨단 네트워킹 연구실\n\n문수복 교수는 서울대학교 컴퓨터공학과에서 학사와 석사 학위를, University of Massachusetts at Amherst에서 박사 학위를 수여 받았습니다. 1999년부터 2003년까지는 Burlingame, California 소재 Sprint ATL에서 IPMON 프로젝트에 참여하였으며, 2003년 8월, 카이스트에 교수로 부임하였습니다. 주요 연구분야는 네트워크 성능 측정 및 분석, 온라인 소셜 네트워크, 네트워크 시스템 입니다.\n[약력]\n2017 ACM SIGCOMM CoNEXT 한국 유치 및 조직위원장 (서울대 권태경 교수와 공동)\n2016 미래여성인재양성 분야 여성가족부 장관 표창\n2016 ∼ 2017 한국정보과학회 여성위원장\n2015.03. 현재 한국과학기술원 사이버보안연구센터장\n2015 Best Student Paper Award at EuroSys (1st author Joongi Kim)\n2014.08 ∼ 2016.02. 한국과학기술원 정보보호 대학원장\n2014 KAIST Award for Academic Excellence (학술상)\n2014 WWW 서울 유치 및 부조직위원장 (서울대 이상구 교수와 공동)\n2013 WWW 학술대회장 (Ricardo Baeza-Yates와 공동)\n2013 KAIST Award for International Service (국제협력상)\n2012.08. ∼ 2013.01. Microsoft Research Cambridge Systems and Networking Group 객원 연구\n2012 APSys 서울 유치 및 조직위원장\n2012 교육과학기술부 지식창조대상 수상\n2012 한국공학한림원 젊은 공학인상 수상\n2011 APSys 학술대회장 (YY Zhou와 공동)\n2011 ∼ 2014 KAIST Endowed Chair (KAIST 석좌교수)\n2010 ACM SIGCOMM 최우수 포스터 수상\n2010 KAIST Award for Technology Breakthrough Achievements (기술혁신 우수상)\n2009 아모레퍼시픽 여성과학자상 수상\n2009 PAM 서울 유치\n2008.03. Telefonica Research Lab 객원 연구\n2007 ACM SIGCOMM Internet Measurement Conference 최우수 논문상\n2007.09. ∼ 2008.02. SysNet Group, UCSD 객원 연구\n2006.09. KAIST 전산학과 부교수\n2004 ACM Multimedia 학술대회장\n2003.08. 2006.08. KAIST 전산학과 조교수\n1999.10. 2003.07. Burlingame, California 소재 Sprint ATL에서 Principal MTS로 근무 (IP group)\n1992.09. 2000.02. University of Massachusetts in Amherst에서 Computer Science 박사학위 취득\n1990.03. 1991.12 IMIGE Systems, Inc. 엔지니어로 근무\n1988.3. ∼ 1990.2. 동대학원 석사학위 취득\n1984.3. ∼ 1988.2. 서울대학교 컴퓨터공학과(현 전자컴퓨터공학부) 학사학위 취득",
    "tag": "csweb.profs",
    "id": 15,
    "content": "name:문수복 field:시스템·네트워크, 소셜 컴퓨팅 major:네트워크 플랫폼, 온라인 소셜 네트워크 degree:PhD, Univ of Massachusetts, Amherst, 2000 web:http://an.kaist.ac.kr/~sbmoon/ mail:sbmoon@kaist.ac.kr phone:3548 office:N1, 608 etc:연구실: 첨단 네트워킹 연구실\n\n문수복 교수는 서울대학교 컴퓨터공학과에서 학사와 석사 학위를, University of Massachusetts at Amherst에서 박사 학위를 수여 받았습니다. 1999년부터 2003년까지는 Burlingame, California 소재 Sprint ATL에서 IPMON 프로젝트에 참여하였으며, 2003년 8월, 카이스트에 교수로 부임하였습니다. 주요 연구분야는 네트워크 성능 측정 및 분석, 온라인 소셜 네트워크, 네트워크 시스템 입니다.\n[약력]\n2017 ACM SIGCOMM CoNEXT 한국 유치 및 조직위원장 (서울대 권태경 교수와 공동)\n2016 미래여성인재양성 분야 여성가족부 장관 표창\n2016 ∼ 2017 한국정보과학회 여성위원장\n2015.03. 현재 한국과학기술원 사이버보안연구센터장\n2015 Best Student Paper Award at EuroSys (1st author Joongi Kim)\n2014.08 ∼ 2016.02. 한국과학기술원 정보보호 대학원장\n2014 KAIST Award for Academic Excellence (학술상)\n2014 WWW 서울 유치 및 부조직위원장 (서울대 이상구 교수와 공동)\n2013 WWW 학술대회장 (Ricardo Baeza-Yates와 공동)\n2013 KAIST Award for International Service (국제협력상)\n2012.08. ∼ 2013.01. Microsoft Research Cambridge Systems and Networking Group 객원 연구\n2012 APSys 서울 유치 및 조직위원장\n2012 교육과학기술부 지식창조대상 수상\n2012 한국공학한림원 젊은 공학인상 수상\n2011 APSys 학술대회장 (YY Zhou와 공동)\n2011 ∼ 2014 KAIST Endowed Chair (KAIST 석좌교수)\n2010 ACM SIGCOMM 최우수 포스터 수상\n2010 KAIST Award for Technology Breakthrough Achievements (기술혁신 우수상)\n2009 아모레퍼시픽 여성과학자상 수상\n2009 PAM 서울 유치\n2008.03. Telefonica Research Lab 객원 연구\n2007 ACM SIGCOMM Internet Measurement Conference 최우수 논문상\n2007.09. ∼ 2008.02. SysNet Group, UCSD 객원 연구\n2006.09. KAIST 전산학과 부교수\n2004 ACM Multimedia 학술대회장\n2003.08. 2006.08. KAIST 전산학과 조교수\n1999.10. 2003.07. Burlingame, California 소재 Sprint ATL에서 Principal MTS로 근무 (IP group)\n1992.09. 2000.02. University of Massachusetts in Amherst에서 Computer Science 박사학위 취득\n1990.03. 1991.12 IMIGE Systems, Inc. 엔지니어로 근무\n1988.3. ∼ 1990.2. 동대학원 석사학위 취득\n1984.3. ∼ 1988.2. 서울대학교 컴퓨터공학과(현 전자컴퓨터공학부) 학사학위 취득 tag:csweb.profs content:문수복 시스템·네트워크, 소셜 컴퓨팅 네트워크 플랫폼, 온라인 소셜 네트워크 PhD, Univ of Massachusetts, Amherst, 2000 http://an.kaist.ac.kr/~sbmoon/ sbmoon@kaist.ac.kr 3548 N1, 608 연구실: 첨단 네트워킹 연구실\n\n문수복 교수는 서울대학교 컴퓨터공학과에서 학사와 석사 학위를, University of Massachusetts at Amherst에서 박사 학위를 수여 받았습니다. 1999년부터 2003년까지는 Burlingame, California 소재 Sprint ATL에서 IPMON 프로젝트에 참여하였으며, 2003년 8월, 카이스트에 교수로 부임하였습니다. 주요 연구분야는 네트워크 성능 측정 및 분석, 온라인 소셜 네트워크, 네트워크 시스템 입니다.\n[약력]\n2017 ACM SIGCOMM CoNEXT 한국 유치 및 조직위원장 (서울대 권태경 교수와 공동)\n2016 미래여성인재양성 분야 여성가족부 장관 표창\n2016 ∼ 2017 한국정보과학회 여성위원장\n2015.03. 현재 한국과학기술원 사이버보안연구센터장\n2015 Best Student Paper Award at EuroSys (1st author Joongi Kim)\n2014.08 ∼ 2016.02. 한국과학기술원 정보보호 대학원장\n2014 KAIST Award for Academic Excellence (학술상)\n2014 WWW 서울 유치 및 부조직위원장 (서울대 이상구 교수와 공동)\n2013 WWW 학술대회장 (Ricardo Baeza-Yates와 공동)\n2013 KAIST Award for International Service (국제협력상)\n2012.08. ∼ 2013.01. Microsoft Research Cambridge Systems and Networking Group 객원 연구\n2012 APSys 서울 유치 및 조직위원장\n2012 교육과학기술부 지식창조대상 수상\n2012 한국공학한림원 젊은 공학인상 수상\n2011 APSys 학술대회장 (YY Zhou와 공동)\n2011 ∼ 2014 KAIST Endowed Chair (KAIST 석좌교수)\n2010 ACM SIGCOMM 최우수 포스터 수상\n2010 KAIST Award for Technology Breakthrough Achievements (기술혁신 우수상)\n2009 아모레퍼시픽 여성과학자상 수상\n2009 PAM 서울 유치\n2008.03. Telefonica Research Lab 객원 연구\n2007 ACM SIGCOMM Internet Measurement Conference 최우수 논문상\n2007.09. ∼ 2008.02. SysNet Group, UCSD 객원 연구\n2006.09. KAIST 전산학과 부교수\n2004 ACM Multimedia 학술대회장\n2003.08. 2006.08. KAIST 전산학과 조교수\n1999.10. 2003.07. Burlingame, California 소재 Sprint ATL에서 Principal MTS로 근무 (IP group)\n1992.09. 2000.02. University of Massachusetts in Amherst에서 Computer Science 박사학위 취득\n1990.03. 1991.12 IMIGE Systems, Inc. 엔지니어로 근무\n1988.3. ∼ 1990.2. 동대학원 석사학위 취득\n1984.3. ∼ 1988.2. 서울대학교 컴퓨터공학과(현 전자컴퓨터공학부) 학사학위 취득 csweb.profs"
}