{
    "name": "맹성현",
    "field": "인공지능·정보서비스, 소셜 컴퓨팅",
    "major": "정보검색, 텍스트마이닝, 자연어처리",
    "degree": "PhD, Southern Methodist University, 1987",
    "web": "http://ir.kaist.ac.kr",
    "mail": "myaeng@kaist.ac.kr",
    "phone": "3553",
    "office": "E3-1, 1421",
    "etc": "연구실: \n\n맹성현 교수는 KAIST에서 전산학부 교수와 KAIST Microsoft Research 협력 연구 센터(KMCC)의 센터장을 맡고 있다. 서던메소디스트 대학에서 컴퓨터공학 석사와 박사 학위를 취득한 뒤 미국 시라큐스 대학에서 영년직 교수를 역임하였다. 어휘의미론에 중점을 둔 자연어 처리 기술과 차세대 검색 기술을 바탕으로 경험 마이닝, 정보 추출과 같은 텍스트 마이닝 기술 연구를 중점적으로 수행하고 있으며 2013년부터 국가적으로 조명을 받고 있는 엑소브레인 과제의 3세부 책임을 맡아 개념 그래프와 신경망의 퓨젼을 통한 질의응답시스템 기술 개발을 해 오고 있다, ACM SIGIR 학술대회 프로그램위원장 2회를 비롯하여 정보 검색, 자연어 처리, 월드 와이드 웹과 관련된 여 러 유수 학회들에서 프로그램 위원회 활동을 하였으며, 2008년에는 Microsoft Research로부터 ‘차세대 검색 - 시맨틱 컴퓨팅과 인터넷 경제학’ 영역에서 연구 제안의 우수성을 인정받아 아시아인 수상인 2명 중 한 명으로 선정되었다. 세계연구중심대학(WCU) 지원을 받아 웹사이언스 전공을 개설하여 책임교수를 역임하였으며, 2015-2017에는 KAIST 국제협력처장을 맡아 캠퍼스 국제화 및 외국 유수 대학과의 협력관계 확립을 통한 KAIST의 대외적인 홍보 및 세계대학 랭킹 향상에 일조하였다.",
    "tag": "csweb.profs",
    "id": 56,
    "content": "name:맹성현 field:인공지능·정보서비스, 소셜 컴퓨팅 major:정보검색, 텍스트마이닝, 자연어처리 degree:PhD, Southern Methodist University, 1987 web:http://ir.kaist.ac.kr mail:myaeng@kaist.ac.kr phone:3553 office:E3-1, 1421 etc:연구실: \n\n맹성현 교수는 KAIST에서 전산학부 교수와 KAIST Microsoft Research 협력 연구 센터(KMCC)의 센터장을 맡고 있다. 서던메소디스트 대학에서 컴퓨터공학 석사와 박사 학위를 취득한 뒤 미국 시라큐스 대학에서 영년직 교수를 역임하였다. 어휘의미론에 중점을 둔 자연어 처리 기술과 차세대 검색 기술을 바탕으로 경험 마이닝, 정보 추출과 같은 텍스트 마이닝 기술 연구를 중점적으로 수행하고 있으며 2013년부터 국가적으로 조명을 받고 있는 엑소브레인 과제의 3세부 책임을 맡아 개념 그래프와 신경망의 퓨젼을 통한 질의응답시스템 기술 개발을 해 오고 있다, ACM SIGIR 학술대회 프로그램위원장 2회를 비롯하여 정보 검색, 자연어 처리, 월드 와이드 웹과 관련된 여 러 유수 학회들에서 프로그램 위원회 활동을 하였으며, 2008년에는 Microsoft Research로부터 ‘차세대 검색 - 시맨틱 컴퓨팅과 인터넷 경제학’ 영역에서 연구 제안의 우수성을 인정받아 아시아인 수상인 2명 중 한 명으로 선정되었다. 세계연구중심대학(WCU) 지원을 받아 웹사이언스 전공을 개설하여 책임교수를 역임하였으며, 2015-2017에는 KAIST 국제협력처장을 맡아 캠퍼스 국제화 및 외국 유수 대학과의 협력관계 확립을 통한 KAIST의 대외적인 홍보 및 세계대학 랭킹 향상에 일조하였다. tag:csweb.profs content:맹성현 인공지능·정보서비스, 소셜 컴퓨팅 정보검색, 텍스트마이닝, 자연어처리 PhD, Southern Methodist University, 1987 http://ir.kaist.ac.kr myaeng@kaist.ac.kr 3553 E3-1, 1421 연구실: \n\n맹성현 교수는 KAIST에서 전산학부 교수와 KAIST Microsoft Research 협력 연구 센터(KMCC)의 센터장을 맡고 있다. 서던메소디스트 대학에서 컴퓨터공학 석사와 박사 학위를 취득한 뒤 미국 시라큐스 대학에서 영년직 교수를 역임하였다. 어휘의미론에 중점을 둔 자연어 처리 기술과 차세대 검색 기술을 바탕으로 경험 마이닝, 정보 추출과 같은 텍스트 마이닝 기술 연구를 중점적으로 수행하고 있으며 2013년부터 국가적으로 조명을 받고 있는 엑소브레인 과제의 3세부 책임을 맡아 개념 그래프와 신경망의 퓨젼을 통한 질의응답시스템 기술 개발을 해 오고 있다, ACM SIGIR 학술대회 프로그램위원장 2회를 비롯하여 정보 검색, 자연어 처리, 월드 와이드 웹과 관련된 여 러 유수 학회들에서 프로그램 위원회 활동을 하였으며, 2008년에는 Microsoft Research로부터 ‘차세대 검색 - 시맨틱 컴퓨팅과 인터넷 경제학’ 영역에서 연구 제안의 우수성을 인정받아 아시아인 수상인 2명 중 한 명으로 선정되었다. 세계연구중심대학(WCU) 지원을 받아 웹사이언스 전공을 개설하여 책임교수를 역임하였으며, 2015-2017에는 KAIST 국제협력처장을 맡아 캠퍼스 국제화 및 외국 유수 대학과의 협력관계 확립을 통한 KAIST의 대외적인 홍보 및 세계대학 랭킹 향상에 일조하였다. csweb.profs"
}