{
    "name": "이재길",
    "field": "인공지능·정보서비스",
    "major": "빅데이터, 데이터마이닝, 딥러닝",
    "degree": "PhD, KAIST, 2005",
    "web": "https://dm.kaist.ac.kr/jaegil",
    "mail": "jaegil@kaist.ac.kr",
    "phone": "3545",
    "office": "2435, E3-1",
    "etc": "연구실: 데이터 마이닝 연구실\n\n이재길 교수는 KAIST 전산학부의 교수로서 데이터 마이닝 연구실을 이끌고 있습니다. 2010년 KAIST에 부임하기 전에는 IBM Almaden 연구소와 일리노이 주립대학에서 연구원으로 근무하였습니다. 이 교수는 2005년 KAIST에서 박사학위를 취득하였습니다. 주요 연구분야는 모빌리티 및 스트림 데이터 마이닝, 딥러닝 기반 빅데이터 분석, 분산 딥러닝을 아우릅니다. 이 교수는 AAAI ICWSM 2013 국제학회에서 최우수논문상을 수상하였습니다. 그간 80편 이상의 논문을 발표하였으며, 이러한 논문들은 총 6,200회가량 피인용 되었습니다 (2022년 6월 기준). 이 교수는 KDD, PVLDB, SIGMOD, ICDE, WebConf, AAAI 등 최고 권위 국제학술대회의 프로그램 위원으로 봉사하였고, PAKDD 2017의 프로그램 위원장을 역임하였습니다. 또한, 이 교수는 분야 최고 권위 저널인 IEEE TKDE의 부편집장으로 봉사하고 있으며, 2019년부터 PAKDD의 운영 위원으로 선임되어 아태지역 데이터 마이닝 학계를 선도하고 있습니다.",
    "tag": "csweb.profs",
    "id": 37,
    "content": "name:이재길 field:인공지능·정보서비스 major:빅데이터, 데이터마이닝, 딥러닝 degree:PhD, KAIST, 2005 web:https://dm.kaist.ac.kr/jaegil mail:jaegil@kaist.ac.kr phone:3545 office:2435, E3-1 etc:연구실: 데이터 마이닝 연구실\n\n이재길 교수는 KAIST 전산학부의 교수로서 데이터 마이닝 연구실을 이끌고 있습니다. 2010년 KAIST에 부임하기 전에는 IBM Almaden 연구소와 일리노이 주립대학에서 연구원으로 근무하였습니다. 이 교수는 2005년 KAIST에서 박사학위를 취득하였습니다. 주요 연구분야는 모빌리티 및 스트림 데이터 마이닝, 딥러닝 기반 빅데이터 분석, 분산 딥러닝을 아우릅니다. 이 교수는 AAAI ICWSM 2013 국제학회에서 최우수논문상을 수상하였습니다. 그간 80편 이상의 논문을 발표하였으며, 이러한 논문들은 총 6,200회가량 피인용 되었습니다 (2022년 6월 기준). 이 교수는 KDD, PVLDB, SIGMOD, ICDE, WebConf, AAAI 등 최고 권위 국제학술대회의 프로그램 위원으로 봉사하였고, PAKDD 2017의 프로그램 위원장을 역임하였습니다. 또한, 이 교수는 분야 최고 권위 저널인 IEEE TKDE의 부편집장으로 봉사하고 있으며, 2019년부터 PAKDD의 운영 위원으로 선임되어 아태지역 데이터 마이닝 학계를 선도하고 있습니다. tag:csweb.profs content:이재길 인공지능·정보서비스 빅데이터, 데이터마이닝, 딥러닝 PhD, KAIST, 2005 https://dm.kaist.ac.kr/jaegil jaegil@kaist.ac.kr 3545 2435, E3-1 연구실: 데이터 마이닝 연구실\n\n이재길 교수는 KAIST 전산학부의 교수로서 데이터 마이닝 연구실을 이끌고 있습니다. 2010년 KAIST에 부임하기 전에는 IBM Almaden 연구소와 일리노이 주립대학에서 연구원으로 근무하였습니다. 이 교수는 2005년 KAIST에서 박사학위를 취득하였습니다. 주요 연구분야는 모빌리티 및 스트림 데이터 마이닝, 딥러닝 기반 빅데이터 분석, 분산 딥러닝을 아우릅니다. 이 교수는 AAAI ICWSM 2013 국제학회에서 최우수논문상을 수상하였습니다. 그간 80편 이상의 논문을 발표하였으며, 이러한 논문들은 총 6,200회가량 피인용 되었습니다 (2022년 6월 기준). 이 교수는 KDD, PVLDB, SIGMOD, ICDE, WebConf, AAAI 등 최고 권위 국제학술대회의 프로그램 위원으로 봉사하였고, PAKDD 2017의 프로그램 위원장을 역임하였습니다. 또한, 이 교수는 분야 최고 권위 저널인 IEEE TKDE의 부편집장으로 봉사하고 있으며, 2019년부터 PAKDD의 운영 위원으로 선임되어 아태지역 데이터 마이닝 학계를 선도하고 있습니다. csweb.profs"
}