{
    "name": "김광조",
    "field": "인공지능·정보서비스, 시큐어 컴퓨팅, 시스템·네트워크",
    "major": "암호학, 정보보안",
    "degree": "PhD, Yokohama National Univ., 1991",
    "web": "https://caislab.kaist.ac.kr/kkj/index.php/ko/30-2/",
    "mail": "kkj@kaist.ac.kr",
    "phone": "3550",
    "office": "E3-1, 1423",
    "etc": "연구실: \n\n김광조 교수는 1980년과 1983년에 연세대학교에서 전자과 학사, 석사학위를, 1991년에 일본 요코하마 국립대학교에서 전자 및 컴퓨터 공학과 박사학위를 취득하였다.\n현재는 카이스트 전산학과에 재직 중이며, 주요 관심 연구분야는 암호학과 정보보안 및 응용이다.\n김광조 교수는 2000년부터 2004년까지 International Association for Cryptologic Research（IACR）의 이사회 활동, 2005년부터 2008년까지 Asiacrypt의 운영위원회, 2009년에 한국정보보호학회 회장을 역임하였다. 또한, 방문교수로서 MIT（2005년）, UCSD（2005년）, 아랍에미리트의 KUSTAR（2012년）에서 활동하였고, 교육 고문으로서 2013년에 인도네이사의 ITB에서 활동하였다. 현재 IACR Fellow, 한국정보보호학회 명예회장\n및 IFIP TC-11의 한국대표로 활동하고 있다..",
    "tag": "csweb.profs",
    "id": 51,
    "content": "name:김광조 field:인공지능·정보서비스, 시큐어 컴퓨팅, 시스템·네트워크 major:암호학, 정보보안 degree:PhD, Yokohama National Univ., 1991 web:https://caislab.kaist.ac.kr/kkj/index.php/ko/30-2/ mail:kkj@kaist.ac.kr phone:3550 office:E3-1, 1423 etc:연구실: \n\n김광조 교수는 1980년과 1983년에 연세대학교에서 전자과 학사, 석사학위를, 1991년에 일본 요코하마 국립대학교에서 전자 및 컴퓨터 공학과 박사학위를 취득하였다.\n현재는 카이스트 전산학과에 재직 중이며, 주요 관심 연구분야는 암호학과 정보보안 및 응용이다.\n김광조 교수는 2000년부터 2004년까지 International Association for Cryptologic Research（IACR）의 이사회 활동, 2005년부터 2008년까지 Asiacrypt의 운영위원회, 2009년에 한국정보보호학회 회장을 역임하였다. 또한, 방문교수로서 MIT（2005년）, UCSD（2005년）, 아랍에미리트의 KUSTAR（2012년）에서 활동하였고, 교육 고문으로서 2013년에 인도네이사의 ITB에서 활동하였다. 현재 IACR Fellow, 한국정보보호학회 명예회장\n및 IFIP TC-11의 한국대표로 활동하고 있다.. tag:csweb.profs content:김광조 인공지능·정보서비스, 시큐어 컴퓨팅, 시스템·네트워크 암호학, 정보보안 PhD, Yokohama National Univ., 1991 https://caislab.kaist.ac.kr/kkj/index.php/ko/30-2/ kkj@kaist.ac.kr 3550 E3-1, 1423 연구실: \n\n김광조 교수는 1980년과 1983년에 연세대학교에서 전자과 학사, 석사학위를, 1991년에 일본 요코하마 국립대학교에서 전자 및 컴퓨터 공학과 박사학위를 취득하였다.\n현재는 카이스트 전산학과에 재직 중이며, 주요 관심 연구분야는 암호학과 정보보안 및 응용이다.\n김광조 교수는 2000년부터 2004년까지 International Association for Cryptologic Research（IACR）의 이사회 활동, 2005년부터 2008년까지 Asiacrypt의 운영위원회, 2009년에 한국정보보호학회 회장을 역임하였다. 또한, 방문교수로서 MIT（2005년）, UCSD（2005년）, 아랍에미리트의 KUSTAR（2012년）에서 활동하였고, 교육 고문으로서 2013년에 인도네이사의 ITB에서 활동하였다. 현재 IACR Fellow, 한국정보보호학회 명예회장\n및 IFIP TC-11의 한국대표로 활동하고 있다.. csweb.profs"
}