{
    "name": "한재선",
    "field": "시스템·네트워크",
    "major": "Blockchain, Web3, Distributed System",
    "degree": "PhD, KAIST, 2005",
    "web": "https://jaesunhan.com/",
    "mail": "jshan0000@gmail.com",
    "phone": "",
    "office": "",
    "etc": "연구실: \n\n한재선 대표는 카카오의 블록체인 자회사인 그라운드X를 2018년 설립하고 2022년 3월까지 대표이사를 역임했다. 그라운드X는 국내 최고의 블록체인인 클레이튼을 개발하고 운영하고 있으며, 카카오톡에 탑재된 디지털 자산 지갑인 클립을 개발하여 서비스 중이다. 그는 2005년 KAIST 전자전산학과에서 박사 과정을 마치고, 2007년 국내 최초 빅데이터/클라우드 기술 스타트업인 넥스알을 창업하여 하둡 기반의 빅데이터 솔루션을 개발/공급하고, 아마존 클라우드 호환되는 퍼블릭 클라우드를 최초로 운영했다. 2011년 넥스알을 KT에 인수시키고 대표이사로서 3년 동안 KT의 빅데이터 시스템과 클라우드 서비스를 개발했다. 이후 2014년 기술 스타트업 전문 엑셀러레이터/VC인 퓨처플레이를 공동창업하여 CTO로서 기술 스타트업을 발굴하고 육성하는 역할을 담당했다. 퓨처플레이는 한국, 아시아, 북미 지역의 초기 기술 스타트업에 투자하고 성장을 지원해 주는 투자회사로서 그의 재직 기간 동안 백여개 이상의 스타트업을 투자/육성했다. 또한 그는 2007년부터 8년 동안 KAIST 정보미디어 경영대학원의 겸직교수로서 최신 IT 트랜드와 비즈니스 모델을 가르쳤다. 현재 그는 LTGLAB을 운영하며 KAIST 전산학부 겸직교수로 Web3 강의를 진행하고 있다.",
    "tag": "csweb.profs",
    "id": 98,
    "content": "name:한재선 field:시스템·네트워크 major:Blockchain, Web3, Distributed System degree:PhD, KAIST, 2005 web:https://jaesunhan.com/ mail:jshan0000@gmail.com phone: office: etc:연구실: \n\n한재선 대표는 카카오의 블록체인 자회사인 그라운드X를 2018년 설립하고 2022년 3월까지 대표이사를 역임했다. 그라운드X는 국내 최고의 블록체인인 클레이튼을 개발하고 운영하고 있으며, 카카오톡에 탑재된 디지털 자산 지갑인 클립을 개발하여 서비스 중이다. 그는 2005년 KAIST 전자전산학과에서 박사 과정을 마치고, 2007년 국내 최초 빅데이터/클라우드 기술 스타트업인 넥스알을 창업하여 하둡 기반의 빅데이터 솔루션을 개발/공급하고, 아마존 클라우드 호환되는 퍼블릭 클라우드를 최초로 운영했다. 2011년 넥스알을 KT에 인수시키고 대표이사로서 3년 동안 KT의 빅데이터 시스템과 클라우드 서비스를 개발했다. 이후 2014년 기술 스타트업 전문 엑셀러레이터/VC인 퓨처플레이를 공동창업하여 CTO로서 기술 스타트업을 발굴하고 육성하는 역할을 담당했다. 퓨처플레이는 한국, 아시아, 북미 지역의 초기 기술 스타트업에 투자하고 성장을 지원해 주는 투자회사로서 그의 재직 기간 동안 백여개 이상의 스타트업을 투자/육성했다. 또한 그는 2007년부터 8년 동안 KAIST 정보미디어 경영대학원의 겸직교수로서 최신 IT 트랜드와 비즈니스 모델을 가르쳤다. 현재 그는 LTGLAB을 운영하며 KAIST 전산학부 겸직교수로 Web3 강의를 진행하고 있다. tag:csweb.profs content:한재선 시스템·네트워크 Blockchain, Web3, Distributed System PhD, KAIST, 2005 https://jaesunhan.com/ jshan0000@gmail.com   연구실: \n\n한재선 대표는 카카오의 블록체인 자회사인 그라운드X를 2018년 설립하고 2022년 3월까지 대표이사를 역임했다. 그라운드X는 국내 최고의 블록체인인 클레이튼을 개발하고 운영하고 있으며, 카카오톡에 탑재된 디지털 자산 지갑인 클립을 개발하여 서비스 중이다. 그는 2005년 KAIST 전자전산학과에서 박사 과정을 마치고, 2007년 국내 최초 빅데이터/클라우드 기술 스타트업인 넥스알을 창업하여 하둡 기반의 빅데이터 솔루션을 개발/공급하고, 아마존 클라우드 호환되는 퍼블릭 클라우드를 최초로 운영했다. 2011년 넥스알을 KT에 인수시키고 대표이사로서 3년 동안 KT의 빅데이터 시스템과 클라우드 서비스를 개발했다. 이후 2014년 기술 스타트업 전문 엑셀러레이터/VC인 퓨처플레이를 공동창업하여 CTO로서 기술 스타트업을 발굴하고 육성하는 역할을 담당했다. 퓨처플레이는 한국, 아시아, 북미 지역의 초기 기술 스타트업에 투자하고 성장을 지원해 주는 투자회사로서 그의 재직 기간 동안 백여개 이상의 스타트업을 투자/육성했다. 또한 그는 2007년부터 8년 동안 KAIST 정보미디어 경영대학원의 겸직교수로서 최신 IT 트랜드와 비즈니스 모델을 가르쳤다. 현재 그는 LTGLAB을 운영하며 KAIST 전산학부 겸직교수로 Web3 강의를 진행하고 있다. csweb.profs"
}