{
    "name": "양현승",
    "field": "비주얼 컴퓨팅, 인공지능·정보서비스",
    "major": "인공지능, 컴퓨터비젼, 휴먼로보틱스, 가상현실",
    "degree": "PhD, Purdue Univ, 1986",
    "web": "http://mind.kaist.ac.kr/2_prof/professor.htm",
    "mail": "hsyang@kaist.ac.kr",
    "phone": "3527",
    "office": "E3-1, 1406",
    "etc": "연구실: \n\n양현승 교수는 서울대학교 전자공학과에서 학사학위를 그리고 미국 Purdue University (West Lafayette, Indiana) 전기및 컴퓨터공학과에서 석,박사 학위를 받았으며 1986년부터 1988년까지 미국 Univ. of Iowa 전기및컴퓨터공학과 조교수로 근무하였고 1988년도부터 현재까지 KAIST 전산학과 교수로 재직하고 있다.\n한국최초의 인공지능 이동로봇 CAIR-1, 인공지능 휴먼로봇 아미를 개발하였으며, KAIST 연구처장 및 산학협력단장, 한국정보과학회 부회장, 한국멀티미디어학회 부회장, 한국로봇공학회 부회장, 한국 뇌학회 이사, IAPR(International Association of Pattern Recognition) Governing Board Member 등을 역임하였고 현재는 국제 VSMM( Virtual Systems and Multimedia)학회 부회장, IFIP TC 14 (Entertainment Computing) 부회장, 한국 공학한림원 정회원 등으로 활동중이다.\n2000년 이후 현재까지 16개의 Multimedia, VR, Entertainment Computing, Media Arts and Technology, Digital Contents, Digital Heritage 관련 저명 국제 학술대회를 조직 및 운영하였다. 연구분야는 인공지능, VR/AR, 컴퓨터 비전, 지능형 휴먼로보틱스, 유비쿼터스/웨어러블 컴퓨팅 등이다.",
    "tag": "csweb.profs",
    "id": 59,
    "content": "name:양현승 field:비주얼 컴퓨팅, 인공지능·정보서비스 major:인공지능, 컴퓨터비젼, 휴먼로보틱스, 가상현실 degree:PhD, Purdue Univ, 1986 web:http://mind.kaist.ac.kr/2_prof/professor.htm mail:hsyang@kaist.ac.kr phone:3527 office:E3-1, 1406 etc:연구실: \n\n양현승 교수는 서울대학교 전자공학과에서 학사학위를 그리고 미국 Purdue University (West Lafayette, Indiana) 전기및 컴퓨터공학과에서 석,박사 학위를 받았으며 1986년부터 1988년까지 미국 Univ. of Iowa 전기및컴퓨터공학과 조교수로 근무하였고 1988년도부터 현재까지 KAIST 전산학과 교수로 재직하고 있다.\n한국최초의 인공지능 이동로봇 CAIR-1, 인공지능 휴먼로봇 아미를 개발하였으며, KAIST 연구처장 및 산학협력단장, 한국정보과학회 부회장, 한국멀티미디어학회 부회장, 한국로봇공학회 부회장, 한국 뇌학회 이사, IAPR(International Association of Pattern Recognition) Governing Board Member 등을 역임하였고 현재는 국제 VSMM( Virtual Systems and Multimedia)학회 부회장, IFIP TC 14 (Entertainment Computing) 부회장, 한국 공학한림원 정회원 등으로 활동중이다.\n2000년 이후 현재까지 16개의 Multimedia, VR, Entertainment Computing, Media Arts and Technology, Digital Contents, Digital Heritage 관련 저명 국제 학술대회를 조직 및 운영하였다. 연구분야는 인공지능, VR/AR, 컴퓨터 비전, 지능형 휴먼로보틱스, 유비쿼터스/웨어러블 컴퓨팅 등이다. tag:csweb.profs content:양현승 비주얼 컴퓨팅, 인공지능·정보서비스 인공지능, 컴퓨터비젼, 휴먼로보틱스, 가상현실 PhD, Purdue Univ, 1986 http://mind.kaist.ac.kr/2_prof/professor.htm hsyang@kaist.ac.kr 3527 E3-1, 1406 연구실: \n\n양현승 교수는 서울대학교 전자공학과에서 학사학위를 그리고 미국 Purdue University (West Lafayette, Indiana) 전기및 컴퓨터공학과에서 석,박사 학위를 받았으며 1986년부터 1988년까지 미국 Univ. of Iowa 전기및컴퓨터공학과 조교수로 근무하였고 1988년도부터 현재까지 KAIST 전산학과 교수로 재직하고 있다.\n한국최초의 인공지능 이동로봇 CAIR-1, 인공지능 휴먼로봇 아미를 개발하였으며, KAIST 연구처장 및 산학협력단장, 한국정보과학회 부회장, 한국멀티미디어학회 부회장, 한국로봇공학회 부회장, 한국 뇌학회 이사, IAPR(International Association of Pattern Recognition) Governing Board Member 등을 역임하였고 현재는 국제 VSMM( Virtual Systems and Multimedia)학회 부회장, IFIP TC 14 (Entertainment Computing) 부회장, 한국 공학한림원 정회원 등으로 활동중이다.\n2000년 이후 현재까지 16개의 Multimedia, VR, Entertainment Computing, Media Arts and Technology, Digital Contents, Digital Heritage 관련 저명 국제 학술대회를 조직 및 운영하였다. 연구분야는 인공지능, VR/AR, 컴퓨터 비전, 지능형 휴먼로보틱스, 유비쿼터스/웨어러블 컴퓨팅 등이다. csweb.profs"
}