{
    "name": "김지희",
    "field": "소셜 컴퓨팅",
    "major": "Economics, ML for economic measurement",
    "degree": "PhD, Stanford University, 2013",
    "web": "http://www.jiheekim.net",
    "mail": "jiheekim@kaist.ac.kr",
    "phone": "042-350-4915",
    "office": "N5, 2108",
    "etc": "연구실: \n\n김지희 교수는 카이스트 경영대학 기술경영학부 부교수로 전산학부 겸임도 맡고 있다. 김 교수는 경제학자로 소득이나 자산의 개인별, 지역별 분배가 어떻게 결정되는 지에 대한 연구를 주로 하고 있다. 특히 기업가의 창조적 파괴, 세금 정책, 그리고 CEO 보수 등이 상위 소득 분포에 어떻게 기여했는지를 연구해 왔다. 최근에는 분야를 확장하여 인공위성 영상에 머신 러닝 알고리즘을 적용함으로써 북한과 같은 경제 통계가 부족한 지역에 경제 발전 정도를 상세하게 측정하는 연구를 진행하여 KDD, AAAI, CIKM 등의 전산학회와 Nature Communications 등에 논문을 발표했다. 김 교수는 미국 스탠퍼드 대학교에서 경영 과학 및 공학 박사 학위와 경제학 석사 학위를, 그리고 카이스트에서 전산학 학사 학위를 취득했다.",
    "tag": "csweb.profs",
    "id": 76,
    "content": "name:김지희 field:소셜 컴퓨팅 major:Economics, ML for economic measurement degree:PhD, Stanford University, 2013 web:http://www.jiheekim.net mail:jiheekim@kaist.ac.kr phone:042-350-4915 office:N5, 2108 etc:연구실: \n\n김지희 교수는 카이스트 경영대학 기술경영학부 부교수로 전산학부 겸임도 맡고 있다. 김 교수는 경제학자로 소득이나 자산의 개인별, 지역별 분배가 어떻게 결정되는 지에 대한 연구를 주로 하고 있다. 특히 기업가의 창조적 파괴, 세금 정책, 그리고 CEO 보수 등이 상위 소득 분포에 어떻게 기여했는지를 연구해 왔다. 최근에는 분야를 확장하여 인공위성 영상에 머신 러닝 알고리즘을 적용함으로써 북한과 같은 경제 통계가 부족한 지역에 경제 발전 정도를 상세하게 측정하는 연구를 진행하여 KDD, AAAI, CIKM 등의 전산학회와 Nature Communications 등에 논문을 발표했다. 김 교수는 미국 스탠퍼드 대학교에서 경영 과학 및 공학 박사 학위와 경제학 석사 학위를, 그리고 카이스트에서 전산학 학사 학위를 취득했다. tag:csweb.profs content:김지희 소셜 컴퓨팅 Economics, ML for economic measurement PhD, Stanford University, 2013 http://www.jiheekim.net jiheekim@kaist.ac.kr 042-350-4915 N5, 2108 연구실: \n\n김지희 교수는 카이스트 경영대학 기술경영학부 부교수로 전산학부 겸임도 맡고 있다. 김 교수는 경제학자로 소득이나 자산의 개인별, 지역별 분배가 어떻게 결정되는 지에 대한 연구를 주로 하고 있다. 특히 기업가의 창조적 파괴, 세금 정책, 그리고 CEO 보수 등이 상위 소득 분포에 어떻게 기여했는지를 연구해 왔다. 최근에는 분야를 확장하여 인공위성 영상에 머신 러닝 알고리즘을 적용함으로써 북한과 같은 경제 통계가 부족한 지역에 경제 발전 정도를 상세하게 측정하는 연구를 진행하여 KDD, AAAI, CIKM 등의 전산학회와 Nature Communications 등에 논문을 발표했다. 김 교수는 미국 스탠퍼드 대학교에서 경영 과학 및 공학 박사 학위와 경제학 석사 학위를, 그리고 카이스트에서 전산학 학사 학위를 취득했다. csweb.profs"
}