{
    "name": "백종문",
    "field": "소프트웨어 디자인, 인공지능·정보서비스",
    "major": "소프트웨어공학",
    "degree": "PhD, Univ. of Southern California, 2000",
    "web": "http://spiral.kaist.ac.kr/",
    "mail": "jbaik@kaist.ac.kr",
    "phone": "3556",
    "office": "N1, 502",
    "etc": "연구실: 소프트웨어 프로세스 개선 및 신뢰성 검증 연구실\n\n백종문 교수는 현재 한국과학기술원 전산학부에서 교수로 재직 중이다. 그는 2001년 1월부터 2005년 5월까지 모토로라의 연구실에서 수석연구원으로서 소프트웨어 품질 개선에 관한 연구를 이끌었다. 그의 현재 관심 연구 분야는 소프트웨어 프로세스 모델링, 소프트웨어 이코노믹스, 소프트웨어 신뢰성 공학, 소프트웨어 식스 시그마 등이다. 백종문 교수는 서던캘리포니아 대학교 대학원에서 2000년 12월에 전산학 박사 학위를 받았다. 그는 또한 IEEE와 ACM의 회원이다.",
    "tag": "csweb.profs",
    "id": 21,
    "content": "name:백종문 field:소프트웨어 디자인, 인공지능·정보서비스 major:소프트웨어공학 degree:PhD, Univ. of Southern California, 2000 web:http://spiral.kaist.ac.kr/ mail:jbaik@kaist.ac.kr phone:3556 office:N1, 502 etc:연구실: 소프트웨어 프로세스 개선 및 신뢰성 검증 연구실\n\n백종문 교수는 현재 한국과학기술원 전산학부에서 교수로 재직 중이다. 그는 2001년 1월부터 2005년 5월까지 모토로라의 연구실에서 수석연구원으로서 소프트웨어 품질 개선에 관한 연구를 이끌었다. 그의 현재 관심 연구 분야는 소프트웨어 프로세스 모델링, 소프트웨어 이코노믹스, 소프트웨어 신뢰성 공학, 소프트웨어 식스 시그마 등이다. 백종문 교수는 서던캘리포니아 대학교 대학원에서 2000년 12월에 전산학 박사 학위를 받았다. 그는 또한 IEEE와 ACM의 회원이다. tag:csweb.profs content:백종문 소프트웨어 디자인, 인공지능·정보서비스 소프트웨어공학 PhD, Univ. of Southern California, 2000 http://spiral.kaist.ac.kr/ jbaik@kaist.ac.kr 3556 N1, 502 연구실: 소프트웨어 프로세스 개선 및 신뢰성 검증 연구실\n\n백종문 교수는 현재 한국과학기술원 전산학부에서 교수로 재직 중이다. 그는 2001년 1월부터 2005년 5월까지 모토로라의 연구실에서 수석연구원으로서 소프트웨어 품질 개선에 관한 연구를 이끌었다. 그의 현재 관심 연구 분야는 소프트웨어 프로세스 모델링, 소프트웨어 이코노믹스, 소프트웨어 신뢰성 공학, 소프트웨어 식스 시그마 등이다. 백종문 교수는 서던캘리포니아 대학교 대학원에서 2000년 12월에 전산학 박사 학위를 받았다. 그는 또한 IEEE와 ACM의 회원이다. csweb.profs"
}