{
    "name": "이기혁",
    "field": "인터랙티브 컴퓨팅",
    "major": "인간-컴퓨터 상호작용 (HCI), 인터랙션 장치 및 테크닉",
    "degree": "PhD, Upenn, 2000",
    "web": "https://hcil.kaist.ac.kr/",
    "mail": "geehyuk@kaist.ac.kr",
    "phone": "3557",
    "office": "N1, 708",
    "etc": "연구실: 인간 컴퓨터 상호 작용 연구실\n\n이기혁교수는 KAIST에서 물리학 학사, 석사 학위를 1990년과 1992년에 각각 취득하였고, 미국 University of Pennsylvania에서 전기공학 박사 학위를 취득하였다. 현재 KAIST 전산학과 교수로서 인간 컴퓨터 상호작용 연구실을 운영하고 있다. 사용자 인터페이스 전반에 대한 연구를 수행하고 있고 특히 스마트 정보 기기, 웨어리블 컴퓨터, 및 스마트 환경을 위한 새로운 상호작용 장치 개발 및 이를 활용한 새로운 상호작용 기법에 중점을 두고 있다.",
    "tag": "csweb.profs",
    "id": 34,
    "content": "name:이기혁 field:인터랙티브 컴퓨팅 major:인간-컴퓨터 상호작용 (HCI), 인터랙션 장치 및 테크닉 degree:PhD, Upenn, 2000 web:https://hcil.kaist.ac.kr/ mail:geehyuk@kaist.ac.kr phone:3557 office:N1, 708 etc:연구실: 인간 컴퓨터 상호 작용 연구실\n\n이기혁교수는 KAIST에서 물리학 학사, 석사 학위를 1990년과 1992년에 각각 취득하였고, 미국 University of Pennsylvania에서 전기공학 박사 학위를 취득하였다. 현재 KAIST 전산학과 교수로서 인간 컴퓨터 상호작용 연구실을 운영하고 있다. 사용자 인터페이스 전반에 대한 연구를 수행하고 있고 특히 스마트 정보 기기, 웨어리블 컴퓨터, 및 스마트 환경을 위한 새로운 상호작용 장치 개발 및 이를 활용한 새로운 상호작용 기법에 중점을 두고 있다. tag:csweb.profs content:이기혁 인터랙티브 컴퓨팅 인간-컴퓨터 상호작용 (HCI), 인터랙션 장치 및 테크닉 PhD, Upenn, 2000 https://hcil.kaist.ac.kr/ geehyuk@kaist.ac.kr 3557 N1, 708 연구실: 인간 컴퓨터 상호 작용 연구실\n\n이기혁교수는 KAIST에서 물리학 학사, 석사 학위를 1990년과 1992년에 각각 취득하였고, 미국 University of Pennsylvania에서 전기공학 박사 학위를 취득하였다. 현재 KAIST 전산학과 교수로서 인간 컴퓨터 상호작용 연구실을 운영하고 있다. 사용자 인터페이스 전반에 대한 연구를 수행하고 있고 특히 스마트 정보 기기, 웨어리블 컴퓨터, 및 스마트 환경을 위한 새로운 상호작용 장치 개발 및 이를 활용한 새로운 상호작용 기법에 중점을 두고 있다. csweb.profs"
}