{
    "name": "장정우",
    "field": "소셜 컴퓨팅",
    "major": "Computer-mediated Communication",
    "degree": "Ph.D. Michigan State Univ, 2014",
    "web": "https://hss.kaist.ac.kr/boards/view/fulltime_professor/77",
    "mail": "jangjw29@kaist.ac.kr",
    "phone": "042-350-4635",
    "office": "N4, 1410",
    "etc": "연구실: \n\n장정우 교수는 한국과학기술원(KAIST) 인문사회과학부의 조교수이다. Michigan State University에서 2014년 박사학위를 취득하였고, 서울대학교 사회과학대학 언론정보학과에서 석사와 학사 학위를 받았다. 컴퓨터를 매개로 이루어지는 인간 간 커뮤니케이션 현상의 매커니즘/영향을 심리적, 사회적, 기술적 요소를 통해 설명하는 연구를 수행하고 있다.",
    "tag": "csweb.profs",
    "id": 89,
    "content": "name:장정우 field:소셜 컴퓨팅 major:Computer-mediated Communication degree:Ph.D. Michigan State Univ, 2014 web:https://hss.kaist.ac.kr/boards/view/fulltime_professor/77 mail:jangjw29@kaist.ac.kr phone:042-350-4635 office:N4, 1410 etc:연구실: \n\n장정우 교수는 한국과학기술원(KAIST) 인문사회과학부의 조교수이다. Michigan State University에서 2014년 박사학위를 취득하였고, 서울대학교 사회과학대학 언론정보학과에서 석사와 학사 학위를 받았다. 컴퓨터를 매개로 이루어지는 인간 간 커뮤니케이션 현상의 매커니즘/영향을 심리적, 사회적, 기술적 요소를 통해 설명하는 연구를 수행하고 있다. tag:csweb.profs content:장정우 소셜 컴퓨팅 Computer-mediated Communication Ph.D. Michigan State Univ, 2014 https://hss.kaist.ac.kr/boards/view/fulltime_professor/77 jangjw29@kaist.ac.kr 042-350-4635 N4, 1410 연구실: \n\n장정우 교수는 한국과학기술원(KAIST) 인문사회과학부의 조교수이다. Michigan State University에서 2014년 박사학위를 취득하였고, 서울대학교 사회과학대학 언론정보학과에서 석사와 학사 학위를 받았다. 컴퓨터를 매개로 이루어지는 인간 간 커뮤니케이션 현상의 매커니즘/영향을 심리적, 사회적, 기술적 요소를 통해 설명하는 연구를 수행하고 있다. csweb.profs"
}