{
    "name": "지글러 마틴",
    "field": "전산이론",
    "major": "전산이론, 복잡도, 실수 연산",
    "degree": "PhD, Universitaet Paderborn, 2002 (Habilitation, Universitaet Paderborn, 2008)",
    "web": "http://ziegler.theoryofcomputation.asia",
    "mail": "ziegler@kaist.ac.kr",
    "phone": "3568",
    "office": "N1, 506",
    "etc": "연구실: 복잡도 및 실수 연산 연구실\n\n마틴 지글러 교수는 독일 Paderborn대학에서 전산학 박사와 교수자격(habilitation)을 각각 2002년과 2008년에 취득하고, 2010부터 2015년까지 TU Darmstadt 응용수학과 교수로 재직하며 전산이론을 교육하였으며, 2015년 KAIST 전산학부 교수로 부임했다. 지글러 교수는 Computability and Complexity in Analysis라는 국제학술대회를 2014년에 조직 운영하고, 2015년에는 의장을 역임했다. 그리고 과학적인 평화 연구 및 기술 평가에 관한 IANUS 그룹의 대변인으로 2012년부터 2015년까지 역임했다. 지글러 교수는 두 번에 걸친 JSPS 펠로우십 (2006년과 2013년), 연구인상 (2006년), 최우수논문상 (2009년), 교육상 (2011년) 등 다양한 수상경력을 보유하고 있다.",
    "tag": "csweb.profs",
    "id": 40,
    "content": "name:지글러 마틴 field:전산이론 major:전산이론, 복잡도, 실수 연산 degree:PhD, Universitaet Paderborn, 2002 (Habilitation, Universitaet Paderborn, 2008) web:http://ziegler.theoryofcomputation.asia mail:ziegler@kaist.ac.kr phone:3568 office:N1, 506 etc:연구실: 복잡도 및 실수 연산 연구실\n\n마틴 지글러 교수는 독일 Paderborn대학에서 전산학 박사와 교수자격(habilitation)을 각각 2002년과 2008년에 취득하고, 2010부터 2015년까지 TU Darmstadt 응용수학과 교수로 재직하며 전산이론을 교육하였으며, 2015년 KAIST 전산학부 교수로 부임했다. 지글러 교수는 Computability and Complexity in Analysis라는 국제학술대회를 2014년에 조직 운영하고, 2015년에는 의장을 역임했다. 그리고 과학적인 평화 연구 및 기술 평가에 관한 IANUS 그룹의 대변인으로 2012년부터 2015년까지 역임했다. 지글러 교수는 두 번에 걸친 JSPS 펠로우십 (2006년과 2013년), 연구인상 (2006년), 최우수논문상 (2009년), 교육상 (2011년) 등 다양한 수상경력을 보유하고 있다. tag:csweb.profs content:지글러 마틴 전산이론 전산이론, 복잡도, 실수 연산 PhD, Universitaet Paderborn, 2002 (Habilitation, Universitaet Paderborn, 2008) http://ziegler.theoryofcomputation.asia ziegler@kaist.ac.kr 3568 N1, 506 연구실: 복잡도 및 실수 연산 연구실\n\n마틴 지글러 교수는 독일 Paderborn대학에서 전산학 박사와 교수자격(habilitation)을 각각 2002년과 2008년에 취득하고, 2010부터 2015년까지 TU Darmstadt 응용수학과 교수로 재직하며 전산이론을 교육하였으며, 2015년 KAIST 전산학부 교수로 부임했다. 지글러 교수는 Computability and Complexity in Analysis라는 국제학술대회를 2014년에 조직 운영하고, 2015년에는 의장을 역임했다. 그리고 과학적인 평화 연구 및 기술 평가에 관한 IANUS 그룹의 대변인으로 2012년부터 2015년까지 역임했다. 지글러 교수는 두 번에 걸친 JSPS 펠로우십 (2006년과 2013년), 연구인상 (2006년), 최우수논문상 (2009년), 교육상 (2011년) 등 다양한 수상경력을 보유하고 있다. csweb.profs"
}