{
    "name": "오혜연",
    "field": "인공지능·정보서비스, 소셜 컴퓨팅, 인터랙티브 컴퓨팅",
    "major": "기계학습, 전산사회과학",
    "degree": "PhD, Massachusetts Institute of Technology, 2008",
    "web": "http://uilab.kr/",
    "mail": "alice.oh@kaist.edu",
    "phone": "3549",
    "office": "E3-1, 4404",
    "etc": "연구실: Users and Information Lab\n\n오혜연 교수는 KAIST 전산학과의 부교수이며 2013-2014년의 연구연가 기간동안 Harvard Center for Research on Computation and Society에서 객원 연구원을 맡았다. 현재 전산사회과학 (computational social science) 연구에 집중하고 있으며, 넓은 의미로 대용량의 소셜 미디어 데이터에 전산학적 도구를 적용하여 개인 및 그룹의 사회적 행동을 분석하는 것이다. 또한 기계학습 (machine learning) 연구를 수행하고 있으며 텍스트, 이미지, 그리고 웹 데이터에 대한 새로운 토픽 모델링 연구의 논문들을 게재하였다. 국제활동으로는 ICWSM 2014의 Program Co-Chair, ACL 2014 Workshop on Social Dynamics and Personal Attributes의 Co-Organizer, WWW 2014의 Co-Chair of Publicity, 그리고 ACL, WSDM, COLING, EMNLP, NIPS, AAAI 에서 (Senior) PC 직책을 맡았다. 오혜연 교수는 CMU Language and Information Technologies 에서 석사학위를, MIT의 Computer Science 에서 박사학위를 취득했다.",
    "tag": "csweb.profs",
    "id": 30,
    "content": "name:오혜연 field:인공지능·정보서비스, 소셜 컴퓨팅, 인터랙티브 컴퓨팅 major:기계학습, 전산사회과학 degree:PhD, Massachusetts Institute of Technology, 2008 web:http://uilab.kr/ mail:alice.oh@kaist.edu phone:3549 office:E3-1, 4404 etc:연구실: Users and Information Lab\n\n오혜연 교수는 KAIST 전산학과의 부교수이며 2013-2014년의 연구연가 기간동안 Harvard Center for Research on Computation and Society에서 객원 연구원을 맡았다. 현재 전산사회과학 (computational social science) 연구에 집중하고 있으며, 넓은 의미로 대용량의 소셜 미디어 데이터에 전산학적 도구를 적용하여 개인 및 그룹의 사회적 행동을 분석하는 것이다. 또한 기계학습 (machine learning) 연구를 수행하고 있으며 텍스트, 이미지, 그리고 웹 데이터에 대한 새로운 토픽 모델링 연구의 논문들을 게재하였다. 국제활동으로는 ICWSM 2014의 Program Co-Chair, ACL 2014 Workshop on Social Dynamics and Personal Attributes의 Co-Organizer, WWW 2014의 Co-Chair of Publicity, 그리고 ACL, WSDM, COLING, EMNLP, NIPS, AAAI 에서 (Senior) PC 직책을 맡았다. 오혜연 교수는 CMU Language and Information Technologies 에서 석사학위를, MIT의 Computer Science 에서 박사학위를 취득했다. tag:csweb.profs content:오혜연 인공지능·정보서비스, 소셜 컴퓨팅, 인터랙티브 컴퓨팅 기계학습, 전산사회과학 PhD, Massachusetts Institute of Technology, 2008 http://uilab.kr/ alice.oh@kaist.edu 3549 E3-1, 4404 연구실: Users and Information Lab\n\n오혜연 교수는 KAIST 전산학과의 부교수이며 2013-2014년의 연구연가 기간동안 Harvard Center for Research on Computation and Society에서 객원 연구원을 맡았다. 현재 전산사회과학 (computational social science) 연구에 집중하고 있으며, 넓은 의미로 대용량의 소셜 미디어 데이터에 전산학적 도구를 적용하여 개인 및 그룹의 사회적 행동을 분석하는 것이다. 또한 기계학습 (machine learning) 연구를 수행하고 있으며 텍스트, 이미지, 그리고 웹 데이터에 대한 새로운 토픽 모델링 연구의 논문들을 게재하였다. 국제활동으로는 ICWSM 2014의 Program Co-Chair, ACL 2014 Workshop on Social Dynamics and Personal Attributes의 Co-Organizer, WWW 2014의 Co-Chair of Publicity, 그리고 ACL, WSDM, COLING, EMNLP, NIPS, AAAI 에서 (Senior) PC 직책을 맡았다. 오혜연 교수는 CMU Language and Information Technologies 에서 석사학위를, MIT의 Computer Science 에서 박사학위를 취득했다. csweb.profs"
}