{
    "name": "김현정",
    "field": "인공지능·정보서비스",
    "major": "AI-based Scheduling",
    "degree": "PhD, KAIST, 2013",
    "web": "https://msslab.kaist.ac.kr/",
    "mail": "hyunjungkim@kaist.ac.kr",
    "phone": "042-350-3134",
    "office": "4207, E2-1",
    "etc": "연구실: \n\n김현정 교수는 KAIST 산업및시스템공학과에서 부교수로 재직 중이며, 제조 및 서비스 시스템 연구실을 이끌고 있다. 주요 연구 분야는 생산 및 물류 시스템의 최적화, 인공지능 기반 의사결정 지원, 스마트 제조 시스템 등이며, 다양한 산업 문제 해결을 위한 수리 모델링 및 알고리즘 개발에 주력하고 있다. 현재 IEEE Transactions on Automation Science and Engineering의 Senior Editor로, International Journal of Production Research, Naval Research Logistics, Journal of Scheduling의 Associate Editor로 활동하고 있다.",
    "tag": "csweb.profs",
    "id": 77,
    "content": "name:김현정 field:인공지능·정보서비스 major:AI-based Scheduling degree:PhD, KAIST, 2013 web:https://msslab.kaist.ac.kr/ mail:hyunjungkim@kaist.ac.kr phone:042-350-3134 office:4207, E2-1 etc:연구실: \n\n김현정 교수는 KAIST 산업및시스템공학과에서 부교수로 재직 중이며, 제조 및 서비스 시스템 연구실을 이끌고 있다. 주요 연구 분야는 생산 및 물류 시스템의 최적화, 인공지능 기반 의사결정 지원, 스마트 제조 시스템 등이며, 다양한 산업 문제 해결을 위한 수리 모델링 및 알고리즘 개발에 주력하고 있다. 현재 IEEE Transactions on Automation Science and Engineering의 Senior Editor로, International Journal of Production Research, Naval Research Logistics, Journal of Scheduling의 Associate Editor로 활동하고 있다. tag:csweb.profs content:김현정 인공지능·정보서비스 AI-based Scheduling PhD, KAIST, 2013 https://msslab.kaist.ac.kr/ hyunjungkim@kaist.ac.kr 042-350-3134 4207, E2-1 연구실: \n\n김현정 교수는 KAIST 산업및시스템공학과에서 부교수로 재직 중이며, 제조 및 서비스 시스템 연구실을 이끌고 있다. 주요 연구 분야는 생산 및 물류 시스템의 최적화, 인공지능 기반 의사결정 지원, 스마트 제조 시스템 등이며, 다양한 산업 문제 해결을 위한 수리 모델링 및 알고리즘 개발에 주력하고 있다. 현재 IEEE Transactions on Automation Science and Engineering의 Senior Editor로, International Journal of Production Research, Naval Research Logistics, Journal of Scheduling의 Associate Editor로 활동하고 있다. csweb.profs"
}