{
    "name": "김명호",
    "field": "시스템·네트워크, 인공지능·정보서비스, 소셜 컴퓨팅",
    "major": "데이타베이스, 정보처리",
    "degree": "PhD, Michigan State Univ, 1989",
    "web": "http://dbserver.kaist.ac.kr/~mhkim/",
    "mail": "mhkim@kaist.ac.kr",
    "phone": "3530",
    "office": "E3-1, 3405",
    "etc": "연구실: 데이터베이스 연구실\n\n김명호 교수는 KAIST 전산학과 교수이다. 서울대학교에서 컴퓨터 공학부 학사(1982)와 석사(1984) 학위를 수여하고, 미시건 주립 대학에서 전산학 박사(1989) 학위를 취득하였다. 데이터베이스 관련 분야를 연구하고 있으며, 2007년에 국가지정 연구실로 선정되기도 하였다. 관심 분야는 데이터베이스 시스템 및 응용, 분산 및 병렬 데이터베이스, 멀티미디어 데이터베이스, 생물정보학, 정보검색, 데이터마이닝 등이다.",
    "tag": "csweb.profs",
    "id": 54,
    "content": "name:김명호 field:시스템·네트워크, 인공지능·정보서비스, 소셜 컴퓨팅 major:데이타베이스, 정보처리 degree:PhD, Michigan State Univ, 1989 web:http://dbserver.kaist.ac.kr/~mhkim/ mail:mhkim@kaist.ac.kr phone:3530 office:E3-1, 3405 etc:연구실: 데이터베이스 연구실\n\n김명호 교수는 KAIST 전산학과 교수이다. 서울대학교에서 컴퓨터 공학부 학사(1982)와 석사(1984) 학위를 수여하고, 미시건 주립 대학에서 전산학 박사(1989) 학위를 취득하였다. 데이터베이스 관련 분야를 연구하고 있으며, 2007년에 국가지정 연구실로 선정되기도 하였다. 관심 분야는 데이터베이스 시스템 및 응용, 분산 및 병렬 데이터베이스, 멀티미디어 데이터베이스, 생물정보학, 정보검색, 데이터마이닝 등이다. tag:csweb.profs content:김명호 시스템·네트워크, 인공지능·정보서비스, 소셜 컴퓨팅 데이타베이스, 정보처리 PhD, Michigan State Univ, 1989 http://dbserver.kaist.ac.kr/~mhkim/ mhkim@kaist.ac.kr 3530 E3-1, 3405 연구실: 데이터베이스 연구실\n\n김명호 교수는 KAIST 전산학과 교수이다. 서울대학교에서 컴퓨터 공학부 학사(1982)와 석사(1984) 학위를 수여하고, 미시건 주립 대학에서 전산학 박사(1989) 학위를 취득하였다. 데이터베이스 관련 분야를 연구하고 있으며, 2007년에 국가지정 연구실로 선정되기도 하였다. 관심 분야는 데이터베이스 시스템 및 응용, 분산 및 병렬 데이터베이스, 멀티미디어 데이터베이스, 생물정보학, 정보검색, 데이터마이닝 등이다. csweb.profs"
}