{
    "name": "시어링 조셉",
    "field": "인공지능·정보서비스, 소셜 컴퓨팅, 인터랙티브 컴퓨팅",
    "major": "Human-Computer Interaction, Social Computing",
    "degree": "PhD, Carnegie Mellon University, 2020",
    "web": "http://joseph.seering.org/",
    "mail": "seering@kaist.ac.kr",
    "phone": "3589",
    "office": "604, N1",
    "etc": "연구실: 협동 사회 기술 연구실\n\nJoseph Seering is an assistant professor in the School of Computing at KAIST, where he leads the Collaborative Social Technologies Lab. His work focuses on understanding the social and organizational dynamics of conflict and coordination on online social platforms in order to drive the development of new forms of social tools. He has received awards for his papers at the ACM CHI, CSCW, and CHI PLAY conferences, and was named one of the CCC/CRA Computing Innovation Fellows of 2021. He is also an affiliated fellow at the Yale University Social Media Governance Initiative and a member of the Trust and Safety Professionals Association. Joseph received his Ph.D. from the Human-Computer Interaction Institute at Carnegie Mellon University and was a postdoctoral researcher in the Computer Science Department at Stanford University and a fellow at the Stanford Human-Centered AI Institute.",
    "tag": "csweb.profs",
    "id": 25,
    "content": "name:시어링 조셉 field:인공지능·정보서비스, 소셜 컴퓨팅, 인터랙티브 컴퓨팅 major:Human-Computer Interaction, Social Computing degree:PhD, Carnegie Mellon University, 2020 web:http://joseph.seering.org/ mail:seering@kaist.ac.kr phone:3589 office:604, N1 etc:연구실: 협동 사회 기술 연구실\n\nJoseph Seering is an assistant professor in the School of Computing at KAIST, where he leads the Collaborative Social Technologies Lab. His work focuses on understanding the social and organizational dynamics of conflict and coordination on online social platforms in order to drive the development of new forms of social tools. He has received awards for his papers at the ACM CHI, CSCW, and CHI PLAY conferences, and was named one of the CCC/CRA Computing Innovation Fellows of 2021. He is also an affiliated fellow at the Yale University Social Media Governance Initiative and a member of the Trust and Safety Professionals Association. Joseph received his Ph.D. from the Human-Computer Interaction Institute at Carnegie Mellon University and was a postdoctoral researcher in the Computer Science Department at Stanford University and a fellow at the Stanford Human-Centered AI Institute. tag:csweb.profs content:시어링 조셉 인공지능·정보서비스, 소셜 컴퓨팅, 인터랙티브 컴퓨팅 Human-Computer Interaction, Social Computing PhD, Carnegie Mellon University, 2020 http://joseph.seering.org/ seering@kaist.ac.kr 3589 604, N1 연구실: 협동 사회 기술 연구실\n\nJoseph Seering is an assistant professor in the School of Computing at KAIST, where he leads the Collaborative Social Technologies Lab. His work focuses on understanding the social and organizational dynamics of conflict and coordination on online social platforms in order to drive the development of new forms of social tools. He has received awards for his papers at the ACM CHI, CSCW, and CHI PLAY conferences, and was named one of the CCC/CRA Computing Innovation Fellows of 2021. He is also an affiliated fellow at the Yale University Social Media Governance Initiative and a member of the Trust and Safety Professionals Association. Joseph received his Ph.D. from the Human-Computer Interaction Institute at Carnegie Mellon University and was a postdoctoral researcher in the Computer Science Department at Stanford University and a fellow at the Stanford Human-Centered AI Institute. csweb.profs"
}