{
    "name": "강민석",
    "field": "시큐어 컴퓨팅, 시스템·네트워크",
    "major": "Network and distributed system security",
    "degree": "PhD, Carnegie Mellon University, 2016",
    "web": "https://netsp.kaist.ac.kr/",
    "mail": "minsukk@kaist.ac.kr",
    "phone": "3585",
    "office": "N5, 2322",
    "etc": "연구실: 네트워크 보안 및 프라이버시 연구실\n\n강민석 교수는 한국과학기술원(KAIST)에 부교수로 근무하고 네트워크 보안 및 프라이버시 연구실(NetSP-Lab)을 이끌고 있다. 강 교수는 2020년 8월에 KAIST에 부임하기 전 4년간 싱가포르국립대학교 전산학과에서 조교수로 근무했었으며, 2016년엔 미국 카네기멜론대학교(Carnegie Mellon University)에서 컴퓨터 보안 연구로 컴퓨터공학 박사학위를 취득했다. 강민석 교수의 연구는 새로운 네트워크 시스템에서 구조적으로 존재하는 보안 및 프라이버시 취약점들을 발견하고, 공격을 제시하고, 방어 시스템을 제안한다. 최근에는 블록체인, 5G 모바일 네트워크, IoT망 등의 보안 및 프라이버시 연구에 집중하고 세계적인 연구 성과를 거두고 있다. NetSP-Lab은 다년간 다수의 논문을 세계 최고 수준의 컴퓨터 보안 컨퍼런스(IEEE Symposium on Security and Privacy, Usenix Security, ACM CCS, NDSS Symposium )에서 발표하여 그 성과를 주목받고 있다. 강민석 교수는 또한 다수의 주요 학회(ACM CCS 2020, ACM ICDCS 2020, ACM AsiaCCS 2020)에서 활발한 위원회 활동을 보여주고 있다.",
    "tag": "csweb.profs",
    "id": 1,
    "content": "name:강민석 field:시큐어 컴퓨팅, 시스템·네트워크 major:Network and distributed system security degree:PhD, Carnegie Mellon University, 2016 web:https://netsp.kaist.ac.kr/ mail:minsukk@kaist.ac.kr phone:3585 office:N5, 2322 etc:연구실: 네트워크 보안 및 프라이버시 연구실\n\n강민석 교수는 한국과학기술원(KAIST)에 부교수로 근무하고 네트워크 보안 및 프라이버시 연구실(NetSP-Lab)을 이끌고 있다. 강 교수는 2020년 8월에 KAIST에 부임하기 전 4년간 싱가포르국립대학교 전산학과에서 조교수로 근무했었으며, 2016년엔 미국 카네기멜론대학교(Carnegie Mellon University)에서 컴퓨터 보안 연구로 컴퓨터공학 박사학위를 취득했다. 강민석 교수의 연구는 새로운 네트워크 시스템에서 구조적으로 존재하는 보안 및 프라이버시 취약점들을 발견하고, 공격을 제시하고, 방어 시스템을 제안한다. 최근에는 블록체인, 5G 모바일 네트워크, IoT망 등의 보안 및 프라이버시 연구에 집중하고 세계적인 연구 성과를 거두고 있다. NetSP-Lab은 다년간 다수의 논문을 세계 최고 수준의 컴퓨터 보안 컨퍼런스(IEEE Symposium on Security and Privacy, Usenix Security, ACM CCS, NDSS Symposium )에서 발표하여 그 성과를 주목받고 있다. 강민석 교수는 또한 다수의 주요 학회(ACM CCS 2020, ACM ICDCS 2020, ACM AsiaCCS 2020)에서 활발한 위원회 활동을 보여주고 있다. tag:csweb.profs content:강민석 시큐어 컴퓨팅, 시스템·네트워크 Network and distributed system security PhD, Carnegie Mellon University, 2016 https://netsp.kaist.ac.kr/ minsukk@kaist.ac.kr 3585 N5, 2322 연구실: 네트워크 보안 및 프라이버시 연구실\n\n강민석 교수는 한국과학기술원(KAIST)에 부교수로 근무하고 네트워크 보안 및 프라이버시 연구실(NetSP-Lab)을 이끌고 있다. 강 교수는 2020년 8월에 KAIST에 부임하기 전 4년간 싱가포르국립대학교 전산학과에서 조교수로 근무했었으며, 2016년엔 미국 카네기멜론대학교(Carnegie Mellon University)에서 컴퓨터 보안 연구로 컴퓨터공학 박사학위를 취득했다. 강민석 교수의 연구는 새로운 네트워크 시스템에서 구조적으로 존재하는 보안 및 프라이버시 취약점들을 발견하고, 공격을 제시하고, 방어 시스템을 제안한다. 최근에는 블록체인, 5G 모바일 네트워크, IoT망 등의 보안 및 프라이버시 연구에 집중하고 세계적인 연구 성과를 거두고 있다. NetSP-Lab은 다년간 다수의 논문을 세계 최고 수준의 컴퓨터 보안 컨퍼런스(IEEE Symposium on Security and Privacy, Usenix Security, ACM CCS, NDSS Symposium )에서 발표하여 그 성과를 주목받고 있다. 강민석 교수는 또한 다수의 주요 학회(ACM CCS 2020, ACM ICDCS 2020, ACM AsiaCCS 2020)에서 활발한 위원회 활동을 보여주고 있다. csweb.profs"
}