{
    "name": "성민혁",
    "field": "비주얼 컴퓨팅, 인공지능·정보서비스",
    "major": "기계 학습, 컴퓨터 그래픽, 컴퓨터 비전, 기하학 처리",
    "degree": "PhD, Stanford University, 2019",
    "web": "https://mhsung.github.io/",
    "mail": "mhsung@kaist.ac.kr",
    "phone": "3587",
    "office": "507, E-5",
    "etc": "연구실: KAIST Visual AI Group\n\n성민혁 교수는 KAIST 전산학부 부교수이다. KAIST 부임 전 Adobe Research에서 연구원으로 1년동안 근무하였다. 2019년 Stanford University에서 박사학위를 취득하였으며, 2008년, 2010년에 KAIST에서 학사 및 석사학위를 취득하였다. 2010년부터 2013년까지 KIST에서 연구원으로 근무하였다. 주 연구분야는 3차원 형상 데이터 처리를 위한 기계학습이다.",
    "tag": "csweb.profs",
    "id": 22,
    "content": "name:성민혁 field:비주얼 컴퓨팅, 인공지능·정보서비스 major:기계 학습, 컴퓨터 그래픽, 컴퓨터 비전, 기하학 처리 degree:PhD, Stanford University, 2019 web:https://mhsung.github.io/ mail:mhsung@kaist.ac.kr phone:3587 office:507, E-5 etc:연구실: KAIST Visual AI Group\n\n성민혁 교수는 KAIST 전산학부 부교수이다. KAIST 부임 전 Adobe Research에서 연구원으로 1년동안 근무하였다. 2019년 Stanford University에서 박사학위를 취득하였으며, 2008년, 2010년에 KAIST에서 학사 및 석사학위를 취득하였다. 2010년부터 2013년까지 KIST에서 연구원으로 근무하였다. 주 연구분야는 3차원 형상 데이터 처리를 위한 기계학습이다. tag:csweb.profs content:성민혁 비주얼 컴퓨팅, 인공지능·정보서비스 기계 학습, 컴퓨터 그래픽, 컴퓨터 비전, 기하학 처리 PhD, Stanford University, 2019 https://mhsung.github.io/ mhsung@kaist.ac.kr 3587 507, E-5 연구실: KAIST Visual AI Group\n\n성민혁 교수는 KAIST 전산학부 부교수이다. KAIST 부임 전 Adobe Research에서 연구원으로 1년동안 근무하였다. 2019년 Stanford University에서 박사학위를 취득하였으며, 2008년, 2010년에 KAIST에서 학사 및 석사학위를 취득하였다. 2010년부터 2013년까지 KIST에서 연구원으로 근무하였다. 주 연구분야는 3차원 형상 데이터 처리를 위한 기계학습이다. csweb.profs"
}