{
    "name": "안소연",
    "field": "인공지능·정보서비스",
    "major": "Foreign and Second Language Education",
    "degree": "Ph.D, State University of New York at Buffalo",
    "web": "https://hss.kaist.ac.kr/boards/view/fulltime_professor/86",
    "mail": "ahnsoyeon@kaist.ac.kr",
    "phone": "042-350-4611",
    "office": "N4, 1422",
    "etc": "연구실: \n\n안소연 교수는 KAIST 인문사회과학부의 조교수로 EFL 프로그램 운영에 참여하고 있다. 2020년 KAIST에 부임하기 전에는 한국외국어대학교와 홍콩 시립대에서 조교수로 근무했다. 현재 인간과 인공지능의 소통방식 및 영어학습과정에서 이 소통방식이 어떻게 나타나는 지 linguistic 및 paralinguistic features를 동시에 멀티모덜 분석하는 연구에 집중하고 있다. 그 외에도 사회언어학적인 측면에서 영어를 비롯한 언어학습을 연구하며, 언어 및 문화적 인지, 상호문화의사소통 능력, 멀티모덜 분석을 통한 정체성 연구의 논문들을 게재하였다. 안소연 교수는 UPENN 에서 TESOL 석사학위를, SUNY Buffalo의 Foreign and Second Language Education에서 박사학위를 취득했다.",
    "tag": "csweb.profs",
    "id": 82,
    "content": "name:안소연 field:인공지능·정보서비스 major:Foreign and Second Language Education degree:Ph.D, State University of New York at Buffalo web:https://hss.kaist.ac.kr/boards/view/fulltime_professor/86 mail:ahnsoyeon@kaist.ac.kr phone:042-350-4611 office:N4, 1422 etc:연구실: \n\n안소연 교수는 KAIST 인문사회과학부의 조교수로 EFL 프로그램 운영에 참여하고 있다. 2020년 KAIST에 부임하기 전에는 한국외국어대학교와 홍콩 시립대에서 조교수로 근무했다. 현재 인간과 인공지능의 소통방식 및 영어학습과정에서 이 소통방식이 어떻게 나타나는 지 linguistic 및 paralinguistic features를 동시에 멀티모덜 분석하는 연구에 집중하고 있다. 그 외에도 사회언어학적인 측면에서 영어를 비롯한 언어학습을 연구하며, 언어 및 문화적 인지, 상호문화의사소통 능력, 멀티모덜 분석을 통한 정체성 연구의 논문들을 게재하였다. 안소연 교수는 UPENN 에서 TESOL 석사학위를, SUNY Buffalo의 Foreign and Second Language Education에서 박사학위를 취득했다. tag:csweb.profs content:안소연 인공지능·정보서비스 Foreign and Second Language Education Ph.D, State University of New York at Buffalo https://hss.kaist.ac.kr/boards/view/fulltime_professor/86 ahnsoyeon@kaist.ac.kr 042-350-4611 N4, 1422 연구실: \n\n안소연 교수는 KAIST 인문사회과학부의 조교수로 EFL 프로그램 운영에 참여하고 있다. 2020년 KAIST에 부임하기 전에는 한국외국어대학교와 홍콩 시립대에서 조교수로 근무했다. 현재 인간과 인공지능의 소통방식 및 영어학습과정에서 이 소통방식이 어떻게 나타나는 지 linguistic 및 paralinguistic features를 동시에 멀티모덜 분석하는 연구에 집중하고 있다. 그 외에도 사회언어학적인 측면에서 영어를 비롯한 언어학습을 연구하며, 언어 및 문화적 인지, 상호문화의사소통 능력, 멀티모덜 분석을 통한 정체성 연구의 논문들을 게재하였다. 안소연 교수는 UPENN 에서 TESOL 석사학위를, SUNY Buffalo의 Foreign and Second Language Education에서 박사학위를 취득했다. csweb.profs"
}