{
    "name": "지은경",
    "field": "소프트웨어 디자인",
    "major": "Software Engineering",
    "degree": "PhD, KAIST, 2009",
    "web": "http://se.kaist.ac.kr/ekjee",
    "mail": "ekjee@se.kaist.ac.kr",
    "phone": "042-350-7810",
    "office": "N1, 501",
    "etc": "연구실: \n\nEunkyoung Jee is a research associate professor in School of Computing at KAIST. She had been a postdoctoral researcher in the Computer and Information Science Department at the University of Pennsylvania. She received her B.S., M.S., and Ph.D. degrees in Computer Science from KAIST. Her research interest includes software testing, software verification, and safety analysis.",
    "tag": "csweb.profs",
    "id": 110,
    "content": "name:지은경 field:소프트웨어 디자인 major:Software Engineering degree:PhD, KAIST, 2009 web:http://se.kaist.ac.kr/ekjee mail:ekjee@se.kaist.ac.kr phone:042-350-7810 office:N1, 501 etc:연구실: \n\nEunkyoung Jee is a research associate professor in School of Computing at KAIST. She had been a postdoctoral researcher in the Computer and Information Science Department at the University of Pennsylvania. She received her B.S., M.S., and Ph.D. degrees in Computer Science from KAIST. Her research interest includes software testing, software verification, and safety analysis. tag:csweb.profs content:지은경 소프트웨어 디자인 Software Engineering PhD, KAIST, 2009 http://se.kaist.ac.kr/ekjee ekjee@se.kaist.ac.kr 042-350-7810 N1, 501 연구실: \n\nEunkyoung Jee is a research associate professor in School of Computing at KAIST. She had been a postdoctoral researcher in the Computer and Information Science Department at the University of Pennsylvania. She received her B.S., M.S., and Ph.D. degrees in Computer Science from KAIST. Her research interest includes software testing, software verification, and safety analysis. csweb.profs"
}