{
    "name": "이현수",
    "field": "소프트웨어 디자인, 인터랙티브 컴퓨팅",
    "major": "Data Science",
    "degree": "PhD, KAIST, 2023",
    "web": "http://hslee90.github.io",
    "mail": "hslee90@kaist.ac.kr",
    "phone": "",
    "office": "606, N1",
    "etc": "연구실: \n\n이현수 교수는 한국과학기술원(KAIST) 연구교수로, 인간-컴퓨터 상호작용(HCI)과 사용성 중심 보안/프라이버시(Usable Privacy & Security)를 연구한다. 이 교수는 2023년에 카이스트에서 데이터사이언스 박사학위를 취득했다. 이 교수는 모바일 센싱, 웨어러블 기기, 스마트홈, AI 시스템 등 데이터 집약적 환경에서 사용자들의 프라이버시와 보안 요구 사항을 탐구하고, 이를 기반으로 사용자가 자신의 데이터를 이해하고 공유를 관리하며 통제할 수 있는 인터랙티브 시스템을 설계 및 개발한다. 현재 연구분야로는 AI 기반 기술(예: LLM, 스마트 어시스턴트) 사용 시 프라이버시/보안 UX 향상, 스마트홈/IoT 등 유비쿼터스 환경 내에서의 사용자 프라이버시와 보안 보장을 위한 인포매틱스 시스템 설계, 고령층·아동 등 취약 계층을 위한 맞춤형 프라이버시 설계 등이 있다.",
    "tag": "csweb.profs",
    "id": 109,
    "content": "name:이현수 field:소프트웨어 디자인, 인터랙티브 컴퓨팅 major:Data Science degree:PhD, KAIST, 2023 web:http://hslee90.github.io mail:hslee90@kaist.ac.kr phone: office:606, N1 etc:연구실: \n\n이현수 교수는 한국과학기술원(KAIST) 연구교수로, 인간-컴퓨터 상호작용(HCI)과 사용성 중심 보안/프라이버시(Usable Privacy & Security)를 연구한다. 이 교수는 2023년에 카이스트에서 데이터사이언스 박사학위를 취득했다. 이 교수는 모바일 센싱, 웨어러블 기기, 스마트홈, AI 시스템 등 데이터 집약적 환경에서 사용자들의 프라이버시와 보안 요구 사항을 탐구하고, 이를 기반으로 사용자가 자신의 데이터를 이해하고 공유를 관리하며 통제할 수 있는 인터랙티브 시스템을 설계 및 개발한다. 현재 연구분야로는 AI 기반 기술(예: LLM, 스마트 어시스턴트) 사용 시 프라이버시/보안 UX 향상, 스마트홈/IoT 등 유비쿼터스 환경 내에서의 사용자 프라이버시와 보안 보장을 위한 인포매틱스 시스템 설계, 고령층·아동 등 취약 계층을 위한 맞춤형 프라이버시 설계 등이 있다. tag:csweb.profs content:이현수 소프트웨어 디자인, 인터랙티브 컴퓨팅 Data Science PhD, KAIST, 2023 http://hslee90.github.io hslee90@kaist.ac.kr  606, N1 연구실: \n\n이현수 교수는 한국과학기술원(KAIST) 연구교수로, 인간-컴퓨터 상호작용(HCI)과 사용성 중심 보안/프라이버시(Usable Privacy & Security)를 연구한다. 이 교수는 2023년에 카이스트에서 데이터사이언스 박사학위를 취득했다. 이 교수는 모바일 센싱, 웨어러블 기기, 스마트홈, AI 시스템 등 데이터 집약적 환경에서 사용자들의 프라이버시와 보안 요구 사항을 탐구하고, 이를 기반으로 사용자가 자신의 데이터를 이해하고 공유를 관리하며 통제할 수 있는 인터랙티브 시스템을 설계 및 개발한다. 현재 연구분야로는 AI 기반 기술(예: LLM, 스마트 어시스턴트) 사용 시 프라이버시/보안 UX 향상, 스마트홈/IoT 등 유비쿼터스 환경 내에서의 사용자 프라이버시와 보안 보장을 위한 인포매틱스 시스템 설계, 고령층·아동 등 취약 계층을 위한 맞춤형 프라이버시 설계 등이 있다. csweb.profs"
}