{
    "name": "최원호",
    "field": "인공지능·정보서비스",
    "major": "금융관련 인공지능",
    "degree": "PhD in Finance, Wharton School, Univ. of Pennsylvania, 2008",
    "web": "https://cs.kaist.ac.kr",
    "mail": "wonho.choi@kaist.ac.kr",
    "phone": "",
    "office": "도곡캠퍼스",
    "etc": "연구실: \n\n최원호 박사는 KAIST 전산학부 초빙교수이며, 관심분야는 금융관련 인공지능이다. 과거, 2008-2016년에 KAIST 경영대학에서, 2017-2021년에 UNIST 경영학부에서, 각각 조교수, 초빙부교수로서 재직하였고, 예일대학교에서 2009년에 visiting associates, 2016-2017년에 visiting research associate 로서 연구하였다. 서울대학교 경영학과를 졸업하였으며, 스탠퍼드대학교에서 statistics 석사학위를 취득하였다. 박사학위는 펜실베이니아대학교의 워튼스쿨에서 finance 전공으로 수여받았다.",
    "tag": "csweb.profs",
    "id": 103,
    "content": "name:최원호 field:인공지능·정보서비스 major:금융관련 인공지능 degree:PhD in Finance, Wharton School, Univ. of Pennsylvania, 2008 web:https://cs.kaist.ac.kr mail:wonho.choi@kaist.ac.kr phone: office:도곡캠퍼스 etc:연구실: \n\n최원호 박사는 KAIST 전산학부 초빙교수이며, 관심분야는 금융관련 인공지능이다. 과거, 2008-2016년에 KAIST 경영대학에서, 2017-2021년에 UNIST 경영학부에서, 각각 조교수, 초빙부교수로서 재직하였고, 예일대학교에서 2009년에 visiting associates, 2016-2017년에 visiting research associate 로서 연구하였다. 서울대학교 경영학과를 졸업하였으며, 스탠퍼드대학교에서 statistics 석사학위를 취득하였다. 박사학위는 펜실베이니아대학교의 워튼스쿨에서 finance 전공으로 수여받았다. tag:csweb.profs content:최원호 인공지능·정보서비스 금융관련 인공지능 PhD in Finance, Wharton School, Univ. of Pennsylvania, 2008 https://cs.kaist.ac.kr wonho.choi@kaist.ac.kr  도곡캠퍼스 연구실: \n\n최원호 박사는 KAIST 전산학부 초빙교수이며, 관심분야는 금융관련 인공지능이다. 과거, 2008-2016년에 KAIST 경영대학에서, 2017-2021년에 UNIST 경영학부에서, 각각 조교수, 초빙부교수로서 재직하였고, 예일대학교에서 2009년에 visiting associates, 2016-2017년에 visiting research associate 로서 연구하였다. 서울대학교 경영학과를 졸업하였으며, 스탠퍼드대학교에서 statistics 석사학위를 취득하였다. 박사학위는 펜실베이니아대학교의 워튼스쿨에서 finance 전공으로 수여받았다. csweb.profs"
}