{
    "name": "고인영",
    "field": "소프트웨어 디자인, 인공지능·정보서비스",
    "major": "소프트웨어공학, 웹공학, 서비스 컴퓨팅",
    "degree": "PhD, University of Southern California, 2003",
    "web": "https://webeng.kaist.ac.kr/",
    "mail": "iko@kaist.ac.kr",
    "phone": "3547",
    "office": "N1, 505",
    "etc": "연구실: 웹 공학 및 서비스 컴퓨팅 연구실\n\n고인영 교수는 현재 KAIST 전산학과 교수로 재직중이며, Big Data Edge Cloud Services (BECS) ITRC 연구센터의 센터장을 맡고 있다. 2005년부터 2011년까지는 미국 카네기멜론대학교 School of Computer  Science의 소프트웨어공학 과정 겸임교수로도 활동하였다. 고인영 교수는 2003년 University of Southern California에서 전산학 박사학위를 취득하였고, 그 이전에 서강대학교에서 전산학 학사와 석사를 취득하였다. 2004년 KAIST에 오기전에 고인영 교수는 미국 USC Information Sciences Institute (ISI)의 Distributed Scalable Systems Division에서 박사후 과정 연구원으로 재직하였다. 1993년부터 1996년까지는 공군사관학교 컴퓨터공학과 교관(전임강사)으로도 재직하였다. 고인영 교수의 주 연구분야는 소프트웨어공학, 웹공학, 서비스 컴퓨팅 이며, 현재 엣지-클라우드와 Cyber-Physical 시스템 등의 대규모 분산 컴퓨팅 환경에서의 효과적이고 효율적인 소프트웨어 개발과 배포, 실행에 대한 연구를 수행 중에 있다.",
    "tag": "csweb.profs",
    "id": 3,
    "content": "name:고인영 field:소프트웨어 디자인, 인공지능·정보서비스 major:소프트웨어공학, 웹공학, 서비스 컴퓨팅 degree:PhD, University of Southern California, 2003 web:https://webeng.kaist.ac.kr/ mail:iko@kaist.ac.kr phone:3547 office:N1, 505 etc:연구실: 웹 공학 및 서비스 컴퓨팅 연구실\n\n고인영 교수는 현재 KAIST 전산학과 교수로 재직중이며, Big Data Edge Cloud Services (BECS) ITRC 연구센터의 센터장을 맡고 있다. 2005년부터 2011년까지는 미국 카네기멜론대학교 School of Computer  Science의 소프트웨어공학 과정 겸임교수로도 활동하였다. 고인영 교수는 2003년 University of Southern California에서 전산학 박사학위를 취득하였고, 그 이전에 서강대학교에서 전산학 학사와 석사를 취득하였다. 2004년 KAIST에 오기전에 고인영 교수는 미국 USC Information Sciences Institute (ISI)의 Distributed Scalable Systems Division에서 박사후 과정 연구원으로 재직하였다. 1993년부터 1996년까지는 공군사관학교 컴퓨터공학과 교관(전임강사)으로도 재직하였다. 고인영 교수의 주 연구분야는 소프트웨어공학, 웹공학, 서비스 컴퓨팅 이며, 현재 엣지-클라우드와 Cyber-Physical 시스템 등의 대규모 분산 컴퓨팅 환경에서의 효과적이고 효율적인 소프트웨어 개발과 배포, 실행에 대한 연구를 수행 중에 있다. tag:csweb.profs content:고인영 소프트웨어 디자인, 인공지능·정보서비스 소프트웨어공학, 웹공학, 서비스 컴퓨팅 PhD, University of Southern California, 2003 https://webeng.kaist.ac.kr/ iko@kaist.ac.kr 3547 N1, 505 연구실: 웹 공학 및 서비스 컴퓨팅 연구실\n\n고인영 교수는 현재 KAIST 전산학과 교수로 재직중이며, Big Data Edge Cloud Services (BECS) ITRC 연구센터의 센터장을 맡고 있다. 2005년부터 2011년까지는 미국 카네기멜론대학교 School of Computer  Science의 소프트웨어공학 과정 겸임교수로도 활동하였다. 고인영 교수는 2003년 University of Southern California에서 전산학 박사학위를 취득하였고, 그 이전에 서강대학교에서 전산학 학사와 석사를 취득하였다. 2004년 KAIST에 오기전에 고인영 교수는 미국 USC Information Sciences Institute (ISI)의 Distributed Scalable Systems Division에서 박사후 과정 연구원으로 재직하였다. 1993년부터 1996년까지는 공군사관학교 컴퓨터공학과 교관(전임강사)으로도 재직하였다. 고인영 교수의 주 연구분야는 소프트웨어공학, 웹공학, 서비스 컴퓨팅 이며, 현재 엣지-클라우드와 Cyber-Physical 시스템 등의 대규모 분산 컴퓨팅 환경에서의 효과적이고 효율적인 소프트웨어 개발과 배포, 실행에 대한 연구를 수행 중에 있다. csweb.profs"
}