{
    "name": "박종세",
    "field": "시스템·네트워크, 인공지능·정보서비스",
    "major": "컴퓨터 시스템, 컴퓨터 구조, 인공지능 시스템, 하드웨어-소프트웨어 코디자인",
    "degree": "PhD, Georgia Institute of Technology, 2018",
    "web": "https://jongse-park.github.io/",
    "mail": "jongse@kaist.ac.kr",
    "phone": "3580",
    "office": "405, E3-5",
    "etc": "연구실: 컴퓨터구조 및 시스템 연구실\n\n박종세 교수는 한국과학기술원(KAIST)에 부교수로 근무하며 컴퓨터구조 및 시스템 연구실 (CASYS) 을 이끌고 있다. 박교수는 2019년 KAIST에 부임하기 전에는 미국 실리콘밸리를 기반으로 한 스타트업 기업인 Bigstream Solutions Inc. 에서 가속화 솔루션 설계 및 개발자로 일하여 FPGA를 이용한 Deep Learing Accelerator의 설계 및 구현 뿐 아니라 이 하드웨어를 지원하기 위한 프로그래밍언어, 컴파일러, 런타임 소프트웨어 등, 컴퓨팅 스택의 개발을 주도했다. 2018년에는 미국 애틀랜타에 위치한 조지아텍(Georgia Institute of Technology)에서 인공지능을 위한 하드웨어 가속기 및 전문화된 소프트웨어 시스템에 대한 연구를 하여 컴퓨터과학 박사학위를 취득했다. 2012년에는 KAIST에서, 가상화된 클라우드 시스템 상에서 분산시스템의 자원효율성에 관한 연구로 전산학 석사를 취득했다. 박교수의 연구 관심분야는 데이터센터 기반의 고성능 시스템에서부터 저전력 모바일/엣지 시스템에 이르는 다양한 이종 컴퓨팅 플랫폼 환경에서 차세대 응용프로그램을 지원할 수 있는 하드웨어/소프트웨어 통합설계이다.",
    "tag": "csweb.profs",
    "id": 18,
    "content": "name:박종세 field:시스템·네트워크, 인공지능·정보서비스 major:컴퓨터 시스템, 컴퓨터 구조, 인공지능 시스템, 하드웨어-소프트웨어 코디자인 degree:PhD, Georgia Institute of Technology, 2018 web:https://jongse-park.github.io/ mail:jongse@kaist.ac.kr phone:3580 office:405, E3-5 etc:연구실: 컴퓨터구조 및 시스템 연구실\n\n박종세 교수는 한국과학기술원(KAIST)에 부교수로 근무하며 컴퓨터구조 및 시스템 연구실 (CASYS) 을 이끌고 있다. 박교수는 2019년 KAIST에 부임하기 전에는 미국 실리콘밸리를 기반으로 한 스타트업 기업인 Bigstream Solutions Inc. 에서 가속화 솔루션 설계 및 개발자로 일하여 FPGA를 이용한 Deep Learing Accelerator의 설계 및 구현 뿐 아니라 이 하드웨어를 지원하기 위한 프로그래밍언어, 컴파일러, 런타임 소프트웨어 등, 컴퓨팅 스택의 개발을 주도했다. 2018년에는 미국 애틀랜타에 위치한 조지아텍(Georgia Institute of Technology)에서 인공지능을 위한 하드웨어 가속기 및 전문화된 소프트웨어 시스템에 대한 연구를 하여 컴퓨터과학 박사학위를 취득했다. 2012년에는 KAIST에서, 가상화된 클라우드 시스템 상에서 분산시스템의 자원효율성에 관한 연구로 전산학 석사를 취득했다. 박교수의 연구 관심분야는 데이터센터 기반의 고성능 시스템에서부터 저전력 모바일/엣지 시스템에 이르는 다양한 이종 컴퓨팅 플랫폼 환경에서 차세대 응용프로그램을 지원할 수 있는 하드웨어/소프트웨어 통합설계이다. tag:csweb.profs content:박종세 시스템·네트워크, 인공지능·정보서비스 컴퓨터 시스템, 컴퓨터 구조, 인공지능 시스템, 하드웨어-소프트웨어 코디자인 PhD, Georgia Institute of Technology, 2018 https://jongse-park.github.io/ jongse@kaist.ac.kr 3580 405, E3-5 연구실: 컴퓨터구조 및 시스템 연구실\n\n박종세 교수는 한국과학기술원(KAIST)에 부교수로 근무하며 컴퓨터구조 및 시스템 연구실 (CASYS) 을 이끌고 있다. 박교수는 2019년 KAIST에 부임하기 전에는 미국 실리콘밸리를 기반으로 한 스타트업 기업인 Bigstream Solutions Inc. 에서 가속화 솔루션 설계 및 개발자로 일하여 FPGA를 이용한 Deep Learing Accelerator의 설계 및 구현 뿐 아니라 이 하드웨어를 지원하기 위한 프로그래밍언어, 컴파일러, 런타임 소프트웨어 등, 컴퓨팅 스택의 개발을 주도했다. 2018년에는 미국 애틀랜타에 위치한 조지아텍(Georgia Institute of Technology)에서 인공지능을 위한 하드웨어 가속기 및 전문화된 소프트웨어 시스템에 대한 연구를 하여 컴퓨터과학 박사학위를 취득했다. 2012년에는 KAIST에서, 가상화된 클라우드 시스템 상에서 분산시스템의 자원효율성에 관한 연구로 전산학 석사를 취득했다. 박교수의 연구 관심분야는 데이터센터 기반의 고성능 시스템에서부터 저전력 모바일/엣지 시스템에 이르는 다양한 이종 컴퓨팅 플랫폼 환경에서 차세대 응용프로그램을 지원할 수 있는 하드웨어/소프트웨어 통합설계이다. csweb.profs"
}