{
    "name": "이성주",
    "field": "시스템·네트워크, 소프트웨어 디자인, 시큐어 컴퓨팅, 소셜 컴퓨팅, 인터랙티브 컴퓨팅",
    "major": "네트워킹, 모바일 컴퓨팅, 시스템, 인간컴퓨터상호작용, 보안",
    "degree": "PhD, University of California, Los Angeles (UCLA), 2000",
    "web": "https://sites.google.com/site/wewantsj/",
    "mail": "profsj@kaist.ac.kr",
    "phone": "3566",
    "office": "-",
    "etc": "연구실: \n\n이성주 교수는 2000년에 UCLA 대학에서 전산학으로 박사 학위를 받았다. 그는 2015년부터 KAIST 전산학과 교수이자 석좌교수로 활동중이다. KAIST 에 부임하기전, 그는 15 년 동안 Silicon Valley 의 기업들에서 연구생활을 하였다. HP 에서 Principal Research Scientist 와 Distinguished Mobility Architect 직을 역임하였으며, 나중에 Symantec 으로 합병되는 Narus 에서 Principal Member of Technical Staff 로 활약하였다. 그의 연구 관심 분야는 모바일 컴퓨팅,무선 네트워크, 인간컴퓨터상호작용, 네트워크 보안, 네트워크 시스템이다.\n이성주 교수는 2010년에 mega-scale wireless sensing team 에서의 큰 활약과 기여로, HP CEO Innovation Award 를 수상하였다. 이 상은 HP가 상품화한 가장 획기적인 제품들을 만든 사람들에서 주는 것으로 HP 사업부 임원들이 추천하는 자들에게 주어진다. IEEE ICDCS 학회 2015년에 최우수논문상을 수상하였으며 ACM WINTECH 학회 2016년에 Test-of-Time 논문상을 수상하였다. 그는 유명한 국제 네트워크 학회에 적극적으로 여러 임무를 맡으며 활약중이다. 2014년에는 ACM MobiCom 20주년 학회의 General Chair 였으며 2016년 IEEE INFOCOM co-TPC chair 이다. 이성주 교수는 IEEE Fellow 이고 ACM Distinguished Scientist 이다.",
    "tag": "csweb.profs",
    "id": 87,
    "content": "name:이성주 field:시스템·네트워크, 소프트웨어 디자인, 시큐어 컴퓨팅, 소셜 컴퓨팅, 인터랙티브 컴퓨팅 major:네트워킹, 모바일 컴퓨팅, 시스템, 인간컴퓨터상호작용, 보안 degree:PhD, University of California, Los Angeles (UCLA), 2000 web:https://sites.google.com/site/wewantsj/ mail:profsj@kaist.ac.kr phone:3566 office:- etc:연구실: \n\n이성주 교수는 2000년에 UCLA 대학에서 전산학으로 박사 학위를 받았다. 그는 2015년부터 KAIST 전산학과 교수이자 석좌교수로 활동중이다. KAIST 에 부임하기전, 그는 15 년 동안 Silicon Valley 의 기업들에서 연구생활을 하였다. HP 에서 Principal Research Scientist 와 Distinguished Mobility Architect 직을 역임하였으며, 나중에 Symantec 으로 합병되는 Narus 에서 Principal Member of Technical Staff 로 활약하였다. 그의 연구 관심 분야는 모바일 컴퓨팅,무선 네트워크, 인간컴퓨터상호작용, 네트워크 보안, 네트워크 시스템이다.\n이성주 교수는 2010년에 mega-scale wireless sensing team 에서의 큰 활약과 기여로, HP CEO Innovation Award 를 수상하였다. 이 상은 HP가 상품화한 가장 획기적인 제품들을 만든 사람들에서 주는 것으로 HP 사업부 임원들이 추천하는 자들에게 주어진다. IEEE ICDCS 학회 2015년에 최우수논문상을 수상하였으며 ACM WINTECH 학회 2016년에 Test-of-Time 논문상을 수상하였다. 그는 유명한 국제 네트워크 학회에 적극적으로 여러 임무를 맡으며 활약중이다. 2014년에는 ACM MobiCom 20주년 학회의 General Chair 였으며 2016년 IEEE INFOCOM co-TPC chair 이다. 이성주 교수는 IEEE Fellow 이고 ACM Distinguished Scientist 이다. tag:csweb.profs content:이성주 시스템·네트워크, 소프트웨어 디자인, 시큐어 컴퓨팅, 소셜 컴퓨팅, 인터랙티브 컴퓨팅 네트워킹, 모바일 컴퓨팅, 시스템, 인간컴퓨터상호작용, 보안 PhD, University of California, Los Angeles (UCLA), 2000 https://sites.google.com/site/wewantsj/ profsj@kaist.ac.kr 3566 - 연구실: \n\n이성주 교수는 2000년에 UCLA 대학에서 전산학으로 박사 학위를 받았다. 그는 2015년부터 KAIST 전산학과 교수이자 석좌교수로 활동중이다. KAIST 에 부임하기전, 그는 15 년 동안 Silicon Valley 의 기업들에서 연구생활을 하였다. HP 에서 Principal Research Scientist 와 Distinguished Mobility Architect 직을 역임하였으며, 나중에 Symantec 으로 합병되는 Narus 에서 Principal Member of Technical Staff 로 활약하였다. 그의 연구 관심 분야는 모바일 컴퓨팅,무선 네트워크, 인간컴퓨터상호작용, 네트워크 보안, 네트워크 시스템이다.\n이성주 교수는 2010년에 mega-scale wireless sensing team 에서의 큰 활약과 기여로, HP CEO Innovation Award 를 수상하였다. 이 상은 HP가 상품화한 가장 획기적인 제품들을 만든 사람들에서 주는 것으로 HP 사업부 임원들이 추천하는 자들에게 주어진다. IEEE ICDCS 학회 2015년에 최우수논문상을 수상하였으며 ACM WINTECH 학회 2016년에 Test-of-Time 논문상을 수상하였다. 그는 유명한 국제 네트워크 학회에 적극적으로 여러 임무를 맡으며 활약중이다. 2014년에는 ACM MobiCom 20주년 학회의 General Chair 였으며 2016년 IEEE INFOCOM co-TPC chair 이다. 이성주 교수는 IEEE Fellow 이고 ACM Distinguished Scientist 이다. csweb.profs"
}