{
    "name": "김순태",
    "field": "시스템·네트워크",
    "major": "임베디드 컴퓨팅, 컴퓨터 구조, 저전력, 신뢰성, 시큐리티",
    "degree": "PhD, Pennsylvania State University, 2003",
    "web": "http://ecl.kaist.ac.kr",
    "mail": "kims@kaist.ac.kr",
    "phone": "3554",
    "office": "N1, 903",
    "etc": "연구실: 임베디드 컴퓨팅 연구실\n\n김순태 교수는 2003년 미국 펜실베니아 주립 대학교에서 박사학위를 받았고, 2004년부터 2007년까지 미국 사우스 플로리다 대학교에서 조교수로 활동하였으며, 2007년부터 현재까지는 한국과학기술원 부교수로 재직중이다. 연구 분야는 임베디드 시스템/소프트웨어, 컴퓨터 구조 와 저전력, 실시간, 신뢰성 컴퓨팅이다. 2010년 International Conference Computer Design (ICCD)과 2013년 Design, Automation and Test in Europe (DATE)에서 아시아권에서는 처음으로 최우수논문상을 수상하였다. 현재 IEEE Transaction on Computer-Aided Design과 대한임베디드공학회 부편집장으로 있으며, International Symposium on Low Power Electronics and Design (ISLPED), International Conference on Hardware/Software Codesign and System Synthesis (CODES＋ISSS), DATE, ICCD 등 여러 학회에서 TPC Member로 활동하고 있다.",
    "tag": "csweb.profs",
    "id": 9,
    "content": "name:김순태 field:시스템·네트워크 major:임베디드 컴퓨팅, 컴퓨터 구조, 저전력, 신뢰성, 시큐리티 degree:PhD, Pennsylvania State University, 2003 web:http://ecl.kaist.ac.kr mail:kims@kaist.ac.kr phone:3554 office:N1, 903 etc:연구실: 임베디드 컴퓨팅 연구실\n\n김순태 교수는 2003년 미국 펜실베니아 주립 대학교에서 박사학위를 받았고, 2004년부터 2007년까지 미국 사우스 플로리다 대학교에서 조교수로 활동하였으며, 2007년부터 현재까지는 한국과학기술원 부교수로 재직중이다. 연구 분야는 임베디드 시스템/소프트웨어, 컴퓨터 구조 와 저전력, 실시간, 신뢰성 컴퓨팅이다. 2010년 International Conference Computer Design (ICCD)과 2013년 Design, Automation and Test in Europe (DATE)에서 아시아권에서는 처음으로 최우수논문상을 수상하였다. 현재 IEEE Transaction on Computer-Aided Design과 대한임베디드공학회 부편집장으로 있으며, International Symposium on Low Power Electronics and Design (ISLPED), International Conference on Hardware/Software Codesign and System Synthesis (CODES＋ISSS), DATE, ICCD 등 여러 학회에서 TPC Member로 활동하고 있다. tag:csweb.profs content:김순태 시스템·네트워크 임베디드 컴퓨팅, 컴퓨터 구조, 저전력, 신뢰성, 시큐리티 PhD, Pennsylvania State University, 2003 http://ecl.kaist.ac.kr kims@kaist.ac.kr 3554 N1, 903 연구실: 임베디드 컴퓨팅 연구실\n\n김순태 교수는 2003년 미국 펜실베니아 주립 대학교에서 박사학위를 받았고, 2004년부터 2007년까지 미국 사우스 플로리다 대학교에서 조교수로 활동하였으며, 2007년부터 현재까지는 한국과학기술원 부교수로 재직중이다. 연구 분야는 임베디드 시스템/소프트웨어, 컴퓨터 구조 와 저전력, 실시간, 신뢰성 컴퓨팅이다. 2010년 International Conference Computer Design (ICCD)과 2013년 Design, Automation and Test in Europe (DATE)에서 아시아권에서는 처음으로 최우수논문상을 수상하였다. 현재 IEEE Transaction on Computer-Aided Design과 대한임베디드공학회 부편집장으로 있으며, International Symposium on Low Power Electronics and Design (ISLPED), International Conference on Hardware/Software Codesign and System Synthesis (CODES＋ISSS), DATE, ICCD 등 여러 학회에서 TPC Member로 활동하고 있다. csweb.profs"
}