{
    "name": "박종철",
    "field": "전산이론, 인공지능·정보서비스, 소셜 컴퓨팅",
    "major": "자연언어처리, 계산언어학, 바이오인포매틱스",
    "degree": "PhD, Univ of Pennsylvania, 1996",
    "web": "http://nlp.kaist.ac.kr/~park/",
    "mail": "jongpark@kaist.ac.kr",
    "phone": "3541",
    "office": "E3-1, 2406",
    "etc": "연구실: 자연언어처리 및 계산언어학 연구실\n\n박종철 교수는 서울대학교 컴퓨터공학과에서 학사와 석사, 미국 펜실베이니아 대학교에서 전산정보과학 박사를 취득하였다. 박 교수는 BioNLP 초기 연구자로서 자연언어처리 기법을 생물학과 의료 분야에 적용하는 연구를 진행하였으며, 텍스트 감정정보파악에 대한 연구, 텍스트 내용을 애니메이션 및 수화 표현으로 변환하는 연구, 자연언어 글에서 경도인지장애, 우울증 등 정신질환 관련 정보를 파악하는 연구, 온라인 환경 내 언어폭력 및 혐오 표현을 탐지 및 순화하는 연구, 그리고 SW스타랩 과제를 통해 문서의 신뢰도 분포를 예측하고 신뢰도를 증강하는 연구 등을 진행하고 있다. 박 교수는 2007년부터 국제학술지인 JCSE의 창립 공동편집위원장을, 그리고 2022년부터 AFNLP의 President를 맡고 있다.",
    "tag": "csweb.profs",
    "id": 19,
    "content": "name:박종철 field:전산이론, 인공지능·정보서비스, 소셜 컴퓨팅 major:자연언어처리, 계산언어학, 바이오인포매틱스 degree:PhD, Univ of Pennsylvania, 1996 web:http://nlp.kaist.ac.kr/~park/ mail:jongpark@kaist.ac.kr phone:3541 office:E3-1, 2406 etc:연구실: 자연언어처리 및 계산언어학 연구실\n\n박종철 교수는 서울대학교 컴퓨터공학과에서 학사와 석사, 미국 펜실베이니아 대학교에서 전산정보과학 박사를 취득하였다. 박 교수는 BioNLP 초기 연구자로서 자연언어처리 기법을 생물학과 의료 분야에 적용하는 연구를 진행하였으며, 텍스트 감정정보파악에 대한 연구, 텍스트 내용을 애니메이션 및 수화 표현으로 변환하는 연구, 자연언어 글에서 경도인지장애, 우울증 등 정신질환 관련 정보를 파악하는 연구, 온라인 환경 내 언어폭력 및 혐오 표현을 탐지 및 순화하는 연구, 그리고 SW스타랩 과제를 통해 문서의 신뢰도 분포를 예측하고 신뢰도를 증강하는 연구 등을 진행하고 있다. 박 교수는 2007년부터 국제학술지인 JCSE의 창립 공동편집위원장을, 그리고 2022년부터 AFNLP의 President를 맡고 있다. tag:csweb.profs content:박종철 전산이론, 인공지능·정보서비스, 소셜 컴퓨팅 자연언어처리, 계산언어학, 바이오인포매틱스 PhD, Univ of Pennsylvania, 1996 http://nlp.kaist.ac.kr/~park/ jongpark@kaist.ac.kr 3541 E3-1, 2406 연구실: 자연언어처리 및 계산언어학 연구실\n\n박종철 교수는 서울대학교 컴퓨터공학과에서 학사와 석사, 미국 펜실베이니아 대학교에서 전산정보과학 박사를 취득하였다. 박 교수는 BioNLP 초기 연구자로서 자연언어처리 기법을 생물학과 의료 분야에 적용하는 연구를 진행하였으며, 텍스트 감정정보파악에 대한 연구, 텍스트 내용을 애니메이션 및 수화 표현으로 변환하는 연구, 자연언어 글에서 경도인지장애, 우울증 등 정신질환 관련 정보를 파악하는 연구, 온라인 환경 내 언어폭력 및 혐오 표현을 탐지 및 순화하는 연구, 그리고 SW스타랩 과제를 통해 문서의 신뢰도 분포를 예측하고 신뢰도를 증강하는 연구 등을 진행하고 있다. 박 교수는 2007년부터 국제학술지인 JCSE의 창립 공동편집위원장을, 그리고 2022년부터 AFNLP의 President를 맡고 있다. csweb.profs"
}