{
    "name": "황성주",
    "field": "인공지능·정보서비스",
    "major": "컴퓨터 비전, 기계학습, 딥러닝",
    "degree": "PhD, University of Texas at Austin, 2013",
    "web": "https://www.mlai-kaist.com",
    "mail": "sjhwang82@kaist.ac.kr",
    "phone": "3576",
    "office": "-",
    "etc": "연구실: \n\n황성주 교수는 Kristen Grauman 교수 지도 하에 텍사스 어스틴 대학교에서 검퓨터 과학 박사학위를 취득하였으며, 학위과정 동안 서던 캘리포니아 대학교의 Fei Sha 교수와 긴밀하게 협업하였다.\n학위 취득 후 디즈니 리서치에서 Leonid Sigal 교수와 함께 박사후 연구원으로 일하였으며, 울산과학기술원 전기컴퓨터 공학부 조교수를 거쳐 현재 한국과학기술원 전산학부 조교수로 근무하고 있다.",
    "tag": "csweb.profs",
    "id": 92,
    "content": "name:황성주 field:인공지능·정보서비스 major:컴퓨터 비전, 기계학습, 딥러닝 degree:PhD, University of Texas at Austin, 2013 web:https://www.mlai-kaist.com mail:sjhwang82@kaist.ac.kr phone:3576 office:- etc:연구실: \n\n황성주 교수는 Kristen Grauman 교수 지도 하에 텍사스 어스틴 대학교에서 검퓨터 과학 박사학위를 취득하였으며, 학위과정 동안 서던 캘리포니아 대학교의 Fei Sha 교수와 긴밀하게 협업하였다.\n학위 취득 후 디즈니 리서치에서 Leonid Sigal 교수와 함께 박사후 연구원으로 일하였으며, 울산과학기술원 전기컴퓨터 공학부 조교수를 거쳐 현재 한국과학기술원 전산학부 조교수로 근무하고 있다. tag:csweb.profs content:황성주 인공지능·정보서비스 컴퓨터 비전, 기계학습, 딥러닝 PhD, University of Texas at Austin, 2013 https://www.mlai-kaist.com sjhwang82@kaist.ac.kr 3576 - 연구실: \n\n황성주 교수는 Kristen Grauman 교수 지도 하에 텍사스 어스틴 대학교에서 검퓨터 과학 박사학위를 취득하였으며, 학위과정 동안 서던 캘리포니아 대학교의 Fei Sha 교수와 긴밀하게 협업하였다.\n학위 취득 후 디즈니 리서치에서 Leonid Sigal 교수와 함께 박사후 연구원으로 일하였으며, 울산과학기술원 전기컴퓨터 공학부 조교수를 거쳐 현재 한국과학기술원 전산학부 조교수로 근무하고 있다. csweb.profs"
}