{
    "name": "이윤준",
    "field": "인공지능·정보서비스, 소셜 컴퓨팅, 시스템·네트워크",
    "major": "데이타베이스, 미들웨어, 웹서비스",
    "degree": "PhD, INP Grenoble, 1983",
    "web": "http://dbserver.kaist.ac.kr/~yjlee/",
    "mail": "yoonjoon.lee@kaist.ac.kr",
    "phone": "3523",
    "office": "E3-1, 1417",
    "etc": "연구실: \n\n이윤준 교수님은 카이스트 전산학과 교수로 재직 중이시며 데이터베이스 연구실을 운영하고 계신다.\nENSIMAG(École nationale supérieure d'informatique et de mathématiques appliquées de Grenoble) 에서 SQL 최적화 질의 처리 연구를 하셨으며, 관계형 MICROBE 데이터베이스 관리 시스템을 구현하셨다.\n현재 관심 분야는 스트림 처리, 플래시 메모리 기반 데이터베이스 관리 시스템, 분석 질의 처리 연구이다.",
    "tag": "csweb.profs",
    "id": 63,
    "content": "name:이윤준 field:인공지능·정보서비스, 소셜 컴퓨팅, 시스템·네트워크 major:데이타베이스, 미들웨어, 웹서비스 degree:PhD, INP Grenoble, 1983 web:http://dbserver.kaist.ac.kr/~yjlee/ mail:yoonjoon.lee@kaist.ac.kr phone:3523 office:E3-1, 1417 etc:연구실: \n\n이윤준 교수님은 카이스트 전산학과 교수로 재직 중이시며 데이터베이스 연구실을 운영하고 계신다.\nENSIMAG(École nationale supérieure d'informatique et de mathématiques appliquées de Grenoble) 에서 SQL 최적화 질의 처리 연구를 하셨으며, 관계형 MICROBE 데이터베이스 관리 시스템을 구현하셨다.\n현재 관심 분야는 스트림 처리, 플래시 메모리 기반 데이터베이스 관리 시스템, 분석 질의 처리 연구이다. tag:csweb.profs content:이윤준 인공지능·정보서비스, 소셜 컴퓨팅, 시스템·네트워크 데이타베이스, 미들웨어, 웹서비스 PhD, INP Grenoble, 1983 http://dbserver.kaist.ac.kr/~yjlee/ yoonjoon.lee@kaist.ac.kr 3523 E3-1, 1417 연구실: \n\n이윤준 교수님은 카이스트 전산학과 교수로 재직 중이시며 데이터베이스 연구실을 운영하고 계신다.\nENSIMAG(École nationale supérieure d'informatique et de mathématiques appliquées de Grenoble) 에서 SQL 최적화 질의 처리 연구를 하셨으며, 관계형 MICROBE 데이터베이스 관리 시스템을 구현하셨다.\n현재 관심 분야는 스트림 처리, 플래시 메모리 기반 데이터베이스 관리 시스템, 분석 질의 처리 연구이다. csweb.profs"
}