{
    "name": "김은정",
    "field": "전산이론",
    "major": "Algorithms design, Computational complexity, Structural graph theory",
    "degree": "PhD, University of London, 2010",
    "web": "https://ssimplexity.github.io/",
    "mail": "eunjung.kim@kaist.ac.kr",
    "phone": "3513",
    "office": "307, E3-5",
    "etc": "연구실: \n\n김은정 교수는 한국과학기술원 (KAIST) 전산학부의 부교수이다. 김교수는 2010년 런던 대학교에서 컴퓨터 과학 분야의 박사학위를 취득한 후, 프랑스 몽펠리에의 CNRS 연구소 LIRMM에서 박사후 연구원으로 일했다. 2011년부터는 프랑스 국립과학연구센터 (CNRS)의 연구원으로 재직하였다. 김은정 교수의 연구 분야는 알고리즘 설계 및 복잡도 분석, parameterized complexity, 그래프 이론과 알고리즘에의 응용, 그래프 및 매트로이드의 width parameter, constraint satisfaction problem 등을 포함한다. 김교수는 2017년 CNRS 동메달을 수상했다.",
    "tag": "csweb.profs",
    "id": 10,
    "content": "name:김은정 field:전산이론 major:Algorithms design, Computational complexity, Structural graph theory degree:PhD, University of London, 2010 web:https://ssimplexity.github.io/ mail:eunjung.kim@kaist.ac.kr phone:3513 office:307, E3-5 etc:연구실: \n\n김은정 교수는 한국과학기술원 (KAIST) 전산학부의 부교수이다. 김교수는 2010년 런던 대학교에서 컴퓨터 과학 분야의 박사학위를 취득한 후, 프랑스 몽펠리에의 CNRS 연구소 LIRMM에서 박사후 연구원으로 일했다. 2011년부터는 프랑스 국립과학연구센터 (CNRS)의 연구원으로 재직하였다. 김은정 교수의 연구 분야는 알고리즘 설계 및 복잡도 분석, parameterized complexity, 그래프 이론과 알고리즘에의 응용, 그래프 및 매트로이드의 width parameter, constraint satisfaction problem 등을 포함한다. 김교수는 2017년 CNRS 동메달을 수상했다. tag:csweb.profs content:김은정 전산이론 Algorithms design, Computational complexity, Structural graph theory PhD, University of London, 2010 https://ssimplexity.github.io/ eunjung.kim@kaist.ac.kr 3513 307, E3-5 연구실: \n\n김은정 교수는 한국과학기술원 (KAIST) 전산학부의 부교수이다. 김교수는 2010년 런던 대학교에서 컴퓨터 과학 분야의 박사학위를 취득한 후, 프랑스 몽펠리에의 CNRS 연구소 LIRMM에서 박사후 연구원으로 일했다. 2011년부터는 프랑스 국립과학연구센터 (CNRS)의 연구원으로 재직하였다. 김은정 교수의 연구 분야는 알고리즘 설계 및 복잡도 분석, parameterized complexity, 그래프 이론과 알고리즘에의 응용, 그래프 및 매트로이드의 width parameter, constraint satisfaction problem 등을 포함한다. 김교수는 2017년 CNRS 동메달을 수상했다. csweb.profs"
}