{
    "name": "안성진",
    "field": "비주얼 컴퓨팅, 인공지능·정보서비스, 인터랙티브 컴퓨팅",
    "major": "기계학습, 강화학습, 로봇학습",
    "degree": "PhD, University of California, Irvine, 2015",
    "web": "http://www.sungjinahn.com",
    "mail": "sungjin.ahn@kaist.ac.kr",
    "phone": "3588",
    "office": "3435, E3-1",
    "etc": "연구실: 머신러닝 & 마인드 랩\n\n안성진 교수는 2021년부터 KAIST 전산학부 부교수로 재직중이다. 주 연구분야는 기계학습, 강화학습, 로봇학습이며, 특히 지능 에이전트의 범용성 향상을 위한 기계학습 모델과 알고리즘 개발에 관심이 있다. 안성진 교수는 KAIST에 부임하기 전 3년간 미국 Rutgers 대학교의 전산학과와 인지과학센터 조교수로 재직했으며, 몬트리올대학 Mila연구소에서 Postdoc과정을, University of California, Irvine에서 전산학 박사학위를 취득하였다. 안성진 교수는 ICML'12와 ParLearning'16에서 최우수 논문상을 수상하였다.",
    "tag": "csweb.profs",
    "id": 27,
    "content": "name:안성진 field:비주얼 컴퓨팅, 인공지능·정보서비스, 인터랙티브 컴퓨팅 major:기계학습, 강화학습, 로봇학습 degree:PhD, University of California, Irvine, 2015 web:http://www.sungjinahn.com mail:sungjin.ahn@kaist.ac.kr phone:3588 office:3435, E3-1 etc:연구실: 머신러닝 & 마인드 랩\n\n안성진 교수는 2021년부터 KAIST 전산학부 부교수로 재직중이다. 주 연구분야는 기계학습, 강화학습, 로봇학습이며, 특히 지능 에이전트의 범용성 향상을 위한 기계학습 모델과 알고리즘 개발에 관심이 있다. 안성진 교수는 KAIST에 부임하기 전 3년간 미국 Rutgers 대학교의 전산학과와 인지과학센터 조교수로 재직했으며, 몬트리올대학 Mila연구소에서 Postdoc과정을, University of California, Irvine에서 전산학 박사학위를 취득하였다. 안성진 교수는 ICML'12와 ParLearning'16에서 최우수 논문상을 수상하였다. tag:csweb.profs content:안성진 비주얼 컴퓨팅, 인공지능·정보서비스, 인터랙티브 컴퓨팅 기계학습, 강화학습, 로봇학습 PhD, University of California, Irvine, 2015 http://www.sungjinahn.com sungjin.ahn@kaist.ac.kr 3588 3435, E3-1 연구실: 머신러닝 & 마인드 랩\n\n안성진 교수는 2021년부터 KAIST 전산학부 부교수로 재직중이다. 주 연구분야는 기계학습, 강화학습, 로봇학습이며, 특히 지능 에이전트의 범용성 향상을 위한 기계학습 모델과 알고리즘 개발에 관심이 있다. 안성진 교수는 KAIST에 부임하기 전 3년간 미국 Rutgers 대학교의 전산학과와 인지과학센터 조교수로 재직했으며, 몬트리올대학 Mila연구소에서 Postdoc과정을, University of California, Irvine에서 전산학 박사학위를 취득하였다. 안성진 교수는 ICML'12와 ParLearning'16에서 최우수 논문상을 수상하였다. csweb.profs"
}