{
    "name": "신인식",
    "field": "소프트웨어 디자인, 시스템·네트워크",
    "major": "실시간 임베디드 시스템, 사이버-피지컬 시스템",
    "degree": "PhD, Univ of Pennsylvania, 2006",
    "web": "http://cps.kaist.ac.kr/~ishin/",
    "mail": "ishin@kaist.ac.kr",
    "phone": "3524",
    "office": "E3-1, 4425",
    "etc": "연구실: 사이버 물리 시스템 연구실\n\n신인식 교수는 2008년에 KAIST 전산학과에 부임하였으며, 현재 교수로 재직중이다. 그는 고려대학교 전산학과 학사, 스탠포드대 전산학과 석사, 펜실베이니아 주립대학 전산학과 박사를 각각 1994, 1998, 2006년에 졸업하였다. 그는 스웨덴의 말라르달렌 대학에서의 박사후 연구원을 거쳐 일리노이 주립대학(얼반-샴페인)에서 2008년까지 방문 연구원으로 재직하였다. 관심 연구주제는 모바일 컴퓨팅, 시스템 보안 및 실시간 임베디드 시스템이다. 그는 RTSS, RTAS, RTCSA의 부속 워크숍을 비롯한 여러 워크숍의 공동 의장직과, RTSS, RTAS, ECRTS, EMSOFT와 같은 실시간 임베디드 시스템의 프로그램 위원 역할을 수행하였다. 그는 2019년 MobiCom Best Paper Award, 2003년과 2012년에 IEEE RTSS Best Paper Award를 수상하였으며, RTAS 2011에서 Best Student Award, 그리고 RTSS 2008과 ECRTS 2008에서 베스트 페이퍼 후보에 올랐다.",
    "tag": "csweb.profs",
    "id": 26,
    "content": "name:신인식 field:소프트웨어 디자인, 시스템·네트워크 major:실시간 임베디드 시스템, 사이버-피지컬 시스템 degree:PhD, Univ of Pennsylvania, 2006 web:http://cps.kaist.ac.kr/~ishin/ mail:ishin@kaist.ac.kr phone:3524 office:E3-1, 4425 etc:연구실: 사이버 물리 시스템 연구실\n\n신인식 교수는 2008년에 KAIST 전산학과에 부임하였으며, 현재 교수로 재직중이다. 그는 고려대학교 전산학과 학사, 스탠포드대 전산학과 석사, 펜실베이니아 주립대학 전산학과 박사를 각각 1994, 1998, 2006년에 졸업하였다. 그는 스웨덴의 말라르달렌 대학에서의 박사후 연구원을 거쳐 일리노이 주립대학(얼반-샴페인)에서 2008년까지 방문 연구원으로 재직하였다. 관심 연구주제는 모바일 컴퓨팅, 시스템 보안 및 실시간 임베디드 시스템이다. 그는 RTSS, RTAS, RTCSA의 부속 워크숍을 비롯한 여러 워크숍의 공동 의장직과, RTSS, RTAS, ECRTS, EMSOFT와 같은 실시간 임베디드 시스템의 프로그램 위원 역할을 수행하였다. 그는 2019년 MobiCom Best Paper Award, 2003년과 2012년에 IEEE RTSS Best Paper Award를 수상하였으며, RTAS 2011에서 Best Student Award, 그리고 RTSS 2008과 ECRTS 2008에서 베스트 페이퍼 후보에 올랐다. tag:csweb.profs content:신인식 소프트웨어 디자인, 시스템·네트워크 실시간 임베디드 시스템, 사이버-피지컬 시스템 PhD, Univ of Pennsylvania, 2006 http://cps.kaist.ac.kr/~ishin/ ishin@kaist.ac.kr 3524 E3-1, 4425 연구실: 사이버 물리 시스템 연구실\n\n신인식 교수는 2008년에 KAIST 전산학과에 부임하였으며, 현재 교수로 재직중이다. 그는 고려대학교 전산학과 학사, 스탠포드대 전산학과 석사, 펜실베이니아 주립대학 전산학과 박사를 각각 1994, 1998, 2006년에 졸업하였다. 그는 스웨덴의 말라르달렌 대학에서의 박사후 연구원을 거쳐 일리노이 주립대학(얼반-샴페인)에서 2008년까지 방문 연구원으로 재직하였다. 관심 연구주제는 모바일 컴퓨팅, 시스템 보안 및 실시간 임베디드 시스템이다. 그는 RTSS, RTAS, RTCSA의 부속 워크숍을 비롯한 여러 워크숍의 공동 의장직과, RTSS, RTAS, ECRTS, EMSOFT와 같은 실시간 임베디드 시스템의 프로그램 위원 역할을 수행하였다. 그는 2019년 MobiCom Best Paper Award, 2003년과 2012년에 IEEE RTSS Best Paper Award를 수상하였으며, RTAS 2011에서 Best Student Award, 그리고 RTSS 2008과 ECRTS 2008에서 베스트 페이퍼 후보에 올랐다. csweb.profs"
}