{
    "name": "황규영",
    "field": "전산이론, 인공지능·정보서비스",
    "major": "데이타베이스, 검색엔진",
    "degree": "PhD, Stanford Univ., 1984",
    "web": "http://dblab.kaist.ac.kr/Prof/main_eng.html",
    "mail": "kywhang@kaist.ac.kr",
    "phone": "042-350-3522",
    "office": "E3-1, 1406",
    "etc": "연구실: \n\n황규영 교수는 1973년에 서울대학교에서 학사(공과대학 수석졸업 총장상 수상), 1975년에 KAIST에서 석사, 1982년, 1984년에 스탠포드 대학에서 석사, 박사 학위를 받았다. 그 후 1983년에서 1991년까지 IBM T.J. Watson Research Center에서 Research Staff Member로서 근무하였으며, 1990년 KAIST 전산학과 교수로 부임하였고 2016년부터 명예교수로 재임 중이다. 2008년 – 2021년 KAIST 특훈교수를 역임했다. 황 교수는 또한, IT라는 용어도 생소하던 시절, 1999년 - 2016년 연구재단 우수연구센터인 첨단정보기술연구센터(Advanced IT Research Center: AITrc)를 소장으로 유치하고 이끌어 국내 IT/Software 분야 연구를 새로이 정의하고 선도하였다. 관심분야는 물리적 데이터베이스 설계, 질의 최적화, DBMS/검색엔진을 포함하며, 빅데이터 관리 시스템, IR, 공간 데이터베이스, 데이터마이닝, XML 등 데이터베이스 전 분야를 아우르고 있다.\n황 교수는 The VLDB Journal의 창립 editorial board member로서 13년간 공헌하였으며, 2003년∼2009년에는 편집 위원장(수석 편집 위원장: 2007∼2009)을 역임하여 Top 저널로 성장시키는데 공헌하였다. 또한, 1998년∼2004년 권위있는 VLDB Endowment(국제학술재단)의 Trustee (이사) (2010년∼2016년 재선임), Top 국제학술대회 VLDB2006 의 대회장(General Chair, 서울 유치), IEEE ICDE2015 국제학술대회의 명예 대회장, 2013년∼2015 년 IEEE Technical Community on Data Engineering(TCDE)의 회장(Chair)을 역임하고 2022.12 까지 고문(Advisor)을 역임했다. 황 교수는 2007년에 한국정보과학회(KIISE) 회장을 역임하는 등 국내 전산학계의 발전과 국제화, 세계화를 위하여 헌신적으로 공헌하였으며, 연구성과 및 국내 IT/Software 산업 발전과 인터넷 정보문화 시대의 조기 출범 (1997∼2000) 및 확산에 선구자적으로 기여한 공로로 2012년 한국공학상(대통령상), 2017년 대한민국 최고과학기술인상(대통령상)을 수상하였다. 또한, 전세계 데이터베이스 분야 발전을 위한 헌신적이고 지속적인 공헌으로 2014년 최고 권위의 ACM SIGMOD Contributions Award (http://www.sigmod.org/sigmod-awards), 2023년 IEEE TCDE Service Award를, 아시아-태평양 지역의 데이터베이스 분야 발전을 위한 공로로 2011년 DASFAA Outstanding Contributions Award를, 그리고 아시아-태평양 지역의 데이터마이닝 분야 발전을 위한 공로로 2014년 PAKDD Distinguished Contributions Award를 수상하였다.\n황 교수는 ACM Fellow(2009, 국내최초), IEEE Life Fellow(국내 전산학 분야 최초)이며, 1994년∼2012년 IFIP WG2.6의 회원으로 활동하였다. 황 교수는 한국과학기술한림원(KAST)(2001년∼)의 정회원/종신회원, 한국공학한림원(NAEK)(2002년∼)의 정회원/원로회원이며, 2018년 컴퓨터분야 최초로 대한민국학술원 회원으로 선임되었다.\n2025년 과학기술훈장 창조장 (1등급)을 수훈했다.",
    "tag": "csweb.profs",
    "id": 70,
    "content": "name:황규영 field:전산이론, 인공지능·정보서비스 major:데이타베이스, 검색엔진 degree:PhD, Stanford Univ., 1984 web:http://dblab.kaist.ac.kr/Prof/main_eng.html mail:kywhang@kaist.ac.kr phone:042-350-3522 office:E3-1, 1406 etc:연구실: \n\n황규영 교수는 1973년에 서울대학교에서 학사(공과대학 수석졸업 총장상 수상), 1975년에 KAIST에서 석사, 1982년, 1984년에 스탠포드 대학에서 석사, 박사 학위를 받았다. 그 후 1983년에서 1991년까지 IBM T.J. Watson Research Center에서 Research Staff Member로서 근무하였으며, 1990년 KAIST 전산학과 교수로 부임하였고 2016년부터 명예교수로 재임 중이다. 2008년 – 2021년 KAIST 특훈교수를 역임했다. 황 교수는 또한, IT라는 용어도 생소하던 시절, 1999년 - 2016년 연구재단 우수연구센터인 첨단정보기술연구센터(Advanced IT Research Center: AITrc)를 소장으로 유치하고 이끌어 국내 IT/Software 분야 연구를 새로이 정의하고 선도하였다. 관심분야는 물리적 데이터베이스 설계, 질의 최적화, DBMS/검색엔진을 포함하며, 빅데이터 관리 시스템, IR, 공간 데이터베이스, 데이터마이닝, XML 등 데이터베이스 전 분야를 아우르고 있다.\n황 교수는 The VLDB Journal의 창립 editorial board member로서 13년간 공헌하였으며, 2003년∼2009년에는 편집 위원장(수석 편집 위원장: 2007∼2009)을 역임하여 Top 저널로 성장시키는데 공헌하였다. 또한, 1998년∼2004년 권위있는 VLDB Endowment(국제학술재단)의 Trustee (이사) (2010년∼2016년 재선임), Top 국제학술대회 VLDB2006 의 대회장(General Chair, 서울 유치), IEEE ICDE2015 국제학술대회의 명예 대회장, 2013년∼2015 년 IEEE Technical Community on Data Engineering(TCDE)의 회장(Chair)을 역임하고 2022.12 까지 고문(Advisor)을 역임했다. 황 교수는 2007년에 한국정보과학회(KIISE) 회장을 역임하는 등 국내 전산학계의 발전과 국제화, 세계화를 위하여 헌신적으로 공헌하였으며, 연구성과 및 국내 IT/Software 산업 발전과 인터넷 정보문화 시대의 조기 출범 (1997∼2000) 및 확산에 선구자적으로 기여한 공로로 2012년 한국공학상(대통령상), 2017년 대한민국 최고과학기술인상(대통령상)을 수상하였다. 또한, 전세계 데이터베이스 분야 발전을 위한 헌신적이고 지속적인 공헌으로 2014년 최고 권위의 ACM SIGMOD Contributions Award (http://www.sigmod.org/sigmod-awards), 2023년 IEEE TCDE Service Award를, 아시아-태평양 지역의 데이터베이스 분야 발전을 위한 공로로 2011년 DASFAA Outstanding Contributions Award를, 그리고 아시아-태평양 지역의 데이터마이닝 분야 발전을 위한 공로로 2014년 PAKDD Distinguished Contributions Award를 수상하였다.\n황 교수는 ACM Fellow(2009, 국내최초), IEEE Life Fellow(국내 전산학 분야 최초)이며, 1994년∼2012년 IFIP WG2.6의 회원으로 활동하였다. 황 교수는 한국과학기술한림원(KAST)(2001년∼)의 정회원/종신회원, 한국공학한림원(NAEK)(2002년∼)의 정회원/원로회원이며, 2018년 컴퓨터분야 최초로 대한민국학술원 회원으로 선임되었다.\n2025년 과학기술훈장 창조장 (1등급)을 수훈했다. tag:csweb.profs content:황규영 전산이론, 인공지능·정보서비스 데이타베이스, 검색엔진 PhD, Stanford Univ., 1984 http://dblab.kaist.ac.kr/Prof/main_eng.html kywhang@kaist.ac.kr 042-350-3522 E3-1, 1406 연구실: \n\n황규영 교수는 1973년에 서울대학교에서 학사(공과대학 수석졸업 총장상 수상), 1975년에 KAIST에서 석사, 1982년, 1984년에 스탠포드 대학에서 석사, 박사 학위를 받았다. 그 후 1983년에서 1991년까지 IBM T.J. Watson Research Center에서 Research Staff Member로서 근무하였으며, 1990년 KAIST 전산학과 교수로 부임하였고 2016년부터 명예교수로 재임 중이다. 2008년 – 2021년 KAIST 특훈교수를 역임했다. 황 교수는 또한, IT라는 용어도 생소하던 시절, 1999년 - 2016년 연구재단 우수연구센터인 첨단정보기술연구센터(Advanced IT Research Center: AITrc)를 소장으로 유치하고 이끌어 국내 IT/Software 분야 연구를 새로이 정의하고 선도하였다. 관심분야는 물리적 데이터베이스 설계, 질의 최적화, DBMS/검색엔진을 포함하며, 빅데이터 관리 시스템, IR, 공간 데이터베이스, 데이터마이닝, XML 등 데이터베이스 전 분야를 아우르고 있다.\n황 교수는 The VLDB Journal의 창립 editorial board member로서 13년간 공헌하였으며, 2003년∼2009년에는 편집 위원장(수석 편집 위원장: 2007∼2009)을 역임하여 Top 저널로 성장시키는데 공헌하였다. 또한, 1998년∼2004년 권위있는 VLDB Endowment(국제학술재단)의 Trustee (이사) (2010년∼2016년 재선임), Top 국제학술대회 VLDB2006 의 대회장(General Chair, 서울 유치), IEEE ICDE2015 국제학술대회의 명예 대회장, 2013년∼2015 년 IEEE Technical Community on Data Engineering(TCDE)의 회장(Chair)을 역임하고 2022.12 까지 고문(Advisor)을 역임했다. 황 교수는 2007년에 한국정보과학회(KIISE) 회장을 역임하는 등 국내 전산학계의 발전과 국제화, 세계화를 위하여 헌신적으로 공헌하였으며, 연구성과 및 국내 IT/Software 산업 발전과 인터넷 정보문화 시대의 조기 출범 (1997∼2000) 및 확산에 선구자적으로 기여한 공로로 2012년 한국공학상(대통령상), 2017년 대한민국 최고과학기술인상(대통령상)을 수상하였다. 또한, 전세계 데이터베이스 분야 발전을 위한 헌신적이고 지속적인 공헌으로 2014년 최고 권위의 ACM SIGMOD Contributions Award (http://www.sigmod.org/sigmod-awards), 2023년 IEEE TCDE Service Award를, 아시아-태평양 지역의 데이터베이스 분야 발전을 위한 공로로 2011년 DASFAA Outstanding Contributions Award를, 그리고 아시아-태평양 지역의 데이터마이닝 분야 발전을 위한 공로로 2014년 PAKDD Distinguished Contributions Award를 수상하였다.\n황 교수는 ACM Fellow(2009, 국내최초), IEEE Life Fellow(국내 전산학 분야 최초)이며, 1994년∼2012년 IFIP WG2.6의 회원으로 활동하였다. 황 교수는 한국과학기술한림원(KAST)(2001년∼)의 정회원/종신회원, 한국공학한림원(NAEK)(2002년∼)의 정회원/원로회원이며, 2018년 컴퓨터분야 최초로 대한민국학술원 회원으로 선임되었다.\n2025년 과학기술훈장 창조장 (1등급)을 수훈했다. csweb.profs"
}