{
    "name": "차상길",
    "field": "시스템·네트워크, 소프트웨어 디자인, 시큐어 컴퓨팅",
    "major": "소프트웨어 보안, 프로그램 분석",
    "degree": "박사, 카네기멜론 대학교, 2015",
    "web": "https://softsec.kaist.ac.kr/~sangkilc/",
    "mail": "sangkilc@kaist.ac.kr",
    "phone": "3569",
    "office": "N5, 2319",
    "etc": "연구실: 소프트웨어 보안 연구실\n\n차상길 교수는 컴퓨터 기반의 실험과학자이며, 현재 주 연구 분야는 소프트웨어 보안 및 프로그램 분석이다. 그의 연구는 컴퓨터 보안과 소프트웨어 공학의 교차점에 있다고 할 수 있으며, 대개 프로그램을 자동 분석하는 시스템을 설계, 구현하고 평가하는 것을 포함한다. 차상길 교수는 2014년과 2020년에는 취약점 자동 탐지에 관한 논문으로 ACM distinguished paper award를 수상한 바 있다. 현재는 카이스트 사이버보안연구센터의 센터장을 역임중이며, 또한 카이스트 소프트웨어 보안 연구실을 운영하고 있다.",
    "tag": "csweb.profs",
    "id": 42,
    "content": "name:차상길 field:시스템·네트워크, 소프트웨어 디자인, 시큐어 컴퓨팅 major:소프트웨어 보안, 프로그램 분석 degree:박사, 카네기멜론 대학교, 2015 web:https://softsec.kaist.ac.kr/~sangkilc/ mail:sangkilc@kaist.ac.kr phone:3569 office:N5, 2319 etc:연구실: 소프트웨어 보안 연구실\n\n차상길 교수는 컴퓨터 기반의 실험과학자이며, 현재 주 연구 분야는 소프트웨어 보안 및 프로그램 분석이다. 그의 연구는 컴퓨터 보안과 소프트웨어 공학의 교차점에 있다고 할 수 있으며, 대개 프로그램을 자동 분석하는 시스템을 설계, 구현하고 평가하는 것을 포함한다. 차상길 교수는 2014년과 2020년에는 취약점 자동 탐지에 관한 논문으로 ACM distinguished paper award를 수상한 바 있다. 현재는 카이스트 사이버보안연구센터의 센터장을 역임중이며, 또한 카이스트 소프트웨어 보안 연구실을 운영하고 있다. tag:csweb.profs content:차상길 시스템·네트워크, 소프트웨어 디자인, 시큐어 컴퓨팅 소프트웨어 보안, 프로그램 분석 박사, 카네기멜론 대학교, 2015 https://softsec.kaist.ac.kr/~sangkilc/ sangkilc@kaist.ac.kr 3569 N5, 2319 연구실: 소프트웨어 보안 연구실\n\n차상길 교수는 컴퓨터 기반의 실험과학자이며, 현재 주 연구 분야는 소프트웨어 보안 및 프로그램 분석이다. 그의 연구는 컴퓨터 보안과 소프트웨어 공학의 교차점에 있다고 할 수 있으며, 대개 프로그램을 자동 분석하는 시스템을 설계, 구현하고 평가하는 것을 포함한다. 차상길 교수는 2014년과 2020년에는 취약점 자동 탐지에 관한 논문으로 ACM distinguished paper award를 수상한 바 있다. 현재는 카이스트 사이버보안연구센터의 센터장을 역임중이며, 또한 카이스트 소프트웨어 보안 연구실을 운영하고 있다. csweb.profs"
}