{
    "name": "배두환",
    "field": "소프트웨어 디자인, 인공지능·정보서비스",
    "major": "소프트웨어공학",
    "degree": "PhD, Univ of Florida, 1992",
    "web": "http://se.kaist.ac.kr",
    "mail": "bae@se.kaist.ac.kr",
    "phone": "3539",
    "office": "N1, 503",
    "etc": "연구실: \n\n배두환 교수님은 1992년에 플로리다 대학(University of Florida)의 컴퓨터과학(CS) 전공으로 박사학위를 받고, 1995년부터 카이스트 교수로 재직 중이시며, 주 연구 분야는 소프트웨어 모델링/검증, 품질/프로세스 개선, 임베디드 소프트웨어 설계와 같은 소프트웨어 공학 분야입니다. 주요 경력으로는 삼성, LG, SK 및 여러 금융기관과 자동차 관련 회사와 같이 협력해서 일을 하였고, 1999년에는 소프트웨어 공학에 특화된 벤처기업인 솔루션 링크 회사를 창업하였습니다. 학술 경력으로는 2008년부터 JSS, IST 저널의 편집위원으로 활동하고 계시며, 2008년부터 2012년에는 APSEC 의장, 2012년부터 2016년까지 전산학부장으로도 활동하셨습니다.",
    "tag": "csweb.profs",
    "id": 58,
    "content": "name:배두환 field:소프트웨어 디자인, 인공지능·정보서비스 major:소프트웨어공학 degree:PhD, Univ of Florida, 1992 web:http://se.kaist.ac.kr mail:bae@se.kaist.ac.kr phone:3539 office:N1, 503 etc:연구실: \n\n배두환 교수님은 1992년에 플로리다 대학(University of Florida)의 컴퓨터과학(CS) 전공으로 박사학위를 받고, 1995년부터 카이스트 교수로 재직 중이시며, 주 연구 분야는 소프트웨어 모델링/검증, 품질/프로세스 개선, 임베디드 소프트웨어 설계와 같은 소프트웨어 공학 분야입니다. 주요 경력으로는 삼성, LG, SK 및 여러 금융기관과 자동차 관련 회사와 같이 협력해서 일을 하였고, 1999년에는 소프트웨어 공학에 특화된 벤처기업인 솔루션 링크 회사를 창업하였습니다. 학술 경력으로는 2008년부터 JSS, IST 저널의 편집위원으로 활동하고 계시며, 2008년부터 2012년에는 APSEC 의장, 2012년부터 2016년까지 전산학부장으로도 활동하셨습니다. tag:csweb.profs content:배두환 소프트웨어 디자인, 인공지능·정보서비스 소프트웨어공학 PhD, Univ of Florida, 1992 http://se.kaist.ac.kr bae@se.kaist.ac.kr 3539 N1, 503 연구실: \n\n배두환 교수님은 1992년에 플로리다 대학(University of Florida)의 컴퓨터과학(CS) 전공으로 박사학위를 받고, 1995년부터 카이스트 교수로 재직 중이시며, 주 연구 분야는 소프트웨어 모델링/검증, 품질/프로세스 개선, 임베디드 소프트웨어 설계와 같은 소프트웨어 공학 분야입니다. 주요 경력으로는 삼성, LG, SK 및 여러 금융기관과 자동차 관련 회사와 같이 협력해서 일을 하였고, 1999년에는 소프트웨어 공학에 특화된 벤처기업인 솔루션 링크 회사를 창업하였습니다. 학술 경력으로는 2008년부터 JSS, IST 저널의 편집위원으로 활동하고 계시며, 2008년부터 2012년에는 APSEC 의장, 2012년부터 2016년까지 전산학부장으로도 활동하셨습니다. csweb.profs"
}