{
    "name": "황지영",
    "field": "인공지능·정보서비스, 소셜 컴퓨팅",
    "major": "인공지능, 데이터 마이닝, 기계학습",
    "degree": "PhD, University of Texas at Austin, 2015",
    "web": "http://bdi-lab.kaist.ac.kr/",
    "mail": "jjwhang@kaist.ac.kr",
    "phone": "3584",
    "office": "N1, 905",
    "etc": "연구실: 빅데이터 지능 연구실\n\n황지영 교수는 2020년 7월부터 KAIST 전산학부에 재직 중이며, 빅데이터 지능 연구실을 이끌고 있다. 황지영 교수는 2015년 12월 미국 텍사스 오스틴 대학교(University of Texas at Austin)에서 Inderjit S. Dhillon 교수의 지도 하에 컴퓨터학(Computer Science)으로 박사 학위를 취득하였다. 박사학위 취득 후, 2016년 3월부터 2020년 6월까지 성균관대학교 소프트웨어학과 조교수로 재직하며 빅데이터 연구실을 이끌었다. 황지영 교수의 주요 연구분야는 인공지능, 데이터 마이닝, 그래프 기계학습 등이다. 특히, 그래프 모델로 표현되는 데이터에 대한 새로운 기계학습 및 마이닝 알고리즘을 개발하는 연구를 주로 수행하고 있다.",
    "tag": "csweb.profs",
    "id": 49,
    "content": "name:황지영 field:인공지능·정보서비스, 소셜 컴퓨팅 major:인공지능, 데이터 마이닝, 기계학습 degree:PhD, University of Texas at Austin, 2015 web:http://bdi-lab.kaist.ac.kr/ mail:jjwhang@kaist.ac.kr phone:3584 office:N1, 905 etc:연구실: 빅데이터 지능 연구실\n\n황지영 교수는 2020년 7월부터 KAIST 전산학부에 재직 중이며, 빅데이터 지능 연구실을 이끌고 있다. 황지영 교수는 2015년 12월 미국 텍사스 오스틴 대학교(University of Texas at Austin)에서 Inderjit S. Dhillon 교수의 지도 하에 컴퓨터학(Computer Science)으로 박사 학위를 취득하였다. 박사학위 취득 후, 2016년 3월부터 2020년 6월까지 성균관대학교 소프트웨어학과 조교수로 재직하며 빅데이터 연구실을 이끌었다. 황지영 교수의 주요 연구분야는 인공지능, 데이터 마이닝, 그래프 기계학습 등이다. 특히, 그래프 모델로 표현되는 데이터에 대한 새로운 기계학습 및 마이닝 알고리즘을 개발하는 연구를 주로 수행하고 있다. tag:csweb.profs content:황지영 인공지능·정보서비스, 소셜 컴퓨팅 인공지능, 데이터 마이닝, 기계학습 PhD, University of Texas at Austin, 2015 http://bdi-lab.kaist.ac.kr/ jjwhang@kaist.ac.kr 3584 N1, 905 연구실: 빅데이터 지능 연구실\n\n황지영 교수는 2020년 7월부터 KAIST 전산학부에 재직 중이며, 빅데이터 지능 연구실을 이끌고 있다. 황지영 교수는 2015년 12월 미국 텍사스 오스틴 대학교(University of Texas at Austin)에서 Inderjit S. Dhillon 교수의 지도 하에 컴퓨터학(Computer Science)으로 박사 학위를 취득하였다. 박사학위 취득 후, 2016년 3월부터 2020년 6월까지 성균관대학교 소프트웨어학과 조교수로 재직하며 빅데이터 연구실을 이끌었다. 황지영 교수의 주요 연구분야는 인공지능, 데이터 마이닝, 그래프 기계학습 등이다. 특히, 그래프 모델로 표현되는 데이터에 대한 새로운 기계학습 및 마이닝 알고리즘을 개발하는 연구를 주로 수행하고 있다. csweb.profs"
}