{
    "name": "심원태",
    "field": "소프트웨어 디자인, 인공지능·정보서비스",
    "major": "Information Security",
    "degree": "PhD, Chonnam National University, 2012",
    "web": "https://cs.kaist.ac.kr",
    "mail": "wtsim@kaist.ac.kr",
    "phone": "",
    "office": "",
    "etc": "연구실: \n\n심원태 교수는 한국과학기술원(KAIST)에서 전산학부 정보보호대학원 연구교수(산학협력중점교수)로 근무하고 있다. 2024년 11월 KAIST에 부임하기 전에는 LG데이콤, (주)인젠, 한국인터넷진흥원에사 근무를 하였으며, 이 기간 동안에 천리안 플랫폼 개발, 침입탐지 시스템 개발, 인터넷침해사고 예방 및 대응, 정보보호 산업활성화 등 다양한 개발사업과 산업체 협력을 추진하였다. 관심 분야로는 소프트웨어 개발 보안, 개인정보 데이터 보호 및 활용에 대한 연구, 그리고 소프트웨어 개발에 특화된 정보보호 인력 양성 등이다.",
    "tag": "csweb.profs",
    "id": 107,
    "content": "name:심원태 field:소프트웨어 디자인, 인공지능·정보서비스 major:Information Security degree:PhD, Chonnam National University, 2012 web:https://cs.kaist.ac.kr mail:wtsim@kaist.ac.kr phone: office: etc:연구실: \n\n심원태 교수는 한국과학기술원(KAIST)에서 전산학부 정보보호대학원 연구교수(산학협력중점교수)로 근무하고 있다. 2024년 11월 KAIST에 부임하기 전에는 LG데이콤, (주)인젠, 한국인터넷진흥원에사 근무를 하였으며, 이 기간 동안에 천리안 플랫폼 개발, 침입탐지 시스템 개발, 인터넷침해사고 예방 및 대응, 정보보호 산업활성화 등 다양한 개발사업과 산업체 협력을 추진하였다. 관심 분야로는 소프트웨어 개발 보안, 개인정보 데이터 보호 및 활용에 대한 연구, 그리고 소프트웨어 개발에 특화된 정보보호 인력 양성 등이다. tag:csweb.profs content:심원태 소프트웨어 디자인, 인공지능·정보서비스 Information Security PhD, Chonnam National University, 2012 https://cs.kaist.ac.kr wtsim@kaist.ac.kr   연구실: \n\n심원태 교수는 한국과학기술원(KAIST)에서 전산학부 정보보호대학원 연구교수(산학협력중점교수)로 근무하고 있다. 2024년 11월 KAIST에 부임하기 전에는 LG데이콤, (주)인젠, 한국인터넷진흥원에사 근무를 하였으며, 이 기간 동안에 천리안 플랫폼 개발, 침입탐지 시스템 개발, 인터넷침해사고 예방 및 대응, 정보보호 산업활성화 등 다양한 개발사업과 산업체 협력을 추진하였다. 관심 분야로는 소프트웨어 개발 보안, 개인정보 데이터 보호 및 활용에 대한 연구, 그리고 소프트웨어 개발에 특화된 정보보호 인력 양성 등이다. csweb.profs"
}