{
    "name": "김영환",
    "field": "인공지능·정보서비스",
    "major": "인공지능(지능형 정보검색)",
    "degree": "PhD, KAIST, 1990",
    "web": "https://cs.kaist.ac.kr",
    "mail": "nomadyoung@kaist.ac.kr",
    "phone": "",
    "office": "인공지능연구원",
    "etc": "연구실: \n\n김영환 교수는 KAIST 전산학과에서 공학석사('81∼'83), 공학박사('86∼'90) 학위를 취득하였다.\n1983년부터 kt에서 31년간 근무하면서 연구개발/사업개발/ 마케팅-영업/ 사업기획/ 대외협력 담당 임원(부사장) ,그리고 그룹사 CEO 등 다양한 업무를 수행하였고 한국정보과학회 부회장, 한국정보처리학회부회장, 한국인지과학회 부회장,인터넷협회 기술위원장, 한국인터넷사업자협의회 회장, 한국컨텍센터협회 회장, 한국소프트산업협회 부회장,한국디지탈미디어산업협회 부회장, 한국정보산업연합회 부회장을 역임하였고 정보통신 산업발전에 기여한 공로로 산업포장, KRNET 인터넷 진흥대상, 대한민국 신성장 경영대상을 수상하였다.\n2014년 6월 1일 전산학부 초빙교수로 임용되어 소프트웨어대학원에서 소프트웨어산업, 기업경영, 리더십 등에 대해 강의하고 있으며 2015년 2월부터 KAIST 컨버전스 AMP (KCAMP) 과정 책임교수직을 맡아 운영하면서 KAIST의 산학협력에 기여하고 있다.",
    "tag": "csweb.profs",
    "id": 93,
    "content": "name:김영환 field:인공지능·정보서비스 major:인공지능(지능형 정보검색) degree:PhD, KAIST, 1990 web:https://cs.kaist.ac.kr mail:nomadyoung@kaist.ac.kr phone: office:인공지능연구원 etc:연구실: \n\n김영환 교수는 KAIST 전산학과에서 공학석사('81∼'83), 공학박사('86∼'90) 학위를 취득하였다.\n1983년부터 kt에서 31년간 근무하면서 연구개발/사업개발/ 마케팅-영업/ 사업기획/ 대외협력 담당 임원(부사장) ,그리고 그룹사 CEO 등 다양한 업무를 수행하였고 한국정보과학회 부회장, 한국정보처리학회부회장, 한국인지과학회 부회장,인터넷협회 기술위원장, 한국인터넷사업자협의회 회장, 한국컨텍센터협회 회장, 한국소프트산업협회 부회장,한국디지탈미디어산업협회 부회장, 한국정보산업연합회 부회장을 역임하였고 정보통신 산업발전에 기여한 공로로 산업포장, KRNET 인터넷 진흥대상, 대한민국 신성장 경영대상을 수상하였다.\n2014년 6월 1일 전산학부 초빙교수로 임용되어 소프트웨어대학원에서 소프트웨어산업, 기업경영, 리더십 등에 대해 강의하고 있으며 2015년 2월부터 KAIST 컨버전스 AMP (KCAMP) 과정 책임교수직을 맡아 운영하면서 KAIST의 산학협력에 기여하고 있다. tag:csweb.profs content:김영환 인공지능·정보서비스 인공지능(지능형 정보검색) PhD, KAIST, 1990 https://cs.kaist.ac.kr nomadyoung@kaist.ac.kr  인공지능연구원 연구실: \n\n김영환 교수는 KAIST 전산학과에서 공학석사('81∼'83), 공학박사('86∼'90) 학위를 취득하였다.\n1983년부터 kt에서 31년간 근무하면서 연구개발/사업개발/ 마케팅-영업/ 사업기획/ 대외협력 담당 임원(부사장) ,그리고 그룹사 CEO 등 다양한 업무를 수행하였고 한국정보과학회 부회장, 한국정보처리학회부회장, 한국인지과학회 부회장,인터넷협회 기술위원장, 한국인터넷사업자협의회 회장, 한국컨텍센터협회 회장, 한국소프트산업협회 부회장,한국디지탈미디어산업협회 부회장, 한국정보산업연합회 부회장을 역임하였고 정보통신 산업발전에 기여한 공로로 산업포장, KRNET 인터넷 진흥대상, 대한민국 신성장 경영대상을 수상하였다.\n2014년 6월 1일 전산학부 초빙교수로 임용되어 소프트웨어대학원에서 소프트웨어산업, 기업경영, 리더십 등에 대해 강의하고 있으며 2015년 2월부터 KAIST 컨버전스 AMP (KCAMP) 과정 책임교수직을 맡아 운영하면서 KAIST의 산학협력에 기여하고 있다. csweb.profs"
}