{
    "name": "조성호",
    "field": "소프트웨어 디자인, 비주얼 컴퓨팅, 인공지능·정보서비스, 인터랙티브 컴퓨팅",
    "major": "증강지능, 생체신호기반 상호작용, 지능 로봇",
    "degree": "PhD, Massachusetts Institute of Technology (MIT), 2006",
    "web": "http://nmail.kaist.ac.kr/",
    "mail": "shjo@kaist.ac.kr",
    "phone": "3540",
    "office": "E3-1, 2433",
    "etc": "연구실: 뉴로-기계 증강지능 연구실\n\n조성호 교수는 카이스트 전산학과에서 교수로 재직하고 있으며, KI HST, KI Robotics 그리고 KI AI 겸임교수로 있다. 2006년도에 MIT에서 전자공학 및 전산학 박사학위를 취득하였고 MIT Media Lab에서 post doctorate과정을 수행하였다. 그동안 CSAIL, LIDS, Harvard-MIT HST NeuroEngineering Collaborative에도 참여하였다. 현재의 연구분야로 robotic intelligence, augmented intelligence, neuro-interactive intelligence 등이 있다.",
    "tag": "csweb.profs",
    "id": 39,
    "content": "name:조성호 field:소프트웨어 디자인, 비주얼 컴퓨팅, 인공지능·정보서비스, 인터랙티브 컴퓨팅 major:증강지능, 생체신호기반 상호작용, 지능 로봇 degree:PhD, Massachusetts Institute of Technology (MIT), 2006 web:http://nmail.kaist.ac.kr/ mail:shjo@kaist.ac.kr phone:3540 office:E3-1, 2433 etc:연구실: 뉴로-기계 증강지능 연구실\n\n조성호 교수는 카이스트 전산학과에서 교수로 재직하고 있으며, KI HST, KI Robotics 그리고 KI AI 겸임교수로 있다. 2006년도에 MIT에서 전자공학 및 전산학 박사학위를 취득하였고 MIT Media Lab에서 post doctorate과정을 수행하였다. 그동안 CSAIL, LIDS, Harvard-MIT HST NeuroEngineering Collaborative에도 참여하였다. 현재의 연구분야로 robotic intelligence, augmented intelligence, neuro-interactive intelligence 등이 있다. tag:csweb.profs content:조성호 소프트웨어 디자인, 비주얼 컴퓨팅, 인공지능·정보서비스, 인터랙티브 컴퓨팅 증강지능, 생체신호기반 상호작용, 지능 로봇 PhD, Massachusetts Institute of Technology (MIT), 2006 http://nmail.kaist.ac.kr/ shjo@kaist.ac.kr 3540 E3-1, 2433 연구실: 뉴로-기계 증강지능 연구실\n\n조성호 교수는 카이스트 전산학과에서 교수로 재직하고 있으며, KI HST, KI Robotics 그리고 KI AI 겸임교수로 있다. 2006년도에 MIT에서 전자공학 및 전산학 박사학위를 취득하였고 MIT Media Lab에서 post doctorate과정을 수행하였다. 그동안 CSAIL, LIDS, Harvard-MIT HST NeuroEngineering Collaborative에도 참여하였다. 현재의 연구분야로 robotic intelligence, augmented intelligence, neuro-interactive intelligence 등이 있다. csweb.profs"
}