{
    "name": "유신",
    "field": "전산이론, 소프트웨어 디자인",
    "major": "소프트웨어공학, 소프트웨어테스팅",
    "degree": "PhD in Computer Science, King’s College London, 2009",
    "web": "https://coinse.github.io",
    "mail": "shin.yoo@kaist.ac.kr",
    "phone": "3567",
    "office": "E3-5, 305",
    "etc": "연구실: 계산지능형 소프트웨어 공학 연구실\n\n유신 교수는 현재 KAIST 전산학부 교수로 계산지능형 소프트웨어공학 연구실 (COINSE: Computational Ingellegence for Software Engineer) 연구실을 이끌고 있으며, 2012년부터 2015년까지는 영국 University Collge London에서 조교수로도 재직하였다. 2009년 영국 King's College London에서 전산학 박사학위를 취득하였고, 이전에는 King's College London과 서울대학교에서 전산학 석사와 학사를 각각 취득하였다. 계산지능형 소프트웨어공학 연구실은 코드에 존재하는 결함의 위치를 자동으로 찾고 수정하기 위해 유전알고리즘이나 딥러닝과 같은 계산지능을 이용하는 것은 물론, 새로운 소프트웨어 개발 패러다임으로 부상한 기계학습 모델의 결함을 찾고 수정하는 것까지 다양한 테스팅과 디버깅 문제를 다루고 있다.",
    "tag": "csweb.profs",
    "id": 32,
    "content": "name:유신 field:전산이론, 소프트웨어 디자인 major:소프트웨어공학, 소프트웨어테스팅 degree:PhD in Computer Science, King’s College London, 2009 web:https://coinse.github.io mail:shin.yoo@kaist.ac.kr phone:3567 office:E3-5, 305 etc:연구실: 계산지능형 소프트웨어 공학 연구실\n\n유신 교수는 현재 KAIST 전산학부 교수로 계산지능형 소프트웨어공학 연구실 (COINSE: Computational Ingellegence for Software Engineer) 연구실을 이끌고 있으며, 2012년부터 2015년까지는 영국 University Collge London에서 조교수로도 재직하였다. 2009년 영국 King's College London에서 전산학 박사학위를 취득하였고, 이전에는 King's College London과 서울대학교에서 전산학 석사와 학사를 각각 취득하였다. 계산지능형 소프트웨어공학 연구실은 코드에 존재하는 결함의 위치를 자동으로 찾고 수정하기 위해 유전알고리즘이나 딥러닝과 같은 계산지능을 이용하는 것은 물론, 새로운 소프트웨어 개발 패러다임으로 부상한 기계학습 모델의 결함을 찾고 수정하는 것까지 다양한 테스팅과 디버깅 문제를 다루고 있다. tag:csweb.profs content:유신 전산이론, 소프트웨어 디자인 소프트웨어공학, 소프트웨어테스팅 PhD in Computer Science, King’s College London, 2009 https://coinse.github.io shin.yoo@kaist.ac.kr 3567 E3-5, 305 연구실: 계산지능형 소프트웨어 공학 연구실\n\n유신 교수는 현재 KAIST 전산학부 교수로 계산지능형 소프트웨어공학 연구실 (COINSE: Computational Ingellegence for Software Engineer) 연구실을 이끌고 있으며, 2012년부터 2015년까지는 영국 University Collge London에서 조교수로도 재직하였다. 2009년 영국 King's College London에서 전산학 박사학위를 취득하였고, 이전에는 King's College London과 서울대학교에서 전산학 석사와 학사를 각각 취득하였다. 계산지능형 소프트웨어공학 연구실은 코드에 존재하는 결함의 위치를 자동으로 찾고 수정하기 위해 유전알고리즘이나 딥러닝과 같은 계산지능을 이용하는 것은 물론, 새로운 소프트웨어 개발 패러다임으로 부상한 기계학습 모델의 결함을 찾고 수정하는 것까지 다양한 테스팅과 디버깅 문제를 다루고 있다. csweb.profs"
}