{
    "name": "이의진",
    "field": "소셜 컴퓨팅, 인터랙티브 컴퓨팅",
    "major": "인간-컴퓨터 상호작용, 유비쿼터스 컴퓨팅, 디지털 헬스",
    "degree": "PhD, UCLA, 2008",
    "web": "http://ic.kaist.ac.kr",
    "mail": "uclee@kaist.ac.kr",
    "phone": "3544",
    "office": "706, N1",
    "etc": "연구실: 인터랙티브 컴퓨팅 연구실\n\n이의진 교수는 현재 KAIST 전산학부에 재직 중이며 인터랙티브 컴퓨팅 연구실을 지도하고 있다. KAIST 산업및시스템공학과, 지식서비스공학대학원, KI 건강과학연구소(DrM 프로젝트)에 참여 교수로 활동하고 있다. 이 교수는 UCLA에서 전산학 박사(2008년) 학위를 취득 후, 박사 후 과정을 거쳐 미국 뉴저지 소재의 벨 연구소(Bell Labs)에서 선임연구원으로 근무한 후 2010년에 KAIST에 부임하였다. 주요 연구 분야는 인간-컴퓨터 상호작용(HCI), 유비쿼터스 컴퓨팅(Ubicomp), 센서 데 이터 사이언스(IoT), 데이터 가시화이다. 국내외 주요 HCI 학회 및 저널의 프로그램 커미티(한국HCI 학회, ACM CHI, IMWUT/Ubicomp, CSCW/HCI)에 참여하였고 다수의 최우수 논문상(IEEE IoT Forum’19, ACM CHI’16, AAAI ICWSM’13 등)을 수상하였다. 현재 모바일, 웨어러블, IoT 기술을 활용한 디지털 헬스 및 웰빙에 관한 연구를 수행 중이며 인간-컴퓨터 상호작용, 데이터 가시화, 센서 데이터 사이언스, 유비쿼터스 컴퓨팅 등의 교과목을 강의하고 있다.",
    "tag": "csweb.profs",
    "id": 36,
    "content": "name:이의진 field:소셜 컴퓨팅, 인터랙티브 컴퓨팅 major:인간-컴퓨터 상호작용, 유비쿼터스 컴퓨팅, 디지털 헬스 degree:PhD, UCLA, 2008 web:http://ic.kaist.ac.kr mail:uclee@kaist.ac.kr phone:3544 office:706, N1 etc:연구실: 인터랙티브 컴퓨팅 연구실\n\n이의진 교수는 현재 KAIST 전산학부에 재직 중이며 인터랙티브 컴퓨팅 연구실을 지도하고 있다. KAIST 산업및시스템공학과, 지식서비스공학대학원, KI 건강과학연구소(DrM 프로젝트)에 참여 교수로 활동하고 있다. 이 교수는 UCLA에서 전산학 박사(2008년) 학위를 취득 후, 박사 후 과정을 거쳐 미국 뉴저지 소재의 벨 연구소(Bell Labs)에서 선임연구원으로 근무한 후 2010년에 KAIST에 부임하였다. 주요 연구 분야는 인간-컴퓨터 상호작용(HCI), 유비쿼터스 컴퓨팅(Ubicomp), 센서 데 이터 사이언스(IoT), 데이터 가시화이다. 국내외 주요 HCI 학회 및 저널의 프로그램 커미티(한국HCI 학회, ACM CHI, IMWUT/Ubicomp, CSCW/HCI)에 참여하였고 다수의 최우수 논문상(IEEE IoT Forum’19, ACM CHI’16, AAAI ICWSM’13 등)을 수상하였다. 현재 모바일, 웨어러블, IoT 기술을 활용한 디지털 헬스 및 웰빙에 관한 연구를 수행 중이며 인간-컴퓨터 상호작용, 데이터 가시화, 센서 데이터 사이언스, 유비쿼터스 컴퓨팅 등의 교과목을 강의하고 있다. tag:csweb.profs content:이의진 소셜 컴퓨팅, 인터랙티브 컴퓨팅 인간-컴퓨터 상호작용, 유비쿼터스 컴퓨팅, 디지털 헬스 PhD, UCLA, 2008 http://ic.kaist.ac.kr uclee@kaist.ac.kr 3544 706, N1 연구실: 인터랙티브 컴퓨팅 연구실\n\n이의진 교수는 현재 KAIST 전산학부에 재직 중이며 인터랙티브 컴퓨팅 연구실을 지도하고 있다. KAIST 산업및시스템공학과, 지식서비스공학대학원, KI 건강과학연구소(DrM 프로젝트)에 참여 교수로 활동하고 있다. 이 교수는 UCLA에서 전산학 박사(2008년) 학위를 취득 후, 박사 후 과정을 거쳐 미국 뉴저지 소재의 벨 연구소(Bell Labs)에서 선임연구원으로 근무한 후 2010년에 KAIST에 부임하였다. 주요 연구 분야는 인간-컴퓨터 상호작용(HCI), 유비쿼터스 컴퓨팅(Ubicomp), 센서 데 이터 사이언스(IoT), 데이터 가시화이다. 국내외 주요 HCI 학회 및 저널의 프로그램 커미티(한국HCI 학회, ACM CHI, IMWUT/Ubicomp, CSCW/HCI)에 참여하였고 다수의 최우수 논문상(IEEE IoT Forum’19, ACM CHI’16, AAAI ICWSM’13 등)을 수상하였다. 현재 모바일, 웨어러블, IoT 기술을 활용한 디지털 헬스 및 웰빙에 관한 연구를 수행 중이며 인간-컴퓨터 상호작용, 데이터 가시화, 센서 데이터 사이언스, 유비쿼터스 컴퓨팅 등의 교과목을 강의하고 있다. csweb.profs"
}