{
    "name": "한준",
    "field": "시스템·네트워크, 시큐어 컴퓨팅, 인터랙티브 컴퓨팅",
    "major": "IoT／CPS Security",
    "degree": "Ph.D., Carnegie Mellon University, 2018",
    "web": "https://www.junhan.org/",
    "mail": "jun.han@kaist.ac.kr",
    "phone": "3516",
    "office": "N1, 901",
    "etc": "연구실: 센싱 지능 및 사이버-물리 보안 (CyPhy) 연구실\n\n한 준 교수는 한국과학기술원(KAIST) 전산학부 부교수로서 센싱 지능 및 사이버-물리 보안 (CyPhy) 연구실을 이끌고 있다. 2024년 2월 KAIST 부임 전에는 약 6년간 싱가포르 국립대학교 전산학과 및 연세대학교 전기전자공학부에서 조교수로 근무하였으며, 2018년에는 미국 카네기멜론대학교(Carnegie Mellon University)에서 IoT 보안 연구로 컴퓨터공학 박사학위를 취득하였다. 한 준 교수의 연구분야는 보안과 모바일/센싱 시스템의 교차점에 있으며 컨텍스트 정보를 활용하여 사물 인터넷과 사이버 물리 시스템의 보안 문제를 해결하는 시스템을 제안한다. 한 교수는 컴퓨터 보안, 모바일 컴퓨팅 및 센싱 시스템 분야의 최우수 국제학회(IEEE S&P, USENIX Security, ACM CCS, MobiSys, MobiCom, SenSys, Ubicomp, IPSN 등)에 다년간 다수의 논문을 게재하여 그 성과를 주목 받고 있다. 또한 다수의 최우수 국제학회(IEEE S&P, USENIX Security, ACM MobiSys, SenSys, IPSN 등)에서 활발한 위원회 활동을 진행하고 있으며Google Research Scholar Award를 포함한 다수의 수상 실적을 보유하고 있다.",
    "tag": "csweb.profs",
    "id": 45,
    "content": "name:한준 field:시스템·네트워크, 시큐어 컴퓨팅, 인터랙티브 컴퓨팅 major:IoT／CPS Security degree:Ph.D., Carnegie Mellon University, 2018 web:https://www.junhan.org/ mail:jun.han@kaist.ac.kr phone:3516 office:N1, 901 etc:연구실: 센싱 지능 및 사이버-물리 보안 (CyPhy) 연구실\n\n한 준 교수는 한국과학기술원(KAIST) 전산학부 부교수로서 센싱 지능 및 사이버-물리 보안 (CyPhy) 연구실을 이끌고 있다. 2024년 2월 KAIST 부임 전에는 약 6년간 싱가포르 국립대학교 전산학과 및 연세대학교 전기전자공학부에서 조교수로 근무하였으며, 2018년에는 미국 카네기멜론대학교(Carnegie Mellon University)에서 IoT 보안 연구로 컴퓨터공학 박사학위를 취득하였다. 한 준 교수의 연구분야는 보안과 모바일/센싱 시스템의 교차점에 있으며 컨텍스트 정보를 활용하여 사물 인터넷과 사이버 물리 시스템의 보안 문제를 해결하는 시스템을 제안한다. 한 교수는 컴퓨터 보안, 모바일 컴퓨팅 및 센싱 시스템 분야의 최우수 국제학회(IEEE S&P, USENIX Security, ACM CCS, MobiSys, MobiCom, SenSys, Ubicomp, IPSN 등)에 다년간 다수의 논문을 게재하여 그 성과를 주목 받고 있다. 또한 다수의 최우수 국제학회(IEEE S&P, USENIX Security, ACM MobiSys, SenSys, IPSN 등)에서 활발한 위원회 활동을 진행하고 있으며Google Research Scholar Award를 포함한 다수의 수상 실적을 보유하고 있다. tag:csweb.profs content:한준 시스템·네트워크, 시큐어 컴퓨팅, 인터랙티브 컴퓨팅 IoT／CPS Security Ph.D., Carnegie Mellon University, 2018 https://www.junhan.org/ jun.han@kaist.ac.kr 3516 N1, 901 연구실: 센싱 지능 및 사이버-물리 보안 (CyPhy) 연구실\n\n한 준 교수는 한국과학기술원(KAIST) 전산학부 부교수로서 센싱 지능 및 사이버-물리 보안 (CyPhy) 연구실을 이끌고 있다. 2024년 2월 KAIST 부임 전에는 약 6년간 싱가포르 국립대학교 전산학과 및 연세대학교 전기전자공학부에서 조교수로 근무하였으며, 2018년에는 미국 카네기멜론대학교(Carnegie Mellon University)에서 IoT 보안 연구로 컴퓨터공학 박사학위를 취득하였다. 한 준 교수의 연구분야는 보안과 모바일/센싱 시스템의 교차점에 있으며 컨텍스트 정보를 활용하여 사물 인터넷과 사이버 물리 시스템의 보안 문제를 해결하는 시스템을 제안한다. 한 교수는 컴퓨터 보안, 모바일 컴퓨팅 및 센싱 시스템 분야의 최우수 국제학회(IEEE S&P, USENIX Security, ACM CCS, MobiSys, MobiCom, SenSys, Ubicomp, IPSN 등)에 다년간 다수의 논문을 게재하여 그 성과를 주목 받고 있다. 또한 다수의 최우수 국제학회(IEEE S&P, USENIX Security, ACM MobiSys, SenSys, IPSN 등)에서 활발한 위원회 활동을 진행하고 있으며Google Research Scholar Award를 포함한 다수의 수상 실적을 보유하고 있다. csweb.profs"
}