{
    "name": "위다레흐트 세버스티언",
    "field": "전산이론",
    "major": "Graph Theory, Parameterized Complexity",
    "degree": "PhD, Technical University Berlin, 2021",
    "web": "https://www.wiederrecht.com/",
    "mail": "wiederrecht@kaist.ac.kr",
    "phone": "3517",
    "office": "306, E3-5",
    "etc": "연구실: \n\n위다레흐트 세버스티언는(Sebastian Wiederrecht)는 KAIST에서 전산이론을 연구하는 조교수로, 구조적 및 알고리즘적 그래프 이론을 연구하고 있다. KAIST 부임 전 한국기초과학연구원(IBS) 산하 이산수학그룹(DIMAG)과 프랑스 LIRMM의 알고리즘, 그래프 및 조합론 그룹(AlGCo)에서 박사후연구원으로 근무했다. 2021년 베를린 공과대학교(Technische Universität Berlin, TUB)에서 컴퓨터 과학 박사 학위를 취득하였으며, 이때 이분 그래프에서 매칭 마이너 이론과 Permanent 문제에 대한 응용을 개발했다.\n그의 관심 연구분야는 구조적 그래프 이론에 초점을 두고 있으며, 특히 그래프 마이너 이론과 관련된 그래프 포함 관계 이론의 발전에 주력하고 있다. 여기에는 구조 정리, 그래프 알고리즘, 매개변수화된 복잡도, 계산 문제, 라우팅 문제, 선형 대수 및 논리학과의 연관성 등이 포함된다.",
    "tag": "csweb.profs",
    "id": 31,
    "content": "name:위다레흐트 세버스티언 field:전산이론 major:Graph Theory, Parameterized Complexity degree:PhD, Technical University Berlin, 2021 web:https://www.wiederrecht.com/ mail:wiederrecht@kaist.ac.kr phone:3517 office:306, E3-5 etc:연구실: \n\n위다레흐트 세버스티언는(Sebastian Wiederrecht)는 KAIST에서 전산이론을 연구하는 조교수로, 구조적 및 알고리즘적 그래프 이론을 연구하고 있다. KAIST 부임 전 한국기초과학연구원(IBS) 산하 이산수학그룹(DIMAG)과 프랑스 LIRMM의 알고리즘, 그래프 및 조합론 그룹(AlGCo)에서 박사후연구원으로 근무했다. 2021년 베를린 공과대학교(Technische Universität Berlin, TUB)에서 컴퓨터 과학 박사 학위를 취득하였으며, 이때 이분 그래프에서 매칭 마이너 이론과 Permanent 문제에 대한 응용을 개발했다.\n그의 관심 연구분야는 구조적 그래프 이론에 초점을 두고 있으며, 특히 그래프 마이너 이론과 관련된 그래프 포함 관계 이론의 발전에 주력하고 있다. 여기에는 구조 정리, 그래프 알고리즘, 매개변수화된 복잡도, 계산 문제, 라우팅 문제, 선형 대수 및 논리학과의 연관성 등이 포함된다. tag:csweb.profs content:위다레흐트 세버스티언 전산이론 Graph Theory, Parameterized Complexity PhD, Technical University Berlin, 2021 https://www.wiederrecht.com/ wiederrecht@kaist.ac.kr 3517 306, E3-5 연구실: \n\n위다레흐트 세버스티언는(Sebastian Wiederrecht)는 KAIST에서 전산이론을 연구하는 조교수로, 구조적 및 알고리즘적 그래프 이론을 연구하고 있다. KAIST 부임 전 한국기초과학연구원(IBS) 산하 이산수학그룹(DIMAG)과 프랑스 LIRMM의 알고리즘, 그래프 및 조합론 그룹(AlGCo)에서 박사후연구원으로 근무했다. 2021년 베를린 공과대학교(Technische Universität Berlin, TUB)에서 컴퓨터 과학 박사 학위를 취득하였으며, 이때 이분 그래프에서 매칭 마이너 이론과 Permanent 문제에 대한 응용을 개발했다.\n그의 관심 연구분야는 구조적 그래프 이론에 초점을 두고 있으며, 특히 그래프 마이너 이론과 관련된 그래프 포함 관계 이론의 발전에 주력하고 있다. 여기에는 구조 정리, 그래프 알고리즘, 매개변수화된 복잡도, 계산 문제, 라우팅 문제, 선형 대수 및 논리학과의 연관성 등이 포함된다. csweb.profs"
}