{
    "name": "김태균",
    "field": "비주얼 컴퓨팅, 인공지능·정보서비스",
    "major": "컴퓨터비전, 기계학습",
    "degree": "PhD, University of Cambridge, 2008",
    "web": "https://sites.google.com/view/tkkim/",
    "mail": "kimtaekyun@kaist.ac.kr",
    "phone": "3583",
    "office": "N1, 504",
    "etc": "연구실: 컴퓨터 비전 및 머신 러닝 랩\n\n김태균 교수는 한국과학기술원(KAIST) 교수로서 전산학부에서 컴퓨터 비전 및 기계학습 연구실을 이끌고 있다. 김교수는 2020년 KAIST에 부임하기 전에는 영국 임페리얼 컬리지 런던에서 2010부터 2020년까지 부교수로 근무했다. 김교수는 2008년 영국 캠브리지 대학에서 박사학위를 취득하였으며, 이후 2007년부터 2010년까지 캠브리지 대학의 시드니 석세스 컬리지에서 Research Fellow로 근무했다. 그의 연구분야는 컴퓨터 비전, 머신 러닝이며, 특히 3차원 손 자세 인지 및 얼굴인식을 위한 트리구조 기반 기계학습, 랜덤포레스트 및 컨볼루셔널 뉴럴네트워크 분야이다. 김교수는 지금가지 HANDS workshops을 CVPR15/CVPR16/ICCV17/ECCV18에서 주최해왔으며, BMVC17 제너럴 체어, Image and Vision Computing Journal 맟 IPSJ Trans. on Computer Vision and Applications의 부편집자로서 활동해오고 있다. 김교수는 KUKA best service robotics paper award를 ICRA 2014에 받았으며, 2016년 the ASCE Journal of Computing in Civil Engineering에서 best paper award를 받았다. 김교수의 얼굴 인식 알고리즘은 MPEG-7 ISO/IEC에 국제표준으로 사용되고 있기도 하다.",
    "tag": "csweb.profs",
    "id": 12,
    "content": "name:김태균 field:비주얼 컴퓨팅, 인공지능·정보서비스 major:컴퓨터비전, 기계학습 degree:PhD, University of Cambridge, 2008 web:https://sites.google.com/view/tkkim/ mail:kimtaekyun@kaist.ac.kr phone:3583 office:N1, 504 etc:연구실: 컴퓨터 비전 및 머신 러닝 랩\n\n김태균 교수는 한국과학기술원(KAIST) 교수로서 전산학부에서 컴퓨터 비전 및 기계학습 연구실을 이끌고 있다. 김교수는 2020년 KAIST에 부임하기 전에는 영국 임페리얼 컬리지 런던에서 2010부터 2020년까지 부교수로 근무했다. 김교수는 2008년 영국 캠브리지 대학에서 박사학위를 취득하였으며, 이후 2007년부터 2010년까지 캠브리지 대학의 시드니 석세스 컬리지에서 Research Fellow로 근무했다. 그의 연구분야는 컴퓨터 비전, 머신 러닝이며, 특히 3차원 손 자세 인지 및 얼굴인식을 위한 트리구조 기반 기계학습, 랜덤포레스트 및 컨볼루셔널 뉴럴네트워크 분야이다. 김교수는 지금가지 HANDS workshops을 CVPR15/CVPR16/ICCV17/ECCV18에서 주최해왔으며, BMVC17 제너럴 체어, Image and Vision Computing Journal 맟 IPSJ Trans. on Computer Vision and Applications의 부편집자로서 활동해오고 있다. 김교수는 KUKA best service robotics paper award를 ICRA 2014에 받았으며, 2016년 the ASCE Journal of Computing in Civil Engineering에서 best paper award를 받았다. 김교수의 얼굴 인식 알고리즘은 MPEG-7 ISO/IEC에 국제표준으로 사용되고 있기도 하다. tag:csweb.profs content:김태균 비주얼 컴퓨팅, 인공지능·정보서비스 컴퓨터비전, 기계학습 PhD, University of Cambridge, 2008 https://sites.google.com/view/tkkim/ kimtaekyun@kaist.ac.kr 3583 N1, 504 연구실: 컴퓨터 비전 및 머신 러닝 랩\n\n김태균 교수는 한국과학기술원(KAIST) 교수로서 전산학부에서 컴퓨터 비전 및 기계학습 연구실을 이끌고 있다. 김교수는 2020년 KAIST에 부임하기 전에는 영국 임페리얼 컬리지 런던에서 2010부터 2020년까지 부교수로 근무했다. 김교수는 2008년 영국 캠브리지 대학에서 박사학위를 취득하였으며, 이후 2007년부터 2010년까지 캠브리지 대학의 시드니 석세스 컬리지에서 Research Fellow로 근무했다. 그의 연구분야는 컴퓨터 비전, 머신 러닝이며, 특히 3차원 손 자세 인지 및 얼굴인식을 위한 트리구조 기반 기계학습, 랜덤포레스트 및 컨볼루셔널 뉴럴네트워크 분야이다. 김교수는 지금가지 HANDS workshops을 CVPR15/CVPR16/ICCV17/ECCV18에서 주최해왔으며, BMVC17 제너럴 체어, Image and Vision Computing Journal 맟 IPSJ Trans. on Computer Vision and Applications의 부편집자로서 활동해오고 있다. 김교수는 KUKA best service robotics paper award를 ICRA 2014에 받았으며, 2016년 the ASCE Journal of Computing in Civil Engineering에서 best paper award를 받았다. 김교수의 얼굴 인식 알고리즘은 MPEG-7 ISO/IEC에 국제표준으로 사용되고 있기도 하다. csweb.profs"
}