{
    "name": "강성원",
    "field": "시스템·네트워크, 소프트웨어 디자인",
    "major": "소프트웨어 아키텍처, 소프트웨어 제품라인, 데이터 기반 소프트웨어 공학",
    "degree": "PhD, University of Iowa, 1992",
    "web": "http://salab.kaist.ac.kr/members/prof",
    "mail": "sungwon.kang@kaist.ac.kr",
    "phone": "3512",
    "office": "E3-1, 1429",
    "etc": "연구실: 소프트웨어 아키텍처 연구실\n\n강성원 교수는 1992년 University of Iowa에서 전산학 박사를 취득하고, 1993년부터 2001년 9월까지 KT 선임연구원으로 근무한 후, 2001년 10월부터 KAIST 전산학과 교수로 재직하고 있다.\n저서로는 소프트웨어 아키텍처로의 초대(초판 2012, 제 4판 2021), 체계적인 소프트웨어 제품라인 개발(2018), 소프트웨어 제품라인 개발 입문(공저, 2021)가 있다.",
    "tag": "csweb.profs",
    "id": 50,
    "content": "name:강성원 field:시스템·네트워크, 소프트웨어 디자인 major:소프트웨어 아키텍처, 소프트웨어 제품라인, 데이터 기반 소프트웨어 공학 degree:PhD, University of Iowa, 1992 web:http://salab.kaist.ac.kr/members/prof mail:sungwon.kang@kaist.ac.kr phone:3512 office:E3-1, 1429 etc:연구실: 소프트웨어 아키텍처 연구실\n\n강성원 교수는 1992년 University of Iowa에서 전산학 박사를 취득하고, 1993년부터 2001년 9월까지 KT 선임연구원으로 근무한 후, 2001년 10월부터 KAIST 전산학과 교수로 재직하고 있다.\n저서로는 소프트웨어 아키텍처로의 초대(초판 2012, 제 4판 2021), 체계적인 소프트웨어 제품라인 개발(2018), 소프트웨어 제품라인 개발 입문(공저, 2021)가 있다. tag:csweb.profs content:강성원 시스템·네트워크, 소프트웨어 디자인 소프트웨어 아키텍처, 소프트웨어 제품라인, 데이터 기반 소프트웨어 공학 PhD, University of Iowa, 1992 http://salab.kaist.ac.kr/members/prof sungwon.kang@kaist.ac.kr 3512 E3-1, 1429 연구실: 소프트웨어 아키텍처 연구실\n\n강성원 교수는 1992년 University of Iowa에서 전산학 박사를 취득하고, 1993년부터 2001년 9월까지 KT 선임연구원으로 근무한 후, 2001년 10월부터 KAIST 전산학과 교수로 재직하고 있다.\n저서로는 소프트웨어 아키텍처로의 초대(초판 2012, 제 4판 2021), 체계적인 소프트웨어 제품라인 개발(2018), 소프트웨어 제품라인 개발 입문(공저, 2021)가 있다. csweb.profs"
}