{
    "name": "손수엘",
    "field": "시큐어 컴퓨팅",
    "major": "웹보안, 프라이버시, 프로그램 분석",
    "degree": "박사, 텍사스 오스틴 주립대학교, 2014",
    "web": "https://sites.google.com/site/ssonkaist/",
    "mail": "sl.son@kaist.ac.kr",
    "phone": "3575",
    "office": "E3-1, 4434",
    "etc": "연구실: 웹 보안 및 개인정보 보호 연구실\n\n손수엘 교수는 카이스트 전산학부에서 부교수로 일하고 있습니다. 연구는 웹보안과 프라이버시 보호에 집중하고 있으며 복잡한 시스템의 취약점 발견및 분석, 웹/모바일 취약점 발견 자동화 도구 작성에 관심을 가지고 연구를 진행 중에 있습니다.  손수엘 교수는 텍사스 오스틴 전산학과에서 2014년에 박사학위를 받았고, 그 후에 구글에서 안드로이드 앱 분석및 광고 시스템의 익명 정체성 보호를 위한 연구및개발을 진행 했습니다.",
    "tag": "csweb.profs",
    "id": 23,
    "content": "name:손수엘 field:시큐어 컴퓨팅 major:웹보안, 프라이버시, 프로그램 분석 degree:박사, 텍사스 오스틴 주립대학교, 2014 web:https://sites.google.com/site/ssonkaist/ mail:sl.son@kaist.ac.kr phone:3575 office:E3-1, 4434 etc:연구실: 웹 보안 및 개인정보 보호 연구실\n\n손수엘 교수는 카이스트 전산학부에서 부교수로 일하고 있습니다. 연구는 웹보안과 프라이버시 보호에 집중하고 있으며 복잡한 시스템의 취약점 발견및 분석, 웹/모바일 취약점 발견 자동화 도구 작성에 관심을 가지고 연구를 진행 중에 있습니다.  손수엘 교수는 텍사스 오스틴 전산학과에서 2014년에 박사학위를 받았고, 그 후에 구글에서 안드로이드 앱 분석및 광고 시스템의 익명 정체성 보호를 위한 연구및개발을 진행 했습니다. tag:csweb.profs content:손수엘 시큐어 컴퓨팅 웹보안, 프라이버시, 프로그램 분석 박사, 텍사스 오스틴 주립대학교, 2014 https://sites.google.com/site/ssonkaist/ sl.son@kaist.ac.kr 3575 E3-1, 4434 연구실: 웹 보안 및 개인정보 보호 연구실\n\n손수엘 교수는 카이스트 전산학부에서 부교수로 일하고 있습니다. 연구는 웹보안과 프라이버시 보호에 집중하고 있으며 복잡한 시스템의 취약점 발견및 분석, 웹/모바일 취약점 발견 자동화 도구 작성에 관심을 가지고 연구를 진행 중에 있습니다.  손수엘 교수는 텍사스 오스틴 전산학과에서 2014년에 박사학위를 받았고, 그 후에 구글에서 안드로이드 앱 분석및 광고 시스템의 익명 정체성 보호를 위한 연구및개발을 진행 했습니다. csweb.profs"
}