{
    "name": "김민혁",
    "field": "비주얼 컴퓨팅, 인공지능·정보서비스",
    "major": "컴퓨터그래픽스, 컴퓨터비전, 머신러닝",
    "degree": "Ph.D., University College London (UCL), 2010",
    "web": "http://vclab.kaist.ac.kr/minhkim/",
    "mail": "minhkim@vclab.kaist.ac.kr",
    "phone": "3564",
    "office": "E3-1, 2403",
    "etc": "연구실: 비주얼 컴퓨팅 연구실\n\n김민혁 교수는 한국과학기술원 전산학부 교수로서 비주얼컴퓨팅연구실을 이끌고 있다. 김 교수는 2012년 KAIST에 부임하기 전에는 미국 예일대학교에서 박사후연구원으로 근무를 했었으며, 2010년엔 영국 University College London(UCL)에서 컴퓨터그래픽스에 대한 연구를 하여 컴퓨터과학 박사학위를 취득했다. 김 교수는 다양한 컴퓨터 그래픽스 및 비전 국제학회(ACM SIGGRAPH/Asia, CVPR, ICCV, AAAI, Eurographics, Pacific Graphics 등)에 TPC 위원회 활동을 해오고 있으며, 미국컴퓨터학회(Association for Computing Machinery, ACM)에서 발간하는 트랜잭션 온 컴퓨터 그래픽스(Transactions on Graphics), 트랙잭션 온 어플라이드 퍼셉션(Transactions on Applied Perception) 및 컴퓨터스엔 그래픽스(Computers & Graphics)의 부편집장(Associate Editor)로 활동해오고 있다. 김 교수의 주요 연구분야는 컴퓨터 그래픽스 및 비전의 융합 분야로서, 특히 초분광 영상 비전 시스템, 3차원 영상 측정 시스템, 그래픽스 데이터 획득용 영상 측정 시스템, 인공지능 2/3차원 영상처리 등이다.",
    "tag": "csweb.profs",
    "id": 8,
    "content": "name:김민혁 field:비주얼 컴퓨팅, 인공지능·정보서비스 major:컴퓨터그래픽스, 컴퓨터비전, 머신러닝 degree:Ph.D., University College London (UCL), 2010 web:http://vclab.kaist.ac.kr/minhkim/ mail:minhkim@vclab.kaist.ac.kr phone:3564 office:E3-1, 2403 etc:연구실: 비주얼 컴퓨팅 연구실\n\n김민혁 교수는 한국과학기술원 전산학부 교수로서 비주얼컴퓨팅연구실을 이끌고 있다. 김 교수는 2012년 KAIST에 부임하기 전에는 미국 예일대학교에서 박사후연구원으로 근무를 했었으며, 2010년엔 영국 University College London(UCL)에서 컴퓨터그래픽스에 대한 연구를 하여 컴퓨터과학 박사학위를 취득했다. 김 교수는 다양한 컴퓨터 그래픽스 및 비전 국제학회(ACM SIGGRAPH/Asia, CVPR, ICCV, AAAI, Eurographics, Pacific Graphics 등)에 TPC 위원회 활동을 해오고 있으며, 미국컴퓨터학회(Association for Computing Machinery, ACM)에서 발간하는 트랜잭션 온 컴퓨터 그래픽스(Transactions on Graphics), 트랙잭션 온 어플라이드 퍼셉션(Transactions on Applied Perception) 및 컴퓨터스엔 그래픽스(Computers & Graphics)의 부편집장(Associate Editor)로 활동해오고 있다. 김 교수의 주요 연구분야는 컴퓨터 그래픽스 및 비전의 융합 분야로서, 특히 초분광 영상 비전 시스템, 3차원 영상 측정 시스템, 그래픽스 데이터 획득용 영상 측정 시스템, 인공지능 2/3차원 영상처리 등이다. tag:csweb.profs content:김민혁 비주얼 컴퓨팅, 인공지능·정보서비스 컴퓨터그래픽스, 컴퓨터비전, 머신러닝 Ph.D., University College London (UCL), 2010 http://vclab.kaist.ac.kr/minhkim/ minhkim@vclab.kaist.ac.kr 3564 E3-1, 2403 연구실: 비주얼 컴퓨팅 연구실\n\n김민혁 교수는 한국과학기술원 전산학부 교수로서 비주얼컴퓨팅연구실을 이끌고 있다. 김 교수는 2012년 KAIST에 부임하기 전에는 미국 예일대학교에서 박사후연구원으로 근무를 했었으며, 2010년엔 영국 University College London(UCL)에서 컴퓨터그래픽스에 대한 연구를 하여 컴퓨터과학 박사학위를 취득했다. 김 교수는 다양한 컴퓨터 그래픽스 및 비전 국제학회(ACM SIGGRAPH/Asia, CVPR, ICCV, AAAI, Eurographics, Pacific Graphics 등)에 TPC 위원회 활동을 해오고 있으며, 미국컴퓨터학회(Association for Computing Machinery, ACM)에서 발간하는 트랜잭션 온 컴퓨터 그래픽스(Transactions on Graphics), 트랙잭션 온 어플라이드 퍼셉션(Transactions on Applied Perception) 및 컴퓨터스엔 그래픽스(Computers & Graphics)의 부편집장(Associate Editor)로 활동해오고 있다. 김 교수의 주요 연구분야는 컴퓨터 그래픽스 및 비전의 융합 분야로서, 특히 초분광 영상 비전 시스템, 3차원 영상 측정 시스템, 그래픽스 데이터 획득용 영상 측정 시스템, 인공지능 2/3차원 영상처리 등이다. csweb.profs"
}