{
    "name": "노준용",
    "field": "비주얼 컴퓨팅",
    "major": "Computer Graphics",
    "degree": "Ph.D., USC, 2002",
    "web": "https://vml.kaist.ac.kr",
    "mail": "junyongnoh@kaist.ac.kr",
    "phone": "042-350-2901",
    "office": "3238, N25",
    "etc": "연구실: \n\n노준용 박사는 미국 캘리포니아주에 위치한 University of Southern California (USC)에서 전기/전자 공학 (1994), 컴퓨터 공학 (1996), 전산학 (2002) 전공으로 각각 학사, 석사, 박사 학위를 취득한 후 현재 카이스트 문화 기술 대학원의 교수이자 대학원장으로 재직하고 있다. 자동화된 얼굴 모델링과 애니메이션에 관한 다수의 논문을 발표하고 졸업 후 미국 할리우드의 대표적 시각 특수 효과 제작 전문 회사인 리듬앤 휴즈 스튜디오스에서 그래픽스 사이언티스트로 활동하였다. 약 4년간 다수의 영화와 애니메이션 그리고 TV 광고의 기술 개발에 참여했는데 대표적인 작품들로는 해피 핏, 수퍼맨 리턴스, 나니아 연대기, 가필드, 80일간의 세계일주, 리딕 등이 있다. 2006년 귀국 후, 카이스트에서 비주얼 미디어 랩을 총괄, 캐릭터 애니메이션, 이미지 향상, 입체 영상 생성등 비주얼 콘텐츠의 시각적 현실감을 극대화 시켜주는 연구를 진행하고 있다. 그래픽스 분야 세계 최고의 학회인 SIGGRAPH 에 발표된 다수의 논문들을 포함하여 수십편의 CG 제작 관련 논문들을 저술 하였다. 한반도의 공룡, 제 7광구, 고양이, 구미호 여우뉴이뎐등의 국내 CG 작업에도 참여 했으며, 반지의 제왕, 아바타등을 제작한 Weta Digital 과도 얼굴 애니메이션 제작에 필요한 핵심 기술들을 공동 개발 하였다. CG 분야의 연구 성과를 인정받아 카이스트 석좌 교수 타이틀 (2011)을 부여 받고 카이스트 기술 혁신상을 수상했다 (2011). 최근에는 몰입형 극장 시스템인 스크린 X 기술을 세계 최초로 개발하고 상업화에 성공하였으며, 동 기술은 카이스트 10대 연구에 선정 (2013) 되었으며, 나아가 창조 경제를 대표하는 미래 성장 3대 플래그쉽 프로젝트 중 하나로 선정되었다 (2015).",
    "tag": "csweb.profs",
    "id": 79,
    "content": "name:노준용 field:비주얼 컴퓨팅 major:Computer Graphics degree:Ph.D., USC, 2002 web:https://vml.kaist.ac.kr mail:junyongnoh@kaist.ac.kr phone:042-350-2901 office:3238, N25 etc:연구실: \n\n노준용 박사는 미국 캘리포니아주에 위치한 University of Southern California (USC)에서 전기/전자 공학 (1994), 컴퓨터 공학 (1996), 전산학 (2002) 전공으로 각각 학사, 석사, 박사 학위를 취득한 후 현재 카이스트 문화 기술 대학원의 교수이자 대학원장으로 재직하고 있다. 자동화된 얼굴 모델링과 애니메이션에 관한 다수의 논문을 발표하고 졸업 후 미국 할리우드의 대표적 시각 특수 효과 제작 전문 회사인 리듬앤 휴즈 스튜디오스에서 그래픽스 사이언티스트로 활동하였다. 약 4년간 다수의 영화와 애니메이션 그리고 TV 광고의 기술 개발에 참여했는데 대표적인 작품들로는 해피 핏, 수퍼맨 리턴스, 나니아 연대기, 가필드, 80일간의 세계일주, 리딕 등이 있다. 2006년 귀국 후, 카이스트에서 비주얼 미디어 랩을 총괄, 캐릭터 애니메이션, 이미지 향상, 입체 영상 생성등 비주얼 콘텐츠의 시각적 현실감을 극대화 시켜주는 연구를 진행하고 있다. 그래픽스 분야 세계 최고의 학회인 SIGGRAPH 에 발표된 다수의 논문들을 포함하여 수십편의 CG 제작 관련 논문들을 저술 하였다. 한반도의 공룡, 제 7광구, 고양이, 구미호 여우뉴이뎐등의 국내 CG 작업에도 참여 했으며, 반지의 제왕, 아바타등을 제작한 Weta Digital 과도 얼굴 애니메이션 제작에 필요한 핵심 기술들을 공동 개발 하였다. CG 분야의 연구 성과를 인정받아 카이스트 석좌 교수 타이틀 (2011)을 부여 받고 카이스트 기술 혁신상을 수상했다 (2011). 최근에는 몰입형 극장 시스템인 스크린 X 기술을 세계 최초로 개발하고 상업화에 성공하였으며, 동 기술은 카이스트 10대 연구에 선정 (2013) 되었으며, 나아가 창조 경제를 대표하는 미래 성장 3대 플래그쉽 프로젝트 중 하나로 선정되었다 (2015). tag:csweb.profs content:노준용 비주얼 컴퓨팅 Computer Graphics Ph.D., USC, 2002 https://vml.kaist.ac.kr junyongnoh@kaist.ac.kr 042-350-2901 3238, N25 연구실: \n\n노준용 박사는 미국 캘리포니아주에 위치한 University of Southern California (USC)에서 전기/전자 공학 (1994), 컴퓨터 공학 (1996), 전산학 (2002) 전공으로 각각 학사, 석사, 박사 학위를 취득한 후 현재 카이스트 문화 기술 대학원의 교수이자 대학원장으로 재직하고 있다. 자동화된 얼굴 모델링과 애니메이션에 관한 다수의 논문을 발표하고 졸업 후 미국 할리우드의 대표적 시각 특수 효과 제작 전문 회사인 리듬앤 휴즈 스튜디오스에서 그래픽스 사이언티스트로 활동하였다. 약 4년간 다수의 영화와 애니메이션 그리고 TV 광고의 기술 개발에 참여했는데 대표적인 작품들로는 해피 핏, 수퍼맨 리턴스, 나니아 연대기, 가필드, 80일간의 세계일주, 리딕 등이 있다. 2006년 귀국 후, 카이스트에서 비주얼 미디어 랩을 총괄, 캐릭터 애니메이션, 이미지 향상, 입체 영상 생성등 비주얼 콘텐츠의 시각적 현실감을 극대화 시켜주는 연구를 진행하고 있다. 그래픽스 분야 세계 최고의 학회인 SIGGRAPH 에 발표된 다수의 논문들을 포함하여 수십편의 CG 제작 관련 논문들을 저술 하였다. 한반도의 공룡, 제 7광구, 고양이, 구미호 여우뉴이뎐등의 국내 CG 작업에도 참여 했으며, 반지의 제왕, 아바타등을 제작한 Weta Digital 과도 얼굴 애니메이션 제작에 필요한 핵심 기술들을 공동 개발 하였다. CG 분야의 연구 성과를 인정받아 카이스트 석좌 교수 타이틀 (2011)을 부여 받고 카이스트 기술 혁신상을 수상했다 (2011). 최근에는 몰입형 극장 시스템인 스크린 X 기술을 세계 최초로 개발하고 상업화에 성공하였으며, 동 기술은 카이스트 10대 연구에 선정 (2013) 되었으며, 나아가 창조 경제를 대표하는 미래 성장 3대 플래그쉽 프로젝트 중 하나로 선정되었다 (2015). csweb.profs"
}