{
    "name": "배홍상",
    "field": "인공지능·정보서비스",
    "major": "Control systems, autonomous driving, automotive engineering",
    "degree": "PhD, Stanford University, 2004",
    "web": "https://cs.kaist.ac.kr",
    "mail": "baehongs@kaist.ac.kr",
    "phone": "",
    "office": "",
    "etc": "연구실: \n\n배홍상 박사는 한국과학기술원(KAIST) 전산학과의 KT-AI융합인재양성프로그램 초빙교수이며, 제타 모빌리티 (Zeta Mobility) 스타트업의 대표이사이다. 제타 모빌리티를 창업하기 전에는 베트남 소재 완성차 업체 VinFast CTO를 역임 했으며, 삼성전자, Faraday Future, Fisker Automotive에서 완성차용ADAS와 자율주행 개발 총괄업무를 담당했다. 배박사는 미국 미시간州 제너럴 모터스 (General Motors) 연구소에서 연구개발 경력을 시작했으며, 2007년 미국 국방고등연구계획국 (DARPA) 주최Urban Challenge에 서GM-카네기멜론 대학 합동팀으로 참가하여 자율주행 “Boss” 차량을 제작, 우승했다.",
    "tag": "csweb.profs",
    "id": 100,
    "content": "name:배홍상 field:인공지능·정보서비스 major:Control systems, autonomous driving, automotive engineering degree:PhD, Stanford University, 2004 web:https://cs.kaist.ac.kr mail:baehongs@kaist.ac.kr phone: office: etc:연구실: \n\n배홍상 박사는 한국과학기술원(KAIST) 전산학과의 KT-AI융합인재양성프로그램 초빙교수이며, 제타 모빌리티 (Zeta Mobility) 스타트업의 대표이사이다. 제타 모빌리티를 창업하기 전에는 베트남 소재 완성차 업체 VinFast CTO를 역임 했으며, 삼성전자, Faraday Future, Fisker Automotive에서 완성차용ADAS와 자율주행 개발 총괄업무를 담당했다. 배박사는 미국 미시간州 제너럴 모터스 (General Motors) 연구소에서 연구개발 경력을 시작했으며, 2007년 미국 국방고등연구계획국 (DARPA) 주최Urban Challenge에 서GM-카네기멜론 대학 합동팀으로 참가하여 자율주행 “Boss” 차량을 제작, 우승했다. tag:csweb.profs content:배홍상 인공지능·정보서비스 Control systems, autonomous driving, automotive engineering PhD, Stanford University, 2004 https://cs.kaist.ac.kr baehongs@kaist.ac.kr   연구실: \n\n배홍상 박사는 한국과학기술원(KAIST) 전산학과의 KT-AI융합인재양성프로그램 초빙교수이며, 제타 모빌리티 (Zeta Mobility) 스타트업의 대표이사이다. 제타 모빌리티를 창업하기 전에는 베트남 소재 완성차 업체 VinFast CTO를 역임 했으며, 삼성전자, Faraday Future, Fisker Automotive에서 완성차용ADAS와 자율주행 개발 총괄업무를 담당했다. 배박사는 미국 미시간州 제너럴 모터스 (General Motors) 연구소에서 연구개발 경력을 시작했으며, 2007년 미국 국방고등연구계획국 (DARPA) 주최Urban Challenge에 서GM-카네기멜론 대학 합동팀으로 참가하여 자율주행 “Boss” 차량을 제작, 우승했다. csweb.profs"
}