{
    "name": "김기응",
    "field": "전산이론, 인공지능·정보서비스",
    "major": "인공지능, 기계학습, 강화학습",
    "degree": "PhD, Brown Univ, 2001",
    "web": "http://ailab.kaist.ac.kr/users/kekim",
    "mail": "keeeung.kim@kaist.edu",
    "phone": "3536",
    "office": "E3-1, 3426",
    "etc": "연구실: \n\n김기응 교수는 한국과학기술원 (KAIST) 부교수로 재직중이며 현재 KAIST AIPR (Artificial Intelligence and Probabilistic Reasoning) 연구실을 이끌고 있다.\n김기응 교수는 1995년 한국과학기술원 학사학위를 취득하였고 이후 Brown University에서 2001년 박사학위를 취득하였다. 삼성SDS와 삼성종합기술원을 거쳐 2006년부터 한국과학기술원 교수로 부임하고 있다. 김기응 교수는 마코프 의사결정과정 (MDP)과 부분관찰 마코프 의사결정과정 (POMDP)으로 대표되는 순차적 의사결정 문제 (강화학습)의 모델링 및 알고리즘 연구에 중점을 두고 있으며, 이외에도 다양한 인공지능 및 기계학습 연구를 수행하고 있다.",
    "tag": "csweb.profs",
    "id": 72,
    "content": "name:김기응 field:전산이론, 인공지능·정보서비스 major:인공지능, 기계학습, 강화학습 degree:PhD, Brown Univ, 2001 web:http://ailab.kaist.ac.kr/users/kekim mail:keeeung.kim@kaist.edu phone:3536 office:E3-1, 3426 etc:연구실: \n\n김기응 교수는 한국과학기술원 (KAIST) 부교수로 재직중이며 현재 KAIST AIPR (Artificial Intelligence and Probabilistic Reasoning) 연구실을 이끌고 있다.\n김기응 교수는 1995년 한국과학기술원 학사학위를 취득하였고 이후 Brown University에서 2001년 박사학위를 취득하였다. 삼성SDS와 삼성종합기술원을 거쳐 2006년부터 한국과학기술원 교수로 부임하고 있다. 김기응 교수는 마코프 의사결정과정 (MDP)과 부분관찰 마코프 의사결정과정 (POMDP)으로 대표되는 순차적 의사결정 문제 (강화학습)의 모델링 및 알고리즘 연구에 중점을 두고 있으며, 이외에도 다양한 인공지능 및 기계학습 연구를 수행하고 있다. tag:csweb.profs content:김기응 전산이론, 인공지능·정보서비스 인공지능, 기계학습, 강화학습 PhD, Brown Univ, 2001 http://ailab.kaist.ac.kr/users/kekim keeeung.kim@kaist.edu 3536 E3-1, 3426 연구실: \n\n김기응 교수는 한국과학기술원 (KAIST) 부교수로 재직중이며 현재 KAIST AIPR (Artificial Intelligence and Probabilistic Reasoning) 연구실을 이끌고 있다.\n김기응 교수는 1995년 한국과학기술원 학사학위를 취득하였고 이후 Brown University에서 2001년 박사학위를 취득하였다. 삼성SDS와 삼성종합기술원을 거쳐 2006년부터 한국과학기술원 교수로 부임하고 있다. 김기응 교수는 마코프 의사결정과정 (MDP)과 부분관찰 마코프 의사결정과정 (POMDP)으로 대표되는 순차적 의사결정 문제 (강화학습)의 모델링 및 알고리즘 연구에 중점을 두고 있으며, 이외에도 다양한 인공지능 및 기계학습 연구를 수행하고 있다. csweb.profs"
}