{
    "name": "이주영",
    "field": "전산이론, 시큐어 컴퓨팅",
    "major": "암호론, 조합론",
    "degree": "Ph.D., University of Waterloo, 2005",
    "web": "https://sites.google.com/view/cryptlab/home",
    "mail": "hicalf@kaist.ac.kr",
    "phone": "3571",
    "office": "N5, 2318",
    "etc": "연구실: 암호론 연구실\n\n이주영 교수는 서울대학교 수학과에서 1996년과 1998년 각각 학사와 석사를 취득하고, 2005년 University of Waterloo에서 암호론으로 박사를 취득하였다. 2005년부터 2011년까지 국가보안기술연구소에서, 2011년부터 세종대학교 수학통계학부에서 근무하였으며, 2016년 KAIST 전산학부 (정보보호대학원)에 부교수로 부임하였다. 주요 연구 분야는 암호론과 조합론이며, 최근에는 화이트박스 암호, 동형암호-대칭키 암호 하이브리드 구조, 대칭키 암호 기반 양자 내성 암호 등을 연구하고 있다.",
    "tag": "csweb.profs",
    "id": 38,
    "content": "name:이주영 field:전산이론, 시큐어 컴퓨팅 major:암호론, 조합론 degree:Ph.D., University of Waterloo, 2005 web:https://sites.google.com/view/cryptlab/home mail:hicalf@kaist.ac.kr phone:3571 office:N5, 2318 etc:연구실: 암호론 연구실\n\n이주영 교수는 서울대학교 수학과에서 1996년과 1998년 각각 학사와 석사를 취득하고, 2005년 University of Waterloo에서 암호론으로 박사를 취득하였다. 2005년부터 2011년까지 국가보안기술연구소에서, 2011년부터 세종대학교 수학통계학부에서 근무하였으며, 2016년 KAIST 전산학부 (정보보호대학원)에 부교수로 부임하였다. 주요 연구 분야는 암호론과 조합론이며, 최근에는 화이트박스 암호, 동형암호-대칭키 암호 하이브리드 구조, 대칭키 암호 기반 양자 내성 암호 등을 연구하고 있다. tag:csweb.profs content:이주영 전산이론, 시큐어 컴퓨팅 암호론, 조합론 Ph.D., University of Waterloo, 2005 https://sites.google.com/view/cryptlab/home hicalf@kaist.ac.kr 3571 N5, 2318 연구실: 암호론 연구실\n\n이주영 교수는 서울대학교 수학과에서 1996년과 1998년 각각 학사와 석사를 취득하고, 2005년 University of Waterloo에서 암호론으로 박사를 취득하였다. 2005년부터 2011년까지 국가보안기술연구소에서, 2011년부터 세종대학교 수학통계학부에서 근무하였으며, 2016년 KAIST 전산학부 (정보보호대학원)에 부교수로 부임하였다. 주요 연구 분야는 암호론과 조합론이며, 최근에는 화이트박스 암호, 동형암호-대칭키 암호 하이브리드 구조, 대칭키 암호 기반 양자 내성 암호 등을 연구하고 있다. csweb.profs"
}