{
    "name": "안드리아 비앙키",
    "field": "인터랙티브 컴퓨팅",
    "major": "Human-Computer Interaction, Design",
    "degree": "PhD, KAIST, 2012",
    "web": "https://makinteract.kaist.ac.kr",
    "mail": "andrea@kaist.ac.kr",
    "phone": "042-350-4526",
    "office": "418, N25",
    "etc": "연구실: \n\nAndrea Bianchi is an Associate Professor in the Department of Industrial Design and an Adjunct Professor in the School of Computing at KAIST, and the director of the MAKinteract lab (makinteract.kaist.ac.kr). He researches in the field of Human-Computer Interaction focusing on building tools for prototyping interactive systems, and hardware devices for body augmentation (i.e., haptics for VR). Before joining KAIST, he worked at Sungkyunkwan University (Korea) as a faculty member in the department of Computer Science, and as a video game programmer for a New York startup. Andrea received a Ph.D. from KAIST (Korea) in 2012.",
    "tag": "csweb.profs",
    "id": 81,
    "content": "name:안드리아 비앙키 field:인터랙티브 컴퓨팅 major:Human-Computer Interaction, Design degree:PhD, KAIST, 2012 web:https://makinteract.kaist.ac.kr mail:andrea@kaist.ac.kr phone:042-350-4526 office:418, N25 etc:연구실: \n\nAndrea Bianchi is an Associate Professor in the Department of Industrial Design and an Adjunct Professor in the School of Computing at KAIST, and the director of the MAKinteract lab (makinteract.kaist.ac.kr). He researches in the field of Human-Computer Interaction focusing on building tools for prototyping interactive systems, and hardware devices for body augmentation (i.e., haptics for VR). Before joining KAIST, he worked at Sungkyunkwan University (Korea) as a faculty member in the department of Computer Science, and as a video game programmer for a New York startup. Andrea received a Ph.D. from KAIST (Korea) in 2012. tag:csweb.profs content:안드리아 비앙키 인터랙티브 컴퓨팅 Human-Computer Interaction, Design PhD, KAIST, 2012 https://makinteract.kaist.ac.kr andrea@kaist.ac.kr 042-350-4526 418, N25 연구실: \n\nAndrea Bianchi is an Associate Professor in the Department of Industrial Design and an Adjunct Professor in the School of Computing at KAIST, and the director of the MAKinteract lab (makinteract.kaist.ac.kr). He researches in the field of Human-Computer Interaction focusing on building tools for prototyping interactive systems, and hardware devices for body augmentation (i.e., haptics for VR). Before joining KAIST, he worked at Sungkyunkwan University (Korea) as a faculty member in the department of Computer Science, and as a video game programmer for a New York startup. Andrea received a Ph.D. from KAIST (Korea) in 2012. csweb.profs"
}