{
    "name": "김현우",
    "field": "비주얼 컴퓨팅, 인공지능·정보서비스",
    "major": "인공지능, 컴퓨터 비전, 기계 학습",
    "degree": "PhD, University of Wisconsin-Madison, 2017",
    "web": "http://hyunwoojkim.com",
    "mail": "hyunwoojkim@kaist.ac.kr",
    "phone": "3518",
    "office": "205, E3-5",
    "etc": "연구실: 기계학습 및 비전 연구실\n\n김현우 교수는 한국과학기술원(KAIST)에 부교수로 근무하고 기계학습 및 비전 연구실을 이끌고 있다. 김교수는 2025년 KAIST에 부임하기 전에는 고려대학교 교수와 Amazon Lab126에서 응용과학자로 활동했으며, 미국 위스콘신-매디슨 대학교(University of Wisconsin-Madison)에서 전산학 박사 학위를 취득했다. CVPR, ICCV, ECCV, NeurIPS 등 인공지능 분야 우수 국제학술대회에 다수의 논문을 발표하며 연구 성과를 인정받았다. 또한, CVPR, ICCV, ICLR 등 국제 학회에서 Area Chair로 활동하며 학계 발전에도 기여하고 있다. 그의 연구 분야는 △범용인공지능(AGI) △멀티모달 거대언어모델 △생성 모델 △3D 비전 △의료 영상 분석 등으로 다양하고 복잡한 태스크 자율적으로 해결할 수 있는 차세대 인공지능 모델 개발과 응용 확대에 집중하고 있다.",
    "tag": "csweb.profs",
    "id": 13,
    "content": "name:김현우 field:비주얼 컴퓨팅, 인공지능·정보서비스 major:인공지능, 컴퓨터 비전, 기계 학습 degree:PhD, University of Wisconsin-Madison, 2017 web:http://hyunwoojkim.com mail:hyunwoojkim@kaist.ac.kr phone:3518 office:205, E3-5 etc:연구실: 기계학습 및 비전 연구실\n\n김현우 교수는 한국과학기술원(KAIST)에 부교수로 근무하고 기계학습 및 비전 연구실을 이끌고 있다. 김교수는 2025년 KAIST에 부임하기 전에는 고려대학교 교수와 Amazon Lab126에서 응용과학자로 활동했으며, 미국 위스콘신-매디슨 대학교(University of Wisconsin-Madison)에서 전산학 박사 학위를 취득했다. CVPR, ICCV, ECCV, NeurIPS 등 인공지능 분야 우수 국제학술대회에 다수의 논문을 발표하며 연구 성과를 인정받았다. 또한, CVPR, ICCV, ICLR 등 국제 학회에서 Area Chair로 활동하며 학계 발전에도 기여하고 있다. 그의 연구 분야는 △범용인공지능(AGI) △멀티모달 거대언어모델 △생성 모델 △3D 비전 △의료 영상 분석 등으로 다양하고 복잡한 태스크 자율적으로 해결할 수 있는 차세대 인공지능 모델 개발과 응용 확대에 집중하고 있다. tag:csweb.profs content:김현우 비주얼 컴퓨팅, 인공지능·정보서비스 인공지능, 컴퓨터 비전, 기계 학습 PhD, University of Wisconsin-Madison, 2017 http://hyunwoojkim.com hyunwoojkim@kaist.ac.kr 3518 205, E3-5 연구실: 기계학습 및 비전 연구실\n\n김현우 교수는 한국과학기술원(KAIST)에 부교수로 근무하고 기계학습 및 비전 연구실을 이끌고 있다. 김교수는 2025년 KAIST에 부임하기 전에는 고려대학교 교수와 Amazon Lab126에서 응용과학자로 활동했으며, 미국 위스콘신-매디슨 대학교(University of Wisconsin-Madison)에서 전산학 박사 학위를 취득했다. CVPR, ICCV, ECCV, NeurIPS 등 인공지능 분야 우수 국제학술대회에 다수의 논문을 발표하며 연구 성과를 인정받았다. 또한, CVPR, ICCV, ICLR 등 국제 학회에서 Area Chair로 활동하며 학계 발전에도 기여하고 있다. 그의 연구 분야는 △범용인공지능(AGI) △멀티모달 거대언어모델 △생성 모델 △3D 비전 △의료 영상 분석 등으로 다양하고 복잡한 태스크 자율적으로 해결할 수 있는 차세대 인공지능 모델 개발과 응용 확대에 집중하고 있다. csweb.profs"
}