{
    "name": "빅데이터 지능 연구실",
    "professor": "황지영",
    "field": "인공지능·정보서비스, 소셜 컴퓨팅",
    "web": "http://bdi-lab.kaist.ac.kr/",
    "email": "jjwhang@kaist.ac.kr",
    "phone": "042-350-7784",
    "office": "N1   921호",
    "intro": "https://bdi-lab.kaist.ac.kr/down/BDI_Lab_KAIST.pdf",
    "etc": "빅데이터 지능 연구실은 카이스트 전산학부 황지영 교수가 운영하고 있다. 실생활에 산재해 있는 다양한 데이터에서 유의미한 정보를 추출하기 위한 새로운 인공지능 및 기계학습 알고리즘을 개발하는 연구를 진행하고 있다. 특히, 데이터를 개체간의 관계성의 관점에서 표현하고 해석하는 다양한 그래프 기계학습 및 마이닝 기술들을 개발하고 있다. 인공지능, 그래프 기계학습, 데이터 마이닝 분야에서 아직 풀지 못한 다양한 문제들을 정형화하고, 이 문제들을 해결할 수 있는 새로운 알고리즘을 개발하고 있다.",
    "tag": "csweb.research",
    "id": 46,
    "content": "name:빅데이터 지능 연구실 professor:황지영 field:인공지능·정보서비스, 소셜 컴퓨팅 web:http://bdi-lab.kaist.ac.kr/ email:jjwhang@kaist.ac.kr phone:042-350-7784 office:N1   921호 intro:https://bdi-lab.kaist.ac.kr/down/BDI_Lab_KAIST.pdf etc:빅데이터 지능 연구실은 카이스트 전산학부 황지영 교수가 운영하고 있다. 실생활에 산재해 있는 다양한 데이터에서 유의미한 정보를 추출하기 위한 새로운 인공지능 및 기계학습 알고리즘을 개발하는 연구를 진행하고 있다. 특히, 데이터를 개체간의 관계성의 관점에서 표현하고 해석하는 다양한 그래프 기계학습 및 마이닝 기술들을 개발하고 있다. 인공지능, 그래프 기계학습, 데이터 마이닝 분야에서 아직 풀지 못한 다양한 문제들을 정형화하고, 이 문제들을 해결할 수 있는 새로운 알고리즘을 개발하고 있다. tag:csweb.research content:빅데이터 지능 연구실 황지영 인공지능·정보서비스, 소셜 컴퓨팅 http://bdi-lab.kaist.ac.kr/ jjwhang@kaist.ac.kr 042-350-7784 N1   921호 https://bdi-lab.kaist.ac.kr/down/BDI_Lab_KAIST.pdf 빅데이터 지능 연구실은 카이스트 전산학부 황지영 교수가 운영하고 있다. 실생활에 산재해 있는 다양한 데이터에서 유의미한 정보를 추출하기 위한 새로운 인공지능 및 기계학습 알고리즘을 개발하는 연구를 진행하고 있다. 특히, 데이터를 개체간의 관계성의 관점에서 표현하고 해석하는 다양한 그래프 기계학습 및 마이닝 기술들을 개발하고 있다. 인공지능, 그래프 기계학습, 데이터 마이닝 분야에서 아직 풀지 못한 다양한 문제들을 정형화하고, 이 문제들을 해결할 수 있는 새로운 알고리즘을 개발하고 있다. csweb.research"
}