{
    "name": "인터랙션 연구실",
    "professor": "김주호",
    "field": "인공지능·정보서비스, 소셜 컴퓨팅, 인터랙티브 컴퓨팅",
    "web": "https://kixlab.org/",
    "email": "kixlab.kaist@gmail.com",
    "phone": "042-350-3570",
    "office": "N1   624호",
    "intro": "https://socnas.kaist.ac.kr/drive/d/s/lz6mqldyEuuqvUG1LMUDzyRE4y4SkP5q/7S3mcz3Lsp4IjDGIzCwviY4IDO5o98xa-6rgAT8nKAwk",
    "etc": "KAIST 전산학부의 인터랙션 연구실(KAIST Interaction Lab: KIXLAB)에서는 대규모 온라인 시스템에서의 인간-컴퓨터 상호작용(HCI)에 관한 연구를 진행하고 있다. 연구실에서는 수만 명의 사용자가 함께 협업하고 학습하고 의사결정을 내리고 집단행동을 하는 데에 도움을 주는 시스템과 인터랙션 기법을 만든다. 특히 전산학과 교육학, 인지심리학, 사회학 등을 접목하여 사람과 컴퓨터를 이어주는 연구를 하고, 실제 사용자에게 쓰이는 기술을 만들기 위해 노력한다. 세부 연구주제로는 크라우드소싱과 휴먼 컴퓨테이션, 온라인 교육, 시민 참여와 집단 의사결정 및 행동을 위한 기술, 인터랙티브 데이터 분석과 마이닝 등이 있다.",
    "tag": "csweb.research",
    "id": 10,
    "content": "name:인터랙션 연구실 professor:김주호 field:인공지능·정보서비스, 소셜 컴퓨팅, 인터랙티브 컴퓨팅 web:https://kixlab.org/ email:kixlab.kaist@gmail.com phone:042-350-3570 office:N1   624호 intro:https://socnas.kaist.ac.kr/drive/d/s/lz6mqldyEuuqvUG1LMUDzyRE4y4SkP5q/7S3mcz3Lsp4IjDGIzCwviY4IDO5o98xa-6rgAT8nKAwk etc:KAIST 전산학부의 인터랙션 연구실(KAIST Interaction Lab: KIXLAB)에서는 대규모 온라인 시스템에서의 인간-컴퓨터 상호작용(HCI)에 관한 연구를 진행하고 있다. 연구실에서는 수만 명의 사용자가 함께 협업하고 학습하고 의사결정을 내리고 집단행동을 하는 데에 도움을 주는 시스템과 인터랙션 기법을 만든다. 특히 전산학과 교육학, 인지심리학, 사회학 등을 접목하여 사람과 컴퓨터를 이어주는 연구를 하고, 실제 사용자에게 쓰이는 기술을 만들기 위해 노력한다. 세부 연구주제로는 크라우드소싱과 휴먼 컴퓨테이션, 온라인 교육, 시민 참여와 집단 의사결정 및 행동을 위한 기술, 인터랙티브 데이터 분석과 마이닝 등이 있다. tag:csweb.research content:인터랙션 연구실 김주호 인공지능·정보서비스, 소셜 컴퓨팅, 인터랙티브 컴퓨팅 https://kixlab.org/ kixlab.kaist@gmail.com 042-350-3570 N1   624호 https://socnas.kaist.ac.kr/drive/d/s/lz6mqldyEuuqvUG1LMUDzyRE4y4SkP5q/7S3mcz3Lsp4IjDGIzCwviY4IDO5o98xa-6rgAT8nKAwk KAIST 전산학부의 인터랙션 연구실(KAIST Interaction Lab: KIXLAB)에서는 대규모 온라인 시스템에서의 인간-컴퓨터 상호작용(HCI)에 관한 연구를 진행하고 있다. 연구실에서는 수만 명의 사용자가 함께 협업하고 학습하고 의사결정을 내리고 집단행동을 하는 데에 도움을 주는 시스템과 인터랙션 기법을 만든다. 특히 전산학과 교육학, 인지심리학, 사회학 등을 접목하여 사람과 컴퓨터를 이어주는 연구를 하고, 실제 사용자에게 쓰이는 기술을 만들기 위해 노력한다. 세부 연구주제로는 크라우드소싱과 휴먼 컴퓨테이션, 온라인 교육, 시민 참여와 집단 의사결정 및 행동을 위한 기술, 인터랙티브 데이터 분석과 마이닝 등이 있다. csweb.research"
}