{
    "name": "임베디드 컴퓨팅 연구실",
    "professor": "김순태",
    "field": "시스템·네트워크",
    "web": "http://ecl.kaist.ac.kr/",
    "email": "kims@kaist.ac.kr",
    "phone": "042-350-3554",
    "office": "N1   903호",
    "intro": "https://socnas.kaist.ac.kr/drive/d/s/lyNUQKnr03rtzNWkHndfAB54Sw60LjjN/wbZrVp9xQ8LIodpwfl0OawYIwnlie51j-2rIA72xEAwk",
    "etc": "임베디드 컴퓨팅 연구실 소개본 연구실에서 하는 연구는 하드웨어와 시스템 소프트웨어로 나눌 수 있다. 하드웨어 연구는 내장형 시스템, 컴퓨터 구조, 메모리 시스템에 대한 연구를 수행하고 있다. 시스템 소프트웨어 연구는 하드웨어에 관한 깊이 있는 지식을 바탕으로 내장형 시스템의 성능, 전력소비 효율, 실시간성, 신뢰성 향상시키는 기술에 관한 연구를 수행한다. 이를 통해서 하드웨어 전문가와 일반 소프트웨어 전문가가 할 수 없는 차별화된 know-how를 축적한다.연구분야임베디드 컴퓨팅, 컴퓨터 구조, 운영체제실생활에서의 연구대상: 스마트폰 아키텍처, DRAM/MRAM등 메모리, Flash/SSD, 자동차용 전자/컴퓨터시스템 （모두 한국이 세계를 주도하는 산업들이어서 연구가 한국의 주도 산업과 매우 연관성이 큼）저전력（low-power）: 삼성, LG, Intel, ARM 등 산업계에서 매우 중시함고신뢰성（reliability）: 컴퓨팅의 미래 운명을 결정하는 중요한 요소실시간성（realtime）: 미래 산업인 Cyber Physical System에서 중추적인 역할관련과목컴퓨터구조, 디지털공학: 하드웨어를 이해해야 함.운영체제, 컴파일러: 저수준의 시스템소프트웨어를 이해하여야 함.하드웨어와 시스템 소프트웨어를 같이 이해하고 이를 결합하는 포괄적 연구를 함, 어느 한쪽만 이해하는 것은 문제를 제대로 푸는데 한계가 있음.졸업후 진로주로 삼성전자, LG전자, 팬택 등 전자회사스마트폰/디지털TV 부서, 메모리（DRAM/FLASH） 관련부서, 자동차 회사, 기타 임베디드 분야 （대부분의 전자관련 회사가 여기에 속함）학계/연구소우리 연구실에 맞는 학생상프로그래밍만 하는 학생이 아닌 시스템을 깊숙히 연구하고 싶은 학생주어진 일만 하는 학생이 아닌 스스로 무엇인가 개척하고 싶은 학생미래 컴퓨팅이 필요로 하는 핵심기술을 알고 싶은 학생국제적으로 연구하고 활동하고 싶은 학생전산/전자/전기과를 졸업하고 컴퓨터 아키텍처, 임베디드 시스템을 공부하고 싶은 학생",
    "tag": "csweb.research",
    "id": 9,
    "content": "name:임베디드 컴퓨팅 연구실 professor:김순태 field:시스템·네트워크 web:http://ecl.kaist.ac.kr/ email:kims@kaist.ac.kr phone:042-350-3554 office:N1   903호 intro:https://socnas.kaist.ac.kr/drive/d/s/lyNUQKnr03rtzNWkHndfAB54Sw60LjjN/wbZrVp9xQ8LIodpwfl0OawYIwnlie51j-2rIA72xEAwk etc:임베디드 컴퓨팅 연구실 소개본 연구실에서 하는 연구는 하드웨어와 시스템 소프트웨어로 나눌 수 있다. 하드웨어 연구는 내장형 시스템, 컴퓨터 구조, 메모리 시스템에 대한 연구를 수행하고 있다. 시스템 소프트웨어 연구는 하드웨어에 관한 깊이 있는 지식을 바탕으로 내장형 시스템의 성능, 전력소비 효율, 실시간성, 신뢰성 향상시키는 기술에 관한 연구를 수행한다. 이를 통해서 하드웨어 전문가와 일반 소프트웨어 전문가가 할 수 없는 차별화된 know-how를 축적한다.연구분야임베디드 컴퓨팅, 컴퓨터 구조, 운영체제실생활에서의 연구대상: 스마트폰 아키텍처, DRAM/MRAM등 메모리, Flash/SSD, 자동차용 전자/컴퓨터시스템 （모두 한국이 세계를 주도하는 산업들이어서 연구가 한국의 주도 산업과 매우 연관성이 큼）저전력（low-power）: 삼성, LG, Intel, ARM 등 산업계에서 매우 중시함고신뢰성（reliability）: 컴퓨팅의 미래 운명을 결정하는 중요한 요소실시간성（realtime）: 미래 산업인 Cyber Physical System에서 중추적인 역할관련과목컴퓨터구조, 디지털공학: 하드웨어를 이해해야 함.운영체제, 컴파일러: 저수준의 시스템소프트웨어를 이해하여야 함.하드웨어와 시스템 소프트웨어를 같이 이해하고 이를 결합하는 포괄적 연구를 함, 어느 한쪽만 이해하는 것은 문제를 제대로 푸는데 한계가 있음.졸업후 진로주로 삼성전자, LG전자, 팬택 등 전자회사스마트폰/디지털TV 부서, 메모리（DRAM/FLASH） 관련부서, 자동차 회사, 기타 임베디드 분야 （대부분의 전자관련 회사가 여기에 속함）학계/연구소우리 연구실에 맞는 학생상프로그래밍만 하는 학생이 아닌 시스템을 깊숙히 연구하고 싶은 학생주어진 일만 하는 학생이 아닌 스스로 무엇인가 개척하고 싶은 학생미래 컴퓨팅이 필요로 하는 핵심기술을 알고 싶은 학생국제적으로 연구하고 활동하고 싶은 학생전산/전자/전기과를 졸업하고 컴퓨터 아키텍처, 임베디드 시스템을 공부하고 싶은 학생 tag:csweb.research content:임베디드 컴퓨팅 연구실 김순태 시스템·네트워크 http://ecl.kaist.ac.kr/ kims@kaist.ac.kr 042-350-3554 N1   903호 https://socnas.kaist.ac.kr/drive/d/s/lyNUQKnr03rtzNWkHndfAB54Sw60LjjN/wbZrVp9xQ8LIodpwfl0OawYIwnlie51j-2rIA72xEAwk 임베디드 컴퓨팅 연구실 소개본 연구실에서 하는 연구는 하드웨어와 시스템 소프트웨어로 나눌 수 있다. 하드웨어 연구는 내장형 시스템, 컴퓨터 구조, 메모리 시스템에 대한 연구를 수행하고 있다. 시스템 소프트웨어 연구는 하드웨어에 관한 깊이 있는 지식을 바탕으로 내장형 시스템의 성능, 전력소비 효율, 실시간성, 신뢰성 향상시키는 기술에 관한 연구를 수행한다. 이를 통해서 하드웨어 전문가와 일반 소프트웨어 전문가가 할 수 없는 차별화된 know-how를 축적한다.연구분야임베디드 컴퓨팅, 컴퓨터 구조, 운영체제실생활에서의 연구대상: 스마트폰 아키텍처, DRAM/MRAM등 메모리, Flash/SSD, 자동차용 전자/컴퓨터시스템 （모두 한국이 세계를 주도하는 산업들이어서 연구가 한국의 주도 산업과 매우 연관성이 큼）저전력（low-power）: 삼성, LG, Intel, ARM 등 산업계에서 매우 중시함고신뢰성（reliability）: 컴퓨팅의 미래 운명을 결정하는 중요한 요소실시간성（realtime）: 미래 산업인 Cyber Physical System에서 중추적인 역할관련과목컴퓨터구조, 디지털공학: 하드웨어를 이해해야 함.운영체제, 컴파일러: 저수준의 시스템소프트웨어를 이해하여야 함.하드웨어와 시스템 소프트웨어를 같이 이해하고 이를 결합하는 포괄적 연구를 함, 어느 한쪽만 이해하는 것은 문제를 제대로 푸는데 한계가 있음.졸업후 진로주로 삼성전자, LG전자, 팬택 등 전자회사스마트폰/디지털TV 부서, 메모리（DRAM/FLASH） 관련부서, 자동차 회사, 기타 임베디드 분야 （대부분의 전자관련 회사가 여기에 속함）학계/연구소우리 연구실에 맞는 학생상프로그래밍만 하는 학생이 아닌 시스템을 깊숙히 연구하고 싶은 학생주어진 일만 하는 학생이 아닌 스스로 무엇인가 개척하고 싶은 학생미래 컴퓨팅이 필요로 하는 핵심기술을 알고 싶은 학생국제적으로 연구하고 활동하고 싶은 학생전산/전자/전기과를 졸업하고 컴퓨터 아키텍처, 임베디드 시스템을 공부하고 싶은 학생 csweb.research"
}