{
    "name": "소프트웨어 프로세스 개선 및 신뢰성 검증 연구실",
    "professor": "백종문",
    "field": "소프트웨어 디자인, 인공지능·정보서비스",
    "web": "http://spiral.kaist.ac.kr/",
    "email": "jbaik@cs.kaist.ac.kr",
    "phone": "042-350-3556",
    "office": "N1   502호",
    "intro": "https://socnas.kaist.ac.kr/drive/d/s/lyLtGJzbgn8azwabqWFraeox7g471o0y/pYbi4sbZzDfOb8dcF3efELjKSc3WKjCE-_7eAT-w1Awk",
    "etc": "스파이럴 연구실（SPIRAL: Software Process Improvement and Reliability Assurance Laboratory） 에서는 소프트웨어 개발 공정 및 소프트웨어 품질을 유지, 개선하는 소프트웨어 기술과 소프트웨어 공학 패러다임에 대해 연구합니다. 그에 따른 스파이럴 연구실의 주요 연구 분야는 아래와 같습니다.- 소프트웨어 신뢰성 보증- 소프트웨어 프로세스 모델링 및 시뮬레이션- 소프트웨어 버그 예측- 소프트웨어 모델 검증자세한 내용은 연구실 홈페이지를 참고해 주시기 바랍니다.",
    "tag": "csweb.research",
    "id": 19,
    "content": "name:소프트웨어 프로세스 개선 및 신뢰성 검증 연구실 professor:백종문 field:소프트웨어 디자인, 인공지능·정보서비스 web:http://spiral.kaist.ac.kr/ email:jbaik@cs.kaist.ac.kr phone:042-350-3556 office:N1   502호 intro:https://socnas.kaist.ac.kr/drive/d/s/lyLtGJzbgn8azwabqWFraeox7g471o0y/pYbi4sbZzDfOb8dcF3efELjKSc3WKjCE-_7eAT-w1Awk etc:스파이럴 연구실（SPIRAL: Software Process Improvement and Reliability Assurance Laboratory） 에서는 소프트웨어 개발 공정 및 소프트웨어 품질을 유지, 개선하는 소프트웨어 기술과 소프트웨어 공학 패러다임에 대해 연구합니다. 그에 따른 스파이럴 연구실의 주요 연구 분야는 아래와 같습니다.- 소프트웨어 신뢰성 보증- 소프트웨어 프로세스 모델링 및 시뮬레이션- 소프트웨어 버그 예측- 소프트웨어 모델 검증자세한 내용은 연구실 홈페이지를 참고해 주시기 바랍니다. tag:csweb.research content:소프트웨어 프로세스 개선 및 신뢰성 검증 연구실 백종문 소프트웨어 디자인, 인공지능·정보서비스 http://spiral.kaist.ac.kr/ jbaik@cs.kaist.ac.kr 042-350-3556 N1   502호 https://socnas.kaist.ac.kr/drive/d/s/lyLtGJzbgn8azwabqWFraeox7g471o0y/pYbi4sbZzDfOb8dcF3efELjKSc3WKjCE-_7eAT-w1Awk 스파이럴 연구실（SPIRAL: Software Process Improvement and Reliability Assurance Laboratory） 에서는 소프트웨어 개발 공정 및 소프트웨어 품질을 유지, 개선하는 소프트웨어 기술과 소프트웨어 공학 패러다임에 대해 연구합니다. 그에 따른 스파이럴 연구실의 주요 연구 분야는 아래와 같습니다.- 소프트웨어 신뢰성 보증- 소프트웨어 프로세스 모델링 및 시뮬레이션- 소프트웨어 버그 예측- 소프트웨어 모델 검증자세한 내용은 연구실 홈페이지를 참고해 주시기 바랍니다. csweb.research"
}