{
    "name": "비주얼 컴퓨팅 연구실",
    "professor": "김민혁",
    "field": "비주얼 컴퓨팅, 인공지능·정보서비스",
    "web": "http://vclab.kaist.ac.kr/",
    "email": "minhkim@vclab.kaist.ac.kr",
    "phone": "042-350-3564",
    "office": "E3-1   2403호",
    "intro": "https://socnas.kaist.ac.kr/drive/d/s/lyLtJ1BLKPC5YIfITc3UgUUJmv7WANdK/nO2H7Jz6cBy4_t31g2Vtu_lgVcf6XoTk-kbjgoSQ2Awk",
    "etc": "KAIST 전산학부 김민혁 교수님에 의해 운영되고 있는 비주얼 컴퓨팅 연구실 (Visual Computing Laboratory, VCLAB)은 컴퓨터 그래픽스와 컴퓨터 비젼을 연구하는 연구실이다. VCLAB에서는 초고화질의 영상 정보를 재현하기 위해 필수적인 3차원 영상처리 기법에 대한 다양한 연구를 다양하게 해오고 있으며, 특히 계산 영상학(computational imaging)분야에 있어서 국제적으로 수월성을 인정받고 있다.VCLAB의 세부적인 연구분야는 초분광 영상기법(hyperspectral imaging), 3차원 영상처리 기법(3D imaging), 3차원 그래픽스를 위한 각종 데이터 획득(3D/4D face scanning and BRDF acquisition), 파동광학 기반 컴퓨터 그래픽스, 색과 시각인지(color and computational vision) 등의 다양한 영상처리 관한 연구를 포함한다. 또한 VCLAB에서는 광학/전기/전자 하드웨어의 설계 및 인공지능(machine learning)을 이용한 영상처리를 포함하여 비주얼 컴퓨팅 영역을 꾸준히 확장해 오고 있다.지금까지 세계 최고의 컴퓨터 그래픽스 저널인 ACM Transactions on Graphics(TOG)에 지금까지 총10편의 논문을 게재하였으며, 이 논문들을 ACM 최고 학회인 SIGGRAPH 및 SIGGRAPH Asia학회에 꾸준히 발표해오고 있다. 특히, VCLAB 박사과정생들에게는 세계 유수 IT 기업들로부터 펠오루십/인턴십 기회와 세계적으로 유명한 대학과의 국제협력 연구의 기회가 제공되고 있다.",
    "tag": "csweb.research",
    "id": 8,
    "content": "name:비주얼 컴퓨팅 연구실 professor:김민혁 field:비주얼 컴퓨팅, 인공지능·정보서비스 web:http://vclab.kaist.ac.kr/ email:minhkim@vclab.kaist.ac.kr phone:042-350-3564 office:E3-1   2403호 intro:https://socnas.kaist.ac.kr/drive/d/s/lyLtJ1BLKPC5YIfITc3UgUUJmv7WANdK/nO2H7Jz6cBy4_t31g2Vtu_lgVcf6XoTk-kbjgoSQ2Awk etc:KAIST 전산학부 김민혁 교수님에 의해 운영되고 있는 비주얼 컴퓨팅 연구실 (Visual Computing Laboratory, VCLAB)은 컴퓨터 그래픽스와 컴퓨터 비젼을 연구하는 연구실이다. VCLAB에서는 초고화질의 영상 정보를 재현하기 위해 필수적인 3차원 영상처리 기법에 대한 다양한 연구를 다양하게 해오고 있으며, 특히 계산 영상학(computational imaging)분야에 있어서 국제적으로 수월성을 인정받고 있다.VCLAB의 세부적인 연구분야는 초분광 영상기법(hyperspectral imaging), 3차원 영상처리 기법(3D imaging), 3차원 그래픽스를 위한 각종 데이터 획득(3D/4D face scanning and BRDF acquisition), 파동광학 기반 컴퓨터 그래픽스, 색과 시각인지(color and computational vision) 등의 다양한 영상처리 관한 연구를 포함한다. 또한 VCLAB에서는 광학/전기/전자 하드웨어의 설계 및 인공지능(machine learning)을 이용한 영상처리를 포함하여 비주얼 컴퓨팅 영역을 꾸준히 확장해 오고 있다.지금까지 세계 최고의 컴퓨터 그래픽스 저널인 ACM Transactions on Graphics(TOG)에 지금까지 총10편의 논문을 게재하였으며, 이 논문들을 ACM 최고 학회인 SIGGRAPH 및 SIGGRAPH Asia학회에 꾸준히 발표해오고 있다. 특히, VCLAB 박사과정생들에게는 세계 유수 IT 기업들로부터 펠오루십/인턴십 기회와 세계적으로 유명한 대학과의 국제협력 연구의 기회가 제공되고 있다. tag:csweb.research content:비주얼 컴퓨팅 연구실 김민혁 비주얼 컴퓨팅, 인공지능·정보서비스 http://vclab.kaist.ac.kr/ minhkim@vclab.kaist.ac.kr 042-350-3564 E3-1   2403호 https://socnas.kaist.ac.kr/drive/d/s/lyLtJ1BLKPC5YIfITc3UgUUJmv7WANdK/nO2H7Jz6cBy4_t31g2Vtu_lgVcf6XoTk-kbjgoSQ2Awk KAIST 전산학부 김민혁 교수님에 의해 운영되고 있는 비주얼 컴퓨팅 연구실 (Visual Computing Laboratory, VCLAB)은 컴퓨터 그래픽스와 컴퓨터 비젼을 연구하는 연구실이다. VCLAB에서는 초고화질의 영상 정보를 재현하기 위해 필수적인 3차원 영상처리 기법에 대한 다양한 연구를 다양하게 해오고 있으며, 특히 계산 영상학(computational imaging)분야에 있어서 국제적으로 수월성을 인정받고 있다.VCLAB의 세부적인 연구분야는 초분광 영상기법(hyperspectral imaging), 3차원 영상처리 기법(3D imaging), 3차원 그래픽스를 위한 각종 데이터 획득(3D/4D face scanning and BRDF acquisition), 파동광학 기반 컴퓨터 그래픽스, 색과 시각인지(color and computational vision) 등의 다양한 영상처리 관한 연구를 포함한다. 또한 VCLAB에서는 광학/전기/전자 하드웨어의 설계 및 인공지능(machine learning)을 이용한 영상처리를 포함하여 비주얼 컴퓨팅 영역을 꾸준히 확장해 오고 있다.지금까지 세계 최고의 컴퓨터 그래픽스 저널인 ACM Transactions on Graphics(TOG)에 지금까지 총10편의 논문을 게재하였으며, 이 논문들을 ACM 최고 학회인 SIGGRAPH 및 SIGGRAPH Asia학회에 꾸준히 발표해오고 있다. 특히, VCLAB 박사과정생들에게는 세계 유수 IT 기업들로부터 펠오루십/인턴십 기회와 세계적으로 유명한 대학과의 국제협력 연구의 기회가 제공되고 있다. csweb.research"
}