{
    "name": "비전 및 학습 연구실",
    "professor": "홍승훈",
    "field": "비주얼 컴퓨팅, 인공지능·정보서비스",
    "web": "https://vllab.kaist.ac.kr/",
    "email": "seunghoon.hong@kaist.ac.kr",
    "phone": "042-350-7779",
    "office": "E3-1   3422호",
    "intro": "",
    "etc": "카이스트 비전 및 학습 연구실에서는 사람 수준의 시각 지능을 갖추기 위한 기계 학습 알고리즘을 연구합니다. 이를 위해 이미지, 비디오, 포인트 클라우드와 같은 다양한 영상 자료를 이해하고, 분석하고, 상상할 수 있는 다양한 기계학습 기법들을 개발합니다. 우리 연구실에서는 특히 이러한 알고리즘이 사람 수준의 지능을 갖추기 위해서는 높은 확장성과 해석 가능성을 갖추어야 한다고 믿고 있습니다. 따라서 기계 학습 알고리즘이 수 많은 시각적 개념들을 최소한의 지도를 통해 학습할 수 있는 학습 알고리즘을 연구하고, 이러한 알고리즘이 시각 세계를 어떻게 이해하는지 사람에게 설명할 수 있는 알고리즘을 함께 연구합니다.",
    "tag": "csweb.research",
    "id": 45,
    "content": "name:비전 및 학습 연구실 professor:홍승훈 field:비주얼 컴퓨팅, 인공지능·정보서비스 web:https://vllab.kaist.ac.kr/ email:seunghoon.hong@kaist.ac.kr phone:042-350-7779 office:E3-1   3422호 intro: etc:카이스트 비전 및 학습 연구실에서는 사람 수준의 시각 지능을 갖추기 위한 기계 학습 알고리즘을 연구합니다. 이를 위해 이미지, 비디오, 포인트 클라우드와 같은 다양한 영상 자료를 이해하고, 분석하고, 상상할 수 있는 다양한 기계학습 기법들을 개발합니다. 우리 연구실에서는 특히 이러한 알고리즘이 사람 수준의 지능을 갖추기 위해서는 높은 확장성과 해석 가능성을 갖추어야 한다고 믿고 있습니다. 따라서 기계 학습 알고리즘이 수 많은 시각적 개념들을 최소한의 지도를 통해 학습할 수 있는 학습 알고리즘을 연구하고, 이러한 알고리즘이 시각 세계를 어떻게 이해하는지 사람에게 설명할 수 있는 알고리즘을 함께 연구합니다. tag:csweb.research content:비전 및 학습 연구실 홍승훈 비주얼 컴퓨팅, 인공지능·정보서비스 https://vllab.kaist.ac.kr/ seunghoon.hong@kaist.ac.kr 042-350-7779 E3-1   3422호  카이스트 비전 및 학습 연구실에서는 사람 수준의 시각 지능을 갖추기 위한 기계 학습 알고리즘을 연구합니다. 이를 위해 이미지, 비디오, 포인트 클라우드와 같은 다양한 영상 자료를 이해하고, 분석하고, 상상할 수 있는 다양한 기계학습 기법들을 개발합니다. 우리 연구실에서는 특히 이러한 알고리즘이 사람 수준의 지능을 갖추기 위해서는 높은 확장성과 해석 가능성을 갖추어야 한다고 믿고 있습니다. 따라서 기계 학습 알고리즘이 수 많은 시각적 개념들을 최소한의 지도를 통해 학습할 수 있는 학습 알고리즘을 연구하고, 이러한 알고리즘이 시각 세계를 어떻게 이해하는지 사람에게 설명할 수 있는 알고리즘을 함께 연구합니다. csweb.research"
}