{
    "name": "프로그래밍 시스템 연구실",
    "professor": "허기홍",
    "field": "전산이론, 소프트웨어 디자인, 시큐어 컴퓨팅",
    "web": "https://prosys.kaist.ac.kr",
    "email": "kihong.heo@kaist.ac.kr",
    "phone": "042-350-7781",
    "office": "N4   1424호",
    "intro": "https://socnas.kaist.ac.kr/drive/d/s/lyLu57ch3ElyDKPQTKO7oLHM7jPELjdh/qZFO5N9B4bWhP8aP-hor4qa_t811Lt7t-ebcAfr01Awk",
    "etc": "프로그래밍 시스템 연구실은 안전하고 믿을만한 소프트웨어를 손쉽게 만드는데 필요한 차세대 기술을 연구한다. 소프트웨어의 심각한 오류를 자동으로 검출하고 고치는 기술, 용도에 알맞게 프로그램을 자동으로 변형하거나 생성하는 기술, 더욱 더 편리하고 사용자 친화적인 프로그래밍 환경 등을 연구한다. 또한 이러한 기술의 근간이 되는 프로그래밍 언어 및 분석 이론과 인공지능 기법을 탐구하고 설계한다.",
    "tag": "csweb.research",
    "id": 44,
    "content": "name:프로그래밍 시스템 연구실 professor:허기홍 field:전산이론, 소프트웨어 디자인, 시큐어 컴퓨팅 web:https://prosys.kaist.ac.kr email:kihong.heo@kaist.ac.kr phone:042-350-7781 office:N4   1424호 intro:https://socnas.kaist.ac.kr/drive/d/s/lyLu57ch3ElyDKPQTKO7oLHM7jPELjdh/qZFO5N9B4bWhP8aP-hor4qa_t811Lt7t-ebcAfr01Awk etc:프로그래밍 시스템 연구실은 안전하고 믿을만한 소프트웨어를 손쉽게 만드는데 필요한 차세대 기술을 연구한다. 소프트웨어의 심각한 오류를 자동으로 검출하고 고치는 기술, 용도에 알맞게 프로그램을 자동으로 변형하거나 생성하는 기술, 더욱 더 편리하고 사용자 친화적인 프로그래밍 환경 등을 연구한다. 또한 이러한 기술의 근간이 되는 프로그래밍 언어 및 분석 이론과 인공지능 기법을 탐구하고 설계한다. tag:csweb.research content:프로그래밍 시스템 연구실 허기홍 전산이론, 소프트웨어 디자인, 시큐어 컴퓨팅 https://prosys.kaist.ac.kr kihong.heo@kaist.ac.kr 042-350-7781 N4   1424호 https://socnas.kaist.ac.kr/drive/d/s/lyLu57ch3ElyDKPQTKO7oLHM7jPELjdh/qZFO5N9B4bWhP8aP-hor4qa_t811Lt7t-ebcAfr01Awk 프로그래밍 시스템 연구실은 안전하고 믿을만한 소프트웨어를 손쉽게 만드는데 필요한 차세대 기술을 연구한다. 소프트웨어의 심각한 오류를 자동으로 검출하고 고치는 기술, 용도에 알맞게 프로그램을 자동으로 변형하거나 생성하는 기술, 더욱 더 편리하고 사용자 친화적인 프로그래밍 환경 등을 연구한다. 또한 이러한 기술의 근간이 되는 프로그래밍 언어 및 분석 이론과 인공지능 기법을 탐구하고 설계한다. csweb.research"
}