{
    "name": "센싱 지능 및 사이버-물리 보안 (CyPhy) 연구실",
    "professor": "한준",
    "field": "시스템·네트워크, 시큐어 컴퓨팅, 인터랙티브 컴퓨팅",
    "web": "https://www.cyphy.kaist.ac.kr/",
    "email": "jun.han@kaist.ac.kr",
    "phone": "",
    "office": "N1   923호",
    "intro": "https://youtu.be/QPnzk5c1WP0?si=X0Kx3aMmb_O8S9jI",
    "etc": "KAIST 전산학부 센싱 지능 및 사이버-물리 보안 (CyPhy) 연구실은 2018년에 한 준 교수가 설립한 연구실이다. CyPhy 랩은 컴퓨터 보안과 모바일/센싱 시스템의 교차점에 있는 새로운 컴퓨팅 패러다임인 물리 기반 컴퓨팅(Physics-guided Computing)을 제안한다. 이는 물리적 컨텍스트 정보를 활용하여 다양한 사물 인터넷 및 사이버-물리 시스템의 보안 문제를 다루는 연구이다. 물리 기반 센싱 증강, 부채널 공격 및 방어, 시큐어 인증 등 다양한 주제를 연구한다. CyPhy 랩은 컴퓨터 보안, 모바일 컴퓨팅 및 센싱 시스템 분야의 최우수 국제학회(IEEE S&P, USENIX Security, ACM CCS, MobiSys, MobiCom, SenSys, Ubicomp, IPSN 등)에 다년간 다수의 논문을 게재 및 발표, 세계적인 인정을 받고 있다. 이러한 연구 성과를 기반으로 CyPhy 랩 박사과정 학생들에게는 세계 유수의 IT 기업 펠로우십(Google Ph.D. Fellowship 등) 및 유명 대학/연구실과 국제협력 기회가 제공되고 있다. 현재 CyPhy 랩은 KAIST와 싱가포르 국립대학교(National University of Singapore) 전산학부 학생들로 구성되어 있다.",
    "tag": "csweb.research",
    "id": 43,
    "content": "name:센싱 지능 및 사이버-물리 보안 (CyPhy) 연구실 professor:한준 field:시스템·네트워크, 시큐어 컴퓨팅, 인터랙티브 컴퓨팅 web:https://www.cyphy.kaist.ac.kr/ email:jun.han@kaist.ac.kr phone: office:N1   923호 intro:https://youtu.be/QPnzk5c1WP0?si=X0Kx3aMmb_O8S9jI etc:KAIST 전산학부 센싱 지능 및 사이버-물리 보안 (CyPhy) 연구실은 2018년에 한 준 교수가 설립한 연구실이다. CyPhy 랩은 컴퓨터 보안과 모바일/센싱 시스템의 교차점에 있는 새로운 컴퓨팅 패러다임인 물리 기반 컴퓨팅(Physics-guided Computing)을 제안한다. 이는 물리적 컨텍스트 정보를 활용하여 다양한 사물 인터넷 및 사이버-물리 시스템의 보안 문제를 다루는 연구이다. 물리 기반 센싱 증강, 부채널 공격 및 방어, 시큐어 인증 등 다양한 주제를 연구한다. CyPhy 랩은 컴퓨터 보안, 모바일 컴퓨팅 및 센싱 시스템 분야의 최우수 국제학회(IEEE S&P, USENIX Security, ACM CCS, MobiSys, MobiCom, SenSys, Ubicomp, IPSN 등)에 다년간 다수의 논문을 게재 및 발표, 세계적인 인정을 받고 있다. 이러한 연구 성과를 기반으로 CyPhy 랩 박사과정 학생들에게는 세계 유수의 IT 기업 펠로우십(Google Ph.D. Fellowship 등) 및 유명 대학/연구실과 국제협력 기회가 제공되고 있다. 현재 CyPhy 랩은 KAIST와 싱가포르 국립대학교(National University of Singapore) 전산학부 학생들로 구성되어 있다. tag:csweb.research content:센싱 지능 및 사이버-물리 보안 (CyPhy) 연구실 한준 시스템·네트워크, 시큐어 컴퓨팅, 인터랙티브 컴퓨팅 https://www.cyphy.kaist.ac.kr/ jun.han@kaist.ac.kr  N1   923호 https://youtu.be/QPnzk5c1WP0?si=X0Kx3aMmb_O8S9jI KAIST 전산학부 센싱 지능 및 사이버-물리 보안 (CyPhy) 연구실은 2018년에 한 준 교수가 설립한 연구실이다. CyPhy 랩은 컴퓨터 보안과 모바일/센싱 시스템의 교차점에 있는 새로운 컴퓨팅 패러다임인 물리 기반 컴퓨팅(Physics-guided Computing)을 제안한다. 이는 물리적 컨텍스트 정보를 활용하여 다양한 사물 인터넷 및 사이버-물리 시스템의 보안 문제를 다루는 연구이다. 물리 기반 센싱 증강, 부채널 공격 및 방어, 시큐어 인증 등 다양한 주제를 연구한다. CyPhy 랩은 컴퓨터 보안, 모바일 컴퓨팅 및 센싱 시스템 분야의 최우수 국제학회(IEEE S&P, USENIX Security, ACM CCS, MobiSys, MobiCom, SenSys, Ubicomp, IPSN 등)에 다년간 다수의 논문을 게재 및 발표, 세계적인 인정을 받고 있다. 이러한 연구 성과를 기반으로 CyPhy 랩 박사과정 학생들에게는 세계 유수의 IT 기업 펠로우십(Google Ph.D. Fellowship 등) 및 유명 대학/연구실과 국제협력 기회가 제공되고 있다. 현재 CyPhy 랩은 KAIST와 싱가포르 국립대학교(National University of Singapore) 전산학부 학생들로 구성되어 있다. csweb.research"
}