{
    "name": "협동 사회 기술 연구실",
    "professor": "시어링 조셉",
    "field": "인공지능·정보서비스, 소셜 컴퓨팅, 인터랙티브 컴퓨팅",
    "web": "https://cstlab.org/",
    "email": "dbwk18@kaist.ac.kr",
    "phone": "042-350-3589",
    "office": "N1   604호",
    "intro": "",
    "etc": "협동 사회 기술 연구실 (CSTL)은 KAIST 전산학부에 속한 인간-컴퓨터 상호작용 연구 그룹이며, 주요 연구분야는 온라인 신뢰와 안전 (Online Trust & Safety)을 기반으로 하여 사회 기술과 대인 관계와의 상호작용을 이해하고 개선하는 데 중점을 두고 있다.이를 통해 사용자가 더 긍정적이고 생산적으로 학습, 작업 및 소통할 수 있는 온라인 환경 및 시스템을 구축하고 이를 지원하는 컴퓨팅 기술을 발전시키는 연구를 진행한다.",
    "tag": "csweb.research",
    "id": 23,
    "content": "name:협동 사회 기술 연구실 professor:시어링 조셉 field:인공지능·정보서비스, 소셜 컴퓨팅, 인터랙티브 컴퓨팅 web:https://cstlab.org/ email:dbwk18@kaist.ac.kr phone:042-350-3589 office:N1   604호 intro: etc:협동 사회 기술 연구실 (CSTL)은 KAIST 전산학부에 속한 인간-컴퓨터 상호작용 연구 그룹이며, 주요 연구분야는 온라인 신뢰와 안전 (Online Trust & Safety)을 기반으로 하여 사회 기술과 대인 관계와의 상호작용을 이해하고 개선하는 데 중점을 두고 있다.이를 통해 사용자가 더 긍정적이고 생산적으로 학습, 작업 및 소통할 수 있는 온라인 환경 및 시스템을 구축하고 이를 지원하는 컴퓨팅 기술을 발전시키는 연구를 진행한다. tag:csweb.research content:협동 사회 기술 연구실 시어링 조셉 인공지능·정보서비스, 소셜 컴퓨팅, 인터랙티브 컴퓨팅 https://cstlab.org/ dbwk18@kaist.ac.kr 042-350-3589 N1   604호  협동 사회 기술 연구실 (CSTL)은 KAIST 전산학부에 속한 인간-컴퓨터 상호작용 연구 그룹이며, 주요 연구분야는 온라인 신뢰와 안전 (Online Trust & Safety)을 기반으로 하여 사회 기술과 대인 관계와의 상호작용을 이해하고 개선하는 데 중점을 두고 있다.이를 통해 사용자가 더 긍정적이고 생산적으로 학습, 작업 및 소통할 수 있는 온라인 환경 및 시스템을 구축하고 이를 지원하는 컴퓨팅 기술을 발전시키는 연구를 진행한다. csweb.research"
}