{
    "name": "네트워크 보안 및 프라이버시 연구실",
    "professor": "강민석",
    "field": "시큐어 컴퓨팅, 시스템·네트워크",
    "web": "https://netsp.kaist.ac.kr",
    "email": "minsukk@kaist.ac.kr",
    "phone": "042-350-3585",
    "office": "N5   2322호",
    "intro": "https://socnas.kaist.ac.kr/drive/d/s/lz6eyQUGxvMSfMlo6mMIcozpVgTB4NYv/f13A5d1dFrKFcgJtjPHx7-wXoHVvXrb9-ILhgkGHKAwk",
    "etc": "KAIST 전산학부 네트워크 보안 및 프라이버시 연구실 (Network Security and Privacy Laboratory, NetSP-Lab)은 2016년에 강민석 교수님이 설립한 연구실이다. NetSP-Lab에서는 기존의 인터넷 보안 연구 및 최근에 주목받는 네트워크 (블록체인, IoT망, 5G 시스템) 등의 보안/프라이버시 개선에 대한 다양한 연구를 해오고 있으며, 특히 분산서비스공격 (DDoS), 블록체인 공격, 5G 프라이버시 공격 및 방어기술에 대한 연구는 국제적으로 인정받고 있다. NetSP-Lab의 세부적인 연구분야는 (1) 전통적인 인터넷 보안 (DDoS, secure routing, software defined networking security), (2) 블록체인 보안 (비트코인 공격, 거래 내역 프라이버시), (3) 4G/5G 네트워크 보안 (5G 단말 위치 추적 공격, 무선 자원 공격) (4) 무선네트워크 보안 (IoT 관제 기술, Wi-Fi 보안기술). NetSP-Lab의 연구는 주로 전산/전자 분야의 시스템/네트워크에 대한 깊은 이해를 바탕으로 새로운 네트워크 시스템의 디테일한 운영/동작 방식을 연구하여 구조적인 보안/프라이버시 취약점을 발견하고 이를 해결하는 솔루션을 제안한다. 지금까지 세계 최고의 컴퓨터 보안 학회인 IEEE Symposium on Security and Privacy, Usenix Security, ACM CCS, NDSS Symposium 등에 꾸준히 논문을 발표하여 세계적인 인정을 받고 있다. NetSP-Lab 박사과정 학생들에게는 세계 유수의 IT 기업 펠로우십 (Microsoft Research Asia 등) 및 세계적으로 유명한 대학과의 국제협력 연구의 기회가 제공되고 있다.",
    "tag": "csweb.research",
    "id": 1,
    "content": "name:네트워크 보안 및 프라이버시 연구실 professor:강민석 field:시큐어 컴퓨팅, 시스템·네트워크 web:https://netsp.kaist.ac.kr email:minsukk@kaist.ac.kr phone:042-350-3585 office:N5   2322호 intro:https://socnas.kaist.ac.kr/drive/d/s/lz6eyQUGxvMSfMlo6mMIcozpVgTB4NYv/f13A5d1dFrKFcgJtjPHx7-wXoHVvXrb9-ILhgkGHKAwk etc:KAIST 전산학부 네트워크 보안 및 프라이버시 연구실 (Network Security and Privacy Laboratory, NetSP-Lab)은 2016년에 강민석 교수님이 설립한 연구실이다. NetSP-Lab에서는 기존의 인터넷 보안 연구 및 최근에 주목받는 네트워크 (블록체인, IoT망, 5G 시스템) 등의 보안/프라이버시 개선에 대한 다양한 연구를 해오고 있으며, 특히 분산서비스공격 (DDoS), 블록체인 공격, 5G 프라이버시 공격 및 방어기술에 대한 연구는 국제적으로 인정받고 있다. NetSP-Lab의 세부적인 연구분야는 (1) 전통적인 인터넷 보안 (DDoS, secure routing, software defined networking security), (2) 블록체인 보안 (비트코인 공격, 거래 내역 프라이버시), (3) 4G/5G 네트워크 보안 (5G 단말 위치 추적 공격, 무선 자원 공격) (4) 무선네트워크 보안 (IoT 관제 기술, Wi-Fi 보안기술). NetSP-Lab의 연구는 주로 전산/전자 분야의 시스템/네트워크에 대한 깊은 이해를 바탕으로 새로운 네트워크 시스템의 디테일한 운영/동작 방식을 연구하여 구조적인 보안/프라이버시 취약점을 발견하고 이를 해결하는 솔루션을 제안한다. 지금까지 세계 최고의 컴퓨터 보안 학회인 IEEE Symposium on Security and Privacy, Usenix Security, ACM CCS, NDSS Symposium 등에 꾸준히 논문을 발표하여 세계적인 인정을 받고 있다. NetSP-Lab 박사과정 학생들에게는 세계 유수의 IT 기업 펠로우십 (Microsoft Research Asia 등) 및 세계적으로 유명한 대학과의 국제협력 연구의 기회가 제공되고 있다. tag:csweb.research content:네트워크 보안 및 프라이버시 연구실 강민석 시큐어 컴퓨팅, 시스템·네트워크 https://netsp.kaist.ac.kr minsukk@kaist.ac.kr 042-350-3585 N5   2322호 https://socnas.kaist.ac.kr/drive/d/s/lz6eyQUGxvMSfMlo6mMIcozpVgTB4NYv/f13A5d1dFrKFcgJtjPHx7-wXoHVvXrb9-ILhgkGHKAwk KAIST 전산학부 네트워크 보안 및 프라이버시 연구실 (Network Security and Privacy Laboratory, NetSP-Lab)은 2016년에 강민석 교수님이 설립한 연구실이다. NetSP-Lab에서는 기존의 인터넷 보안 연구 및 최근에 주목받는 네트워크 (블록체인, IoT망, 5G 시스템) 등의 보안/프라이버시 개선에 대한 다양한 연구를 해오고 있으며, 특히 분산서비스공격 (DDoS), 블록체인 공격, 5G 프라이버시 공격 및 방어기술에 대한 연구는 국제적으로 인정받고 있다. NetSP-Lab의 세부적인 연구분야는 (1) 전통적인 인터넷 보안 (DDoS, secure routing, software defined networking security), (2) 블록체인 보안 (비트코인 공격, 거래 내역 프라이버시), (3) 4G/5G 네트워크 보안 (5G 단말 위치 추적 공격, 무선 자원 공격) (4) 무선네트워크 보안 (IoT 관제 기술, Wi-Fi 보안기술). NetSP-Lab의 연구는 주로 전산/전자 분야의 시스템/네트워크에 대한 깊은 이해를 바탕으로 새로운 네트워크 시스템의 디테일한 운영/동작 방식을 연구하여 구조적인 보안/프라이버시 취약점을 발견하고 이를 해결하는 솔루션을 제안한다. 지금까지 세계 최고의 컴퓨터 보안 학회인 IEEE Symposium on Security and Privacy, Usenix Security, ACM CCS, NDSS Symposium 등에 꾸준히 논문을 발표하여 세계적인 인정을 받고 있다. NetSP-Lab 박사과정 학생들에게는 세계 유수의 IT 기업 펠로우십 (Microsoft Research Asia 등) 및 세계적으로 유명한 대학과의 국제협력 연구의 기회가 제공되고 있다. csweb.research"
}