{
    "name": "빅데이터 분석 및 학습 연구실",
    "professor": "박노성",
    "field": "인공지능·정보서비스, 소셜 컴퓨팅",
    "web": "https://sites.google.com/view/npark",
    "email": "noseong@kaist.ac.kr",
    "phone": "042-350-3514",
    "office": "E3-1   3425호",
    "intro": "",
    "etc": "KAIST 전산학부 박노성 교수에 의해 운영되고 있는 빅데이터 분석 및 학습 연구실(Laboratory of Big Data Analytics and Learning, BigDyL)은 웹, 산업, 과학 환경(Web, Industrial, and Scientific Environments, WISE)에서의 문제를 인공지능 기술로 해결하는 것을 목표로 하고 있다. 그래프 콘볼류셔널 네트워크, 트랜스포머, 심층 생성모델, 미분방정식 기반 딥러닝 분야를 주로 연구하면서, 과학적 지식에 기반한 모델 개선 및 설계에 힘쓰고 있다. 동시에 이러한 딥러닝 기술을 활용한 과학적 문제 해결에도 좋은 연구를 지속하고 있다. 관련 분야의 세계 유수의 연구실 및 연구자들과 네트워킹을 하면서 공동 연구를 하고있다.",
    "tag": "csweb.research",
    "id": 15,
    "content": "name:빅데이터 분석 및 학습 연구실 professor:박노성 field:인공지능·정보서비스, 소셜 컴퓨팅 web:https://sites.google.com/view/npark email:noseong@kaist.ac.kr phone:042-350-3514 office:E3-1   3425호 intro: etc:KAIST 전산학부 박노성 교수에 의해 운영되고 있는 빅데이터 분석 및 학습 연구실(Laboratory of Big Data Analytics and Learning, BigDyL)은 웹, 산업, 과학 환경(Web, Industrial, and Scientific Environments, WISE)에서의 문제를 인공지능 기술로 해결하는 것을 목표로 하고 있다. 그래프 콘볼류셔널 네트워크, 트랜스포머, 심층 생성모델, 미분방정식 기반 딥러닝 분야를 주로 연구하면서, 과학적 지식에 기반한 모델 개선 및 설계에 힘쓰고 있다. 동시에 이러한 딥러닝 기술을 활용한 과학적 문제 해결에도 좋은 연구를 지속하고 있다. 관련 분야의 세계 유수의 연구실 및 연구자들과 네트워킹을 하면서 공동 연구를 하고있다. tag:csweb.research content:빅데이터 분석 및 학습 연구실 박노성 인공지능·정보서비스, 소셜 컴퓨팅 https://sites.google.com/view/npark noseong@kaist.ac.kr 042-350-3514 E3-1   3425호  KAIST 전산학부 박노성 교수에 의해 운영되고 있는 빅데이터 분석 및 학습 연구실(Laboratory of Big Data Analytics and Learning, BigDyL)은 웹, 산업, 과학 환경(Web, Industrial, and Scientific Environments, WISE)에서의 문제를 인공지능 기술로 해결하는 것을 목표로 하고 있다. 그래프 콘볼류셔널 네트워크, 트랜스포머, 심층 생성모델, 미분방정식 기반 딥러닝 분야를 주로 연구하면서, 과학적 지식에 기반한 모델 개선 및 설계에 힘쓰고 있다. 동시에 이러한 딥러닝 기술을 활용한 과학적 문제 해결에도 좋은 연구를 지속하고 있다. 관련 분야의 세계 유수의 연구실 및 연구자들과 네트워킹을 하면서 공동 연구를 하고있다. csweb.research"
}