{
    "name": "컴퓨터 비전 및 머신 러닝 랩",
    "professor": "김태균",
    "field": "비주얼 컴퓨팅, 인공지능·정보서비스",
    "web": "https://sites.google.com/view/tkkim/",
    "email": "kimtaekyun@kaist.ac.kr",
    "phone": "",
    "office": "N1   504호",
    "intro": "https://socnas.kaist.ac.kr/drive/d/s/onOGbe1SdK8rT8PtIaEPL17yV0R09Abp/6ACyg23Sa2S7L4YF0niGjmFGs07cvnH1-Bbjgw437igk",
    "etc": "김태균 교수는 한국과학기술원(KAIST) 교수로서 전산학부에서 컴퓨터비전 및 머신러닝 연구실을 이끌고 있다. 김교수는 2020년 KAIST에 부임하기 전에는 영국 임페리얼 컬리지 런던에서 2010부터 2020년까지 부교수로 근무했다. 김교수는 2008년 영국 캠브리지 대학에서 박사학위를 취득하였으며, 이후 2007년부터 2010년까지 캠브리지 대학의 시드니 석세스 컬리지에서 리서치 펠로우로 근무했다. 그의 연구분야는 삼차원 컴퓨터 비전을 위한 머신러닝/딥러닝이며, 특히 3차원 손 자세 인지 및 얼굴인식, 6D 물체 자세 인식등 다양한 비전 문제를 연구하고 있다. 김교수는 지금가지 HANDS workshops을 CVPR15/CVPR16/ICCV17/ECCV18에서 주최해왔으며, BMVC17 제너럴 체어, Pattern Recognition Journal, Image and Vision Computing Journal 맟 IPSJ Trans. on Computer Vision and Applications의 부편집자로서 활동해오고 있다. 김교수는 KUKA best service robotics paper award를 ICRA 2014에 받았으며, 2016년 the ASCE Journal of Computing in Civil Engineering에서 best paper award를 받았다. 김교수의 얼굴 인식 알고리즘은 MPEG-7 ISO/IEC에 국제표준으로 사용되고 있기도 하다.",
    "tag": "csweb.research",
    "id": 11,
    "content": "name:컴퓨터 비전 및 머신 러닝 랩 professor:김태균 field:비주얼 컴퓨팅, 인공지능·정보서비스 web:https://sites.google.com/view/tkkim/ email:kimtaekyun@kaist.ac.kr phone: office:N1   504호 intro:https://socnas.kaist.ac.kr/drive/d/s/onOGbe1SdK8rT8PtIaEPL17yV0R09Abp/6ACyg23Sa2S7L4YF0niGjmFGs07cvnH1-Bbjgw437igk etc:김태균 교수는 한국과학기술원(KAIST) 교수로서 전산학부에서 컴퓨터비전 및 머신러닝 연구실을 이끌고 있다. 김교수는 2020년 KAIST에 부임하기 전에는 영국 임페리얼 컬리지 런던에서 2010부터 2020년까지 부교수로 근무했다. 김교수는 2008년 영국 캠브리지 대학에서 박사학위를 취득하였으며, 이후 2007년부터 2010년까지 캠브리지 대학의 시드니 석세스 컬리지에서 리서치 펠로우로 근무했다. 그의 연구분야는 삼차원 컴퓨터 비전을 위한 머신러닝/딥러닝이며, 특히 3차원 손 자세 인지 및 얼굴인식, 6D 물체 자세 인식등 다양한 비전 문제를 연구하고 있다. 김교수는 지금가지 HANDS workshops을 CVPR15/CVPR16/ICCV17/ECCV18에서 주최해왔으며, BMVC17 제너럴 체어, Pattern Recognition Journal, Image and Vision Computing Journal 맟 IPSJ Trans. on Computer Vision and Applications의 부편집자로서 활동해오고 있다. 김교수는 KUKA best service robotics paper award를 ICRA 2014에 받았으며, 2016년 the ASCE Journal of Computing in Civil Engineering에서 best paper award를 받았다. 김교수의 얼굴 인식 알고리즘은 MPEG-7 ISO/IEC에 국제표준으로 사용되고 있기도 하다. tag:csweb.research content:컴퓨터 비전 및 머신 러닝 랩 김태균 비주얼 컴퓨팅, 인공지능·정보서비스 https://sites.google.com/view/tkkim/ kimtaekyun@kaist.ac.kr  N1   504호 https://socnas.kaist.ac.kr/drive/d/s/onOGbe1SdK8rT8PtIaEPL17yV0R09Abp/6ACyg23Sa2S7L4YF0niGjmFGs07cvnH1-Bbjgw437igk 김태균 교수는 한국과학기술원(KAIST) 교수로서 전산학부에서 컴퓨터비전 및 머신러닝 연구실을 이끌고 있다. 김교수는 2020년 KAIST에 부임하기 전에는 영국 임페리얼 컬리지 런던에서 2010부터 2020년까지 부교수로 근무했다. 김교수는 2008년 영국 캠브리지 대학에서 박사학위를 취득하였으며, 이후 2007년부터 2010년까지 캠브리지 대학의 시드니 석세스 컬리지에서 리서치 펠로우로 근무했다. 그의 연구분야는 삼차원 컴퓨터 비전을 위한 머신러닝/딥러닝이며, 특히 3차원 손 자세 인지 및 얼굴인식, 6D 물체 자세 인식등 다양한 비전 문제를 연구하고 있다. 김교수는 지금가지 HANDS workshops을 CVPR15/CVPR16/ICCV17/ECCV18에서 주최해왔으며, BMVC17 제너럴 체어, Pattern Recognition Journal, Image and Vision Computing Journal 맟 IPSJ Trans. on Computer Vision and Applications의 부편집자로서 활동해오고 있다. 김교수는 KUKA best service robotics paper award를 ICRA 2014에 받았으며, 2016년 the ASCE Journal of Computing in Civil Engineering에서 best paper award를 받았다. 김교수의 얼굴 인식 알고리즘은 MPEG-7 ISO/IEC에 국제표준으로 사용되고 있기도 하다. csweb.research"
}