{
    "name": "웹 보안 및 개인정보 보호 연구실",
    "professor": "손수엘",
    "field": "시큐어 컴퓨팅",
    "web": "https://wsp-lab.github.io/",
    "email": "sl.son@kaist.ac.kr",
    "phone": "042-350-3575",
    "office": "E3-1   4434호",
    "intro": "https://socnas.kaist.ac.kr/drive/d/s/lyNUPbWpjaRXLBMz7j4JhPvVAsBbiDFt/6JDpbR_UaUFqhV73gf4DL2Ko0RP2uwvs-abNgGrREAwk",
    "etc": "WSP 연구실은 웹을 보다 안전한 환경으로 만들기 위한 새로운 아이디어의 구현이라는 비젼을 가지고 웹 서비스들의 취약점 탐지와 웹을 통한 개인정보 침해 측정을 목표로 연구를 진행하고 있습니다.연구주제는 웹 애플리케이션의 동적 및 정적 분석을 통한 취약점 탐지, 웹 브라우져 보안기능 분석, 웹 취약점을 이용하는 악성 공격코드에 대한 분석들을 포함하고 있습니다. 또한 웹 및 모바일 서비스와의 통신을 통한 프라이버시 침해에 대한 연구 역시 진행중에 있습니다.",
    "tag": "csweb.research",
    "id": 21,
    "content": "name:웹 보안 및 개인정보 보호 연구실 professor:손수엘 field:시큐어 컴퓨팅 web:https://wsp-lab.github.io/ email:sl.son@kaist.ac.kr phone:042-350-3575 office:E3-1   4434호 intro:https://socnas.kaist.ac.kr/drive/d/s/lyNUPbWpjaRXLBMz7j4JhPvVAsBbiDFt/6JDpbR_UaUFqhV73gf4DL2Ko0RP2uwvs-abNgGrREAwk etc:WSP 연구실은 웹을 보다 안전한 환경으로 만들기 위한 새로운 아이디어의 구현이라는 비젼을 가지고 웹 서비스들의 취약점 탐지와 웹을 통한 개인정보 침해 측정을 목표로 연구를 진행하고 있습니다.연구주제는 웹 애플리케이션의 동적 및 정적 분석을 통한 취약점 탐지, 웹 브라우져 보안기능 분석, 웹 취약점을 이용하는 악성 공격코드에 대한 분석들을 포함하고 있습니다. 또한 웹 및 모바일 서비스와의 통신을 통한 프라이버시 침해에 대한 연구 역시 진행중에 있습니다. tag:csweb.research content:웹 보안 및 개인정보 보호 연구실 손수엘 시큐어 컴퓨팅 https://wsp-lab.github.io/ sl.son@kaist.ac.kr 042-350-3575 E3-1   4434호 https://socnas.kaist.ac.kr/drive/d/s/lyNUPbWpjaRXLBMz7j4JhPvVAsBbiDFt/6JDpbR_UaUFqhV73gf4DL2Ko0RP2uwvs-abNgGrREAwk WSP 연구실은 웹을 보다 안전한 환경으로 만들기 위한 새로운 아이디어의 구현이라는 비젼을 가지고 웹 서비스들의 취약점 탐지와 웹을 통한 개인정보 침해 측정을 목표로 연구를 진행하고 있습니다.연구주제는 웹 애플리케이션의 동적 및 정적 분석을 통한 취약점 탐지, 웹 브라우져 보안기능 분석, 웹 취약점을 이용하는 악성 공격코드에 대한 분석들을 포함하고 있습니다. 또한 웹 및 모바일 서비스와의 통신을 통한 프라이버시 침해에 대한 연구 역시 진행중에 있습니다. csweb.research"
}