{
    "name": "사이버 물리 시스템 연구실",
    "professor": "신인식",
    "field": "소프트웨어 디자인, 시스템·네트워크",
    "web": "http://cps.kaist.ac.kr/",
    "email": "insik.shin@cs.kaist.ac.kr",
    "phone": "042-350-3524",
    "office": "E3-1   4425호",
    "intro": "",
    "etc": "CPS 연구실 소개스마트폰, 모바일 서비스, 헬스케어부터 스마트 교통수단과 스마트 전력망까지, 지난 몇 년간 컴퓨터 기술은 우리의 일상생활에 빠르고 폭넓게 파고들어왔다. 이러한 트렌드는 Cyber-Physical Systems（CPS）라고 불리는 새롭게 떠오르는 연구 분야를 이끌어냈다. CPS는 가상 세계의 컴퓨팅과 통신을 물리적 실체와 통합하는 과학적 기반과 기술을 연구함으로써 우리가 주변 세계와 자동으로, 또 실시간으로 상호작용할 수 있는 능력을 증진시키고자 하며, 여기서 인간이 전체 시스템에서 중요한 역할을 차지하게 된다.인간-가상세계-물리적 실체 사이에서 새로운 방식의 상호작용을 위해, 우리는 실시간 시스템, 모바일 컴퓨팅, 인간-컴퓨터 상호작용 분야에서의 연구 현안들을 해결할 수 있는 새로운 이론과 원리를 개발하고, 그러한 이론이 실제로 다지안되고 실시간으로 동작할 수 있도록 근본적인 연구를 진행하고 있다.모바일 마에스트로CPSLAB은 MMA （Mobile Multi-speaker Audio） 어플리케이션에 모바일 사운드 환경 가상화 기술을 제공하기 위하여, AMAC （Adaptive Mobile Audio Coordination） 프레임워크를 개발하였다 （UbiComp 2014 발표）.그린백CPSLAB은 모바일 장치에서 다양한 네트워크 링크의 효율적인 대역폭 병합을 통해, 전력 소모를 최소화하며 고수준의 실시간 데이터 스트리밍 서비스를 제공하는 GeenBag 미들웨어를 개발하였다 （RTSS 2013 발표）.실시간 멀티코어 스케줄링CPSLAB은 멀티코어 환경에서 기존에 존재하는 모든 task-level 우선순위 할당 방법들의 성능을 뛰어넘는 SPDF라는 새로운 job-level 우선순위 할당 방법을 제안하였고, 이 결과 실시간 멀티코어 스케줄링에서 수십년동안 풀리지 않은 미제를 해결하였다 （RTSS 2012 발표）.",
    "tag": "csweb.research",
    "id": 24,
    "content": "name:사이버 물리 시스템 연구실 professor:신인식 field:소프트웨어 디자인, 시스템·네트워크 web:http://cps.kaist.ac.kr/ email:insik.shin@cs.kaist.ac.kr phone:042-350-3524 office:E3-1   4425호 intro: etc:CPS 연구실 소개스마트폰, 모바일 서비스, 헬스케어부터 스마트 교통수단과 스마트 전력망까지, 지난 몇 년간 컴퓨터 기술은 우리의 일상생활에 빠르고 폭넓게 파고들어왔다. 이러한 트렌드는 Cyber-Physical Systems（CPS）라고 불리는 새롭게 떠오르는 연구 분야를 이끌어냈다. CPS는 가상 세계의 컴퓨팅과 통신을 물리적 실체와 통합하는 과학적 기반과 기술을 연구함으로써 우리가 주변 세계와 자동으로, 또 실시간으로 상호작용할 수 있는 능력을 증진시키고자 하며, 여기서 인간이 전체 시스템에서 중요한 역할을 차지하게 된다.인간-가상세계-물리적 실체 사이에서 새로운 방식의 상호작용을 위해, 우리는 실시간 시스템, 모바일 컴퓨팅, 인간-컴퓨터 상호작용 분야에서의 연구 현안들을 해결할 수 있는 새로운 이론과 원리를 개발하고, 그러한 이론이 실제로 다지안되고 실시간으로 동작할 수 있도록 근본적인 연구를 진행하고 있다.모바일 마에스트로CPSLAB은 MMA （Mobile Multi-speaker Audio） 어플리케이션에 모바일 사운드 환경 가상화 기술을 제공하기 위하여, AMAC （Adaptive Mobile Audio Coordination） 프레임워크를 개발하였다 （UbiComp 2014 발표）.그린백CPSLAB은 모바일 장치에서 다양한 네트워크 링크의 효율적인 대역폭 병합을 통해, 전력 소모를 최소화하며 고수준의 실시간 데이터 스트리밍 서비스를 제공하는 GeenBag 미들웨어를 개발하였다 （RTSS 2013 발표）.실시간 멀티코어 스케줄링CPSLAB은 멀티코어 환경에서 기존에 존재하는 모든 task-level 우선순위 할당 방법들의 성능을 뛰어넘는 SPDF라는 새로운 job-level 우선순위 할당 방법을 제안하였고, 이 결과 실시간 멀티코어 스케줄링에서 수십년동안 풀리지 않은 미제를 해결하였다 （RTSS 2012 발표）. tag:csweb.research content:사이버 물리 시스템 연구실 신인식 소프트웨어 디자인, 시스템·네트워크 http://cps.kaist.ac.kr/ insik.shin@cs.kaist.ac.kr 042-350-3524 E3-1   4425호  CPS 연구실 소개스마트폰, 모바일 서비스, 헬스케어부터 스마트 교통수단과 스마트 전력망까지, 지난 몇 년간 컴퓨터 기술은 우리의 일상생활에 빠르고 폭넓게 파고들어왔다. 이러한 트렌드는 Cyber-Physical Systems（CPS）라고 불리는 새롭게 떠오르는 연구 분야를 이끌어냈다. CPS는 가상 세계의 컴퓨팅과 통신을 물리적 실체와 통합하는 과학적 기반과 기술을 연구함으로써 우리가 주변 세계와 자동으로, 또 실시간으로 상호작용할 수 있는 능력을 증진시키고자 하며, 여기서 인간이 전체 시스템에서 중요한 역할을 차지하게 된다.인간-가상세계-물리적 실체 사이에서 새로운 방식의 상호작용을 위해, 우리는 실시간 시스템, 모바일 컴퓨팅, 인간-컴퓨터 상호작용 분야에서의 연구 현안들을 해결할 수 있는 새로운 이론과 원리를 개발하고, 그러한 이론이 실제로 다지안되고 실시간으로 동작할 수 있도록 근본적인 연구를 진행하고 있다.모바일 마에스트로CPSLAB은 MMA （Mobile Multi-speaker Audio） 어플리케이션에 모바일 사운드 환경 가상화 기술을 제공하기 위하여, AMAC （Adaptive Mobile Audio Coordination） 프레임워크를 개발하였다 （UbiComp 2014 발표）.그린백CPSLAB은 모바일 장치에서 다양한 네트워크 링크의 효율적인 대역폭 병합을 통해, 전력 소모를 최소화하며 고수준의 실시간 데이터 스트리밍 서비스를 제공하는 GeenBag 미들웨어를 개발하였다 （RTSS 2013 발표）.실시간 멀티코어 스케줄링CPSLAB은 멀티코어 환경에서 기존에 존재하는 모든 task-level 우선순위 할당 방법들의 성능을 뛰어넘는 SPDF라는 새로운 job-level 우선순위 할당 방법을 제안하였고, 이 결과 실시간 멀티코어 스케줄링에서 수십년동안 풀리지 않은 미제를 해결하였다 （RTSS 2012 발표）. csweb.research"
}