{
    "name": "데이터 사이언스 연구실",
    "professor": "차미영",
    "field": "인공지능·정보서비스, 소셜 컴퓨팅, 인터랙티브 컴퓨팅",
    "web": "http://ds.kaist.ac.kr/",
    "email": "meeyoungcha@kaist.ac.kr",
    "phone": "042-350-3574",
    "office": "E3-1, 2423   3574호",
    "intro": "https://socnas.kaist.ac.kr/drive/d/s/lyNUQ7B6kiBblx3lLpQFkHOVjfRmr0Zx/2hNWHKNsS6wf4pMpGCwg1_TTv0MxKwpK-5LPg3gVFAwk",
    "etc": "카이스트 데이터 사이언스 연구실에서는 복잡하고 어려운 사회문제를 빅데이터와 계산학적 과학적 방법론으로 해결하고자 합니다. 데이터 사이언스 연구실에서 현재 다루고 있는 문제들은 AI 기반 정보 분류를 주로 다루며 가짜뉴스 탐지, 세관 탈세 선별, 생체 이상 신호 구분, 기후 모델링, 이미지 영상 기반 빈곤예측 등이 있습니다. 이러한 연구의 근간에는 네트워크 과학, 계산사회학, 그리고 전산통계의 기초 방법론이 활용됩니다.",
    "tag": "csweb.research",
    "id": 38,
    "content": "name:데이터 사이언스 연구실 professor:차미영 field:인공지능·정보서비스, 소셜 컴퓨팅, 인터랙티브 컴퓨팅 web:http://ds.kaist.ac.kr/ email:meeyoungcha@kaist.ac.kr phone:042-350-3574 office:E3-1, 2423   3574호 intro:https://socnas.kaist.ac.kr/drive/d/s/lyNUQ7B6kiBblx3lLpQFkHOVjfRmr0Zx/2hNWHKNsS6wf4pMpGCwg1_TTv0MxKwpK-5LPg3gVFAwk etc:카이스트 데이터 사이언스 연구실에서는 복잡하고 어려운 사회문제를 빅데이터와 계산학적 과학적 방법론으로 해결하고자 합니다. 데이터 사이언스 연구실에서 현재 다루고 있는 문제들은 AI 기반 정보 분류를 주로 다루며 가짜뉴스 탐지, 세관 탈세 선별, 생체 이상 신호 구분, 기후 모델링, 이미지 영상 기반 빈곤예측 등이 있습니다. 이러한 연구의 근간에는 네트워크 과학, 계산사회학, 그리고 전산통계의 기초 방법론이 활용됩니다. tag:csweb.research content:데이터 사이언스 연구실 차미영 인공지능·정보서비스, 소셜 컴퓨팅, 인터랙티브 컴퓨팅 http://ds.kaist.ac.kr/ meeyoungcha@kaist.ac.kr 042-350-3574 E3-1, 2423   3574호 https://socnas.kaist.ac.kr/drive/d/s/lyNUQ7B6kiBblx3lLpQFkHOVjfRmr0Zx/2hNWHKNsS6wf4pMpGCwg1_TTv0MxKwpK-5LPg3gVFAwk 카이스트 데이터 사이언스 연구실에서는 복잡하고 어려운 사회문제를 빅데이터와 계산학적 과학적 방법론으로 해결하고자 합니다. 데이터 사이언스 연구실에서 현재 다루고 있는 문제들은 AI 기반 정보 분류를 주로 다루며 가짜뉴스 탐지, 세관 탈세 선별, 생체 이상 신호 구분, 기후 모델링, 이미지 영상 기반 빈곤예측 등이 있습니다. 이러한 연구의 근간에는 네트워크 과학, 계산사회학, 그리고 전산통계의 기초 방법론이 활용됩니다. csweb.research"
}