{
    "name": "지식공학 및 인공지능 연구실",
    "professor": "최호진",
    "field": "비주얼 컴퓨팅, 인공지능·정보서비스, 소셜 컴퓨팅",
    "web": "https://keai.kaist.ac.kr",
    "email": "hojinc@cs.kaist.ac.kr",
    "phone": "042-350-3561",
    "office": "N1   707호",
    "intro": "https://socnas.kaist.ac.kr/drive/d/s/lyLu4Vs2kPy72b6eh4yOOMTcC7IUxHeL/9B-vH6mmiykyin2krO4ANJgekDq8UjJe-97YgNJE1Awk",
    "etc": "지식공학 및 인공지능 연구실（KEAI 연구실）은 인공지능, 지식공학 및 데이터마이닝 기술들을 현실세계의 다양한 문제들에 적용하여 해결방안을 모색하는 것을 목표로 한다. 최근 연구실에서 관심을 가지는 응용 도메인은 지능형 에이전트 및 개인비서시스템, 자연어 질의응답시스템, 유비쿼터스 헬스케어시스템, 바이오의료정보학 등의 분야이며, 연구대상 주요 기술들은 토픽마이닝, 의도분석, 시공간정보추출, 질문가설, 행동인식, 센서퓨전, 유전자서열분석 등을 들 수 있다. 연구의 궁극적인 목표는 세상에 존재하는 다양한 데이터로부터 유용한 지식을 추출하는 기법을 탐구하고 지식들을 기계학습에 적용가능한 형태의 경험으로 축적 및 구축하는 것이라고 볼 수 있다.대표적인 연구과제로는 소프트웨어산업 원천기술 국책사업인 휴먼 지식증강 서비스를 위한 지능진화형 WiseQA 플랫폼 기술 개발, 삼성전자 전략산학과제인 주도적 어시스턴트를 위한 의도분석 및 이벤트 제안 기술 연구, UAE 국제공동연구인 헬스케어 감시시스템을 위한 센서퓨전 기반 빅데이터 분석 기술, 서울의대 시스템바이오정보의학연구센터의 모바일 스마트폰 환경에서 개인화된 상황인지형 헬스케어 서비스 에이전트 등이 있다.",
    "tag": "csweb.research",
    "id": 41,
    "content": "name:지식공학 및 인공지능 연구실 professor:최호진 field:비주얼 컴퓨팅, 인공지능·정보서비스, 소셜 컴퓨팅 web:https://keai.kaist.ac.kr email:hojinc@cs.kaist.ac.kr phone:042-350-3561 office:N1   707호 intro:https://socnas.kaist.ac.kr/drive/d/s/lyLu4Vs2kPy72b6eh4yOOMTcC7IUxHeL/9B-vH6mmiykyin2krO4ANJgekDq8UjJe-97YgNJE1Awk etc:지식공학 및 인공지능 연구실（KEAI 연구실）은 인공지능, 지식공학 및 데이터마이닝 기술들을 현실세계의 다양한 문제들에 적용하여 해결방안을 모색하는 것을 목표로 한다. 최근 연구실에서 관심을 가지는 응용 도메인은 지능형 에이전트 및 개인비서시스템, 자연어 질의응답시스템, 유비쿼터스 헬스케어시스템, 바이오의료정보학 등의 분야이며, 연구대상 주요 기술들은 토픽마이닝, 의도분석, 시공간정보추출, 질문가설, 행동인식, 센서퓨전, 유전자서열분석 등을 들 수 있다. 연구의 궁극적인 목표는 세상에 존재하는 다양한 데이터로부터 유용한 지식을 추출하는 기법을 탐구하고 지식들을 기계학습에 적용가능한 형태의 경험으로 축적 및 구축하는 것이라고 볼 수 있다.대표적인 연구과제로는 소프트웨어산업 원천기술 국책사업인 휴먼 지식증강 서비스를 위한 지능진화형 WiseQA 플랫폼 기술 개발, 삼성전자 전략산학과제인 주도적 어시스턴트를 위한 의도분석 및 이벤트 제안 기술 연구, UAE 국제공동연구인 헬스케어 감시시스템을 위한 센서퓨전 기반 빅데이터 분석 기술, 서울의대 시스템바이오정보의학연구센터의 모바일 스마트폰 환경에서 개인화된 상황인지형 헬스케어 서비스 에이전트 등이 있다. tag:csweb.research content:지식공학 및 인공지능 연구실 최호진 비주얼 컴퓨팅, 인공지능·정보서비스, 소셜 컴퓨팅 https://keai.kaist.ac.kr hojinc@cs.kaist.ac.kr 042-350-3561 N1   707호 https://socnas.kaist.ac.kr/drive/d/s/lyLu4Vs2kPy72b6eh4yOOMTcC7IUxHeL/9B-vH6mmiykyin2krO4ANJgekDq8UjJe-97YgNJE1Awk 지식공학 및 인공지능 연구실（KEAI 연구실）은 인공지능, 지식공학 및 데이터마이닝 기술들을 현실세계의 다양한 문제들에 적용하여 해결방안을 모색하는 것을 목표로 한다. 최근 연구실에서 관심을 가지는 응용 도메인은 지능형 에이전트 및 개인비서시스템, 자연어 질의응답시스템, 유비쿼터스 헬스케어시스템, 바이오의료정보학 등의 분야이며, 연구대상 주요 기술들은 토픽마이닝, 의도분석, 시공간정보추출, 질문가설, 행동인식, 센서퓨전, 유전자서열분석 등을 들 수 있다. 연구의 궁극적인 목표는 세상에 존재하는 다양한 데이터로부터 유용한 지식을 추출하는 기법을 탐구하고 지식들을 기계학습에 적용가능한 형태의 경험으로 축적 및 구축하는 것이라고 볼 수 있다.대표적인 연구과제로는 소프트웨어산업 원천기술 국책사업인 휴먼 지식증강 서비스를 위한 지능진화형 WiseQA 플랫폼 기술 개발, 삼성전자 전략산학과제인 주도적 어시스턴트를 위한 의도분석 및 이벤트 제안 기술 연구, UAE 국제공동연구인 헬스케어 감시시스템을 위한 센서퓨전 기반 빅데이터 분석 기술, 서울의대 시스템바이오정보의학연구센터의 모바일 스마트폰 환경에서 개인화된 상황인지형 헬스케어 서비스 에이전트 등이 있다. csweb.research"
}