{
    "name": "강인 지능 및 로보틱스 연구실",
    "professor": "박대형",
    "field": "인공지능·정보서비스, 인터랙티브 컴퓨팅",
    "web": "https://rirolab.kaist.ac.kr",
    "email": "rirolab20@gmail.com",
    "phone": "042-350-3586",
    "office": "E3-1   2419호",
    "intro": "https://socnas.kaist.ac.kr/drive/d/s/lyLtKr9I4MHyov8Zvuy1kmhvjNgVrqid/c1xOqAXGSbUmxxTnsA0Ihm2l-sSHYAJt-lbegSMY1Awk",
    "etc": "한국과학기술원(KAIST) 전산학부 박대형 교수님에 의해 운영되고 있는 강인지능 및 로보틱스 연구실 (Robust Intelligence and Robotics Laboratory, RIRO LAB)은 로보틱스와 기계학습을 연구하는 연구실이다. RIRO LAB에서는 강인한 인공지능을 가진 협업/서비스 로봇을 개발하기위하여 다양한 모바일 매니퓰레이션 관련 연구를 해오고 있으며, 특히 의미론적 학습 및 추론 (semantic learning and reasoning), 역강화학습 (inverse reinforcement learning), 작업 및 경로계획 (task-and-motion planning), 인간-로봇 상호작용 기술 (human-robot interaction), 자연어 이해 (natural language understanding) 등의 복잡한 작업 수행을 위한 필요 기술들에 집중하고 있다. 또한, RIRO Lab에서는 강인 지능 기술을 이용한 자동화 (automation) 및 필드 로봇 (field robots) 영역으로 확장을 계획하고 있으며, 세계 유수의 연구 기관들과의 협업과 방문 연구를 진행하고 있다.",
    "tag": "csweb.research",
    "id": 16,
    "content": "name:강인 지능 및 로보틱스 연구실 professor:박대형 field:인공지능·정보서비스, 인터랙티브 컴퓨팅 web:https://rirolab.kaist.ac.kr email:rirolab20@gmail.com phone:042-350-3586 office:E3-1   2419호 intro:https://socnas.kaist.ac.kr/drive/d/s/lyLtKr9I4MHyov8Zvuy1kmhvjNgVrqid/c1xOqAXGSbUmxxTnsA0Ihm2l-sSHYAJt-lbegSMY1Awk etc:한국과학기술원(KAIST) 전산학부 박대형 교수님에 의해 운영되고 있는 강인지능 및 로보틱스 연구실 (Robust Intelligence and Robotics Laboratory, RIRO LAB)은 로보틱스와 기계학습을 연구하는 연구실이다. RIRO LAB에서는 강인한 인공지능을 가진 협업/서비스 로봇을 개발하기위하여 다양한 모바일 매니퓰레이션 관련 연구를 해오고 있으며, 특히 의미론적 학습 및 추론 (semantic learning and reasoning), 역강화학습 (inverse reinforcement learning), 작업 및 경로계획 (task-and-motion planning), 인간-로봇 상호작용 기술 (human-robot interaction), 자연어 이해 (natural language understanding) 등의 복잡한 작업 수행을 위한 필요 기술들에 집중하고 있다. 또한, RIRO Lab에서는 강인 지능 기술을 이용한 자동화 (automation) 및 필드 로봇 (field robots) 영역으로 확장을 계획하고 있으며, 세계 유수의 연구 기관들과의 협업과 방문 연구를 진행하고 있다. tag:csweb.research content:강인 지능 및 로보틱스 연구실 박대형 인공지능·정보서비스, 인터랙티브 컴퓨팅 https://rirolab.kaist.ac.kr rirolab20@gmail.com 042-350-3586 E3-1   2419호 https://socnas.kaist.ac.kr/drive/d/s/lyLtKr9I4MHyov8Zvuy1kmhvjNgVrqid/c1xOqAXGSbUmxxTnsA0Ihm2l-sSHYAJt-lbegSMY1Awk 한국과학기술원(KAIST) 전산학부 박대형 교수님에 의해 운영되고 있는 강인지능 및 로보틱스 연구실 (Robust Intelligence and Robotics Laboratory, RIRO LAB)은 로보틱스와 기계학습을 연구하는 연구실이다. RIRO LAB에서는 강인한 인공지능을 가진 협업/서비스 로봇을 개발하기위하여 다양한 모바일 매니퓰레이션 관련 연구를 해오고 있으며, 특히 의미론적 학습 및 추론 (semantic learning and reasoning), 역강화학습 (inverse reinforcement learning), 작업 및 경로계획 (task-and-motion planning), 인간-로봇 상호작용 기술 (human-robot interaction), 자연어 이해 (natural language understanding) 등의 복잡한 작업 수행을 위한 필요 기술들에 집중하고 있다. 또한, RIRO Lab에서는 강인 지능 기술을 이용한 자동화 (automation) 및 필드 로봇 (field robots) 영역으로 확장을 계획하고 있으며, 세계 유수의 연구 기관들과의 협업과 방문 연구를 진행하고 있다. csweb.research"
}