{
    "name": "컴퓨터 그래픽스 및 가시화 연구실",
    "professor": "박진아",
    "field": "비주얼 컴퓨팅, 인터랙티브 컴퓨팅",
    "web": "http://cgv.kaist.ac.kr/",
    "email": "jinah@cs.kaist.ac.kr",
    "phone": "042-350-7755",
    "office": "E3-1   2404호",
    "intro": "https://socnas.kaist.ac.kr/drive/d/s/lyLtLXj7aK3rBmi1Cnfwc6lrZ81pmA5W/cusj6LGjO5cIM65RCeW311ob1Uhoy1vE-nbWgZAQ1Awk",
    "etc": "컴퓨터 그래픽스 및 가시화 연구실 소개한국과학기술원 컴퓨터 그래픽스 및 가시화 연구실(Computer Graphics and Visualization Lab, CGV Lab)은 의료 영상으로부터 임상적으로 의미가 있는 장기 모델링 기법을 개발하며 3차원 가상환경과의 상호작용 기법 연구에 초점을 맞추고 있다. 연구의 최종 목표는 컴퓨터 그래픽스의 기술들을 적용하여 의료 영상 분석에 있어 강건함과 직관성을 높이는데 있으며, 모델링 기법 외에도 사용자에게 정보를 제공하는 방법과 정보를 조작할 수 있는 효과적인 방법에 대해 연구하고 있다. 세부 연구 분야에는 의료 영상 분석(medical image analysis), 가변형 모델(deformable models), 의료 시뮬레이션(medical simulation), 햅틱 시뮬레이션(haptics simulation）그리고 3차원 사용자 인터페이스(3D user interface)가 포함된다.환자 맞춤형 장기 모델링CGV Lab은 강건하면서도 정교한 환자 개개인의 장기 모양을 재구축 할 수 있는 모델링 기법을 제안하였고 뇌 퇴행성 질환, 노화 등에 따른 뇌의 형상 변화 분석 연구, 발목 관절의 3차원 모델 및 자세 분석 연구, 척추체 모델링 등 국내외 연구기관과 함께 다양한 인체 장기에 대한 연구를 수행하고 있다.햅틱 피드백을 이용한 의료 시뮬레이션CGV Lab은 정확한 햅틱 피드백 생성을 통한 사실적인 의료 시뮬레이션 환경을 개발하였고 치과치료 시뮬레이션 기술은 우수데모상 수상등으로 주목을 받았다.3차원 사용자 인터랙션CGV Lab은 가상 공간상의 객체 조작에 있어 3차원 입력을 통해 그 직관성과 효율성을 높이는 방법을 연구하고 있다.",
    "tag": "csweb.research",
    "id": 18,
    "content": "name:컴퓨터 그래픽스 및 가시화 연구실 professor:박진아 field:비주얼 컴퓨팅, 인터랙티브 컴퓨팅 web:http://cgv.kaist.ac.kr/ email:jinah@cs.kaist.ac.kr phone:042-350-7755 office:E3-1   2404호 intro:https://socnas.kaist.ac.kr/drive/d/s/lyLtLXj7aK3rBmi1Cnfwc6lrZ81pmA5W/cusj6LGjO5cIM65RCeW311ob1Uhoy1vE-nbWgZAQ1Awk etc:컴퓨터 그래픽스 및 가시화 연구실 소개한국과학기술원 컴퓨터 그래픽스 및 가시화 연구실(Computer Graphics and Visualization Lab, CGV Lab)은 의료 영상으로부터 임상적으로 의미가 있는 장기 모델링 기법을 개발하며 3차원 가상환경과의 상호작용 기법 연구에 초점을 맞추고 있다. 연구의 최종 목표는 컴퓨터 그래픽스의 기술들을 적용하여 의료 영상 분석에 있어 강건함과 직관성을 높이는데 있으며, 모델링 기법 외에도 사용자에게 정보를 제공하는 방법과 정보를 조작할 수 있는 효과적인 방법에 대해 연구하고 있다. 세부 연구 분야에는 의료 영상 분석(medical image analysis), 가변형 모델(deformable models), 의료 시뮬레이션(medical simulation), 햅틱 시뮬레이션(haptics simulation）그리고 3차원 사용자 인터페이스(3D user interface)가 포함된다.환자 맞춤형 장기 모델링CGV Lab은 강건하면서도 정교한 환자 개개인의 장기 모양을 재구축 할 수 있는 모델링 기법을 제안하였고 뇌 퇴행성 질환, 노화 등에 따른 뇌의 형상 변화 분석 연구, 발목 관절의 3차원 모델 및 자세 분석 연구, 척추체 모델링 등 국내외 연구기관과 함께 다양한 인체 장기에 대한 연구를 수행하고 있다.햅틱 피드백을 이용한 의료 시뮬레이션CGV Lab은 정확한 햅틱 피드백 생성을 통한 사실적인 의료 시뮬레이션 환경을 개발하였고 치과치료 시뮬레이션 기술은 우수데모상 수상등으로 주목을 받았다.3차원 사용자 인터랙션CGV Lab은 가상 공간상의 객체 조작에 있어 3차원 입력을 통해 그 직관성과 효율성을 높이는 방법을 연구하고 있다. tag:csweb.research content:컴퓨터 그래픽스 및 가시화 연구실 박진아 비주얼 컴퓨팅, 인터랙티브 컴퓨팅 http://cgv.kaist.ac.kr/ jinah@cs.kaist.ac.kr 042-350-7755 E3-1   2404호 https://socnas.kaist.ac.kr/drive/d/s/lyLtLXj7aK3rBmi1Cnfwc6lrZ81pmA5W/cusj6LGjO5cIM65RCeW311ob1Uhoy1vE-nbWgZAQ1Awk 컴퓨터 그래픽스 및 가시화 연구실 소개한국과학기술원 컴퓨터 그래픽스 및 가시화 연구실(Computer Graphics and Visualization Lab, CGV Lab)은 의료 영상으로부터 임상적으로 의미가 있는 장기 모델링 기법을 개발하며 3차원 가상환경과의 상호작용 기법 연구에 초점을 맞추고 있다. 연구의 최종 목표는 컴퓨터 그래픽스의 기술들을 적용하여 의료 영상 분석에 있어 강건함과 직관성을 높이는데 있으며, 모델링 기법 외에도 사용자에게 정보를 제공하는 방법과 정보를 조작할 수 있는 효과적인 방법에 대해 연구하고 있다. 세부 연구 분야에는 의료 영상 분석(medical image analysis), 가변형 모델(deformable models), 의료 시뮬레이션(medical simulation), 햅틱 시뮬레이션(haptics simulation）그리고 3차원 사용자 인터페이스(3D user interface)가 포함된다.환자 맞춤형 장기 모델링CGV Lab은 강건하면서도 정교한 환자 개개인의 장기 모양을 재구축 할 수 있는 모델링 기법을 제안하였고 뇌 퇴행성 질환, 노화 등에 따른 뇌의 형상 변화 분석 연구, 발목 관절의 3차원 모델 및 자세 분석 연구, 척추체 모델링 등 국내외 연구기관과 함께 다양한 인체 장기에 대한 연구를 수행하고 있다.햅틱 피드백을 이용한 의료 시뮬레이션CGV Lab은 정확한 햅틱 피드백 생성을 통한 사실적인 의료 시뮬레이션 환경을 개발하였고 치과치료 시뮬레이션 기술은 우수데모상 수상등으로 주목을 받았다.3차원 사용자 인터랙션CGV Lab은 가상 공간상의 객체 조작에 있어 3차원 입력을 통해 그 직관성과 효율성을 높이는 방법을 연구하고 있다. csweb.research"
}