{
    "name": "기계 지능 연구실",
    "professor": "오태현",
    "field": "비주얼 컴퓨팅, 인공지능·정보서비스, 인터랙티브 컴퓨팅",
    "web": "http://ami.kaist.ac.kr",
    "email": "taehyun.oh@kaist.ac.kr",
    "phone": "042-350-3520",
    "office": "N1   822호",
    "intro": "https://drive.google.com/file/d/1oCz2TlwxbGHzowI4FuGhIxFXv2PtELFE/view?usp=sharing",
    "etc": "KAIST 전산학부 오태현 교수님에 의해 운영되고 있는 기계지능연구실 (Advanced Machine Intelligence Laboratory, AMI Lab)은 인간처럼 스스로 세상의 이해를 넓히는 AI을 개발하는 것을 목표로 연구를 하고 있다. 최근에는 이를 위한 첫 단계로 현실 세계와 AI간 인터페이스를 위한 강인한 기계 지각 능력을 개발에 주력하고 있다. 주요 연구 분야로는 멀티모달 기계 지각 능력 연구, 컴퓨터 비전 및 그래픽스, 데이터 효율적 머신러닝 연구를 수행하고 있다. 현재까지 컴퓨터 비전 및 머신러닝 분야의 최고 권위 학술지인 IEEE Transactions on Pattern Analysis and Machine Intelligence (TPAMI)에 총 8편의 논문을 게재하여 국제적으로 연구의 우수성을 인정받고 있다. 특히, AMI Lab은 세계 유수의 IT 기업, 연구소, 대학들과의 활발한 공동연구를 수행하고 있으며, 박사과정 학생들에게는 인턴십과 파견 기회를 제공하고 있다.",
    "tag": "csweb.research",
    "id": 27,
    "content": "name:기계 지능 연구실 professor:오태현 field:비주얼 컴퓨팅, 인공지능·정보서비스, 인터랙티브 컴퓨팅 web:http://ami.kaist.ac.kr email:taehyun.oh@kaist.ac.kr phone:042-350-3520 office:N1   822호 intro:https://drive.google.com/file/d/1oCz2TlwxbGHzowI4FuGhIxFXv2PtELFE/view?usp=sharing etc:KAIST 전산학부 오태현 교수님에 의해 운영되고 있는 기계지능연구실 (Advanced Machine Intelligence Laboratory, AMI Lab)은 인간처럼 스스로 세상의 이해를 넓히는 AI을 개발하는 것을 목표로 연구를 하고 있다. 최근에는 이를 위한 첫 단계로 현실 세계와 AI간 인터페이스를 위한 강인한 기계 지각 능력을 개발에 주력하고 있다. 주요 연구 분야로는 멀티모달 기계 지각 능력 연구, 컴퓨터 비전 및 그래픽스, 데이터 효율적 머신러닝 연구를 수행하고 있다. 현재까지 컴퓨터 비전 및 머신러닝 분야의 최고 권위 학술지인 IEEE Transactions on Pattern Analysis and Machine Intelligence (TPAMI)에 총 8편의 논문을 게재하여 국제적으로 연구의 우수성을 인정받고 있다. 특히, AMI Lab은 세계 유수의 IT 기업, 연구소, 대학들과의 활발한 공동연구를 수행하고 있으며, 박사과정 학생들에게는 인턴십과 파견 기회를 제공하고 있다. tag:csweb.research content:기계 지능 연구실 오태현 비주얼 컴퓨팅, 인공지능·정보서비스, 인터랙티브 컴퓨팅 http://ami.kaist.ac.kr taehyun.oh@kaist.ac.kr 042-350-3520 N1   822호 https://drive.google.com/file/d/1oCz2TlwxbGHzowI4FuGhIxFXv2PtELFE/view?usp=sharing KAIST 전산학부 오태현 교수님에 의해 운영되고 있는 기계지능연구실 (Advanced Machine Intelligence Laboratory, AMI Lab)은 인간처럼 스스로 세상의 이해를 넓히는 AI을 개발하는 것을 목표로 연구를 하고 있다. 최근에는 이를 위한 첫 단계로 현실 세계와 AI간 인터페이스를 위한 강인한 기계 지각 능력을 개발에 주력하고 있다. 주요 연구 분야로는 멀티모달 기계 지각 능력 연구, 컴퓨터 비전 및 그래픽스, 데이터 효율적 머신러닝 연구를 수행하고 있다. 현재까지 컴퓨터 비전 및 머신러닝 분야의 최고 권위 학술지인 IEEE Transactions on Pattern Analysis and Machine Intelligence (TPAMI)에 총 8편의 논문을 게재하여 국제적으로 연구의 우수성을 인정받고 있다. 특히, AMI Lab은 세계 유수의 IT 기업, 연구소, 대학들과의 활발한 공동연구를 수행하고 있으며, 박사과정 학생들에게는 인턴십과 파견 기회를 제공하고 있다. csweb.research"
}