{
    "name": "첨단 네트워킹 연구실",
    "professor": "문수복",
    "field": "시스템·네트워크, 소셜 컴퓨팅",
    "web": "http://an.kaist.ac.kr/",
    "email": "sbmoon@kaist.edu",
    "phone": "042-350-3548",
    "office": "N1   621호",
    "intro": "https://socnas.kaist.ac.kr/drive/d/s/lyNUPgDDNuR2dgr67nCKijATCWTWewRy/UOh17h2LRlsMAArF410xyuo6nYrxzV1i-7r1gibk5Awk",
    "etc": "카이스트 첨단네트워크 연구실은 네트워크 플랫폼과 온라인 소셜 네트워크, 두 분야에서 실험적, 이론적 연구를 진행하고 있습니다. 네트워크 플랫폼 팀에서는 현재 기존의 소프트웨어 라우터 프레임워크를 모듈화하고, GPU와 같은 Coprocessor를 이용해 각종 네트워크 기능을 동적으로 가속화한 모델을 연구, 개발 중에 있으며, 소셜 네트워크 팀에서는 트위터, 소셜 게이밍 플랫폼, 스마트 시티 모델에서 발견되는 사용자 간 상호작용 모델 등을 연구 중에 있습니다.한편, 저희 첨단네트워크 연구실에서는 점차 전산학의 응용분야가 확대됨에 따라 카이스트 내외 및 다양한 해외 연구기관에 소속된 연구진과 협력하고 있으며, 박사 과정 중 해외 방문연구 또한 장려하고 있습니다. 첨단네트워크 연구실 재학생 및 졸업생들은 DIMACS (Center for Discrete Mathematics and Theoretical Computer Science), AT&T Research, Intel Research Cambridge, Microsoft Research Cambridge, Telefonica Research - Barcelona 및 SysNet group at the University of California, San Diego에서 객원연구원 및 인턴으로 활동한 바 있습니다.",
    "tag": "csweb.research",
    "id": 14,
    "content": "name:첨단 네트워킹 연구실 professor:문수복 field:시스템·네트워크, 소셜 컴퓨팅 web:http://an.kaist.ac.kr/ email:sbmoon@kaist.edu phone:042-350-3548 office:N1   621호 intro:https://socnas.kaist.ac.kr/drive/d/s/lyNUPgDDNuR2dgr67nCKijATCWTWewRy/UOh17h2LRlsMAArF410xyuo6nYrxzV1i-7r1gibk5Awk etc:카이스트 첨단네트워크 연구실은 네트워크 플랫폼과 온라인 소셜 네트워크, 두 분야에서 실험적, 이론적 연구를 진행하고 있습니다. 네트워크 플랫폼 팀에서는 현재 기존의 소프트웨어 라우터 프레임워크를 모듈화하고, GPU와 같은 Coprocessor를 이용해 각종 네트워크 기능을 동적으로 가속화한 모델을 연구, 개발 중에 있으며, 소셜 네트워크 팀에서는 트위터, 소셜 게이밍 플랫폼, 스마트 시티 모델에서 발견되는 사용자 간 상호작용 모델 등을 연구 중에 있습니다.한편, 저희 첨단네트워크 연구실에서는 점차 전산학의 응용분야가 확대됨에 따라 카이스트 내외 및 다양한 해외 연구기관에 소속된 연구진과 협력하고 있으며, 박사 과정 중 해외 방문연구 또한 장려하고 있습니다. 첨단네트워크 연구실 재학생 및 졸업생들은 DIMACS (Center for Discrete Mathematics and Theoretical Computer Science), AT&T Research, Intel Research Cambridge, Microsoft Research Cambridge, Telefonica Research - Barcelona 및 SysNet group at the University of California, San Diego에서 객원연구원 및 인턴으로 활동한 바 있습니다. tag:csweb.research content:첨단 네트워킹 연구실 문수복 시스템·네트워크, 소셜 컴퓨팅 http://an.kaist.ac.kr/ sbmoon@kaist.edu 042-350-3548 N1   621호 https://socnas.kaist.ac.kr/drive/d/s/lyNUPgDDNuR2dgr67nCKijATCWTWewRy/UOh17h2LRlsMAArF410xyuo6nYrxzV1i-7r1gibk5Awk 카이스트 첨단네트워크 연구실은 네트워크 플랫폼과 온라인 소셜 네트워크, 두 분야에서 실험적, 이론적 연구를 진행하고 있습니다. 네트워크 플랫폼 팀에서는 현재 기존의 소프트웨어 라우터 프레임워크를 모듈화하고, GPU와 같은 Coprocessor를 이용해 각종 네트워크 기능을 동적으로 가속화한 모델을 연구, 개발 중에 있으며, 소셜 네트워크 팀에서는 트위터, 소셜 게이밍 플랫폼, 스마트 시티 모델에서 발견되는 사용자 간 상호작용 모델 등을 연구 중에 있습니다.한편, 저희 첨단네트워크 연구실에서는 점차 전산학의 응용분야가 확대됨에 따라 카이스트 내외 및 다양한 해외 연구기관에 소속된 연구진과 협력하고 있으며, 박사 과정 중 해외 방문연구 또한 장려하고 있습니다. 첨단네트워크 연구실 재학생 및 졸업생들은 DIMACS (Center for Discrete Mathematics and Theoretical Computer Science), AT&T Research, Intel Research Cambridge, Microsoft Research Cambridge, Telefonica Research - Barcelona 및 SysNet group at the University of California, San Diego에서 객원연구원 및 인턴으로 활동한 바 있습니다. csweb.research"
}