{
    "name": "인간 컴퓨터 상호 작용 연구실",
    "professor": "이기혁",
    "field": "인터랙티브 컴퓨팅",
    "web": "http://hcil.kaist.ac.kr/",
    "email": "geehyuk@gmail.com",
    "phone": "042-350-3557",
    "office": "N1   722호",
    "intro": "https://socnas.kaist.ac.kr/drive/d/s/lyLuAcfjqTpMal1MM5YTLlNX2SD3HZ2E/XNPypKyDcbpb7-0XHHnBWMjcWsPV6rK2-jLaALmE1Awk",
    "etc": "HCI 연구실은 스마트정보기기, 웨어러블 컴퓨터 및 스마트 환경을 위한 새로운 인터렉션 장치의 개발 및 이를 활용한 새로운 상호작용 기법 개발을 통하여 신개념 사용자 인터페이스 개척을 지향하고 있다. 최근 중점을 두고 있는 주요 연구 주제는 문자 입력 인터페이스, 터치 기반 인터페이스, 촉각 디스플레이, 웨어러블 입력 장치, AR/VR 입력 장치 등이다. 문자 입력 인터페이스는 2005년 피쳐폰을 위한 문자입력 방법에서 시작하여 최근에는 스마트워치를 위한 문자입력 방법, 스마트글라스를 위한 문자입력 방법, VR 컨트롤러를 이용한 문자입력 방법 등으로 연구가 이어지고 있다. 터치 기반 인터페이스는 충격량, 수직힘, 수평힘, 근접 등 터치 조작에 동반하는 추가적 이벤트를 이용하여 터치스크린의 입력 어휘를 늘이기 위한 연구에서 시작하였다. 터치스크린을 기존의 2-상태 입력 장치에서 4-상태 입력장치로 확장하였고 확장된 입력 공간에서의 새로운 가능성에 대한 탐색을 이어오고 있다. 터치 인터페이스의 연구 과정에서 터치 조작의 충실도를 높이기 위한 필수적인 요소로서 촉각 피드백 연구가 시작되었다. 2013년 버튼 피드백 연구에서 시작하여 현재는 웨어러블 장치를 위한 촉각 디스플레이, 이종 촉각 자극을 결합한 촉각 디스플레이 등으로 연구가 이어지고 있다. HCI 연구실은 2015년 ACM Interactions 지의 Day in the Lab 컬럼에 자세히 소개된 바 있고, 연구 결과는 ACM CHI, ACM UIST, ACM ISS 등의 주요 HCI 국제학회와 IJHCS, IJHCI, IWC 등의 HCI 전문 학술지를 통하여 발표되고 있다.",
    "tag": "csweb.research",
    "id": 31,
    "content": "name:인간 컴퓨터 상호 작용 연구실 professor:이기혁 field:인터랙티브 컴퓨팅 web:http://hcil.kaist.ac.kr/ email:geehyuk@gmail.com phone:042-350-3557 office:N1   722호 intro:https://socnas.kaist.ac.kr/drive/d/s/lyLuAcfjqTpMal1MM5YTLlNX2SD3HZ2E/XNPypKyDcbpb7-0XHHnBWMjcWsPV6rK2-jLaALmE1Awk etc:HCI 연구실은 스마트정보기기, 웨어러블 컴퓨터 및 스마트 환경을 위한 새로운 인터렉션 장치의 개발 및 이를 활용한 새로운 상호작용 기법 개발을 통하여 신개념 사용자 인터페이스 개척을 지향하고 있다. 최근 중점을 두고 있는 주요 연구 주제는 문자 입력 인터페이스, 터치 기반 인터페이스, 촉각 디스플레이, 웨어러블 입력 장치, AR/VR 입력 장치 등이다. 문자 입력 인터페이스는 2005년 피쳐폰을 위한 문자입력 방법에서 시작하여 최근에는 스마트워치를 위한 문자입력 방법, 스마트글라스를 위한 문자입력 방법, VR 컨트롤러를 이용한 문자입력 방법 등으로 연구가 이어지고 있다. 터치 기반 인터페이스는 충격량, 수직힘, 수평힘, 근접 등 터치 조작에 동반하는 추가적 이벤트를 이용하여 터치스크린의 입력 어휘를 늘이기 위한 연구에서 시작하였다. 터치스크린을 기존의 2-상태 입력 장치에서 4-상태 입력장치로 확장하였고 확장된 입력 공간에서의 새로운 가능성에 대한 탐색을 이어오고 있다. 터치 인터페이스의 연구 과정에서 터치 조작의 충실도를 높이기 위한 필수적인 요소로서 촉각 피드백 연구가 시작되었다. 2013년 버튼 피드백 연구에서 시작하여 현재는 웨어러블 장치를 위한 촉각 디스플레이, 이종 촉각 자극을 결합한 촉각 디스플레이 등으로 연구가 이어지고 있다. HCI 연구실은 2015년 ACM Interactions 지의 Day in the Lab 컬럼에 자세히 소개된 바 있고, 연구 결과는 ACM CHI, ACM UIST, ACM ISS 등의 주요 HCI 국제학회와 IJHCS, IJHCI, IWC 등의 HCI 전문 학술지를 통하여 발표되고 있다. tag:csweb.research content:인간 컴퓨터 상호 작용 연구실 이기혁 인터랙티브 컴퓨팅 http://hcil.kaist.ac.kr/ geehyuk@gmail.com 042-350-3557 N1   722호 https://socnas.kaist.ac.kr/drive/d/s/lyLuAcfjqTpMal1MM5YTLlNX2SD3HZ2E/XNPypKyDcbpb7-0XHHnBWMjcWsPV6rK2-jLaALmE1Awk HCI 연구실은 스마트정보기기, 웨어러블 컴퓨터 및 스마트 환경을 위한 새로운 인터렉션 장치의 개발 및 이를 활용한 새로운 상호작용 기법 개발을 통하여 신개념 사용자 인터페이스 개척을 지향하고 있다. 최근 중점을 두고 있는 주요 연구 주제는 문자 입력 인터페이스, 터치 기반 인터페이스, 촉각 디스플레이, 웨어러블 입력 장치, AR/VR 입력 장치 등이다. 문자 입력 인터페이스는 2005년 피쳐폰을 위한 문자입력 방법에서 시작하여 최근에는 스마트워치를 위한 문자입력 방법, 스마트글라스를 위한 문자입력 방법, VR 컨트롤러를 이용한 문자입력 방법 등으로 연구가 이어지고 있다. 터치 기반 인터페이스는 충격량, 수직힘, 수평힘, 근접 등 터치 조작에 동반하는 추가적 이벤트를 이용하여 터치스크린의 입력 어휘를 늘이기 위한 연구에서 시작하였다. 터치스크린을 기존의 2-상태 입력 장치에서 4-상태 입력장치로 확장하였고 확장된 입력 공간에서의 새로운 가능성에 대한 탐색을 이어오고 있다. 터치 인터페이스의 연구 과정에서 터치 조작의 충실도를 높이기 위한 필수적인 요소로서 촉각 피드백 연구가 시작되었다. 2013년 버튼 피드백 연구에서 시작하여 현재는 웨어러블 장치를 위한 촉각 디스플레이, 이종 촉각 자극을 결합한 촉각 디스플레이 등으로 연구가 이어지고 있다. HCI 연구실은 2015년 ACM Interactions 지의 Day in the Lab 컬럼에 자세히 소개된 바 있고, 연구 결과는 ACM CHI, ACM UIST, ACM ISS 등의 주요 HCI 국제학회와 IJHCS, IJHCI, IWC 등의 HCI 전문 학술지를 통하여 발표되고 있다. csweb.research"
}